Unnamed: 0.1,Unnamed: 0,text,labels,txt_len
8849,3961,"Here prediction and exclusion of DMD gene transmission may be possible , the accuracy being dependent on the closeness of the linkage of the DNA marker ( s ) to the DMD gene ; an illustrative case is reported .",O O O O O B O O O O O O O O O O O O O O O O O O O O O O O O O B O O O O O O O O,32
5023,11145,"1 of rat chromosome 8 , and qa4 - qa5 of Syrian hamster chromosome 12 .",O O O O O O O O O O O O O O O O,13
1381,6843,"The Rho - family GTPase , Cdc42 , can regulate the actin cytoskeleton through activation of Wiskott - Aldrich syndrome protein ( WASP ) family members .",O O O O O O O O O O O O O O O O B I I I O O O O O O O,13
9368,9883,"A pair of female monozygotic ( MZ ) twins , heterozygous carriers for a deletion in the DMD gene and discordant for the clinical manifestations of Duchenne muscular dystrophy , were analyzed by molecular studies , in situ hybridization , and methylation pattern of X chromosomes to search for opposite X inactivation as an explanation of their clinical discordance .",O O O O O O O O O O O O O O O O O B O O O O O O O O B I I O O O O O O O O O O O O O O O O O O O O O O O O O O O O O O O,13
839,4130,"The second patient was a compound heterozygote , with a missense mutation , C1837 - - > T , changing the arginine at residue 613 to tryptophan on one allele and a single base deletion at the intron - exon 6 boundary as the second mutation .",O O O O O O O O O O O O O O O O O O O O O O O O O O O O O O O O O O O O O O O O O O O O O O O,32
8044,2583,"PKU is a highly heterogeneous disorder , with more than 60 molecular lesions identified in the PAH gene .",B O O O O O O O O O O O O O O O O O O,32
6124,1240,Meiotic recombination events have localized the critical region containing ALMS1 to a 6 .,O O O O O O O O O O O O O O,32
190,5123,"In this paper we describe four additional PAX6 point mutations in aniridia patients , both sporadic and familial .",O O O O O O O O O O O B O O O O O O O,32
429,3012,"The human gene for histidase ( histidine ammonia - lyase ; HAL ) , the enzyme deficient in histidinemia , was assigned to human chromosome 12 by Southern blot analysis of human X mouse somatic cell hybrid DNA .",O O O O O O O O O O O O O O O O O O B O O O O O O O O O O O O O O O O O O O O,32
10019,814,Atypical or variant forms of well - known chondrodysplasias may pose diagnostic problems .,O O O O O O O O B O O O O O,32
7033,3840,Absent bacteriolysis remains the only consistent defect associated with recurrent neisserial infections and absence of one of the late - acting complement components . .,O O O O O O O O O O B I O O O O O O O O O O O O O,32
2420,1427,"Even though we found no gross cerebellar degeneration in older Atm ( y / y ) animals , ectopic and abnormally differentiated Purkinje cells were apparent in mutant mice of all ages .",O O O O O O B I O O O O O O O O O O O O O O O O O O O O O O O O O,32
6564,12528,"Where the transmitting parent was male , 58 .",O O O O O O O O O,39
4906,7227,"A total of 11 additional families carrying this mutation were identified in Australia ( 1 ) , Belgium ( 1 ) , Canada ( 1 ) , Great Britain ( 6 ) , and the United States ( 2 ) .",O O O O O O O O O O O O O O O O O O O O O O O O O O O O O O O O O O O O O O O O O,13
6906,8056,"In contrast to previous reports of this condition , one of our severely affected cases is a male . .",O O O O O O O O O O O O O O O O O O O O,13
9551,2573,"The support interval around this location extended about 8 cM proximal to DXS92 , and the AIH1 location could not be precisely defined by multipoint mapping .",O O O O O O O O O O O O O O O O O O O O O O O O O O O,32
1831,797,We therefore hypothesized that A - T is due to oxidative damage resulting from loss of function of the A - T gene product .,O O O O B I I O O O O O O O O O O O O B I I O O O,32
8271,3638,This is presently the only animal model for X - linked G6PD deficiency in humans . .,O O O O O O O O B I I I I O O O O,32
4119,1320,"Further , Atm - and Bax - dependent apoptosis in the CNS also required caspase - 3 activation .",O O O O O O O O O O O O O O O O O O O,32
9864,4749,"A high risk of colorectal cancer was predicted when an interstitial deletion of the long arm of chromosome 5 , del ( 5 ) ( q15q22 . 3 ) , was detected in her lymphocytes and deletion of the MCC and APC genes confirmed by molecular analysis .",O O O O B I O O O O O O O O O O O O O O O O O O O O O O O O O O O O O O O O O O O B O O O O O O,32
4629,4804,"Using this approach , we have also identified 3 novel mutations in cDNA from liver and lymphocytes of two patients .",O O O O O O O O O O O O O O O O O O O O O,32
6123,7386,We have expressed the mature form of Yfh1p ( mYfh1p ) in Escherichia coli and have analyzed its function in vitro .,O O O O O O O O O O O O O O O O O O O O O O,13
5420,5647,"The remaining 26 patients were identified as having 21 independent mutations , including 12 novel mutations resulting in small nucleotide alterations in the ALD gene .",O O O O O O O O O O O O O O O O O O O O O O O B O O,13
10090,627,We postulate that the END repeats flanking 15q11 - q13 mediate homologous recombination resulting in deletion .,O O O O O O O O O O O O O O O O O,32
4315,2035,"Thus , transcripts with expanded CUG repeats are sufficient to generate a DM phenotype .",O O O O O O O O O O O O B O O,32
5177,2572,30 for a location of AIH1 at 2 cM distal to DXS16 .,O O O O O O O O O O O O O,32
6936,9339,Comparison of G6PD spectra in two subpopulations and in a mixed group permits to make a conclusion about existence of common and rare G6PD alleles in examined population .,O O O O O O O O O O O O O O O O O O O O O O O O O O O O O,13
5432,1599,We observed that the YAC transgene supported production of the human protein ( FMRP ) which was present at levels 10 to 15 times that of endogenous protein and was expressed in a cell - and tissue - specific manner .,O O O O O O O O O O O O O O O O O O O O O O O O O O O O O O O O O O O O O O O O O,32
7747,7308,"The gene Prph2 encodes a photoreceptor - specific membrane glycoprotein , peripherin - 2 ( also known as peripherin / rds ) , which is inserted into the rims of photoreceptor outer segment discs in a complex with rom - 1 ( ref . 2 ) .",O O O O O O O O O O O O O O O O O O O O O O O O O O O O O O O O O O O O O O O O O O O O O O O,13
4073,9800,The recombinant protein was found to catalyze the reactions also carried out by platelet 5 - phosphatase II .,O O O O O O O O O O O O O O O O O O O,13
1340,9986,CAG expansions in a novel gene for Machado - Joseph disease at chromosome 14q32 . 1 .,O O O O O O O B I I I O O O O O O,13
3188,11271,The majority of mutant mice rapidly develop thymic lymphomas and die before 4 months of age .,O O O O O O O B I O O O O O O O O,13
9767,6260,We present a child in whom phenylketonuria was apparently caused by homozygosity for the mutation E390G in exon 11 of the phenylalanine hydroxylase ( PAH ) gene .,O O O O O O B O O O O O O O O O O O O O O O O O O O O O,13
9839,11609,"Among family members , an average age of less than 55 years at the diagnosis of breast cancer , the presence of ovarian cancer , the presence of breast and ovarian cancer in the same woman , and Ashkenazi Jewish ancestry were all associated with an increased risk of detecting a BRCA1 mutation .",O O O O O O O O O O O O O O O O B I O O O O B I O O O O B I I I O O O O O O O O O O O O O O O O O O O O O O,13
5929,10822,"Characterisation of the expression of this gene in patient tissues has thus far generated conflicting data on alterations in the steady state levels of DMPK mRNA , and on the final DMPK protein levels in the presence of the expansion .",O O O O O O O O O O O O O O O O O O O O O O O O O O O O O O O O O O O O O O O O O,13
4171,9691,The other 6 .,O O O O,13
6274,8564,"The extent of these duplications has been characterized according to the published exon - containing HindIII fragment map , and in six of the 10 duplications a novel restriction fragment that spanned the duplication junction was detected .",O O O O O O O O O O O O O O O O O O O O O O O O O O O O O O O O O O O O O O,13
4405,7885,We were unable to find a mutation in one patient despite complete sequencing of the genomic sequence of the gene .,O O O O O O O O O O O O O O O O O O O O O,13
4347,1615,"Friedreich ataxia ( FRDA ) , the most common autosomal recessive ataxia , is caused in almost all cases by homozygous intronic expansions resulting in the loss of frataxin , a mitochondrial protein conserved through evolution , and involved in mitochondrial iron homeostasis .",B I O B O O O O O B I I O O O O O O O O O O O O O O O O O O O O O O O O O O O O O O O O,32
6434,2758,5 at 1 cM .,O O O O O,32
2061,10773,Several BRCA1 mutations have now been found to occur in geographically diverse breast and ovarian cancer families .,O O O O O O O O O O O O B I I I O O,13
6887,8845,Complete deficiency of hypoxanthine - guanine phosphoribosyltransferase ( HPRT ) causes the Lesch - Nyhan syndrome .,O B I I I I I O O O O O B I I I O,13
701,8804,"Phenylketonuria ( PKU ) is an autosomal recessive human genetic disorder caused by a deficiency of hepatic phenylalanine hydroxylase ( PAH , phenylalanine 4 - monooxygenase , EC 1 . 14 . 16 . 1 ) .",B O B O O O B I I I I O O O B I I I I O O O O O O O O O O O O O O O O O O,13
8735,12612,"This distribution of emerin was similar to that of lamin A , a candidate gene for an autosomal form of EDMD .",O O O O O O O O O O O O O O O O O O O O B O,39
1863,7043,The only instance of disassociation of B27 and spondylitis in a family was where the proband had ulcerative colitis as well as spondylitis .,O O O O O O O O B O O O O O O O O B I O O O B O,13
2561,2053,Several different missense mutations have been identified in patients with FHM .,O O O O O O O O O O B O,32
8599,10835,The mutations were small insertions and deletions and point mutations in roughly equal proportions . .,O O O O O O O O O O O O O O O O,13
1208,5480,Both mutations were predicted to truncate the E - cadherin protein in the signal peptide domain .,O O O O O O O O O O O O O O O O O,13
2369,1794,"Isolation , genomic organization , and expression analysis of the mouse and rat homologs of MEFV , the gene for familial mediterranean fever .",O O O O O O O O O O O O O O O O O O O O B I I O,32
1427,1889,"Caucasians , Blacks , and Mexican Hispanics and stratify by disease severity and ethnicity .",O O O O O O O O O O O O O O O,32
4266,11411,The vast majority of both polymorphic and sporadic G6PD variants are due to single missense mutations .,O O O O O O O O O O O O O O O O O,13
4941,2667,This mutation thus has a different geographic centre of diffusion and is probably less common than the exon 1 deletion TSD mutation in French Canadians .,O O O O O O O O O O O O O O O O O O O O B O O O O O,32
4425,9024,The finding of jaw lesions and / or pigmented ocular fundus lesions in relatives at risk are indications of the possible presence of the GS gene .,O O O B I O O O B I I I O O O O O O O O O O O O B O O,13
4188,697,27 at theta = 0 .,O O O O O O,32
3331,7384,These findings indicate that frataxin is essential for mitochondrial iron homeostasis and protection from iron - induced formation of free radicals .,O O O O O O O O O O O O O O O O O O O O O O,13
4206,8887,We have now used DNA polymorphisms associated with the AAT gene to investigate the origin of the PI Z allele .,O O O O O O O O O O O O O O O O O O O O O,13
9269,1802,"2 domain , in which most FMF - associated mutations have been found in human MEFV .",O O O O O O B O O O O O O O O O O,32
3218,9768,The propositus was an isolated case of Duchenne muscular dystrophy with marked dystrophin deficiency in muscle biopsy .,O O O O O O O B I I O O B I O O O O,13
4246,7549,It appears to be a typical folate sensitive fragile site .,O O O O O O O O O O O,13
5349,9194,"In six kindreds , platelet vWF Ag and RiCof were equally low ( platelet low ) ; after DDAVP , plasma vWF Ag and RiCof remained low , and the BT was prolonged .",O O O O O O O O O O O O O O O O O O O O O O O O O O O O O O O O O O,13
2617,2393,It is well known that an elevated frequency of TSD mutations exists among Ashkenazi Jews .,O O O O O O O O O B O O O O O O,32
9400,3931,"Engraftment and complete hematologic recovery occurred within 4 weeks , but neurologic deterioration continued .",O O O O O O O O O O O B I O O,32
5783,12565,Coincidence of two novel arylsulfatase A alleles and mutation 459 + 1G > A within a family with metachromatic leukodystrophy : molecular basis of phenotypic heterogeneity .,O O O O O O O O O O O O O O O O O O B I O O O O O O O,39
955,5094,"Detailed analysis of genomic deletions in Norrie patients shows that they are heterogeneous , both in size and in position .",O O O O O O B O O O O O O O O O O O O O O,32
6586,1298,Currently there is no known treatment that alters the natural course of the disease .,O O O O O O O O O O O O O O O,32
9735,5322,We found normal whole body oxidation of D - ( 13C ) - galactose by the patient homozygous for S135L and various degrees of enzyme impairment among different tissues .,O O O O O O O O O O O O O O O O O O O O O O O O O O O O O O,32
759,6593,"Nucleotide sequence analysis of GPIa cDNA derived from Sit ( a ) - positive platelets showed C ( 2531 ) - - > T ( 2531 ) point mutation , resulting in Thr ( 799 ) Met dimorphism .",O O O O O O O O O O O O O O O O O O O O O O O O O O O O O O O O O O O O O O O,13
39,8812,"Linkage studies using restriction fragment length polymorphisms were conducted in the X - linked disorder , choroideremia , designated TCD for Progressive Tapeto - Choroidal Dystrophy .",O O O O O O O O O O O B I I I O B O O B O B I I I I O,13
5659,130,"Deficiency of the ninth component of human complement ( C9 ) is the most common complement deficiency in Japan , with an incidence of approximately one homozygote in 1000 , but is very rare in other countries .",B I I I I I I I O O O O O O O B I O O O O O O O O O O O O O O O O O O O O O,32
9292,2674,"Resolution of the two loci for autosomal dominant aniridia , AN1 and AN2 , to a single locus on chromosome 11p13 .",O O O O O O O O B O O O O O O O O O O O O O,32
5505,6871,Transcription of rsca3 was detected in most rat tissues including brain .,O O O O O O O O O O O O,13
1810,8652,"Considerable genetic continuity was demonstrated between these widely dispersed populations , since three common haplotypes ( 4 , 1 , and 7 ) constituted over 95 % of alleles .",O O O O O O O O O O O O O O O O O O O O O O O O O O O O O O,13
1843,11894,"Although increasing measured allele size between patients clearly correlates with an increased severity of symptoms and an earlier age of onset , this correlation is not precise and measured allele length cannot be used as an accurate predictor of age of onset .",O O O O O O O O O O O O O O O O O O O O O O O O O O O O O O O O O O O O O O O O O O O,39
4014,9451,Complement deficiency states in myasthenia gravis ( MG ) have not been reported previously .,B I O O B I O B O O O O O O O,13
4575,8664,"By contrast , tumours from four of the five bilateral patients retained the paternal RB1 allele .",O O O B O O O O O O O O O O O O O,13
2587,1585,We show that Foxc1 ( + / - ) mice have anterior segment abnormalities similar to those reported in human patients .,O O O O O O O O O O O B I I O O O O O O O O,32
1388,6637,A maximum two - point lod score of 7 .,O O O O O O O O O O,13
9953,3676,Estimation of the male to female ratio of mutation rates from the segregation of X - chromosomal DNA haplotypes in Duchenne muscular dystrophy families .,O O O O O O O O O O O O O O O O O O O O B I I O O,32
9868,8550,"In complement - sensitivity lysis tests , 80 % of her erythrocytes were markedly complement - sensitive ( PNH - III ) .",O O O O O O O O O O O O O O O O O O O O O O O,13
7428,7892,"Using these methods , we report striking linkage disequilibrium for diastrophic dysplasia ( DTD ) in Finland indicating that the DTD gene should lie within 0 .",O O O O O O O O O O B I O B O O O O O O B O O O O O O,13
6930,2999,"We report a child with PWS and a de novo unbalanced karyotype - 45 , XY , - 9 , - 15 , + der ( 9 ) t ( 9 ; 15 ) ( q34 ; q13 ) .",O O O O O B O O O O O O O O O O O O O O O O O O O O O O O O O O O O O O O O O O,32
8218,11905,"In ataxia - telangiectasia ( A - T ) patients , mutations in a single gene , ATM , result in an autosomal recessive syndrome that embraces a variety of clinical features and manifests extreme radiosensitivity and a strong pre - disposition to malignancy .",O B I I O B I I O O O O O O O O O O O O O O B I I O O O O O O O O O O O O O O O O O O B O,39
2526,12187,"Mice with a larger deletion involving both Snrpn and the putative PWS - IC lack expression of the imprinted genes Zfp127 ( mouse homologue of ZNF127 ) , Ndn and Ipw , and manifest several phenotypes common to PWS infants .",O O O O O O O O O O O O O O O O O O O O O O O O O O O O O O O O O O O O O O B O O,39
3972,4132,Aberrant subcellular localization of BRCA1 in breast cancer .,O O O O O O B I O,32
1889,11317,RESULTS Four missense mutations producing amino acid substitutions and a somatic 12 - base pair deletion in the coding region of the DPC4 gene were detected in the 31 cancers ( 16 % ; 5 of 31 ) .,O O O O O O O O O O O O O O O O O O O O O O O O O O O O O B O O O O O O O O O,13
2384,10426,Immunoreactive DM - kinase protein of 53 kD is present at low levels in skeletal and cardiac muscle extracts of DM patients and normal controls .,O O O O O O O O O O O O O O O O O O O O B O O O O O,13
2235,3834,"Using similar methods , we now find that C5 deficiency in each of five different mouse strains ( AKR , SWR , DBA / 2J8 A / HeJ and B10 . D2 / old line ) is due to a failure in secretion of C5 protein and not to a failure in biosynthesis of pro - C5",O O O O O O O O B I O O O O O O O O O O O O O O O O O O O O O O O O O O O O O O O O O O O O O O O O O O O O O O O,32
5318,4209,"However , the mutation stats of individuals unselected for breast or ovarian cancer has not been determined , and it is not known whether mutations in such individuals confer the same risk of cancer as in individuals from the high - risk families studied so far .",O O O O O O O O O B I I I O O O O O O O O O O O O O O O O O O O O B O O O O O O O O O O O O O,32
9446,12039,Genetic heterogeneity and penetrance analysis of the BRCA1 and BRCA2 genes in breast cancer families .,O O O O O O O O O O O O B I O O,39
4805,3100,We have identified 43 subjects with a G6PD variant .,O O O O O O O O O O,32
4157,11069,The von Hippel - Lindau ( VHL ) disease product is thought to down - regulate transcription by antagonizing elongin - enhanced transcriptional elongation .,O B I I I I I I I O O O O O O O O O O O O O O O O,13
8403,7964,The AMELX gene located at Xp22 .,O O O O O O O,13
5627,4424,These results suggested the heterogenous nature of the mutations causing the deficiency in the seven patients .,O O O O O O O O O O O O O O O O O,32
3196,7974,"The support interval around this location extended about 8 cM proximal to DXS92 , and the AIH1 location could not be precisely defined by multipoint mapping .",O O O O O O O O O O O O O O O O O O O O O O O O O O O,13
453,9457,"0066 % ( SEM ) of total fatty acids , compared to 0 .",O O O O O O O O O O O O O O,13
1513,10406,Haplotype studies in Wilson disease .,O O O B I O,13
7941,10951,"The A305E missense mutation accounted for 48 % ( 24 / 50 ) of mutant chromosomes in patients of western European descent , while the two predominant Jewish mutations each accounted for a single mutant chromosome .",O O O O O O O O O O O O O O O O O O O O O O O O O O O O O O O O O O O O O,13
6368,6015,"In sharp contrast , among the 34 duplicated cases , 91 % of mothers were carriers , a value significantly ( chi2 = 9 . 20 , P < . 01 ) in favor of a male bias , with an estimation of the male / female mutation frequency ( k ) of 9 .",O O O O O O O O O O O O O O O O O O O O O O O O O O O O O O O O O O O O O O O O O O O O O O O O O O O O O O O,13
10036,6145,Both penetrance and expression ( breast cancer vs . ovarian cancer ) were different from those in reports of the Ashkenazi founder mutations .,O O O O O B I O O B I O O O O O O O O O O O O O,13
3057,8148,"Denys - Drash syndrome is a rare human condition in which severe urogenital aberrations result in renal failure , pseudohermaphroditism , and Wilms tumor ( nephroblastoma ) .",B I I I O O O O O O O O B I O O B I O B O O B I O B O O,13
1621,11800,The highest allele frequency ( 7 . 5 % ) was found in Swedes .,O O O O O O O O O O O O O O O,39
9117,9879,BRCA1 mRNA levels are markedly decreased during the transition from carcinoma in situ to invasive cancer .,O O O O O O O O O O B I I O B I O,13
4862,12051,The estimated cumulative risk of breast cancer reached 28 % ( 95 % CI 9 % - 44 % ) by age 50 years and 84 % ( 95 % CI 43 % - 95 % ) by age 70 years .,O O O O O B I O O O O O O O O O O O O O O O O O O O O O O O O O O O O O O O O O O O,39
4303,3143,"One of the eight previously reported ALD individuals has a long deletion 5 of the red pigment gene , a deletion causing blue cone monochromacy .",O O O O O O B O O O O O O O O O O O O O O O O O O O,32
3135,2472,"Combining these data and the results of LOH , more than 80 % of tumors ( 14 adenomas and 39 carcinomas ) had at least one mutation in the APC gene , of which more than 60 % ( 9 adenomas and 23 carcinomas ) had two mutations .",O O O O O O O O O O O O O O B O O B O O B O O O O O O O O B O O O O O O O O O O B O O B O O O O O,32
6716,12436,"Moreover , a 16 .",O O O O O,39
7686,8218,Gene segregation in the original patients family was consistent with available clinical and biochemical data .,O O O O O O O O O O O O O O O O,13
3014,2881,We report here two missense mutations which result in low or undetectable enzymatic activity .,O O O O O O O O O O O O O O O,32
1929,11819,The identification of the second mutational event in 10 ( 43 % ) tumors establishes PTEN / MMAC1 as a main inactivation target of 10q loss in sporadic prostate cancer . .,O O O O O O O O O O O O O B O O O O O O O O O O O O O B I I O O,39
9174,6115,"We performed a sperm typing study of five MJD patients of French descent and analysis of the pooled data shows a ratio of mutant to normal alleles of 379 436 ( 46 . 5 53 . 5 % ) , which does not support meiotic segregation distortion .",O O O O O O O O B O O O O O O O O O O O O O O O O O O O O O O O O O O O O O O O O O O O O O O O,13
4591,7421,The adenomatous polyposis coli gene ( APC ) is mutated in familial adenomatous polyposis and in sporadic colorectal tumors .,O B I I O O O O O O O B I I O O O B I O,13
471,300,"Moreover , we were able to restore the peroxisomal beta - oxidation defect in the liver of ALDP - deficient mice by stimulation of ALDRP and PMP70 gene expression through a dietary treatment with the peroxisome proliferator fenofibrate .",O O O O O O O O O O O O O O O O O O O O O O O O O O O O O O O O O O O O O O O,32
9215,10702,The KmNADP of G6PD Orissa is fivefold higher than that of the normal enzyme .,O O O O O O O O O O O O O O O,13
1144,10794,A 34 kD protein is immunoreactive with the antisera - - the protein is equivalent to that predicted for emerin .,O O O O O O O O O O O O O O O O O O O O O,13
7283,12071,We show that sodium channels with the missense mutation recover from inactivation more rapidly than normal and that the frameshift mutation causes the sodium channel to be non - functional .,O O O O O O O O O O O O O O O O O O O O O O O O O O O O O O O,39
6195,428,"In several instances , family studies provided molecular evidence for pseudodominant transmission and incomplete penetrance of the disease phenotype .",O O O O O O O O O O O O O O O O O O O O,32
8318,7626,"Tay - Sachs disease ( TSD ) is an autosomal recessive genetic disorder resulting from mutation of the HEXA gene encoding the alpha - subunit of the lysosomal enzyme , beta - N - acetylhexosaminidase A ( Hex A ) .",B I I I O B O O O B I I I O O O O O O O O O O O O O O O O O O O O O O O O O O O O,13
3577,2260,5 megabases of flanking sequences .,O O O O O O,32
10030,5522,We adopted both single - strand conformation polymorphism ( SSCP ) analysis and a method of analysis involving the reverse transcription - polymerase chain reaction ( RT - PCR ) followed by a protein truncation test ( PTT ) .,O O O O O O O O O O O O O O O O O O O O O O O O O O O O O O O O O O O O O O O O,13
3526,11328,"Although the specific gene inactivated by this allelic loss has not been elucidated , the DCC ( deleted in colorectal cancer ) gene is a candidate .",O O O O O O O O O O O O O O O O O O O B I O O O O O O,13
6908,8768,"This finding , in association with 3 other instances of single breaks at 11p13 and aniridia , supports the assignment of AN2 to 11p13 .",O O O O O O O O O O O O O O O B O O O O O O O O O,13
3896,9787,Structural analysis of the 5 ' region of mouse and human Huntington disease genes reveals conservation of putative promoter region and di - and trinucleotide polymorphisms .,O O O O O O O O O O O B I O O O O O O O O O O O O O O,13
7172,7037,One hundred and twenty - eight of 145 patients with ankylosing spondylitis ( AS ) were found to be HLA B27 positive .,O O O O O O O O O O B I O B O O O O O O O O O,13
1614,2922,"Restriction fragment length polymorphism alleles for the ADH2 , ADH3 , EGF , FG alpha and FG beta loci and blood group antigens for the MNS locus were determined in a panel of 12 Finnish AGU families .",O O O O O O O O O O O O O O O O O O O O O O O O O O O O O O O O O O O B O O,32
4971,1449,Mutations in the BRCA1 ( ref . 1 ) tumour suppressor gene are found in almost all of the families with inherited breast and ovarian cancers and about half of the families with only breast cancer .,O O O O O O O O O B O O O O O O O O O O O B I I I I O O O O O O O O B I O,32
