Unnamed: 0.1,Unnamed: 0,text,labels,txt_len
1145,6388,"However , the widespread use of BRCA1 testing has been limited to date by three principal concerns the fear of loss of health and life insurance , the uncertain clinical value of a positive test result , and the current lack of an inexpensive and sensitive screening test for BRCA1 mutations .",O O O O O O O O O O O O O O O O O O O O O O O O O O O O O O O O O O O O O O O O O O O O O O O O O O O O,13
5660,6032,"The expression of VWS , which has incomplete penetrance , is highly variable .",O O O B O O O O O O O O O O,13
555,7935,Endocrine neoplasms have been reported occasionally in patients with familial adenomatous polyposis ( FAP ) .,B I O O O O O O O B I I O B O O,13
1240,11230,"In contrast , a vector derived from a recombinant adenovirus can restore 10 % - 80 % of normal hepatic PAH activity into PAH - deficient mice , which completely normalizes serum phenylalanine levels .",O O O O O O O O O O O O O O O O O O O O O O O B I I O O O O O O O O O,13
5105,9154,The nucleic acid and predicted amino acid sequences from the two species are nearly 90 percent homologous .,O O O O O O O O O O O O O O O O O O,13
610,4004,"Evaluation of his complement system showed an absence of functional and antigenic C7 , compatible with a complete deficiency of the seventh component of complement .",O O O O O O O O O O O O O O O O O O B I I I I I I O,32
5268,1541,"The HMGI family of proteins consists of three members , HMGIC , HMGI and HMGI ( Y ) , that function as architectural factors and are essential components of the enhancesome .",O O O O O O O O O O O O O O O O O O O O O O O O O O O O O O O O,32
226,8543,No deletions were found with probes that lie 3 of the green pigment genes .,O O O O O O O O O O O O O O O,13
8485,3151,"Surprisingly , she has suffered only mild haemolysis and has never experienced massive spontaneous haemolysis .",O O O O O O O B O O O O O O B O,32
4183,2192,Allele - specific oligonucleotide hybridization confirmed homozygosity in the proband .,O O O O O O O O O O O,32
8458,7701,Prader - Willi syndrome ( PWS ) is associated with paternally derived chromosomal deletions in region 15q11 - 13 or with maternal disomy for chromosome 15 .,B I I I O B O O O O O O O O O O O O O O O B I I I I O,13
8603,11560,"While only 5 % of sporadic Wilms tumours have intragenic WT1 mutations , > 90 % of patients with the Denys - Drash syndrome ( renal nephropathy , gonadal anomaly , predisposition to WT ) carry constitutional intragenic WT1 mutations .",O O O O O B I I O O O O O O O O O O O O B I I I O B I O B I O B I I O O O O O O O,13
2890,9212,Three pedigrees of lip pits in the literature show no clefts among a significant number of affected individuals .,O O O B I O O O O O O O O O O O O O O,13
5207,2950,62 .,O O,32
9690,623,Novel DNA sequences potentially associated with the breakpoints were positionally cloned from YACs within or near these regions .,O O O O O O O O O O O O O O O O O O O,32
5468,9945,"In a well - characterized family , in which three of eight siblings have fructosuria , all affected individuals are compound heterozygotes for two mutations Gly40Arg and Ala43Thr .",O O O O O O O O O O O O O O B O O O O O O O O O O O O O O,13
8445,6294,Both carried a missense mutation within the NDP gene on chromosome Xp11 .,O O O O O O O O O O O O O,13
2244,10954,The heterozygosity for 876 deltaAGAA mutation was identified in three independent patients from England .,O O O O O O O O O O O O O O O,13
3086,3565,"C3 levels in family members ( seven of 24 half - normal ) , lack of anti - C3 activity , normal C3b - INA levels and a normal rate of catabolism of transfused C3 indicated that the deficiency was inherited with autosomal codominance and involved decreased synthesis of C3 .",O O O O O O O O O O O O O O O O O O O O O O O O O O O O O O O O O O O O O O O O O O O O O O B I I I O,32
6907,6204,"The c862t ( R279W ) transition is the most common mutation in non - Finnish patients , but in these disorders it is usually combined with other DTDST mutations .",O O O O O O O O O O O O O O O O O O O O O O O O O O O O O O,13
467,645,Mutations have now been defined for every exon of the ATM gene .,O O O O O O O O O O O O O,32
1069,2934,55 at 4 cM for CYP2A - DM .,O O O O O O O O O,32
1201,5434,Our findings suggest that subtle differences in the course of the neurodegeneration in HD may allow interacting genes to exert gender specific effects upon AO .,O O O O O O O O O O O B O B O O O O O O O O O O O O,13
8111,5011,These findings have important implications for mutation detection and molecular diagnosis in families with Wilson disease .,O O O O O O O O O O O O O O B I O,32
7690,2528,"Physical mapping using somatic cell hybrids places D22S66 between D22S75 and D22S259 , suggesting that it should be deleted in the remaining six cases .",O O O O O O O O O O O O O O O O O O O O O O O O O,32
2545,6720,"Therefore , although the major IR - induced apoptotic pathway in the CNS requires Atm and Bax , a p53 - dependent collateral pathway exists that has both Atm - and Bax - independent branches .",O O O O O O O O O O O O O O O O O O O O O O O O O O O O O O O O O O O O,13
8420,1816,"In the inv ( X ) carried by several affected family members , FISH showed PLP signals at Xp11 .",O O O O O O O O O O O O O O O O O O O O,32
7311,11285,Molecular bases of combined subtotal deficiencies of C6 and C7 : their effects in combination with other C6 and C7 deficiencies .,O O O B I I I I I I O O O O O O O B I I I O,13
1194,9597,Our limited data set on galactosemia mutations in Japanese suggests that the N314D GALT mutation encoding the Duarte variant arose before Asian and Caucasian people diverged and that classic galactosemia mutations arose and / or accumulated after the divergence of Asian and Caucasian populations . .,O O O O O B O O O O O O O O O O O O O O O O O O O O O O B I O O O O O O O O O O O O O O O O,13
1595,8986,Impaired fatty alcohol oxidation in cultured fibroblasts due to deficient fatty alcohol : nicotinamide adenine dinucleotide oxidoreductase activity .,O O O O O O O O O O O O O O O O O O O,13
9304,6958,"Variation in the antigen level of heterozygous relatives of probands was found to be significantly higher between families than within families , consistent with the view that the nature of the F10 lesion ( s ) segregating in a given family is a prime determinant of the laboratory phenotype .",O O O O O O O O O O O O O O O O O O O O O O O O O O O O O O O O O O O O O O O O O O O O O O O O O O,13
655,2091,Increased rates of chromosome damage were also observed in the fibroblasts of some phenotypically normal family members ( obligate heterozygotes and sibs ) when compared to normal controls .,O O O O O O O O O O O O O O O O O O O O O O O O O O O O O,32
2141,12073,"Molecular heterogeneity in mucopolysaccharidosis IVA in Australia and Northern Ireland : nine novel mutations including T312S , a common allele that confers a mild phenotype .",O O O B I O O O O O O O O O O O O O O O O O O O O O,39
578,11657,"We describe herein , to our knowledge , for the first time , the cloning of a full - length cDNA for ATM and correction of multiple aspects of the radio - sensitive phenotype of A - T cells by transfection with this cDNA .",O O O O O O O O O O O O O O O O O O O O O O O O O O O O O O O O O O O B I I O O O O O O O,13
10059,8705,2 shows that the DM locus is distal to APOC2 .,O O O O B O O O O O O,13
8596,4593,A total of eight putative disease - causing alterations were identified four of these are frameshifts and two are nonsense mutations .,O O O O O O O O O O O O O O O O O O O O O O,32
5206,1729,"Both the A - T phenotype and the similarity of the ATM protein to other DNA - damage sensors suggests a role for ATM in biochemical pathways involved in the recognition , signalling and repair of DNA double - strand breaks ( DSBs ) .",O O B I I O O O O O O O O O O O O O O O O O O O O O O O O O O O O O O O O O O O O O O O O,32
6579,403,Immunohistochemical staining for AGA was performed on 15 oral specimens .,O O O O O O O O O O O,32
2162,1987,Aerobic addition of ferrous iron to mYfh1p results in assembly of regular spherical multimers with a molecular mass of approximately 1 .,O O O O O O O O O O O O O O O O O O O O O O,32
1294,10257,"This frequency was higher than the frequency expected from the probability of the repeat contractions ( 6 . 4 % ) and the size of DM sib population ( 1 . 54 DM offspring per DM parent , in 968 DM parents ) .",O O O O O O O O O O O O O O O O O O O O O O O O O B O O O O O O B O O B O O O O B O O O,13
8137,2590,Inherited complement deficiencies are associated with a variety of connective tissue diseases .,B I I O O O O O O O O O O,32
382,2591,A family with inherited deficiency of complement factor 2 ( C2 ) is described in which two family members with homozygous C2 deficiency developed cutaneous vasculitis and sicca syndrome .,O O O B I I I I I O O O O O O O O O O O O B I O B I O B I O,32
9519,1343,A high percentage of ATM germline mutations was demonstrated among patients with sporadic breast cancer .,O O O O O O O O O O O O B I I O,32
10047,6295,2 2 .,O O O,13
3222,9983,The mutation was not observed in DNA from either of the clinically unaffected parents of the proband .,O O O O O O O O O O O O O O O O O O,13
6575,6624,"Mutations located at the extreme 5 end of the APC gene , however , are associated with a less severe disease known as attenuated adenomatous polyposis coli ( AAPC ) .",O O O O O O O O O B O O O O O O O O O O O O O B I I I O B O O,13
9741,8438,"However , because of her sex she was diagnosed as having limb - girdle muscular dystrophy .",O O O O O O O O O O O B I I I I O,13
5772,5451,"In addition , a significant excess risk of basal cell carcinoma was seen ( standardized incidence ratio 35 , 95 % confidence interval 7 . 2 to 102 ) .",O O O O O O O O B I I O O O O O O O O O O O O O O O O O O O,13
3021,5050,"However , a modified expression of the WAS gene producing a mild phenotypic variant cannot be excluded entirely . .",O O O O O O O B O O O O O O O O O O O O,32
6918,3888,Molecular evidence for new mutation at the hprt locus in Lesch - Nyhan patients .,O O O O O O O O O O B I I O O,32
2584,9596,We speculate that classic galactosemia mutations appear to differ between Japanese and Caucasian patients .,O O O B I O O O O O O O O O O,13
5095,663,OBJECTIVE To examine the relationship of phenylalanine hydroxylase ( PAH ) genotypes to biochemical phenotype and cognitive development in maternal phenylketonuria ( PKU ) .,O O O O O O O O O O O O O O O O O O O B I O B O O,32
4624,3266,We have estimated the haplotype distribution of mutant and normal phenylalanine hydroxylase ( PAH ) alleles for 17 Turkish phenylketonuria ( PKU ) families 20 normal and 27 mutated PAH alleles could be identified .,O O O O O O O O O O O O O O O O O O O B O B O O O O O O O O O O O O O,32
10079,5158,Each patient represents a different stage of the amyloidotic kidney disease of FMF and the effect of continuous colchicine treatment on its course .,O O O O O O O O B I I O B O O O O O O O O O O O,32
4166,4388,Here we present a detailed comparison of the sequence of the putative promoter and the organization of the 5 genomic region of the murine ( Hdh ) and human HD genes encompassing the first five exons .,O O O O O O O O O O O O O O O O O O O O O O O O O O O O O B O O O O O O O,32
6166,805,He was treated for club foot and hip dysplasia at birth .,O O O O B I O B I O O O,32
5885,10647,Two mutations creating premature termination codons were associated with lack of detectable mRNA on Northern blots .,O O O O O O O O O O O O O O O O O,13
4221,9797,"The OCRL protein is 51 % identical to inositol polyphosphate 5 - phosphatase II ( 5 - phosphatase II ) from human platelets over a span of 744 aa , suggesting that OCRL may be a similar enzyme .",O O O O O O O O O O O O O O O O O O O O O O O O O O O O O O O O O O O O O O O,13
10060,124,"Nineteen of the detected mutations were presumed to be novel , thus emphasizing the heterogeneity of the mutational spectrum in Korean FAP patients .",O O O O O O O O O O O O O O O O O O O O O B O O,32
4719,5878,"This idea is based partly on the phenotype of homozygous Krox20 ( Egr2 ) knockout mice , which display hypomyelination of the PNS and a block of Schwann cells at an early stage of differentiation .",O O O O O O O O O O O O O O O O O O O B I I I O O O O O O O O O O O O O,13
9956,2662,In both mutations a restriction site for the endonuclease EcoRII is abolished .,O O O O O O O O O O O O O,32
3444,6827,Atm ( y / y ) mice exhibit deficits in motor learning indicative of cerebellar dysfunction .,O O O O O O O O O O O O O O B I O,13
3090,178,"The FMF gene ( MEFV ) was cloned recently , and four missense mutations were identified .",O B O O O O O O O O O O O O O O O,32
5069,12061,"In addition , a correlation between smooth pursuit gain and the number of trinucleotide repeats was found .",O O O O O O O O O O O O O O O O O O,39
4797,7547,Characterisation of a new rare fragile site easily confused with the fragile X .,O O O O O O O O O O O B I O,13
3641,6373,Only 20 of 4000 ( 0 . 5 % ) patients had late - onset FMF .,O O O O O O O O O O O O O O O B O,13
2932,7287,Previous analyses have revealed that the pattern of germline mutations in the factor IX gene ( F9 ) is similar among a variety of ethnically and geographically diverse populations and compatible with the ancient pattern that has shaped the mammalian genome .,O O O O O O O O O O O O O O O O O O O O O O O O O O O O O O O O O O O O O O O O O O,13
5680,3397,C4d was normal in all patients studied .,O O O O O O O O,32
4475,9839,"In addition , C5D serum was capable of promoting normal phagocytosis and intracellular killing of Staphylococcus aureus .",O O O B O O O O O O O O O O O O O O,13
2836,10833,"The positioning of the polymerase chain reaction ( PCR ) primers was such that the resulting PCR products were of different sizes , which enabled us to analyze two different exons simultaneously and still distinguish between the banding profiles for both ( biplex analysis ) .",O O O O O O O O O O O O O O O O O O O O O O O O O O O O O O O O O O O O O O O O O O O O O O,13
982,7867,"In addition to loss of heterozygosity ( LOH ) at the APC locus in 30 tumors , 43 other somatic mutations were detected .",O O O O O O O O O O O B O O O B O O O O O O O O,13
2446,6579,The aim of this study is to refine the localization of the VWS gene and to further assess possible heterogeneity .,O O O O O O O O O O O O B O O O O O O O O,13
9921,823,"We have found that FAP patients with germline APC mutations within a small region ( codons 1 , 194 - 1 , 392 at most ) mainly show allelic loss in their colorectal adenomas , in contrast to other FAP patients , whose second hits tend to occur by truncating mutations in the mutation cluster region .",O O O O B O O O B O O O O O O O O O O O O O O O O O O O O O O O B I O O O O O B O O O O O O O O O O O O O O O O O,32
4016,7368,Inactivation of germline mutant APC alleles by attenuated somatic mutations : a molecular genetic mechanism for attenuated familial adenomatous polyposis .,O O O O B O O O O O O O O O O O B I I I O,13
3402,6769,Protein S deficiency is a recognized risk factor for venous thrombosis .,B I I O O O O O O B I O,13
8270,10048,"It encodes a new member of the "" ABC "" superfamily of membrane - associated transporters that shows , in particular , significant homology to the 70 - kDa peroxisomal membrane protein ( PMP70 ) .",O O O O O O O O O O O O O O O O O O O O O O O O O O O O O O O O O O O O,13
9934,10651,Evidence for inter - generational instability in the CAG repeat in the MJD1 gene and for conserved haplotypes at flanking markers amongst Japanese and Caucasian subjects with Machado - Joseph disease .,O O O O O O O O O O O O O O O O O O O O O O O O O O O B I I I O,13
4901,11229,"Vectors derived from a recombinant retrovirus or a DNA / protein complex can efficiently transduce the PAH cDNA into PAH - deficient hepatocytes in vitro , but the application of these vector systems is presently limited by their low transduction efficiency in vivo .",O O O O O O O O O O O O O O O O O O O B I I O O O O O O O O O O O O O O O O O O O O O O,13
6224,4519,The same allele for D14S280 segregates with the disease locus in the three kindreds .,O O O O O O O O O O O O O O O,32
3865,59,A clear correlation between the genotype and phenotype has not been established .,O O O O O O O O O O O O O,32
9290,4099,Wiskott - Aldrich syndrome : cellular impairments and their implication for carrier detection .,B I I I O O O O O O O O O O,32
3820,3858,These electrophoresis used a phosphate buffer system at pH 7 .,O O O O O O O O O O O,32
8461,2033,We have expressed an untranslated CUG repeat in an unrelated mRNA in transgenic mice .,O O O O O O O O O O O O O O O,32
4115,7610,These in vitro activities are the highest reported for mutant PAH enzymes produced in the same expression system .,O O O O O O O O O O O O O O O O O O O,13
4379,2931,"We have studied the genetic linkage of two markers , the apolipoprotein C1 ( APOC1 ) gene and a cytochrome P450 ( CYP2A ) gene , in relation to the gene for myotonic dystrophy ( DM ) .",O O O O O O O O O O O O O O O O O O O O O O O O O O O O O O O O B I O B O O,32
3828,5633,"The locus for non - syndromic sensorineural hearing loss with EVA has been mapped to the same chromosomal region , 7q31 , as the Pendred syndrome locus .",O O O B I I I I I O B O O O O O O O O O O O O O B I O O,13
2031,3712,Functional studies demonstrated that L10 mAb stimulates the proliferation of peripheral blood T lymphocytes as measured by stimulation of [ 3H ] thymidine incorporation .,O O O O O O O O O O O O O O O O O O O O O O O O O,32
3180,2027,We have found that chemical inhibitors of metalloproteases potentiate netrin - mediated axon outgrowth in vitro .,O O O O O O O O O O O O O O O O O,32
2499,4806,"The other two mutations are missense mutations in exons 10 and 11 ( respectively , L333F and E390G ) .",O O O O O O O O O O O O O O O O O O O O,32
2247,4514,"Combined two - point linkage analyses show that the new markers , D14S280 and AFM343vf1 , are tightly linked to the SCA3 locus , with maximal lod scores , at recombination fraction , ( theta ) = .",O O O O O O O O O O O O O O O O O O O O O O O O O O O O O O O O O O O O O O,32
5495,9216,Hereditary C7 deficiency .,B I I O,13
6805,3856,Incidence and characteristics of glucose - 6 - phosphate dehydrogenase variants in Japan .,O O O O O O O O O O O O O O,32
9509,4677,"However , the sera of the patients changed to be "" atherogenic "" ; total cholesterol , triglyceride and low - density lipoprotein ( LDL ) - cholesterol were increased , while high - density lipoprotein ( HDL ) - cholesterol was decreased .",O O O O O O O O O O O O O O O O O O O O O O O O O O O O O O O O O O O O O O O O O O O O,32
6354,4108,A new CT pattern in adrenoleukodystrophy .,O O O O O B O,32
2153,2566,Three families with XAI have been investigated using polymorphic DNA markers flanking the position of AMELX .,O O O B O O O O O O O O O O O O O,32
5554,1895,These results show that formation of preassociated receptor complexes is necessary for Fas signaling and dominant interference in human disease . .,O O O O O O O O O O O O O O O O O O O O O O,32
8195,6222,Most sporadic colorectal cancers also have two APC mutations .,O B I I O O O B O O,13
1480,1788,"Out of a total of 71 unique mutations , 50 were found only in a single family , and 51 had not been reported previously .",O O O O O O O O O O O O O O O O O O O O O O O O O O,32
8165,2279,28 ( recognising the DXS7 locus ) as a probe .,O O O O O O O O O O O,32
7685,1325,"While PLS cases have been identified throughout the world , HMS has only been described among descendants of a religious isolate originally from Cochin , India .",O B O O O O O O O O B O O O O O O O O O O O O O O O O,32
898,7215,Another three affected males from the family had similar findings .,O O O O O O O O O O O,13
9693,6519,"As yet , our understanding of HFE function in iron homeostasis is only partial ; an even more open question is its possible role in the immune system .",O O O O O O O O O O O O O O O O O O O O O O O O O O O O O,13
7638,6791,"Loss of expression of imprinted , paternally expressed genes has been implicated in PWS .",O O O O O O O O O O O O O B O,13
7604,3225,"This region includes the last five exons detected by cDNA5b - 7 , all exons detected by cDNA8 , and the first two exons detected by cDNA9 .",O O O O O O O O O O O O O O O O O O O O O O O O O O O O,32
2539,2638,"Three children are reported with typical cat eye syndrome ( CES ) and three more children with partial CES because of absence of coloboma , in which the supernumerary marker chromosome was studied by FISH .",O O O O O O B I I O B O O O O O O O B O O O O O O O O O O O O O O O O O,32
2578,11280,13105 .,O O,13
6041,8120,Analysis of the canine dystrophin gene in normal and GRMD dogs has failed to demonstrate any detectable loss of exons .,O O O O O O O O O B O O O O O O O O O O O,13
10095,6077,CONCLUSIONS The reproductive outcome in maternal phenylketonuria is dependent on prenatal metabolic control and postnatal environmental circumstances .,O O O O O B I O O O O O O O O O O O,13
7876,12582,Missense mutations in the most ancient residues of the PAX6 paired domain underlie a spectrum of human congenital eye malformations .,O O O O O O O O O O O O O O O O O B I I O,39
2134,3713,The time course and magnitude of increased [ 3H ] thymidine incorporation by T lymphocytes in response to L10 mAb paralleled that induced by anti - CD3 mAb .,O O O O O O O O O O O O O O O O O O O O O O O O O O O O O,32
8780,7301,Here we report that FCM - WASP analysis in monocytes could be a useful tool for the WAS carrier diagnosis .,O O O O O O O O O O O O O O O O O B O O O,13
3181,9521,"In the G6PD - deficient group , the incidence of cortical and total cataracts was also increased .",O O B I I O O O O O B I I I O O O O,13
1156,5274,Alterations were defined by DNA sequencing .,O O O O O O O,32
9710,10269,"Most remarkably , we observed multiple cases where the length distributions of intermediate - or small - sized alleles in fathers sperm were significantly different from that in their offsprings blood .",O O O O O O O O O O O O O O O O O O O O O O O O O O O O O O O O,13
5689,10572,Central nervous system demyelination progresses rapidly and death occurs within a few years .,B I I I O O O O O O O O O O,13
256,9838,The ability of C5D serum to opsonize Saccharomyces cerevisiae ( bakers yeast ) or Candida albicans for ingestion by normal neutrophils was completely normal .,O O O B O O O O O O O O O O O O O O O O O O O O O,13
487,9037,"The mutation does not affect the electrophoretic migration , the isoelectric point , or the thermal stability .",O O O O O O O O O O O O O O O O O O,13
1231,5175,The normal oxidation of VLCFA - CoA in patients fibroblasts suggested that the gene coding for the VLCFA - CoA synthetase could be a candidate gene for ALD .,O O O O O O O O O O O O O O O O O O O O O O O O O O O B O,32
5094,355,"By routine screening of sera , a subject was discovered who showed a sub - total deficiency of C6 and C7 .",O O O O O O O O O O O O O B I I I I I I I O,32
8957,4796,Beyond 0 .,O O O,32
6988,9368,"The linkage analysis required is described , and the need to check DMD families for informative RFLPs is stressed .",O O O O O O O O O O O O B O O O O O O O,13
1270,11674,"Mice doubly null for atm and p53 exhibited a dramatic acceleration of tumour formation relative to singly null mice , indicating that both genes collaborate in a significant manner to prevent tumorigenesis .",O O O O O O O O O O O O B O O O O O O O O O O O O O O O O O O O O,13
4222,8757,"In two type IIA vWD patients , two different but adjacent missense mutations were identified , the locations of which may identify an important vWF functional domain .",O O B I I O O O O O O O O O O O O O O O O O O O O O O O,13
4411,267,PDS encodes a putative transmembrane protein designated pendrin .,O O O O O O O O O,32
7791,11417,These findings help to outline the relationship and evolution of mutations in the human G6PD locus . .,O O O O O O O O O O O O O O O O O O,13
3445,2520,"DiGeorge syndrome ( DGS ) , a developmental field defect of the third and fourth pharyngeal pouches , is characterized by aplasia or hypoplasia of the thymus and parathyroid glands and by conotruncal cardiac malformations .",B I O B O O O O O O O O O O O O O O O O O B I I I I I I I I O O B I I O,32
4126,9300,With her it became possible to determine whether allelic exclusion occurs in particular cell - types of the WAS carrier .,O O O O O O O O O O O O O O O O O O B O O,13
5702,4621,"The BRCA1 region is also subject to allelic loss in sporadic breast and ovarian cancers , an indication that BRCA1 mutations may occur somatically in these tumors .",O O O O O O O O O O B I I I I O O O O O O O O O O O B O,32
3277,4627,"To study this dosage effect , we characterized two PAX6 mutations in a family segregating aniridia and a milder syndrome consisting of congenital cataracts and late onset corneal dystrophy .",O O O O O O O O O O O O O O O B O O O O O O B I O O O B I O,32
7102,12355,"Both human and mouse LRP5 cDNAs have been isolated and the encoded mature proteins are 95 % identical , indicating a high degree of evolutionary conservation . .",O O O O O O O O O O O O O O O O O O O O O O O O O O O O,39
9101,2232,"Instead , the low levels of mRNA from this allele were comprised of aberrant species resulting from the use of either of two cryptic donor sites , one truncating exon 9 and the other within IVS - 9 , spliced to exon 10 .",O O O O O O O O O O O O O O O O O O O O O O O O O O O O O O O O O O O O O O O O O O O O,32
