Unnamed: 0.1,Unnamed: 0,text,labels,txt_len
2666,4134,"In 16 of 17 breast and ovarian cancer lines and 17 of 17 samples of cells obtained from malignant effusions , however , BRCA1 localized mainly in cytoplasm .",O O O O B I I I O O O O O O O O O O O O O O O O O O O O O,32
9661,8909,"Heteroduplex analysis of two of these clones , which grew on DB1257 but not on LE392 , revealed stem - loop structures in the inserts , indicative of inverted , repeated DNA elements .",O O O O O O O O O O O O O O O O O O O O O O O O O O O O O O O O O O,13
199,8405,"The order of fourteen polymorphic markers localised to the long arm of human chromosome 19 has been established by multipoint mapping in a set of 40 CEPH ( Centre dEtude de Polymorphisme Humain , Paris ) reference families .",O O O O O O O O O O O O O O O O O O O O O O O O O O O O O O O O O O O O O O O,13
9815,5686,"To achieve this , we determined the prevalence of BRCA1 alterations in a population - based series of consecutive ovarian cancer cases .",O O O O O O O O O O O O O O O O O O O B I O O,13
7044,4666,"However , the D442G and Int14 A mutations were highly prevalent in subjects with HDL - C > or = 60 mg / dl , with combined allele frequencies of 9 % , 12 % , 21 % and 43 % for HDL - C 60 - 79 , 80 - 99 , 100 - 119 , and > or = 120 mg / dl , respectively .",O O O O O O O O O O O O O O O O O O O O O O O O O O O O O O O O O O O O O O O O O O O O O O O O O O O O O O O O O O O O O O O O O O O O,32
2894,608,"Proteolipoprotein gene analysis in 82 patients with sporadic Pelizaeus - Merzbacher Disease : duplications , the major cause of the disease , originate more frequently in male germ cells , but point mutations do not .",O O O O O O O O B I I I O O O O O O O O O O O O O O O O O O O O O O O O,32
7328,8131,"In studies of eight kindred , the 28 - base pair deletion was observed in all C2Q0 alleles associated with the common type I deficient complotype / haplotype ; this deletion was not present in normal C2 nor in type II C2 - deficient genes .",O O O O O O O O O O O O O O O O O O O O O O O O O O O O O O O O O O O O O O O B I I I I O O,13
2785,7219,"A third family has previously been reported , in which affected members had an extra copy of the PLP gene detected at Xq26 in a chromosome with an otherwise normal banding pattern .",O O O O O O O O O O O O O O O O O O O O O O O O O O O O O O O O O,13
4582,813,Homozygosity for a novel DTDST mutation in a child with a ' broad bone - platyspondylic ' variant of diastrophic dysplasia .,O O O O O O O O O O O O O O O O O O O B I O,32
631,7639,"In Finland , there are more than 120 living CHM patients belonging to eight apparently unrelated pedigrees .",O O O O O O O O O B O O O O O O O O,13
5387,3635,Erythrocyte indices did not show differences between mutants and wild types .,O O O O O O O O O O O O,32
6762,762,"However , previous studies have focused on mildly affected patients and there is still no report of two mutant PEX1 alleles in any Zellweger syndrome patient .",O O O O O O O O O O O O O O O O O O O O O O O B I O O,32
6257,9198,Genetic analysis in families with van der Woude syndrome .,O O O O O B I I I O,13
1851,6543,Splice - site mutation in the PDS gene may result in intrafamilial variability for deafness in Pendred syndrome .,O O O O O O B O O O O O O O B O B I O,13
3881,9967,The PD mutation is frequent in all populations .,O O O O O O O O O,13
5636,11995,Genomic organization of the UBE3A / E6 - AP gene and related pseudogenes .,O O O O O O O O O O O O O O,39
2605,3392,A comparison of the clinical manifestations of the present five patients and reported CGKD or Duchenne muscular dystrophy ( DMD ) patients with DNA deletion suggests the existence of a certain gene responsible for gonadotropin deficiency ( GTD ) .,O O O O O O O O O O O O O B O B I I O B O O O O O O O O O O O O O O B I O B O O,32
7367,2536,"Loss of heterozygosity ( LOH ) in the region close to the adenomatous polyposis coli ( APC ) gene was detected in this carcinoma , and evidence was obtained that there was a loss of the normal allele of the APC gene .",O O O O O O O O O O O O B I I O B O O O O O O B O O O O O O O O O O O O O O O O B O O,32
401,25,These intersex differences in colorectal cancer risks have implications for screening programmes and for attempts to identify colorectal cancer susceptibility modifiers .,O O O O B I O O O O O O O O O O O B I O O O,32
6105,8172,New RFLPs are reported for four loci .,O O O O O O O O,13
1808,4390,Two dinucleotide ( CT ) and one trinucleotide intronic polymorphism in Hdh and an intronic CA polymorphism in the HD gene were identified .,O O O O O O O O O O O O O O O O O O O B O O O O,32
9596,9981,An abnormality was identified in one patient .,O O O O O O O O,13
3301,12609,"A polyclonal rabbit antiserum against emerin did recognize both nuclear membrane and intercalated discs but , after affinity purification against a pure - emerin band on a western blot , it stained only the nuclear membrane .",O O O O O O O O O O O O O O O O O O O O O O O O O O O O O O O O O O O O O,39
530,7532,Deletion of the KIT and PDGFRA genes in a patient with piebaldism .,O O O O O O O O O O O B O,13
9148,1668,This is an example of an exonic mutation which affects exon - splicing . .,O O O O O O O O O O O O O O O,32
6676,4442,Human peroxisomal targeting signal - 1 receptor restores peroxisomal protein import in cells from patients with fatal peroxisomal disorders .,O O O O O O O O O O O O O O O O O B I O,32
9702,8466,We recently described a Japanese family with increased HDL levels and CETP deficiency due to a splicing defect of the CETP gene .,O O O O O O O O O O O B I O O O O O O O O O O,13
4407,8305,"006 g / ml lipoprotein fraction , in both the postprandial and postabsorptive state , are bimodally distributed .",O O O O O O O O O O O O O O O O O O O,13
9516,4844,mRNA from the alleles with the other two mutations was either undetectable or present in greatly reduced amounts .,O O O O O O O O O O O O O O O O O O O,32
2075,3978,"The phenotypic expressions of the different genetic predispositions involved , include sacro - iliitis , psoriasis , acute anterior uveitis , peripheral arthropathy and inflammatory bowel disease .",O O O O O O O O O O O B I I O B O B I I O O B O B I I O,32
7545,3875,"However , his intelligence was normal and he had no evidence of self - mutilation .",O O O O O O O O O O O O O O O O,32
8238,2838,Piebaldism is an autosomal dominant genetic disorder characterized by cogenital patches of skin and hair from which melanocytes are completely absent .,B O O B I I I O O O O O O O O O O O O O O O,32
6719,9057,"For DM and APOE , a maximum lod score ( zmax of 7 .",O O O O O O O O O O O O O O,13
9550,4854,"The parental repeat size correlated with the size of intergenerational contraction ( r2 = . 50 , P < < . 001 ) , and the slope of linear regression was steeper in paternal ( - . 62 ) than in maternal ( - . 30 ) transmissions ( P < < . 001 ) .",O O O O O O O O O O O O O O O O O O O O O O O O O O O O O O O O O O O O O O O O O O O O O O O O O O O O O O O O,32
9473,4362,"The disruptive nature of two mutations ( i . e . , the frameshift and the nonsense mutation ) in patients with biochemically proved childhood ALD and AMN further strongly supports the hypothesis that alterations in this gene play a crucial role in the pathogenesis of X - ALD .",O O O O O O O O O O O O O O O O O O O O O O O O O B O B O O O O O O O O O O O O O O O O O O B I I O,32
5507,11187,"LPP , the preferred fusion partner gene of HMGIC in lipomas , is a novel member of the LIM protein gene family .",O O O O O O O O O O B O O O O O O O O O O O O,13
9448,2036,This result supports a role for RNA gain of function in disease pathogenesis . .,O O O O O O O O O O O O O O O,32
3024,11465,These findings strongly implicate TSG101 mutations in human breast cancer,O O O O O O O O B I,13
4566,11710,"We examined galactosylceramidase ( GALC ) cDNA in four Japanese patients with adult onset globoid cell leukodystrophy ( Krabbe disease ; AO - GLD ) by polymerase chain reaction / single - strand conformation polymorphism ( PCR - SSCP ) analysis , subsequent sequence determination , and restriction enzyme digestion of PCR products , initial symptoms were the onset of slowly progressive spastic paraplegia from the middle of the second decade , and all patients had diminished GALC activity in their leukocytes .",O O O O O O O O O O O O B I I I I O B I O B I I O O O O O O O O O O O O O O O O O O O O O O O O O O O O O O O O O O O O O O B I O O O O O O O O O O O O B I I O O O O,13
7862,4668,These two mutations accounted for about 10 % of the total variance of HDL - C in this population .,O O O O O O O O O O O O O O O O O O O O,32
3872,9792,Comparison of 940 - bp sequence 5 to the putative translation start site reveals a highly conserved region ( 78 . 8 % nucleotide identity ) between Hdh and the HD gene from nucleotide - 56 to - 206 ( of Hdh ) .,O O O O O O O O O O O O O O O O O O O O O O O O O O O O O O B O O O O O O O O O O O O O,13
7313,5888,"All published mutations affect the signal peptide or the neurophysin - II carrier protein and are presumed to interfere with processing of the preprohormone , leading to neuronal damage .",O O O O O O O O O O O O O O O O O O O O O O O O O O O B I O,13
1683,2020,The adenomatous polyposis coli gene ( APC ) is mutated in familial adenomatous polyposis and in sporadic colorectal tumors .,O B I I O O O O O O O B I I O O O B I O,32
4791,9788,We have previously cloned and characterized the murine homologue of the Huntington disease ( HD ) gene and shown that it maps to mouse chromosome 5 within a region of conserved synteny with human chromosome 4p16 .,O O O O O O O O O O O B I O B O O O O O O O O O O O O O O O O O O O O O O,13
1209,10476,"Alternatively , the very tight association of HLA - A3 and allele 1 of the 6 .",O O O O O O O O O O O O O O O O O,13
9802,7397,"Aarskog - Scott Syndrome ( AAS ) is an X - linked disorder characterised by short stature and multiple facial , limb and genital abnormalities .",B I I I O B O O O B I I I O O B I O O B I I I I I O,13
6377,6556,"Nineteen of the missense mutations resulted in a severe reduction of FALDH enzyme catalytic activity when expressed in mammalian cells , but one mutation ( 798G - - > C [ K266N ] ) seemed to have a greater effect on mRNA stability .",O O O O O O O O O O O O O O O O O O O O O O O O O O O O O O O O O O O O O O O O O O O O,13
9182,2814,"Apparently normal levels of mRNA were generated from this allele , but no ARSA activity or immuno - cross - reactive material could be detected .",O O O O O O O O O O O O O O O O O O O O O O O O O O,32
9996,8051,"In two families the father of classical cases showed a milder pattern of abnormalities , consistent with the diagnosis .",O O O O O O O O O O O O O O O O O O O O,13
5042,273,HFE mutations analysis in 711 hemochromatosis probands : evidence for S65C implication in mild form of hemochromatosis .,O O O O O B O O O O O O O O O O B O,32
5202,5025,Immunoreactive DM - kinase protein of 53 kD is present at low levels in skeletal and cardiac muscle extracts of DM patients and normal controls .,O O O O O O O O O O O O O O O O O O O O B O O O O O,32
8179,126,"Using this combined approach , we identified germline APC gene mutations in 29 of the 48 FAP patients ( 60 % ) , including 6 patients in whom SSCP analysis failed to distinguish the mutant allele .",O O O O O O O O B O O O O O O O B O O O O O O O O O O O O O O O O O O O O,32
6034,4777,Human aspartoacylase is coded by six exons intervened by five introns .,O O O O O O O O O O O O,32
7096,5767,"Biochemical analysis has demonstrated that the mobility and expression levels of the mutant forms of emerin are indistinguishable from that of wild - type emerin , but that they have weakened interactions with nuclear lamina components .",O O O O O O O O O O O O O O O O O O O O O O O O O O O O O O O O O O O O O,13
9114,7856,"The following markers were tested C2 levels , factor B polymorphism , blood groups , and enzyme typing .",O O O O O O O O O O O O O O O O O O O,13
3589,7317,Mutations in the fibrinogen aalpha gene account for the majority of cases of congenital afibrinogenemia .,O O O O O O O O O O O O O B I O,13
6333,7650,These results provide genetic evidence for distinct functional roles of the WT1 isoforms in urogenital development . .,O O O O O O O O O O O O O O O O O O,13
2936,5443,This report represents the first cases of C7 deficiency associated with infectious complications and suggests that bactericidal activity may be important in host defense against bacteremic neisseria infections .,O O O O O O O B I O O O O O O O O O O O O O O O O B I I O,13
1904,11820,Risk reversals in predictive testing for Huntington disease .,O O O O O O B I O,39
8473,6731,"Here we report identification of a mutation of cathepsin C ( exon 6 , 2127A - - > G ) that changes a highly conserved amino acid in the cathepsin C peptide .",O O O O O O O O O O O O O O O O O O O O O O O O O O O O O O O O O,13
2300,1929,We propose that the ( CUG ) n is an essential cis acting element for this splicing event .,O O O O O O O O O O O O O O O O O O O,32
2622,10395,Association of the APC tumor suppressor protein with catenins .,O O O B I O O O O O,13
7358,11778,Nonsignificant increases in similarity with regard to age at disease onset and all of the disease severity scores assessed were noted in disease - concordant MZ twins compared with concordant DZ twins .,O O O O O O O O O O O O O O O O O O O O O O O O O O O O O O O O O,39
2544,8745,"Historically , Pelizaeus - Merzbacher disease has encompassed a host of neurologic disorders that present with a deficit of myelin , the membrane elaborated by glial cells that encircles and successively enwraps axons .",O O B I I I O O O O O B I O O O O B I I O O O O O O O O O O O O O O,13
8895,4743,"IQ steadily declined as ( 1 ) the age of onset of signs and symptoms decreased , and ( 2 ) the CTG expansion size increased .",O O O O O O O O O O O O O O O O O O O O O O O O O O O,32
3808,12019,The first was an association noted in the group of CD families with breast disease .,O O O O O O O O O O B O O B I O,39
4819,8617,A normal male with an inherited deletion of one exon within the DMD gene .,O O O O O O O O O O O O B O O,13
8674,6234,"We also examined 29 human tumor cell lines consisting of 12 esophageal cancers , 7 glioma / glioblastomas and 10 others for Mxi1 mutations in exons 1 , 2 , 4 ( HLH domain ) , 5 and 6 .",O O O O O B O O O O O B I O O B O B O O O O O O O O O O O O O O O O O O O O O O,13
8363,12344,Biochemical studies indicated VLCAD deficiency caused by a stable yet inactive enzyme .,O O O B I O O O O O O O O,39
575,9919,Combined multipoint and recombinant haplotype analyses localize the SCA3 locus to a 3 - cM interval flanked by D14S291 and D14S81 .,O O O O O O O O O O O O O O O O O O O O O O,13
8540,4120,"In the G6PD - deficient group , the incidence of cortical and total cataracts was also increased .",O O B I I O O O O O B I I I O O O O,32
8453,10992,Myotonic dystrophy ( DM ) is an autosomal dominant disorder resulting from the expansion of a CTG repeat in the 3 untranslated region of a putative protein kinase ( DMPK ) .,B I O B O O O B I I O O O O O O O O O O O O O O O O O O O O O O,13
3610,10410,"We have examined the distribution of marker alleles at the loci studied and have found that D13S314 , D13S133 , and D13S316 each show nonrandom distribution on chromosomes carrying the WND mutation .",O O O O O O O O O O O O O O O O O O O O O O O O O O O O O O B O O,13
5055,1304,"METHODS Ten patients with XLRS underwent full ophthalmologic examination , including slitlamp biomicroscopy and dilated funduscopy .",O O O O B O O O O O O O O O O O O,32
4995,11815,Deletion mapping studies have unambiguously identified a region of chromosome 10q23 to be the minimal area of loss .,O O O O O O O O O O O O O O O O O O O,39
1066,10904,"Other tumor types found in BRCA1 mutation / haplotype carriers included prostatic , pancreas , skin , and lung cancer , a malignant melanoma , an oligodendroglioma , and a carcinosarcoma .",O B O O O O O O O O O B I I I I I I I I O O B I O O B O O O B O,13
564,2786,"One of the new genes contained sequence identical to SRP19 , the gene coding for the 19 kd component of the ribosomal signal recognition particle .",O O O O O O O O O O O O O O O O O O O O O O O O O O,32
6815,9423,The description of 13 new variants .,O O O O O O O,13
8885,7959,"The child was hypotonic at birth , and high - resolution banding failed to reveal the deletion of 15q11 - 13 , a deletion which is found in 50 % - 70 % of patients with PWS .",O O O B O O O O O O O O O O O O O O O O O O O O O O O O O O O O O O O O B O,13
2240,4295,Genetic epidemiological evidence suggests that mutations in BRCA1 may be responsible for approximately one half of early onset familial breast cancer and the majority of familial breast / ovarian cancer .,O O O O O O O O O O O O O O O O O O B I I O O O O B I I I I O,32
9888,5826,"Renal amyloidosis , prevented by colchicine , is the most severe complication of FMF , a disorder associated with mutations in the MEFV gene .",B I O O O O O O O O O O O B O O O O O O O O O O O,13
3498,7985,"The haplotype associations , relative frequencies , and distributions of five prevalent PAH mutations ( R158Q , R261Q , IVS10nt546 , R408W , and IVS12n1 ) were established in a comprehensive European sample population and subsequently were examined to determine the potential roles of several genetic mechanisms in explaining the present distribution of the major PKU alleles .",O O O O O O O O O O O O O O O O O O O O O O O O O O O O O O O O O O O O O O O O O O O O O O O O O O O O O O O B O O,13
6880,1553,"Missense mutations were studied by means of molecular modelling , whereas single basepair substitutions in splice sites and the 5 flanking region were examined by in vitro splicing assay and luciferase reporter gene assay respectively .",O O O O O O O O O O O O O O O O O O O O O O O O O O O O O O O O O O O O,32
8158,11598,"Therefore , these mutations are sufficient to explain the complete deficiency of both the probands studied .",O O O O O O O O O O O O O O O O O,13
1539,2427,Yeast artificial chromosomes for the molecular analysis of the familial polyposis APC gene region .,O O O O O O O O O B I I O O O,32
798,4045,5 % of normal .,O O O O O,32
1478,3761,Nebulin and titin expression in Duchenne muscular dystrophy appears normal .,O O O O O B I I O O O,32
2074,362,"The emerin gene has been mapped to Xq28 and encodes a 34 - kDa serine - rich protein , emerin , which has been localized to the nuclear envelope in a wide variety of tissues , including skeletal and cardiac muscle .",O O O O O O O O O O O O O O O O O O O O O O O O O O O O O O O O O O O O O O O O O O,32
3702,4538,"This enzyme catalyses the first step of metabolism of dietary fructose , conversion of fructose to fructose - 1 - phosphate .",O O O O O O O O O O O O O O O O O O O O O O,32
1044,583,It is unclear whether the specific molecular changes that distinguish the D1 and D2 alleles account for the different activities .,O O O O O O O O O O O O O O O O O O O O O,32
7095,2775,The map was constructed employing the LINKAGE and CRIMAP computational methodologies to build the multipoint map via a stepwise algorithm .,O O O O O O O O O O O O O O O O O O O O O,32
5688,5511,"After treatment , the three patients with pure spinal abnormalities showed clinical and neurophysiologic worsening , whereas the two patients with a more advanced stage of disease ( exhibited by SEPs ) showed substantially unchanged clinical and neurophysiologic features .",O O O O O O O O B I O O O O O O O O O O O O O O O O O O O O O O O O O O O O O O,13
7855,3245,We have observed significant inter - APOC2 RFLP linkage disequilibrium .,O O O O O O O O O O O,32
3980,6892,Glycerol as a correlate of impaired glucose tolerance : dissection of a complex system by use of a simple genetic trait .,O O O O O B I I O O O O O O O O O O O O O O,13
2351,11445,Molecular basis for Duarte and Los Angeles variant galactosemia .,O O O B I I I I I O,13
7576,3188,"Among 62 Ashkenazi obligate carriers of Tay - Sachs disease , the three specific mutations accounted for all but one of the mutant alleles ( 98 percent ) .",O O O O O O B I I I O O O O O O O O O O O O O O O O O O O,32
5079,1638,One further B27 negative patients had a sister with ankylosing spondylitis and ulcerative colitis and a mother with ulcerative colitis .,O O O O O O O O O B I O B I O O O O B I O,32
9154,9864,"The range of frequency of detection of germline mutations is about 20 % , indicating that other mechanisms of inactivation of RB1 should be involved .",O O O O O O O O O O O O O O O O O O O O O O O O O O,13
7127,3852,"In 19 of 30 family members , levels of hemolytic C5 ranged from 13 to 64 per cent of normal .",O O O O O O O O O O O O O O O O O O O O O,32
4150,5311,"e e . , those in which the father or one of the fathers sibs is affected .",O O O O O O O O O O O O O O O O O O,32
2595,2661,The intron 7 + 1 mutation occurs in the base adjacent to the site of the adult - onset TSD mutation ( G805A ) .,O O O O O O O O O O O O O O O O O O O B O O O O O,32
10058,1771,Biochemical and structural analysis of missense mutations in N - acetylgalactosamine - 6 - sulfate sulfatase causing mucopolysaccharidosis IVA phenotypes .,O O O O O O O O O O O O O O O O O B I O O,32
1206,271,The rates of transport for iodide and chloride were significantly increased following the expression of pendrin in both cell systems .,O O O O O O O O O O O O O O O O O O O O O,32
4401,12147,Two identical de novo 5 - bp duplications in exon 16 were found .,O O O O O O O O O O O O O O,39
4098,9655,We report a CLCN1 Gln - 552 - Arg substitution for a family with dominant inheritance previously diagnosed to have myotonia levior .,O O O O O O O O O O O O O O O O O O O O B I O,13
3891,1773,"To date we have identified 65 missense mutations in the GALNS gene from MPS IVA patients , but the correlation between genotype and phenotype has remained unclear .",O O O O O O O O O O O O O B I O O O O O O O O O O O O O,32
8296,1680,This represents a unique inheritance pattern due to imprinting . .,O O O O O O O O O O O,32
675,2829,"The mutation , which causes loss of an HphI site and changes amino acid 155 from threonine to isoleucine , was absent from 108 normal chromosomes .",O O O O O O O O O O O O O O O O O O O O O O O O O O O,32
9131,4908,The human gene for alkaptonuria ( AKU ) maps to chromosome 3q .,O O O O B O B O O O O O O,32
3923,2197,A G - - > A transition at nt 1444 ( exon 13 ) corresponding to the E482K substitution was found in the third family .,O O O O O O O O O O O O O O O O O O O O O O O O O O,32
8186,12395,"We have investigated the R496H mutation and found this mutation at a relatively high frequency in an African American population ( f = 0 . 09 , n = 61 subjects ) .",O O O O O O O O O O O O O O O O O O O O O O O O O O O O O O O O O,39
825,570,"The disorder exhibits considerable allelic heterogeneity and , at the end of 1998 , more than 150 different base changes were recorded in 24 different populations and ethnic groups in 15 countries worldwide .",O O O O O O O O O O O O O O O O O O O O O O O O O O O O O O O O O O,32
2856,11198,"Using reverse transcriptase combined with polymerase chain reactions in the analysis of a number of lipoma cell lines and primary lipomas , it appeared that LPP is frequently rearranged also in cases without a cytogenetically detectable involvement of 3q27 - q28 .",O O O O O O O O O O O O O O O B O O O B I O O O O O O O O O O O O O O O O O O O O O,13
8834,3626,"A relatively high frequency of carriers ( 1 / 27 ) of a lethal , infantile form of the disease is found in the Ashkenazi Jewish population , but it is not yet evident whether this has resulted from a founder effect and random genetic drift or from a selective advantage of heterozygotes .",O O O O O O O O O O O O O O O O O O O O O O O O O O O O O O O O O O O O O O O O O O O O O O O O O O O O O O,32
4943,3577,The first group consisted of a family with complete homozygous deletions of the vWF gene in the four probands .,O O O O O O O O O O O O O O O O O O O O,32
9632,11087,The pattern of hereditary cancer in 14 ( 61 % ) of the 23 families studied was attributed to BRCA1 by a combination of linkage and mutation analyses .,O O O B I O O O O O O O O O O O O O O O O O O O O O O O O,13
4741,3425,An alternative or prior event to oncogene activation in tumour formation may be the inactivation of a putative tumour suppressor which can be associated with both the inherited and sporadic forms of the cancer .,O O O O O O O O O B O O O O O O O O B O O O O O O O O B I I I I I I O,32
5545,9994,A total of eight putative disease - causing alterations were identified four of these are frameshifts and two are nonsense mutations .,O O O O O O O O O O O O O O O O O O O O O O,13
7287,6756,"From the alignment of the amino acid ( aa ) sequence of 52 glucose 6 - phosphate dehydrogenase ( G6PD ) species from 42 different organisms , we found a striking correlation between the aa replacements that cause G6PD deficiency in humans and the sequence conservation of G6PD two - thirds of such replacements are in highly and moderately conserved ( 50 - 99 % ) aa ; relatively few are in fully conserved aa ( where they might be lethal ) or in poorly conserved aa , where presumably they simply would not cause G6PD deficiency .",O O O O O O O O O O O O O O O O O O O O O O O O O O O O O O O O O O O O O O B I O O O O O O O O O O O O O O O O O O O O O O O O O O O O O O O O O O O O O O O O O O O O O O O O O O O O O O O B I O,13
3347,7569,"About 50 of these mutations are single - base substitutions , including six nonsense mutations and eight splicing mutations , with the remainder being missense mutations .",O O O O O O O O O O O O O O O O O O O O O O O O O O O,13
