Unnamed: 0.1,Unnamed: 0,text,labels,txt_len
2804,6661,"Although the mutant hMre11 proteins retain some ability to interact with hRad50 and Nbs1 , formation of ionizing radiation - induced hMre11 and Nbs1 foci was absent in hMRE11 mutant cells .",O O O O O O O O O O O O O O O O O O O O O O O O O O O O O O O O,13
5350,12558,"The seven exons , the exon / intron boundaries and part of 3 noncoding sequence of the CPO gene were systematically analyzed by an exon - by - exon denaturing gradient gel electrophoresis ( DGGE ) strategy followed by direct sequencing in seven unrelated heterozygous HC patients from France , Holland , and Czech Republic .",O O O O O O O O O O O O O O O O O O O O O O O O O O O O O O O O O O O O O O O O O O O O O B O O O O O O O O O O,39
6281,12293,We conclude that these mice very closely mimic severe human von Willebrand disease and will be very useful for investigating the role of vWf in normal physiology and in disease models . .,O O O O O O O O O O B I I O O O O O O O O O O O O O O O O O O O O,39
3584,1336,ATM - heterozygous germline mutations contribute to breast cancer - susceptibility .,O O O O O O O B I O O O,32
1498,3153,"In her serum , C9 was not detectable either by immunological or by functional assays .",O O O O O O O O O O O O O O O O,32
1709,4546,Neither mutation was seen in a sample of 52 unrelated control individuals .,O O O O O O O O O O O O O,32
5309,9114,The time course and magnitude of increased [ 3H ] thymidine incorporation by T lymphocytes in response to L10 mAb paralleled that induced by anti - CD3 mAb .,O O O O O O O O O O O O O O O O O O O O O O O O O O O O O,13
10104,10132,"A fourth mutation , 433 - - 2 ( A - - > G ) transition , was identified at the splice - acceptor site in intron 2 .",O O O O O O O O O O O O O O O O O O O O O O O O O O O O O,13
5325,4683,Plant sterol levels were also within the normal range .,O O O O O O O O O O,32
9737,11578,"Ten of the possible 12 mutations in the five familial cases and five of the sporadic patients were found , all of which conformed to a functional outcome of haploinsufficiency .",O O O O O O O O O O O O O O O O O O O O O O O O O O O O O O O,13
8279,9916,"00 , of 7 .",O O O O O,13
6444,2756,"We have performed linkage analysis with the DNA markers DXS52 and the clotting factor VIII gene ( F8C ) , in several large families with X - linked adrenoleukodystrophy ( ALD ) .",O O O O O O O O O O O O O O O O O O O O O O O O O B I I I O B O O,32
4237,5142,Genetic recombination with the breast cancer trait excludes RARA from further consideration as a candidate gene for BRCA1 .,O O O O B I O O O O O O O O O O O O O,32
2457,7869,Twenty - two tumors had frameshift mutations due to deletion or insertion ; nineteen of them were deletions of one to 31 bp and three were a 1 - bp insertion .,O O O B O O O O O O O O O O O O O O O O O O O O O O O O O O O O,13
3408,10468,"For these practical considerations , traditional linkage analysis could prove of limited value in further refining the extrapolated physical position of HFE .",O O O O O O O O O O O O O O O O O O O O O O O,13
7338,9221,"On investigation of the patients family , two sisters were found to have the same deficiency but were otherwise in good health .",O O O O O O O O O O O O O O O O O O O O O O O,13
7370,2826,"While this is the first complete report on the occurrence of thrombocytopenia in a carrier female of WAS as the result of atypical lyonization , it also suggests that expression of the WAS gene occurs at ( or extends up to ) a later stage than the multipotent stem cell along the hematopoietic differentiation pathway . .",O O O O O O O O O O O B O O O O O B O O O O O O O O O O O O O O B O O O O O O O O O O O O O O O O O O O O O O O O,32
1317,9861,We systematically explored all 27 exons and flanking sequences as well as the promotor .,O O O O O O O O O O O O O O O,13
2538,2944,Recombination data and two - point linkage analysis support a locus order of centromere - pi 227 - C11P11 - ECB27 - L5 .,O O O O O O O O O O O O O O O O O O O O O O O O,32
4749,385,"These splicing mutations led to a variety of consequences , including exon skipping and , to a lesser degree , intron retention , activation of cryptic splice sites , or creation of new splice sites .",O O O O O O O O O O O O O O O O O O O O O O O O O O O O O O O O O O O O,32
9326,1410,"In the subset of 491 such families , the peak HLOD was 2 .",O O O O O O O O O O O O O O,32
8240,6485,Spinocerebellar ataxia type - 3 or Machado - Joseph disease ( SCA3 / MJD ) is a member of the CAG / polyglutamine repeat disease family .,B I I I I O B I I I O B O B O O O O O O B I I I I O O,13
8375,6190,We then evaluated the effects of differing dosages of gentamicin on expression and functional protection of the muscles of mdx mice .,O O O O O O O O O O O O O O O O O O O O O O,13
7087,10923,"By applying heteroduplex analysis , nonisotopic SSCP , and direct sequencing , we detected germ - line mutations resulting in premature termination codons or disruption of splice signals in 51 ( 72 % ) of the 71 patients .",O O O O O O O O O O O O O O O O O O O O O O O O O O O O O O O O O O O O O O O,13
1866,2424,"On the other hand , the occurrence of an extremely heterogeneous spectrum of mutations spread throughout the entire length of the large APC gene among the FAP patients indicates that this approach may not be useful as a rapid presymptomatic diagnostic procedure in a routine laboratory .",O O O O O O O O O O O O O O O O O O O O O O B O O O B O O O O O O O O O O O O O O O O O O O O,32
428,10461,"Rod electroretinograms were normal or near normal in amplitude , and had normal implicit times .",O O O O O O O O O O O O O O O O,13
8376,11849,We report a rare case of paternally transmitted congenital myotonic dystrophy ( DM ) .,O O O O O O O O B I I O B O O,39
9537,7247,Complexes containing ATM and NBS1 exist in vivo in both untreated cells and cells treated with ionizing radiation .,O O O O O O O O O O O O O O O O O O O,13
7948,1718,"Second , CTG expansion may establish a region of heterochromatin 3 of the repeat sequence and decrease SIX5 transcription .",O O O O O O O O O O O O O O O O O O O O,32
2036,5836,"This method , also called "" antibody test , "" uses monoclonal antibodies against the FMR1 gene product ( FMRP ) and is based on absence of FMRP in patients cells .",O O O O O O O O O O O O O O O O O O O O O O O O O O O O O O O O,13
569,11404,"Twenty microsatellite markers in the HRPT2 region were typed , in addition to markers in the multiple endocrine neoplasia ( MEN ) types 1 and 2 regions at 11q13 and 10q11 .",O O O O O O O O O O O O O O O O B I I I I I I I I I O O O O O O,13
8563,8609,In many parts of the world the Mediterranean type of G6PD deficiency is prevalent .,O O O O O O O O O O B I O O O,13
715,1610,"Using large human flanking sequences and a large amplification , we demonstrate that the intergenerational CTG repeat instability is reproduced in mice , with a strong bias towards expansions and with the same sex - and size - dependent characteristics as in humans .",O O O O O O O O O O O O O O O O O O O O O O O O O O O O O O O O O O O O O O O O O O O O,32
5825,3628,"This change , the substitution of a C for G in the first nucleotide of intron 12 is expected to result in defective splicing of the messenger RNA .",O O O O O O O O O O O O O O O O O O O O O O O O O O O O O,32
7374,9809,"The association between normal alleles at the CTG repeat and two nearby polymorphisms in the myotonin protein kinase gene , the Alu insertion / deletion polymorphism and the myotonic dystrophy kinase ( DMK ) ( G / T ) intron 9 / HinfI polymorphism , has been analyzed in South African Negroids , a population in which myotonic dystrophy ( DM ) has not been described .",O O O O O O O O O O O O O O O O O O O O O O O O O O O O B I O O O O O O O O O O O O O O O O O O O O O O O O O O O B I O B O O O O O O,13
8221,12060,The percentage of errors in antisaccades was greatly increased and was significantly correlated with age at disease onset .,O O O O O O O O O O O O O O O O O O O,39
2629,6639,"16 for marker D2S2110 were observed , further supporting linkage to chromosome 2p13 .",O O O O O O O O O O O O O O,13
5387,3635,Erythrocyte indices did not show differences between mutants and wild types .,O O O O O O O O O O O O,32
8611,4327,"The mutation , an arginine - to - cysteine exchange at residue 24 , was part of the CDK4 peptide recognized by CTLs and prevented binding of the CDK4 inhibitor p16INK4a , but not of p21 or of p27KIP1 .",O O O O O O O O O O O O O O O O O O O O O O O O O O O O O O O O O O O O O O O O,32
2270,309,"Defective CD95 / APO - 1 / Fas signal complex formation in the human autoimmune lymphoproliferative syndrome , type Ia .",O O O O O O O O O O O O O O B I I I I I O,32
5267,12631,"In this study , direct mutation analysis of the APC gene was performed to determine genotype - phenotype correlations for nine extracolonic manifestations and to investigate the incidence of APC mutations in non - FAP colorectal cancer .",O O O O O O O O O B O O O O O O O O O O O O O O O O O O O B O O O O O B I O,39
1270,11674,"Mice doubly null for atm and p53 exhibited a dramatic acceleration of tumour formation relative to singly null mice , indicating that both genes collaborate in a significant manner to prevent tumorigenesis .",O O O O O O O O O O O O B O O O O O O O O O O O O O O O O O O O O,13
7003,10206,"One mutation , detected by the abnormal pattern of migration of an amplified fragment , is a C to T transition in the splice acceptor site of intron 10 , which resulted in the skipping of exon 11 with the premature termination of RNA translation downstream from exon 12 ( - 3 IVS10 ) .",O O O O O O O O O O O O O O O O O O O O O O O O O O O O O O O O O O O O O O O O O O O O O O O O O O O O O O O,13
4183,2192,Allele - specific oligonucleotide hybridization confirmed homozygosity in the proband .,O O O O O O O O O O O,32
3657,11772,OBJECTIVE To determine the relative effects of genetic and environmental factors in susceptibility to ankylosing spondylitis ( AS ) .,O O O O O O O O O O O O O O B I O B O O,39
8545,2673,"The results indicate that the girl is a hemizygote for AGA , permitting the assignment of human AGA to the region 4q33 - - - - qter . .",O O O O O O O O O O O O O O O O O O O O O O O O O O O O O,32
7174,6308,"No other gene alteration in TP53 , P57KIP2 , P15INK4B , and P16INK4A was observed .",O O O O O O O O O O O O O O O O,13
268,7595,This mutation creates an Fnu4HI restriction site .,O O O O O O O O,13
8136,11415,"G6PD Malaga is associated with enzyme deficiency ( class III ) , and the enzymic properties of G6PD Malaga and G6PD Santamaria are quite similar , indicating that in this case the effects of the two mutations are additive rather than synergistic .",O O O O O B I O O O O O O O O O O O O O O O O O O O O O O O O O O O O O O O O O O O O,13
7695,1481,Locus heterogeneity in Friedreich ataxia .,O O O B I O,32
1393,12032,"Mutations in PAX6 are responsible for human aniridia and have also been found in patients with Peters anomaly , with congenital cataracts , with autosomal dominant keratitis , and with isolated foveal hypoplasia .",O O O O O O O B O O O O O O O O B I O O B I O O B I I O O O B I I O,39
8197,4146,We have analysed 60 families with a history of breast and / or ovarian cancer for germline mutations in BRCA1 .,O O O O O O O O O B I I I I I O O O O O O,32
3203,1220,The three novel AKU mutations are most likely specific for the Finnish population and have originated recently . .,O O O B O O O O O O O O O O O O O O O,32
8069,5076,"7 locus , both of which are comprised by the major ancestral or founder HFE haplotype in Brittany , supports the possibility that the disease gene may reside immediately telomeric to the 6 .",O O O O O O O O O O O O O O O O O O O O O O O O O O O O O O O O O O,32
1241,10988,"Nullizygous ( - / - ) mice showed only inconsistent and minor size changes in head and neck muscle fibres at older age , animals with the highest DMPK transgene expression showed hypertrophic cardiomyopathy and enhanced neonatal mortality .",O O O O O O O O O O O O O O O O O O O O O O O O O O O O O O O O B I O O O O O,13
7402,7705,The fact that the mouse Snrpn gene is maternally imprinted in brain suggests that loss of the paternally derived SNRPN allele may be involved in the PWS phenotype . .,O O O O O O O O O O O O O O O O O O O O O O O O O O B O O O,13
9744,11436,This founder effect provides a unique opportunity for population - based screening for A - T carriers in a large Jewish community . .,O O O O O O O O O O O O O B I I O O O O O O O O,13
6883,980,05 .,O O,32
848,4742,"Significant IQ differences were found between ( 1 ) all 55 DM subjects ( mean 90 . 2 , SD 16 . 1 ) and 31 controls ( 102 . 6 , SD 9 . 4 ) , with no sex differences in either group ; ( 2 ) 15 affected parents ( 99 . 3 , SD 12 . 2 ) and their affected children ( 88 . 1 , SD 17 . 2 ) , where significance was dependent on parental sex being female ; and ( 3 ) 15 pairs of affected sibs ( 89 . 6 , SD 13 . 2 ) and their normal sibs ( 100 . 2 , SD 7 . 6 ) .",O O O O O O O O O O O B O O O O O O O O O O O O O O O O O O O O O O O O O O O O O O O O O O O O O O O O O O O O O O O O O O O O O O O O O O O O O O O O O O O O O O O O O O O O O O O O O O O O O O O O O O O O O O O O O O O O O O O O O O O O O,32
7532,1930,"In contrast to ( CUG ) n containing mRNAs , the novel isoform is not retained in the nucleus in DM cells , resulting in imbalances in relative levels of cytoplasmic DMPK mRNA isoforms and a new dominant effect of the mutation on DMPK . .",O O O O O O O O O O O O O O O O O O O O B O O O O O O O O O O O O O O O O O O O O O O O O O,32
5477,5135,These findings indicate that the grandfather was a germinal mosaic for the DMD gene .,O O O O O O O O O O O O B O O,32
452,10005,High resolution genetic analysis suggests one ancestral predisposing haplotype for the origin of the myotonic dystrophy mutation .,O O O O O O O O O O O O O O B I O O,13
3933,10007,"It is in complete linkage disequilibrium with an Alu element polymorphism within the DM kinase gene , suggesting that DM is a consequence of one or few ancestral mutations .",O O O O O O O O O O O O O B O O O O O B O O O O O O O O O O,13
2091,4838,Two subjects shared a G - - > A transition at position + 5 of the donor splice site consensus sequence of intron 10 .,O O O O O O O O O O O O O O O O O O O O O O O O O,32
2065,2303,"Furthermore , SNRPN was mapped to the minimal deletion interval that is critical for PWS .",O O O O O O O O O O O O O O B O,32
2662,12065,"Ventricular fibrillation causes more than 300 , 000 sudden deaths each year in the USA alone .",B I O O O O O O O O O O O O O O O,39
8652,5646,RESULTS Three patients with adult - onset cerebral ALD were identified as having large genomic rearrangements .,O O O O O O O B I O O O O O O O O,13
7164,6449,"Although marked differences in extragenic marker haplotypes were seen in one family , similar intragenic haplotyping suggests the same mutation founder for this family with the differences explicable by two recombination events . .",O O O O O O O O O O O O O O O O O O O O O O O O O O O O O O O O O O,13
5823,12134,"Genetic heterogeneity of Saethre - Chotzen syndrome , due to TWIST and FGFR mutations .",O O O B I I I O O O O O O O O,39
1572,11037,"To investigate the role of gene dosage in more detail , we have generated yeast artificial chromosome transgenic mice carrying the human PAX6 locus .",O O O O O O O O O O O O O O O O O O O O O O O O O,13
4994,9836,"This function was fully restored in the siblings serum , and substantially improved in the probands serum , by addition of highly purified human C5 to normal serum concentrations .",O O O O O O O O O O O O O O O O O O O O O O O O O O O O O O,13
2312,6071,RESULTS The biochemical phenotype predicted from the genotype in functionally hemizygous patients was related significantly to the assigned phenylalanine level .,O O O O O O O O O O O O O O O O O O O O O,13
9178,10229,Two mutations involved C - - > T transitions in CGAarg codons in exons 9 and 11 .,O O O O O O O O O O O O O O O O O O,13
7058,4850,"In 56 of the 95 pairs , clinical data allowed an analysis of their anticipation status .",O O O O O O O O O O O O O O O O O,32
1189,5392,"In contrast , a deficiency in immunofluorescent staining of skeletal and cardiac muscle from EDMD patients was observed .",O O O O O O O O O O O O O O B O O O O,32
4258,12391,The R496H mutation of arylsulfatase A does not cause metachromatic leukodystrophy .,O O O O O O O O O B I O,39
2658,4811,"Analysis of the ARSA gene in this patient revealed heterozygosity for two new mutant alleles in one allele , deletion of C 447 in exon 2 leads to a frameshift and to a premature stop codon at amino acid position 105 ; in the second allele , a G - - > A transition in exon 5 causes a Gly309 - - > Ser substitution .",O O O O O O O O O O O O O O O O O O O O O O O O O O O O O O O O O O O O O O O O O O O O O O O O O O O O O O O O O O O O O O O O O O,32
3296,11274,"Very - long - chain acyl - CoA dehydrogenase ( VLCAD ) is one of four straight - chain acyl - CoA dehydrogenase ( ACD ) enzymes , which are all nuclear encoded mitochondrial flavoproteins catalyzing the initial step in fatty acid beta - oxidation .",O O O O O O O O O O O O O O O O O O O O O O O O O O O O O O O O O O O O O O O O O O O O O O,13
2890,9212,Three pedigrees of lip pits in the literature show no clefts among a significant number of affected individuals .,O O O B I O O O O O O O O O O O O O O,13
1760,965,There were no obvious mutation hot spots or clusters .,O O O O O O O O O O,32
1879,10298,"In at least four cases , family studies of these phenocopies excluded 4p16 .",O O O O O O O O O O O O O O,13
18,3997,Human deficiency of the sixth component of complement in a patient with meningococcal meningitis and no haemostasis abnormality .,O B I I I I I I O O O O B I O O B I O,32
1516,7253,"Hypotonia , chorioretinal dystrophy , and myopia were also identified .",B O B I O O B O O O O,13
7752,73,Germline E - cadherin gene ( CDH1 ) mutations predispose to familial gastric cancer and colorectal cancer .,O O O O O O O O O O O B I I O B I O,32
3150,5872,"To investigate this hypothesis , we developed hamster - human somatic hybrid cell lines from VCFS / DGS patients with all three classes of deletions and we now show that the breakpoints occur within similar low copy repeats , termed LCR22s .",O O O O O O O O O O O O O O O B O B O O O O O O O O O O O O O O O O O O O O O O O O,13
4456,3308,The consequences of this probe order for antenatal diagnosis and future research aiming to isolate the gene which is affected in DM are discussed .,O O O O O O O O O O O O O O O O O O O O O B O O O,32
6421,3777,A full - length complementary DNA clone of human PAH was inserted into a eukaryotic expression vector and transferred into mouse NIH3T3 cells which do not normally express PAH .,O O O O O O O O O O O O O O O O O O O O O O O O O O O O O O,32
4816,5806,"Of 44 patients , nine ( 20 % ) had facial angiofibromas , tumours primarily occurring in association with tuberous sclerosis .",O O O O O O O O O O B I O B O O O O O B I O,13
9911,9715,"A mathematical model incorporating the measured selective advantage against malaria suggests that a counterbalancing selective disadvantage , associated with this enzyme deficiency , has retarded its rise in frequency in malaria - endemic regions .",O O O O O O O O O B O O O O O O O O O O B I O O O O O O O O B O O O O,13
6958,4098,The results suggest that renal failure occurs in the Wiskott - Aldrich syndrome more frequently than generally recognized and that administration of TF may precipitate or accelerate the renal disease in patients with this syndrome . .,O O O O B I O O O B I I I O O O O O O O O O O O O O O O B I O O O O O O O,32
3613,104,Neurophysiologic follow - up of long - term dietary treatment in adult - onset adrenoleukodystrophy .,O O O O O O O O O O O O O O B O,32
5853,2938,Localisation of CYP2A on a panel of somatic cell hybrids also suggests that it is proximal to DM and APOC2 / C1 / E gene cluster .,O O O O O O O O O O O O O O O O O O O O O O O O O O O,32
5436,10398,Two cellular proteins that associate with APC were identified by nucleotide sequence analysis and peptide mapping as the E - cadherin - associated proteins alpha - and beta - catenin .,O O O O O O B O O O O O O O O O O O O O O O O O O O O O O O O,13
9523,12165,The aim of this study was to assess genotype - phenotype correlations in AAPC families .,O O O O O O O O O O O O O B O O,39
5252,6254,"CONCLUSIONS In a population of white adults of northern European ancestry , 0 .",O O O O O O O O O O O O O O,13
2254,6376,"All had abdominal attacks and in most these were the only manifestation of their disease , P < 0 .",O O O O O O O O O O O O O O O O O O O O,13
7621,3665,"One probe , p31 , was shown to cover one of the breakpoints of the smallest deletion .",O O O O O O O O O O O O O O O O O O,32
8717,8259,"We report a mutation within the phenylalanine hydroxylase ( PAH ) gene that causes aberrant splicing of the mRNA and that is in tight association with chromosomal haplotypes 6 , 10 , and 36 .",O O O O O O O O O O O O O O O O O O O O O O O O O O O O O O O O O O O,13
4829,1772,"Mucopolysaccharidosis IVA ( MPS IVA ; OMIM # 253000 ) , a lysosomal storage disorder caused by a deficiency of N - acetylgalactosamine - 6 - sulfate sulfatase ( GALNS ) , has variable clinical phenotypes .",B I O B I O O O O O O O B I I O O O B I I I I I I I I I O O O O O O O O O,32
7815,316,Herein we describe haplotype and mutational analyses of HGO in seven new AKU pedigrees .,O O O O O O O O O O O O B O O,32
5354,9954,"This complex allele is presumed to have formed by recombination ( crossover , fusion ) of the structural gene with the pseudogene , which contains the mutated sequences .",O O O O O O O O O O O O O O O O O O O O O O O O O O O O O,13
7159,6326,The entire coding region of the AVP - NPII gene of all family members was amplified by PCR and sequenced .,O O O O O O O O O O O O O O O O O O O O O,13
4592,6604,A major gene locus for PLS has been mapped to a 2 .,O O O O O B O O O O O O O,13
912,7512,"The incidence of ovarian , gastric , and biliary system carcinomas and of leukemia and lymphoma was increased in these A - T families .",O O O B I I I I I I I O O B O B O O O O B I I O O,13
7090,5649,"Most missense mutations involved amino acids conserved in homologous gene products , including PMP70 , mALDRP , and Pxa1p .",O O O O O O O O O O O O O O O O O O O O,13
2528,2150,In situ hybridization mapping locates the fragile site between 150 kb and 600 kb distal to FRAXA .,O O O O O O O O O O O O O O O O O O,32
4675,2220,"One allele , reported originally in a French TSD patient ( Akli et al . , 1991 ) , is a GT - - > AT transition at the donor splice - site of intron 9 .",O O O O O O O O B O O O O O O O O O O O O O O O O O O O O O O O O O O O O,32
8757,6303,"In a Turkish family with the diagnosis of Li - Fraumeni syndrome , we analyzed the mutation pattern of TP53 , P57KIP2 , P15INK4B , and P16INK4A in the peripheral blood , and loss of heterozygosity ( homo / hemizygous deletion ) pattern of TP53 and P15INK4B / P16INK4A in two tumor tissues .",O O O O O O O O B I I I O O O O O O O O O O O O O O O O O O O O O O O O O O O O O O O O O O O O O O O B O O,13
7742,8821,Von Hippel - Lindau disease maps to the region of chromosome 3 associated with renal cell carcinoma .,B I I I I O O O O O O O O O B I I O,13
8690,4337,Cloning of human very - long - chain acyl - coenzyme A dehydrogenase and molecular characterization of its deficiency in two patients .,O O O O O O O O O O O O O O O O O O O O O O O,32
8844,11789,"Here we show that the steady - state levels of BARD1 , unlike those of BRCA1 , remain relatively constant during cell cycle progression .",O O O O O O O O O O O O O O O O O O O O O O O O O,39
9443,11321,"Atm - deficient mice are retarded in growth , do not produce mature sperm , and exhibit severe defects in T cell maturation while going on to develop thymomas .",O O O O O O O O O O O O O O O O O O O O O O O O O O O O B O,13
3663,3048,Four cases of adrenoleukodystrophy ( ALD ) and one case of adrenomyeloneuropathy ( AMN ) have developed in a kindred over three generations demonstrating that AMN is a clinical variant of ALD .,O O O B O B O O O O O B O B O O O O O O O O O O O B O O O O O B O,32
562,7258,3 - 22 .,O O O O,13
1925,3180,These data are compatible with the VHL gene functioning as a recessive tumour suppressor gene .,O O O O O O B O O O O O B O O O,32
9248,1041,"About 98 % of mutant alleles have an expansion of a GAA trinucleotide repeat in intron 1 of the affected gene , FRDA .",O O O O O O O O O O O O O O O O O O O O O O O O,32
863,9099,This has prompted the development of alternative assays for point mutation detection .,O O O O O O O O O O O O O,13
7945,10004,The four families with both breast and ovarian cancer had chain termination mutations in the N - terminal half of the protein . .,O O O O O B I I I O O O O O O O O O O O O O O O,13
7751,6517,"The puzzling linkage between genetic hemochromatosis and histocompatibility loci became even more so when the gene involved , HFE , was identified .",O O O O O B O O O O O O O O O O O O O O O O O,13
8003,6652,We report on a 4 - year - old boy with Knobloch syndrome .,O O O O O O O O O O O B I O,13
9503,8978,The first group consisted of a family with complete homozygous deletions of the vWF gene in the four probands .,O O O O O O O O O O O O O O O O O O O O,13
695,10276,Both types of mutation are concentrated in the 5 half of exon 15 .,O O O O O O O O O O O O O O,13
3268,1339,Mutations in the ATM gene are responsible for the autosomal recessive disorder ataxia - telangiectasia ( A - T ) ( MIM 208900 ) .,O O O O O O O O O B I I B I I O B I I O O O O O O,32
