Unnamed: 0.1,Unnamed: 0,text,labels,txt_len
787,6369,"To determine the prevalence and characterize demographic , clinical , and genetic features of familial Mediterranean fever ( FMF ) of late onset , all patients experiencing their first FMF attack at age 40 years or more were identified using the computerized registry of our FMF clinic , and then thoroughly interviewed and examined .",O O O O O O O O O O O O O O B I I O B O O O O O O O O O O B O O O O O O O O O O O O O O O B O O O O O O O O O,13
8696,7888,These results further demonstrate that the WT1 gene is important in both the development of the kidney and the genito - urinary system . .,O O O O O O O O O O O O O O O O O O O O O O O O O,13
10059,8705,2 shows that the DM locus is distal to APOC2 .,O O O O B O O O O O O,13
9654,12144,"Angelman syndrome ( AS ) is caused by chromosome 15q11 - q13 deletions of maternal origin , by paternal uniparental disomy ( UPD ) 15 , by imprinting defects , and by mutations in the UBE3A gene .",B I O B O O O O O O O O O O O O O O O B I O B O O O O O O O O O O O O O O O,39
4901,11229,"Vectors derived from a recombinant retrovirus or a DNA / protein complex can efficiently transduce the PAH cDNA into PAH - deficient hepatocytes in vitro , but the application of these vector systems is presently limited by their low transduction efficiency in vivo .",O O O O O O O O O O O O O O O O O O O B I I O O O O O O O O O O O O O O O O O O O O O O,13
8624,8457,We have previously assigned the Friedreich ataxia locus ( FRDA ) to chromosome 9 ; the current maximal lod score between FRDA and MCT112 ( D9S15 ) is greater than 50 at a recombination fraction of theta = 0 .,O O O O O B I O O O O O O O O O O O O O O O O O O O O O O O O O O O O O O O O O,13
5110,4385,"Other cancers of interest that appeared in the BRCA1 - linked families included primary peritoneal cancer , cancer of the fallopian tube , and malignant melanoma . .",O B O O O O O O O O O O O B I I O B I I I I O O B I O O,32
3516,9486,"All of them were found in Italian males and all were associated with enzyme deficiency , but only two with signs of haemolysis .",O O O O O O O O O O O O O B I O O O O O O O B O,13
8395,8155,Our results provide evidence of a direct role for WT1 in Denys - Drash syndrome and thus urogenital system development . .,O O O O O O O O O O O B I I I O O O O O O O,13
1046,383,Fewer than half of the splicing mutations involved the canonical AG splice - acceptor site or GT splice - donor site .,O O O O O O O O O O O O O O O O O O O O O O,32
8091,11986,"A second mutation that has no effect on beta2m association , H63D , was found in eight out of nine patients heterozygous for the C282Y mutant .",O O O O O O O O O O O O O O O O O O O O O O O O O O O,39
8734,4104,"However , a small number of cells expressing the G - 6 - PD type linked with the WAS allele were detected .",O O O O O O O O O O O O O O O O O O B O O O O,32
8458,7701,Prader - Willi syndrome ( PWS ) is associated with paternally derived chromosomal deletions in region 15q11 - 13 or with maternal disomy for chromosome 15 .,B I I I O B O O O O O O O O O O O O O O O B I I I I O,13
2245,12419,Dysfunction of this pathway may be a general phenomenon in the majority of cases of hereditary breast and / or ovarian cancer . .,O O O O O O O O O O O O O O O B I I I I I I O O,39
2572,6947,Mice with a partial or complete deficiency of Hmgic resisted diet - induced obesity .,O O O B I I I I I O O O O B O,13
6144,4475,Our data support a tumour suppressor mechanism for BRCA1 ; somatic mutations and LOH may result in inactivation of BRCA1 in at least a small number of ovarian cancers . .,O O O O B O O O O O O O O O O O O O O O O O O O O O O B I O O,32
608,11532,Sequence similarities to human expressed sequence tags ( EST ) clones ranged from 70 % to 20 % .,O O O O O O O O O O O O O O O O O O O,13
8554,683,An array of genotypes was found in these patients .,O O O O O O O O O O,32
6989,6542,"From a molecular biological point of view , we concluded that the two diseases were not separable , and that FS should be included as an atypical form of DDS . .",O O O O O O O O O O O O O O O O O O O O B O O O O O O O O B O O,13
8506,11666,"In contrast , PAX7 - FKHR overexpression results from fusion gene amplification .",O O O O O O O O O O O O O,13
8827,1038,The observed increase in ventilation and inspiratory drive may contribute to the improved activity level reported by parents of PWS children during growth hormone therapy,O O O O O O O O O O O O O O O O O O O B O O O O O,32
3519,8020,"Given both the large proportion of non - Jewish carriers with this allele and that standard biochemical screening cannot differentiate between heterozygotes for the C739 - to - T mutations and Tay - Sachs disease carriers , DNA testing for this mutation in at - risk couples is essential .",O O O O O O O O O O O O O O O O O O O O O O O O O O O O O O O B I I I O O O O O O O O O O O O O O O,13
7083,759,"The Zellweger spectrum of disease , encompassing Zellweger syndrome and the progressively milder phenotypes of neonatal adrenoleukodystrophy and infantile Refsum disease , is due to a failure to form functional peroxisomes .",O B I I I O O B I O O O O O O B I O B I I O O O O O O O O O O O,32
7093,12596,A lod score of 13 was calculated for linkage between C2 deficiency and HLA - B at a maximum likelihood value of the recombinant fraction of 0 .,O O O O O O O O O O B I O O O O O O O O O O O O O O O O,39
4175,2548,Late - onset metachromatic leukodystrophy : molecular pathology in two siblings .,O O O B I O O O O O O O,32
4664,12645,7 for colorectal neoplasia ( both P = . 01 ) .,O O B I O O O O O O O O,39
1380,1835,Our results show that ( quantitative ) Southern blot analysis is a sensitive method for detecting germline deletions of the VHL gene and should be implemented in routine DNA diagnosis for VHL disease .,O O O O O O O O O O O O O O O O O O O O B O O O O O O O O O O B I O,32
9457,11784,Germ - line mutations of the BRCA1 gene predispose women to early - onset breast and ovarian cancer by compromising the genes presumptive function as a tumor suppressor .,O O O O O O O O O O O O O O B I I I O O O O O O O O B O O,39
2491,961,"Of these , 23 were novel mutations , and most occurred in exon 8 .",O O O O O O O O O O O O O O O,32
5191,10739,The loss of wild - type BRCA1 in tumours of individuals carrying one nonfunctional BRCA1 allele suggests that BRCA1 encodes a tumour suppressor that may inhibit the proliferation of mammary epithelial cells .,O O O O O O O O B O O O O O O O O O O O O B O O O O O O O O O O O,13
535,3331,The relationship between abnormal color vision and adrenomyeloneuropathy ( AMN ) was investigated in 27 AMN patients and 31 age - matched controls by using the Farnsworth - Munsell 100 Hue test .,O O O B I I O B O B O O O O O B O O O O O O O O O O O O O O O O O,32
6942,11257,"In addition , ATM - / - mouse thymocytes are more resistant to apoptosis induced by gamma - irradiation than normal thymocytes .",O O O O O O O O O O O O O O O O O O O O O O O,13
7513,11138,"Introducing chromosome 5 , encoding the MSH3 gene , into the mutant cell line increased the stability of some but not all microsatellites .",O O O O O O O O O O O O O O O O O O O O O O O O,13
6346,9502,Isolated peripheral blood cell types from the doubly heterozygous mother of the affected males seemingly failed to express the G - 6 - PD allele in cis position with the WAS allele while her cultured skin fibroblasts expressed both G - 6 - PD alleles .,O O O O O O O O O O O O O O O O O O O O O O O O O O O O O O B O O O O O O O O O O O O O O O,13
7957,3221,"Expression was found in RNA from normal fetal muscle , adult cardiac and skeletal muscle , and cultured muscle after myoblast fusion .",O O O O O O O O O O O O O O O O O O O O O O O,32
3166,5727,"By use of chemical cleavage of mismatches adapted to fluorescence - based detection systems , we have characterized the mutations underlying alpha - Gal A deficiency in 16 individuals from six unrelated families with FD .",O O O O O O O O O O O O O O O O O O O O O B I I I I O O O O O O O O B O,13
741,4923,These data facilitate the search for new glucose / galactose malabsorption - related mutations in this important gene and provide a basis for future evolutionary comparisons with other Na ( + ) - dependent cotransporters . .,O O O O O O O B I I I O O O O O O O O O O O O O O O O O O O O O O O O O O,32
283,6189,Exposure of mdx myotubes to gentamicin led to the expression and localization of dystrophin to the cell membrane .,O O O O O O O O O O O O O O O O O O O,13
8646,662,"Relationship among genotype , biochemical phenotype , and cognitive performance in females with phenylalanine hydroxylase deficiency : report from the Maternal Phenylketonuria Collaborative Study .",O O O O O O O O O O O O O B I I O O O O B I O O O,32
8634,3440,The markers DXS10 and DXS42 therefore show tight linkage with OCRL in six families and flank the Xq25 breakpoint in a female patient with an X ; 3 translocation .,O O O O O O O O O O B O O O O O O O O O O O O O O O O O O O,32
7407,1795,Familial Mediterranean fever ( FMF ) is a recessive disorder characterized by episodes of fever with serositis or synovitis .,B I I O B O O O B I O O O O B O B O B O,32
1190,3696,Identification and localization of mutations at the Lesch - Nyhan locus by ribonuclease A cleavage .,O O O O O O O B I I O O O O O O,32
7571,4883,Mutations at the PAX6 locus are found in heterogeneous anterior segment malformations including Peters ' anomaly .,O O O O O O O O O B I I O B I I O,32
350,11680,3 ( refs 1 - 3 ) .,O O O O O O O O,13
6922,4739,"Intelligence quotient profile in myotonic dystrophy , intergenerational deficit , and correlation with CTG amplification .",O O O O B I O O O O O O O O O O,32
5502,3778,"The transformed mouse cells expressed PAH messenger RNA , immunoreactive protein , and enzymatic activity that are characteristic of the normal human liver products , demonstrating that a single gene contains all of the necessary genetic information to code for functional PAH .",O O O O O O O O O O O O O O O O O O O O O O O O O O O O O O O O O O O O O O O O O O O,32
6488,7567,Mutations in the human phenylalanine hydroxylase gene producing phenylketonuria or hyperphenylalaninemia have now been identified in many patients from various ethnic groups .,O O O O O O O O B O B O O O O O O O O O O O O,13
3195,9077,Estimation of the male to female ratio of mutation rates from the segregation of X - chromosomal DNA haplotypes in Duchenne muscular dystrophy families .,O O O O O O O O O O O O O O O O O O O O B I I O O,13
2116,2320,Detection of a nonsense mutation in the dystrophin gene by multiple SSCP .,O O O O O O O O O O O O O,32
1131,3859,"0 , a TRIS - EDTA - borate buffer system at pH 8 .",O O O O O O O O O O O O O O,32
5590,1155,"Nineteen of the missense mutations resulted in a severe reduction of FALDH enzyme catalytic activity when expressed in mammalian cells , but one mutation ( 798G - - > C [ K266N ] ) seemed to have a greater effect on mRNA stability .",O O O O O O O O O O O O O O O O O O O O O O O O O O O O O O O O O O O O O O O O O O O O,32
8674,6234,"We also examined 29 human tumor cell lines consisting of 12 esophageal cancers , 7 glioma / glioblastomas and 10 others for Mxi1 mutations in exons 1 , 2 , 4 ( HLH domain ) , 5 and 6 .",O O O O O B O O O O O B I O O B O B O O O O O O O O O O O O O O O O O O O O O O,13
5215,2103,Ataxia - telangiectasia ( A - T ) is an autosomal recessive syndrome associated with a greatly increased incidence of malignant neoplasms in homozygous affected individuals .,B I I O B I I O O O B I I O O O O O O O B I O O O O O,32
8100,5268,BACKGROUND .,O O,32
9827,1279,"Coexpression of hbeta ( 1 ) did not significantly alter current decay or recovery from inactivation of wild - type hH1 ; however , it further shifted the V ( 1 / 2 ) and accelerated the recovery from inactivation of T1620M .",O O O O O O O O O O O O O O O O O O O O O O O O O O O O O O O O O O O O O O O O O O O,32
812,11256,"Consistent with cellular defects of AT patients , the ATM - / - cells are hypersensitive to gamma - irradiation and defective in cell - cycle arrest following radiation , correlating with a defective up - regulation of p53 .",O O O O O B O O O O O O O O O O O O O O O O O O O O O O O O O O O O O O O O O O,13
9452,8453,"In addition , the integrated 24 - hour response to the administration were also subnormal in these two cases .",O O O O O O O O O O O O O O O O O O O O,13
5834,3140,"The red / green color pigment ( R / GCP ) region was studied by pulsed - field gel electrophoresis in 14 of these patients , and we did not find any fragment size difference between the patients and normal individuals who have the same number of pigment genes .",O O O O O O O O O O O O O O O O O O O O O O O O O O O O O O O O O O O O O O O O O O O O O O O O O O,32
814,3959,28 that bridge the DMD gene .,O O O O B O O,32
2264,11780,Additive genetic effects were estimated to contribute 97 % of the population variance .,O O O O O O O O O O O O O O,39
4975,2300,Prader - Willi syndrome ( PWS ) is associated with paternally derived chromosomal deletions in region 15q11 - 13 or with maternal disomy for chromosome 15 .,B I I I O B O O O O O O O O O O O O O O O B I I I I O,32
3503,4106,This observation suggests that selection against cells expressing the Wiskott - Aldrich defect takes place in the hemopoietic system of the heterozygous female and offers a possible means of carrier detection in some women .,O O O O O O O O O B I I I O O O O O O O O O O O O O O O O O O O O O O,32
8918,1027,"Mutations identified in this study include 19 missense mutations , two nonsense mutations , one intragenic deletion , four microdeletions , one insertion , and one intronic sequence substitution that is likely to result in a splice site defect .",O O O O O O O O O O O O O O O O O O O O O O O O O O O O O O O O O O O O O O O O,32
8623,2029,"Thus , potentiation of netrin activity by inhibitors may result from stabilization of DCC on the axons , and proteolytic activity may regulate axon migration by controlling the number of functional extracellular axon guidance receptors . .",O O O O O O O O O O O O O O O O O O O O O O O O O O O O O O O O O O O O O,32
2715,8074,"The results indicate that the girl is a hemizygote for AGA , permitting the assignment of human AGA to the region 4q33 - - - - qter . .",O O O O O O O O O O O O O O O O O O O O O O O O O O O O O,13
6189,943,Restriction digestion following PCR amplification of ARG1 exon 2 confirmed the presence of the mutation .,O O O O O O O O O O O O O O O O,32
8413,7087,The transcription initiation site has been assigned to a residue 163 bp upstream from the translation initiation triplet by primer extension analysis .,O O O O O O O O O O O O O O O O O O O O O O O,13
3701,7027,"To investigate the genetic history of these mutations in the AJ population , short tandem repeat ( STR ) markers were used to map a 9 .",O O O O O O O O O O O O O O O O O O O O O O O O O O O,13
1506,6684,Meiotic segregation analysis of RB1 alleles in retinoblastoma pedigrees by use of single - sperm typing .,O O O O O O O B O O O O O O O O O,13
1485,2772,The map integrates a high - resolution genetic map of 4p16 into a continuous map extending to 4q31 and an unlinked cluster of three loci at 4q35 .,O O O O O O O O O O O O O O O O O O O O O O O O O O O O,32
5727,4701,Adrenoleukodystrophy gene encodes an 80 kDa membrane protein .,B O O O O O O O O,32
2975,12450,Founder BRCA1 and BRCA2 mutations in French Canadian breast and ovarian cancer families .,O O O O O O O O B I I I O O,39
6301,9043,"However , until now , their precise molecular basis has remained unknown .",O O O O O O O O O O O O O,13
242,6424,"Novel mutations in XLRS1 causing retinoschisis , including first evidence of putative leader sequence change .",O O O O O B O O O O O O O O O O,13
2426,10626,Neither immunohistochemical studies nor molecular genetic analyses of the VHL gene have been reported previously for this lesion .,O O O O O O O O O B O O O O O O O O O,13
9956,2662,In both mutations a restriction site for the endonuclease EcoRII is abolished .,O O O O O O O O O O O O O,32
997,7589,Novel mutations were found in two of these families .,O O O O O O O O O O,13
3976,3973,The results were in agreement with our hypothesis that ankylosing spondylitis is part of a syndrome where different genetic factors interact .,O O O O O O O O O B I O O O O O O O O O O O,32
8866,4629,The wild - type PST domain activates transcription autonomously and the mutant form has partial activity .,O O O O O O O O O O O O O O O O O,32
560,2458,"They share , however , the SD2 antigen W18 and the LD type 7a . .",O O O O O O O O O O O O O O O O,32
7842,10708,The affected - sibpair analyses indicated excess allele sharing for markers on 18p within the region reported previously .,O O O O O O O O O O O O O O O O O O O,13
540,4416,"In this family , congenital as well as early severe childhood and later childhood onset DM coexist .",O O O O O O O O O O O O O O O B O O,32
9417,5509,"RESULTS Before treatment , brain MRI was normal in five patients .",O O O O O O O O O O O O,13
8449,6930,The method is based on SSCP analysis of nested PCR fragments followed by sequence - determination reactions .,O O O O O O O O O O O O O O O O O O,13
9201,3752,"A portion of the Duchenne muscular dystrophy ( DMD ) gene transcript from human fetal skeletal muscle and mouse adult heart was sequenced , representing approximately 25 percent of the total , 14 - kb DMD transcript .",O O O O B I I O B O O O O O O O O O O O O O O O O O O O O O O O O O O B O O,32
3001,11831,Three novel missense mutations never identified previously in other populations and found in 16 out of 19 Colombian MPS IVA unrelated alleles account for 84 .,O O O O O O O O O O O O O O O O O O B I O O O O O O,39
5353,8857,"We cloned and sequenced the four G6PD variants from Sardinia and found that only two mutations are responsible for G6PD deficiency in this area one mutation is the cause of the G6PD Seattle - like phenotype , a milder form of G6PD deficiency ; the other mutation is responsible for all forms of very severe G6PD deficiency in Sardinia and , possibly , in the Mediterranean . .",O O O O O O O O O O O O O O O O O O O B I O O O O O O O O O O B I I I I O O O O O B I O O O O O O O O O O O O B I O O O O O O O O O O O,13
5893,5521,We extensively analyzed genomic DNA and messenger RNA ( mRNA ) from 62 unrelated Korean patients with familial adenomatous polyposis ( FAP ) for identification of germline adenomatous polyposis coli ( APC ) gene mutations .,O O O O O O O O O O O O O O O O O B I I O B O O O O O B I I O B O O O O,13
1232,5275,Germ - line BRCA1 mutations were identified in 6 of the 80 women .,O O O O O O O O O O O O O O,32
7765,9570,"Interestingly , all three subjects were probably heterozygous for both subtotal C6 and complete C6 deficiency .",O O O O O O O O O O B I I I I I O,13
4482,6953,Family studies were performed in order to distinguish the contributions of individual mutant F10 alleles to the clinical and laboratory phenotypes .,O O O O O O O O O O O O O O O O O O O O O O,13
8514,12404,"Although both domains of the VHL protein contribute to regulation of CA12 expression , the elongin binding domain alone could effectively regulate CA9 expression .",O O O O O B O O O O O O O O O O O O O O O O O O O,39
772,11266,"The homozygous mutant ( ATM - / - ) mice are viable , growth - retarded , and infertile .",O O O O O O O O O O O O O O O O O O O O,13
7243,1628,"A highly conserved haplotype at four markers flanking GBA ( PKLR , D1S1595 , D1S2721 , and D1S2777 ) was observed on both the AJ chromosomes and the non - Jewish N370S chromosomes , suggesting the occurrence of a founder common to both populations .",O O O O O O O O O O O O O O O O O O O O O O O O O O O O O O O O O O O O O O O O O O O O O,32
5088,7766,"However , following splenectomy to increase the platelet count , biopsy of the mediastinal mass revealed T - cell large cell lymphoma .",O O O O O O O O O O O O O O O O B I I I I I O,13
8562,7914,"Restriction mapping and sequencing of clones that span both translocation breakpoints as well as the corresponding normal regions indicate the loss of approximately 5 kb in the formation of the derivative X chromosome , with 4 - 6 bp deleted from chromosome 4 .",O O O O O O O O O O O O O O O O O O O O O O O O O O O O O O O O O O O O O O O O O O O O,13
1846,5206,The mutation causing myotonic dystrophy ( DM ) has recently been identified as an unstable CTG trinucleotide repeat located in the 3 untranslated region of a gene encoding for a protein with putative serine - threonine protein kinase activity .,O O O B I O B O O O O O O O O O O O O O O O O O O O O O O O O O O O O O O O O O,32
5010,11159,"The outer plexiform layer disappears occasionally , resulting in a juxtaposed inner and outer nuclear layer .",O O O O O O O O O O O O O O O O O,13
3935,2094,Two pregnancies at risk for Wolman disease were monitored by assay and electrophoresis of acid lipase in cultured amniotic - fluid cells .,O O O O O B I O O O O O O O O O O O O O O O O,32
175,5449,This cohort underwent follow - up for cancer incidence through the Finnish Cancer Registry to the end of 1995 .,O O O O O O O B O O O O O O O O O O O O,13
8383,5295,"A new glucose - 6 - phosphate dehydrogenase variant , G6PD Orissa ( 44 Ala - - > Gly ) , is the major polymorphic variant in tribal populations in India .",O O O O O O O O O O O O O O O O O O O O O O O O O O O O O O O O,32
6313,5007,"3 region , to examine these markers for association with the Wilson disease gene ( WND ) .",O O O O O O O O O O O B I O O B O O,32
919,976,001 001 .,O O O,32
2436,10360,The son had onset of macular degeneration at age 44 years .,O O O O O B I O O O O O,13
1187,5791,We identified the alpha - cardiac actin gene ( ACTC ) as a novel disease gene in a pedigree suffering from familial hypertrophic cardiomyopathy ( FHC ) .,O O O O O O O O O O O O O O O O O O O O O B I I O B O O,13
7069,192,Similar defects were found in a Fas - negative cell line transfected with cDNAs bearing each of the mutations .,O O O O O O O O O O O O O O O O O O O O,32
3653,3782,A cDNA clone for human PAH has previously been used to assign the corresponding gene to human chromosome 12 .,O O O O O O O O O O O O O O O O O O O O,32
6242,8723,"1 , but a review of published reports suggests that the aetiology of LGS may be a more complex issue",O O O O O O O O O O O O O B O O O O O O,13
9516,4844,mRNA from the alleles with the other two mutations was either undetectable or present in greatly reduced amounts .,O O O O O O O O O O O O O O O O O O O,32
9238,5542,"N . , Gnirke , A . , Thomas , W . , Tsuchihashi , Z . , Ruddy , D .",O O O O O O O O O O O O O O O O O O O O O O,13
6632,482,The zinc finger mutations affect DNA binding and the amount of residual binding directly correlates with disease severity .,O O O O O O O O O O O O O O O O O O O,32
9396,12000,5 kb of 5 - UTR and > 2 kb of 3 - UTR .,O O O O O O O O O O O O O O O,39
6937,6250,"Seven of these 12 patients had elevated serum ferritin levels in 1994 ; 6 of the 7 had further increases in 1998 , and 1 had a decrease , although the value remained elevated .",O O O O O O O O O O O O O O O O O O O O O O O O O O O O O O O O O O O,13
9000,3161,"We have conducted a survey for duplication in 72 unrelated nondeletion patients , analyzed by Southern blot hybridization with clones representing the entire DMD cDNA .",O O O O O O O O O O O O O O O O O O O O O O O B O O,32
2614,12562,These mutations resulted in the absence or a dramatic decrease of CPO activity .,O O O O O O O O O O O O O O,39
5096,468,"Most VCFS / DGS patients have a similar 3 Mb deletion , some have a nested distal deletion breakpoint resulting in a 1 .",O B O B O O O O O O O O O O O O O O O O O O O O,32
4324,2886,"Second , we report the substitution of arginine 333 by tryptophan , caused by a transition at nucleotide 1025 .",O O O O O O O O O O O O O O O O O O O O,32
6626,12100,Heteroduplex analysis complemented by direct DNA sequencing of abnormally migrating bands were employed .,O O O O O O O O O O O O O O,39
4323,1307,The mutations were identical in each of 2 pairs of brothers .,O O O O O O O O O O O O,32
2915,8971,"Of the 31 variants found in this province , Gd Kaiping , Gd Taiwan - Hakka , Gd Haad Yai , Gd Haad Yai - like and Gd Huiyang occurred most frequently .",O O O O O O O O O O O O O O O O O O O O O O O O O O O O O O O O O,13
6860,4635,"We have localized more than 20 genes on this map , ten of which had not been mapped to the region previously , and have isolated 30 cDNA clones representing partial sequences of as yet unidentified genes .",O O O O O O O O O O O O O O O O O O O O O O O O O O O O O O O O O O O O O O,32
8890,7180,"Sulfatases , including GALNS , are members of a highly conserved gene family sharing an extensive sequence homology .",O O O O O O O O O O O O O O O O O O O,13
6679,6686,"To investigate this mechanism , we analyzed sperm samples from six individuals from five unrelated families affected with hereditary retinoblastoma .",O O O O O O O O O O O O O O O O O O B I O,13
1198,456,beta - Glucuronidase activity was undetectable in affected cat fibroblasts and restored by retroviral gene transfer of rat beta - glucuronidase cDNA .,O O O O O O O O O O O O O O O O O O O O O O O,32
2215,6118,3 % of the samples and the allele linked to the normal chromosome was found in 49 .,O O O O O O O O O O O O O O O O O O,13
5463,5682,8 % of HH chromosomes that were neither C282Y nor H63D .,O O O B O O O O O O O O,13
1484,6799,This study provides the means for further investigation of additional genes that cause or modify the phenotypes associated with rearrangements of 15q11 - q13 .,O O O O O O O O O O O O O O O O O O O O O O O O O,13
