Unnamed: 0.1,Unnamed: 0,text,labels,txt_len
6134,3465,"Although molecular characteristics of this variant closely resemble those of G6PD Bangkok and G6PD Duarte , it can be distinguished from these and all other previously reported variants by virtue of its unusual pH curve .",O O O O O O O O O O O O O O O O O O O O O O O O O O O O O O O O O O O O,32
9142,2121,Analbuminemia in an American Indian girl .,B O O O O O O,32
9709,6631,"Alstrom syndrome is a rare autosomal recessive disorder characterized by retinal degeneration , sensorineural hearing loss , early - onset obesity , and non - insulin - dependent diabetes mellitus .",B I O O O B I I O O B I O B I I O O O O B O O B I I I I I I O,13
8849,3961,"Here prediction and exclusion of DMD gene transmission may be possible , the accuracy being dependent on the closeness of the linkage of the DNA marker ( s ) to the DMD gene ; an illustrative case is reported .",O O O O O B O O O O O O O O O O O O O O O O O O O O O O O O O B O O O O O O O O,32
5326,4812,Transient expression of the mutant Ser309 - ARSA resulted in only 13 % enzyme activity of that observed in cells expressing normal ARSA .,O O O O O O O O O O O O O O O O O O O O O O O O,32
8989,6153,The presence of dimeric COLIA1 / PDGFB precursors was demonstrated through PDGFB immunoprecipitations of metabolically labeled cells and also by PDGFB immunoprecipitations followed by immunoblotting with COLIA1 antibodies .,O O O O O O O O O O O O O O O O O O O O O O O O O O O O O,13
1726,10029,"The nonsense mutations , at codons 103 and 353 , truncate PAX6 within the N - terminal paired and C - terminal PST domains , respectively .",O O O O O O O O O O O O O O O O O O O O O O O O O O O,13
4821,9292,L - N patients fail to reproduce and the heterozygous state appears to confer no selective advantage .,B I I O O O O O O O O O O O O O O O,13
3850,3101,"Of these , 31 had severe G6PD deficiency , nine had mild to moderate deficiency , and three had a non - deficient electrophoretic variant .",O O O O O O B I O O O O O O O O O O O O O O O O O O,32
8312,8984,These techniques should prove useful in identifying carriers of severe von Willebrand disease and also in defining patients predictably at risk of developing alloantibodies to vWF .,O O O O O O O O O B I I I O O O O O O O O O O O O O O,13
8655,4170,Myotonic dystrophy : evidence for a possible dominant - negative RNA mutation .,B I O O O O O O O O O O O,32
1997,8190,"5 , that is transcribed in the same orientation as SRP19 .",O O O O O O O O O O O O,13
8632,10513,"Mutations were found in all tumors , and one - third of the tumors had independent mutations in both alleles neither of which were found in the germ line , confirming their true sporadic nature .",O O O O O B O O O O O O O B O O O O O O O O O O O O O O O O O O O O O O,13
2118,6466,"Recently a quantitative Southern blotting procedure was found to improve this frequency ( C . Stolle et al . , Hum . Mutat . , 12 417 - 423 , 1998 ) .",O O O O O O O O O O O O O O O O O O O O O O O O O O O O O O O O O,13
1741,10445,X linked recessive thrombocytopenia .,B I I I O,13
7491,5195,DNA samples were obtained from peripheral blood of these individuals for sequencing using a direct polymerase chain reaction ( PCR ) sequencing procedure .,O O O O O O O O O O O O O O O O O O O O O O O O,32
2087,2178,"Sequencing of amplified cDNA fragments revealed a single alteration , guanine to adenine at nt 749 creating a G250D mutation .",O O O O O O O O O O O O O O O O O O O O O,32
4630,7303,None of control individuals possessed the WASPdim population .,O O O O O O O O O,13
2179,895,Subsequently analysis of the retinas of nine enucleated eyes from males with Coats disease demonstrated in one a somatic mutation in the NDP gene which was not present within non - retinal tissue .,O O O O O O O O O O O O B I O O O O O O O O O O O O O O O O O O O O,32
6394,4067,The mean HDL - cholesterol concentration in the CTX plasmas was 14 .,O O O O O O O O B O O O O,32
722,8490,No impairment of cellular immunity or immunoglobulin deficiency could be found .,O B I I I O B I O O O O,13
992,7226,"To do this , a collaborative screening study was set up that involved 39 institutions from 19 countries and included 3 , 580 unrelated individuals with a family history of the disease and 934 early - onset breast and / or ovarian cancer cases .",O O O O O O O O O O O O O O O O O O O O O O O O O O O O O O O O O O O O O B I I I I I O O,13
3636,10014,"In clones and subclones derived serially from one of these cell lines ( 2774 ; serous cystadenocarcinoma ) , a very high proportion of microsatellites distributed in many different regions of the genome change their size in a mercurial fashion .",O O O O O O O O O O O O O O O B I O O O O O O O O O O O O O O O O O O O O O O O O,13
10108,5289,"In one family , penetrance was complete , with females developing early - onset breast cancer or ovarian cancer and the male carrier developing prostatic cancer , whereas , in the other family , penetrance was incomplete and only breast cancer occurred , diagnosed at ages 38 - 81 years .",O O O O O O O O O O O O O O B I O B I O O O O O B I O O O O O O O O O O O O O B I O O O O O O O O O O,32
6811,8197,Rearrangement of the BCL1 ( B - cell lymphoma 1 ) region on chromosome 11q13 appears to be highly characteristic of centrocytic lymphoma and also is found infrequently in other B - cell neoplasms .,O O O O O O O O O O O O O O O O O O O O O B I O O O O O O O B I I I O,13
8375,6190,We then evaluated the effects of differing dosages of gentamicin on expression and functional protection of the muscles of mdx mice .,O O O O O O O O O O O O O O O O O O O O O O,13
6198,2719,Analysis of the canine dystrophin gene in normal and GRMD dogs has failed to demonstrate any detectable loss of exons .,O O O O O O O O O B O O O O O O O O O O O,32
4297,8653,"A control group of individuals from Southeast Asia shared the same major haplotypes , 4 , 1 , and 7 , with Polynesians .",O O O O O O O O O O O O O O O O O O O O O O O O,13
9369,3721,"The presence of hypopigmentation correlated with a small interstitial deletion on the proximal long arm of chromosome 15 ; however , this deletion was also found in individuals who did not meet the full criteria for hypopigmentation .",O O O B O O O O O O O O O O O O O O O O O O O O O O O O O O O O O O O O B O,32
7183,9708,Natural selection of hemi - and heterozygotes for G6PD deficiency in Africa by resistance to severe malaria .,O O O O O O O O B I O O O O O O B O,13
272,93,This has implications regarding the mechanism by which the mutant allele exerts its effect .,O O O O O O O O O O O O O O O,32
5286,8571,"Two male subjects are described , with unusual clinical presentations and with hitherto undescribed G6PD variants .",O O O O O O O O O O O O O O O O O,13
9283,368,This is the first report of protein studies on patients with missense mutations resulting in the clinical features of EDMD .,O O O O O O O O O O O O O O O O O O O B O,32
8783,928,"Additionally , one of the asymptomatic relatives ( a girl 8 months old at the time of study ) was identified as carrier of the same mutation and developed the disease 3 months later .",O O O O O O O O O O O O O O O O O O O O O O O O O O O O O O O O O O O,32
5429,11963,"50 mg / ml , which was approximately half the level of Hp in control sera from the Hp1 phenotype ( 1 . 26 + / - 0 . 33 mg / ml ; n = 9 ) , showing a gene - dosage effect .",O O O O O O O O O O O O O O O O O O O O O O O O O O O O O O O O O O O O O O O O O O O O O O,39
1516,7253,"Hypotonia , chorioretinal dystrophy , and myopia were also identified .",B O B I O O B O O O O,13
7867,11377,"The 24 exons of BRCA1 span an 81 - kb region that has an unusually high density of Alu repetitive DNA ( 41 . 5 % ) , but relatively low density ( 4 . 8 % ) of other repetitive sequences .",O O O O O O O O O O O O O O O O O O O O O O O O O O O O O O O O O O O O O O O O O O O,13
39,8812,"Linkage studies using restriction fragment length polymorphisms were conducted in the X - linked disorder , choroideremia , designated TCD for Progressive Tapeto - Choroidal Dystrophy .",O O O O O O O O O O O B I I I O B O O B O B I I I I O,13
2670,10480,"Overall , the establishment of a likely "" hemochromatosis critical region "" centromeric boundary and the identification of a linkage - disequilibrium zone both significantly contribute to a reduction in the amount of DNA required to be searched for novel coding sequences constituting the HFE defect",O O O O O O O O B O O O O O O O O O O O O O O O O O O O O O O O O O O O O O O O O O O O B I,13
6272,7362,"We studied SCN1B exons 1 , 2 , 3 , 4 , and 5 , using four SSCP methods in 10 Caucasian BFIC probands of Western Europe .",O O O O O O O O O O O O O O O O O O O O O O B O O O O O,13
5173,3144,This finding and the previous findings of a 45 % frequency of phenotypic color vision defects in patients with AMN may suggest that the ALD / AMN gene lies 5 to the red pigment gene and that the frequent phenotypic color vision anomalies owe their origin to deleted DNA that includes regulatory genes for color vision .,O O O O O O O O O O O O O O O O O O O B O O O O B O B O O O O O O O O O O O O O B I I O O O O O O O O O O O O O O,32
5406,9629,Analysis of the mutation in these families shows a strong negative correlation between size of the expanded CAG repeat and age at onset of clinical disease .,O O O O O O O O O O O O O O O O O O O O O O O O O O O,13
1096,4713,XK encodes a novel protein with structural characteristics of prokaryotic and eukaryotic membrane transport proteins .,O O O O O O O O O O O O O O O O,32
5694,12126,Altered expression of genes regulated posttranscriptionally by CUG - BP therefore may contribute to DM pathogenesis . .,O O O O O O O O O O O O O O B O O O,39
2984,8450,"Pituitary - adrenal function studies were performed in 10 family members , including two affected males and four females identified as carriers of ALD / AMN .",O O O O O O O O O O O O O O O O O O O O O O O B O B O,13
4955,1129,A translocation involving 14q was found in clones obtained from seven of the eight patients whereas a ring 14 chromosome was found in a clone obtained from the other .,O O O O O O O O O O O O O O O O O O O O O O O O O O O O O O,32
8731,7992,A family with inherited deficiency of complement factor 2 ( C2 ) is described in which two family members with homozygous C2 deficiency developed cutaneous vasculitis and sicca syndrome .,O O O B I I I I I O O O O O O O O O O O O B I O B I O B I O,13
6215,4887,"Second , affected members of a family with dominantly inherited anterior segment malformations , including Peters anomaly are heterozygous for an R26G mutation in the PAX6 paired box .",O O O O O O O O O O B I I O O B I O O O O O O O O O O O O,32
3493,4014,G6PD activity was absent in patients red cells and was about 2 % of normal in leukocytes .,O O O O O O O O O O O O O O O O O O,32
1534,149,"K . , Loeb , D .",O O O O O O O,32
2873,10862,X - linked adrenoleukodystrophy is a frequent cause of idiopathic Addison ' s disease in young adult male patients .,B I I I O O O O O O B I I I O O O O O O,13
2643,7852,Linkage of gene for C2 deficiency and the major histocompatibility complex MHC in man .,O O O O B I O O O O O O O O O,13
133,47,Their parents and nonaffected siblings were identified through the Population Register Center .,O O O O O O O O O O O O O,32
4425,9024,The finding of jaw lesions and / or pigmented ocular fundus lesions in relatives at risk are indications of the possible presence of the GS gene .,O O O B I O O O B I I I O O O O O O O O O O O O B O O,13
9605,6963,"Despite the ubiquitous expression of the truncated HMG I - C protein , the transgenic mice develop a selective abundance of fat tissue early in life , show marked adipose tissue inflammation , and have an abnormally high incidence of lipomas .",O O O O O O O O O O O O O O O O O O O O O O O O O O O O O B I I O O O O O O O O B O,13
3381,9246,5 per cent of normal .,O O O O O O,13
6983,6577,"Its clinical features are variably expressed , but include cleft lip and / or cleft palate , lip pits and hypodontia .",O O O O O O O O O B I O O O B I O B I O B O,13
5899,5915,Genotype - phenotype analysis in X - linked Emery - Dreifuss muscular dystrophy and identification of a missense mutation associated with a milder phenotype .,O O O O O B I I I I I I I O O O O O O O O O O O O,13
8582,9656,"Thus , this disorder appears as a variant of Thomsens disease due to mutations leading to low clinical expressivity .",O O O O O O O O O B I O O O O O O O O O,13
6638,867,"These results confirmed the diagnosis of X - linked Emery - Dreifuss muscular dystrophy ( EDMD ) , and reinforce the necessity of molecular genetic diagnosis of the membrane protein emerin in younger patients with possible EDMD before appearance of the typical symptoms , to avoid sudden cardiac death . .",O O O O O O B I I I I I I I O B O O O O O O O O O O O O O O O O O O O O B O O O O O O O O O B I I O O,32
1495,795,"Ataxia - telangiectasia ( A - T ) is characterized by a markedly increased sensitivity to ionizing radiation , increased incidence of cancer , and neurodegeneration , especially of the cerebellar Purkinje cells .",B I I O B I I O O O O O O O O O O O O O O O B O O B O O O O O O O O,32
5888,5907,"The second mutation introduces a missense mutation ( C282Y ) into the Hfe locus , but otherwise leaves the gene intact .",O O O O O O O O O O O O O O O O O O O O O O,13
176,8167,"The abolition of an invariant BamHI site located in the coding sequence of the PAH gene ( exon 7 ) led to the recognition of two new point mutations at codon 272 and 273 ( 272gly - - - - stop and 273ser - - - - phe , respectively ) .",O O O O O O O O O O O O O O O O O O O O O O O O O O O O O O O O O O O O O O O O O O O O O O O O O O O O,13
2090,6103,The Atp7b protein is a copper - transporting ATPase expressed predominantly in the liver and to a lesser extent in most other tissues .,O O O O O O O O O O O O O O O O O O O O O O O O,13
5601,7989,"Together , these data suggest that there were multiple , geographically and ethnically distinct origins for PKU within the European population . .",O O O O O O O O O O O O O O O O B O O O O O O,13
7904,732,A T - - > A transition at the 20th nucleotide position of exon 5a results in a Val - - > Asp ( GTC - - > GAC ) substitution at the 7th codon of the alternative splice region .,O O O O O O O O O O O O O O O O O O O O O O O O O O O O O O O O O O O O O O O O O,32
7420,2911,A single origin of phenylketonuria in Yemenite Jews .,O O O O B O O O O,32
5843,1036,This observed increase in ventilatory output was not correlated to changes in body mass index .,O O O O O O O O O O O O O O O O,32
4346,3556,Half of all BMD patients have a deletion of one particular small group of exons ; smaller deletions within this same group produce the more severe DMD . .,O O O B O O O O O O O O O O O O O O O O O O O O O O B O O,32
3884,8677,69 at theta = 0 .,O O O O O O,13
3114,10892,"The BRCA2 coding sequence is huge , composed of 26 exons that span 10 , 443 bp .",O O O O O O O O O O O O O O O O O O,13
9147,5856,"A family of domestic cats was found that exhibited clinical and biochemical abnormalities consistent with mucopolysaccharidosis VII , an autosomal recessive lysosomal storage disorder caused by beta - glucuronidase deficiency .",O O O O O O O O O O O O O O O B I O O B I I I I O O B I I I O,13
7691,10550,Cholesteryl ester transfer protein ( CETP ; 476 amino acids ) transfers cholesteryl ester from HDL to other lipoproteins .,O O O O O O O O O O O O O O O O O O O O,13
4025,12240,We identified both causative mutations in 686 patients from seven European centers .,O O O O O O O O O O O O O,39
9491,6735,We also report a mutation of the same exon 6 CTSC codon ( 2126C - - > T ) in a Turkish family with classical PLS .,O O O O O O O O O O O O O O O O O O O O O O O O O B O,13
1060,4231,Overexpression of DM20 messenger RNA in two brothers with Pelizaeus - Merzbacher disease .,O O O O O O O O O B I I I O,32
4911,1692,These results suggest a large homozygous deletion ( at least 30 kb ) in the patient .,O O O O O O O O O O O O O O O O O,32
8684,1440,"Therefore , the accumulation of the types of mutations in Japanese patients with WD will facilitate the fast and effective genetic diagnosis of WD in Japanese patients . .",O O O O O O O O O O O O O B O O O O O O O O O B O O O O O,32
3546,6465,"The reported frequency of detection of VHL germline mutations has varied from 39 to 80 % ( J . M . Whaley et al . , Am . J . Hum . Genet . , 55 1092 - 1102 , 1994 ; Clinical Research Group for Japan , Hum . Mol . Genet . , 4 2233 - 2237 , 1995 ; F . Chen et al . , Hum . Mutat . , 5 66 - 75 , 1995 ; E . R . Maher et al . , J . Med . Genet . , 33 328 - 332 , 1996 ; B . Zbar , Cancer Surv . , 25 219 - 232 , 1995 ) .",O O O O O O B O O O O O O O O O O O O O O O O O O O O O O O O O O O O O O O O O O O O O O O O O O O O O O O O O O O O O O O O O O O O O O O O O O O O O O O O O O O O O O O O O O O O O O O O O O O O O O O O O O O O O O O O O O O O O O O O O,13
10001,10168,"Because EWS proteins contain putative conserved RNA binding motifs , we studied the RNA binding properties of the EWS protein .",O O O O O O O O O O O O O O O O O O O O O,13
528,5534,"Heterozygote detection was performed with an allele - specific polymerase chain reaction ( PCR ) system designed to detect exclusively only one of the normal and mutant alleles , followed by confirmation with PCR / single - strand conformation polymorphism ( SSCP ) analysis and direct sequencing .",O O O O O O O O O O O O O O O O O O O O O O O O O O O O O O O O O O O O O O O O O O O O O O O O,13
3464,850,The serum ferritin levels in the four other homozygous patients remained in the normal range .,O O O O O O O O O O O O O O O O,32
9610,8107,The second type of mutation ( 493 A - - - - G ) is a novel mutation that has not been reported in any other ethnic group and was identified in two affected Chinese .,O O O O O O O O O O O O O O O O O O O O O O O O O O O O O O O O O O O O,13
8802,11568,Voltage - dependent blocks by intracellular and extracellular iodide help to distinguish two distinct ion binding sites within the hClC - 1 conduction pathway .,O O O O O O O O O O O O O O O O O O O O O O O O O,13
4647,4605,The mutation causing myotonic dystrophy ( DM ) has been identified as an amplification of an unstable trinucleotide ( CTG ) n repeat in over 99 % of the global DM population .,O O O B I O B O O O O O O O O O O O O O O O O O O O O O O O B O O,32
4706,8817,"All 36 patients and 48 carriers tested from the three kindreds had the same haplotype ( TCD / DXYS1 , 11kb / DXYS12 , 1 . 6kb ) .",O O O O O O O O O O O O O O O O B O O O O O O O O O O O O,13
10089,6514,"Relevance of this model was suggested by verification that three of these genes ( IGFBP5 , HSIX1 , and Slug ) were also expressed in alveolar rhabdomyosarcoma cell lines .",O O O O O O O O O O O O O O O O O O O O O O O O O B I O O O,13
3498,7985,"The haplotype associations , relative frequencies , and distributions of five prevalent PAH mutations ( R158Q , R261Q , IVS10nt546 , R408W , and IVS12n1 ) were established in a comprehensive European sample population and subsequently were examined to determine the potential roles of several genetic mechanisms in explaining the present distribution of the major PKU alleles .",O O O O O O O O O O O O O O O O O O O O O O O O O O O O O O O O O O O O O O O O O O O O O O O O O O O O O O O B O O,13
6887,8845,Complete deficiency of hypoxanthine - guanine phosphoribosyltransferase ( HPRT ) causes the Lesch - Nyhan syndrome .,O B I I I I I O O O O O B I I I O,13
1651,10258,"We conclude that ( 1 ) intergenerational contractions of the CTG repeat in leukocyte DNA frequently accompanies apparent anticipation , especially when DM is maternally transmitted , and ( 2 ) the paternal origin of the repeat and the presence of the repeat contraction in a sibling increase the probability of the CTG repeat contraction",O O O O O O O O O O O O O O O O O O O O O O B O O O O O O O O O O O O O O O O O O O O O O O O O O O O O O O O,13
7516,8961,Protein levels of Clq .,O O O O O,13
3220,8528,"Several mutations in the PAH gene have recently been reported , and linkage disequilibrium was observed between RFLP haplotypes and specific mutations .",O O O O O O O O O O O O O O O O O O O O O O O,13
7088,12417,"Like BRCA1 and RAD51 , BRCA2 relocates to PCNA + replication sites following exposure of S phase cells to hydroxyurea or UV irradiation .",O O O O O O O O O O O O O O O O O O O O O O O O,39
8932,1079,Recurrent hSNF5 / INI1 alterations were also observed in choroid plexus carcinomas and in a subset of central primitive neuroectodermal tumors ( cPNETs ) and medulloblastomas .,O O O O O O O O O B I I O O O O O O O B I O O O O B O,32
5767,8026,"Sequencing of the exon from the CVS , the predicted - carrier mother , and the obligate - carrier grandmother revealed an A - to - C change at nucleotide 541 in the two women but not in the fetus .",O O O O O O O O O O O O O O O O O O O O O O O O O O O O O O O O O O O O O O O O O,13
2513,11997,Previous UBE3A cDNA analysis has shown a coding region of approximately 2 .,O O O O O O O O O O O O O,39
9701,3627,We have identified a single - base mutation in a cloned fragment of the HEXA gene from an Ashkenazi Jewish patient .,O O O O O O O O O O O O O O O O O O O O O O,32
6322,7173,"Mucopolysaccharidosis IVA ( MPS IVA ; OMIM # 253000 ) , a lysosomal storage disorder caused by a deficiency of N - acetylgalactosamine - 6 - sulfate sulfatase ( GALNS ) , has variable clinical phenotypes .",B I O B I O O O O O O O B I I O O O B I I I I I I I I I O O O O O O O O O,13
8124,9749,Expansion of the repeat has been correlated with severity of several clinical features of the disease .,O O O O O O O O O O O O O O O O O,13
7503,6682,"CONCLUSIONS It is suggested that coexpression of hbeta ( 1 ) exposes a more severe functional defect that results in a greater overlap in the relationship between channel inactivation and activation ( window current ) in T1620M , which is proposed to be a potential pathophysiological mechanism of IVF in vivo .",O O O O O O O O O O O O O O O O O O O O O O O O O O O O O O O O O O O O O O O O O O O O O O O O B O O O,13
6422,6311,A novel mutation in the sodium / iodide symporter gene in the largest family with iodide transport defect .,O O O O O O O O O O O O O O O B I I O,13
9,4638,The LEC rat has a deletion in the copper transporting ATPase gene homologous to the Wilson disease gene .,O O O O O O O O O O O O O O O B I O O,32
7714,10877,"Prostate secretory epithelial cells and androgen - dependent prostate carcinomas undergo apoptosis in response to androgen deprivation and , furthermore , most prostate carcinomas become androgen independent and refractory to further therapeutic manipulations during disease progression .",O O O O O O O O B I O O O O O O O O O O O O B I O O O O O O O O O O O O O,13
3474,9536,Absence of BRCA1 or aberrant subcellular location was also observed to a variable extent in histological sections of many breast cancer biopsies .,O O O O O O O O O O O O O O O O O O O B I O O,13
9113,3561,"C4 , C5 , properdin , and C3b - INA and hemolytic activities of complement components C1 to C9 except C3 were normal or elevated ; total hemolytic complement activity was 13 % of normal and was reconstituted by purified C3 .",O O O O O O O O O O O O O O O O O O O O O O O O O O O O O O O O O O O O O O O O O O,32
6659,1821,The BRCA1 Exon 13 Duplication Screening Group .,O O O O O O O O,32
7945,10004,The four families with both breast and ovarian cancer had chain termination mutations in the N - terminal half of the protein . .,O O O O O B I I I O O O O O O O O O O O O O O O,13
5996,6278,The human genotype - phenotype correlations are consistent with a role for Dp260 in normal retinal electrophysiology and may also reflect the expression of other C - terminal dystrophin isoforms and their contributions to retinal signal transmission . .,O O O O O O O O O O O O O O O O O O O O O O O O O O O O O O O O O O O O O O O,13
1091,3578,Gene dosage analysis was consistent with heterozygous deletions in both of the asymptomatic parents and four asymptomatic siblings of this kindred ( P less than 0 . 01 ) .,O O O O O O O O O O O O O O O O O O O O O O O O O O O O O O,32
8044,2583,"PKU is a highly heterogeneous disorder , with more than 60 molecular lesions identified in the PAH gene .",B O O O O O O O O O O O O O O O O O O,32
8251,4192,The N314D and R333W mutations were found on one allele each .,O O O O O O O O O O O O,32
9010,4719,"A rare X - linked dysmyelinating disorder of the central nervous system , Pelizaeus - Merzbacher disease ( PMD ) , has also been mapped to Xq21 - q22 , and is caused by mutations in the proteolipid protein gene ( PLP ) which encodes two myelin proteins , PLP and DM20 .",O O B I I I I O O O O O O B I I I O B O O O O O O O O O O O O O O O O O O O O O O O O O O O O O O O O O O,32
4236,6243,"In 1994 , we obtained blood samples for the determination of serum transferrin saturation and ferritin levels and the presence or absence of the C282Y mutation and the H63D mutation ( which may contribute to increased hepatic iron levels ) in 3011 unrelated white adults .",O O O O O O O O O O O O O O O O O O O O O O O O O O O O O O O O O O O O O O O O O O O O O O,13
6352,9296,The origin of one unusual mutation has been identified by analysis of DNA from four generations of family members .,O O O O O O O O O O O O O O O O O O O O,13
9335,3103,6 % .,O O O,32
8918,1027,"Mutations identified in this study include 19 missense mutations , two nonsense mutations , one intragenic deletion , four microdeletions , one insertion , and one intronic sequence substitution that is likely to result in a splice site defect .",O O O O O O O O O O O O O O O O O O O O O O O O O O O O O O O O O O O O O O O O,32
