Unnamed: 0.1,Unnamed: 0,text,labels,txt_len
2662,12065,"Ventricular fibrillation causes more than 300 , 000 sudden deaths each year in the USA alone .",B I O O O O O O O O O O O O O O O,39
1297,8485,"These data , together with recent refinements in the linkage and physical maps of 11q22 - 23 , place the AT locus at 11q23 .",O O O O O O O O O O O O O O O O O O O O B O O O O,13
3279,2191,This change generates an early termination codon 6 bp downstream from the insertion site .,O O O O O O O O O O O O O O O,32
4413,2873,The rapid identification of mutations causing Tay - Sachs disease requires the capacity to readily screen the regions of the HEXA gene most likely to be affected by mutation .,O O O O O O B I I I O O O O O O O O O O O O O O O O O O O O,32
6035,24,For females there was a high risk of endometrial cancer ( 0 . 5 at age 60 years ) and premenopausal ovarian cancer ( 0 . 2 at 50 years ) .,O O O O O O O O B I O O O O O O O O O O B I I O O O O O O O O O,32
6574,3738,"Recent progress has resulted in part of the gene mutated in Duchenne and the milder Becker muscular dystrophies being cloned and has suggested that the gene itself extends over 1 , 000 to 2 , 000 kilobases ( kb ) .",O O O O O O O O O O O B I I I I I I O O O O O O O O O O O O O O O O O O O O O O O,32
1915,12549,6 % of 188 non - European Jews ( P = 0 . 08 ) .,O O O O O O O O O O O O O O O O,39
451,9528,We have isolated the human VLCAD cDNA and gene and determined the complete nucleotide sequences .,O O O O O O O O O O O O O O O O,13
125,575,"Globally , K285N is rarer , but in many European populations it can be found on 25 - 40 % of mutant chromosomes .",O O O O O O O O O O O O O O O O O O O O O O O O,32
1468,4480,These studies suggest that BRCA1 may normally serve as a negative regulator of mammary epithelial cell growth whose function is compromised in breast cancer either by direct mutation or alterations in gene expression . .,O O O O O O O O O O O O O O O O O O O O O O B I O O O O O O O O O O O,32
9996,8051,"In two families the father of classical cases showed a milder pattern of abnormalities , consistent with the diagnosis .",O O O O O O O O O O O O O O O O O O O O,13
8788,12336,It is not clear whether such mutants really behave as loss - of - function mutants as predicted by haploinsufficiency .,O O O O O O O O O O O O O O O O O O O O O,39
4580,12542,"BACKGROUND & AIMS Israeli Jews of European birth , i . e . , Ashkenazim , have the highest colorectal cancer incidence of any Israeli ethnic group .",O O O O O O O O O O O O O O O O O O O B I O O O O O O O,39
8416,8746,"We describe here a Pelizaeus - Merzbacher pedigree of the classical type , with X - linked inheritance , a typical clinical progression , and a pathologic loss of myelinating cells and myelin in the central nervous system .",O O O O B I I O O O O O O O O O O O O O O O O O O O O O O O O O O O O O O O O,13
247,10997,Our results indicate that DMPK may be necessary for the maintenance of skeletal muscle structure and function and suggest that a decrease in DMPK levels may contribute to DM pathology . .,O O O O O O O O O O O O O O O O O O O O O O O O O O O O B O O O,13
713,8580,"The age incidence curves for renal cell carcinoma and cerebellar haemangioblastoma in VHL disease were compatible with a single mutation model , whereas the age incidence curves for sporadic renal cell carcinoma and cerebellar haemangioblastoma suggested a two stage mutation process .",O O O O O B I I O B I O B I O O O O O O O O O O O O O O B I I I O B I O O O O O O O,13
4526,7530,"Gc - types in the family were compatible with , but did not prove , linkage of analbuminemia to the Gc - locus .",O O O O O O O O O O O O O O O O O B O O O O O O,13
6865,7065,"Patient 1 was homozygous for a complex mutant allele containing two alterations , including a 194C > T transition ( P65L ) and 739A > C transversion ( K247Q ) ; in the case of P65L , the amino acid change does not reduce enzyme activity .",O O O O O O O O O O O O O O O O O O O O O O O O O O O O O O O O O O O O O O O O O O O O O O O,13
2405,8631,"Of these , eight BMD patients and one intermediate patient had gene deletions predicted to leave the reading frame intact , while 21 DMD patients , 7 intermediate patients , and 1 BMD patient had gene deletions predicted to disrupt the reading frame .",O O O O B O O O O O O O O O O O O O O O O O O B O O O O O O O O B O O O O O O O O O O O,13
7807,2206,These mutations segregated with mutant haplotype 12 alleles in nuclear families but were not present on normal or other mutant alleles .,O O O O O O O O O O O O O O O O O O O O O O,32
1427,1889,"Caucasians , Blacks , and Mexican Hispanics and stratify by disease severity and ethnicity .",O O O O O O O O O O O O O O O,32
6871,11875,"Mutations in the SMAD4 / DPC4 tumor suppressor gene , a key signal transducer in most TGFbeta - related pathways , are involved in 50 % of pancreatic cancers .",O O O O O O B O O O O O O O O O O O O O O O O O O O O B I O,39
7529,1196,Polymerase chain reaction - restriction fragment length polymorphism analysis on DNA derived from 100 donors using the restriction enzyme Mae III showed that the Met ( 799 ) form of GPIa is restricted to Sit ( a ) ( + ) phenotype .,O O O O O O O O O O O O O O O O O O O O O O O O O O O O O O O O O O O O O O O O O O O,32
6098,4699,"These percentages differ significantly from previous reports , in which 25 to 28 % of the patients developed AMN and 53 to 57 % CCALD or AdolCALD .",O O O O O O O O O O O O O O O O O O B O O O O O B O B O,32
9714,1484,To date most data suggest locus homogeneity in FRDA .,O O O O O O O O B O,32
4697,2009,N - terminal fragments of mutant huntingtin form aggregates and induce neuritic degeneration in cultured striatal neurons .,O O O O O O O O O O O B I O O O O O,32
5254,11550,"We found that a group of patients have mild skeletal changes which may be secondary consequences of myotonia , while another group of patients appear to have primary bone dysplasia with myotonia .",O O O O O O O O O O O O O O O O O B O O O O O O O O O O B I O B O,13
8516,8785,This may explain the relatively mild symptoms of the Lesch - Nyhan syndrome exhibited by this patient . .,O O O O O O O O O B I I I O O O O O O,13
6258,9152,Conservation of the Duchenne muscular dystrophy gene in mice and humans .,O O O B I I O O O O O O,13
5573,2654,"Unlike almost all other X - linked disorders , clinical expression in CFND is generally much more severe in females than in males .",O O O O B I I I O O O O B O O O O O O O O O O O,32
9233,10848,"In one family , both alleles were normal in the parents and one sister ; thus , the mutation originated de novo in the proposita .",O O O O O O O O O O O O O O O O O O O O O O O O O O,13
3260,3788,These results not only provide a regionalized map position for a major human disease locus but also can serve as a reference point for linkage analysis with other DNA markers on human chromosome 12,O O O O O O O O O O O O O O O O O O O O O O O O O O O O O O O O O O,32
8332,6611,Sequence analysis of CTSC from subjects affected with PLS from five consanguineous Turkish families identified four different mutations .,O O O O O O O O B O O O O O O O O O O,13
2648,4559,"A previous conceptus in this family was stillborn at 36 weeks , with features of severe type II GD .",O O O O O O O B O O O O O O O O B I I O,32
6082,3223,Molecular and phenotypic analysis of patients with deletions within the deletion - rich region of the Duchenne muscular dystrophy ( DMD ) gene .,O O O O O O O O O O O O O O O O B I I O B O O O,32
3350,10766,"Atelosteogenesis type II ( AO II ) is a neonatally lethal chondrodysplasia whose clinical and histological characteristics resemble those of another chondrodysplasia , the much less severe diastrophic dysplasia ( DTD ) .",B I I O B I O O O O O B O O O O O O O O O B O O O O O B I O B O O,13
5951,2807,"Clones hybridizing with cDNA for human ARSA were selected , examined for appropriate size inserts , and used to prepare single - stranded phage DNA .",O O O O O O O O O O O O O O O O O O O O O O O O O O,32
6712,2629,These results provide further examples of mutations in PLP that cause Pelizaeus - Merzbacher disease and illustrate the value of SSCP in genetic analysis . .,O O O O O O O O O O O B I I I O O O O O O O O O O O,32
2980,10623,""" We conclude that vWF mutation may be an under recognized cause of hemophilia , especially in cases where the inheritance pattern is not consistent with X - linked transmission .",O O O O O O O O O O O O O B O O O O O O O O O O O O O O O O O,13
9669,5935,CONCLUSIONS The incidence of each of the germline mutations in these prostate cancer patients closely matched their incidence ( about 1 % ) in the general Ashkenazi Jewish population .,O O O O O O O O O O O B I O O O O O O O O O O O O O O O O O,13
2054,3109,Deficiency of the murine fifth complement component ( C5 ) .,B I I I I I I I I I O,32
1942,5350,Four mutations could be shown to be de novo .,O O O O O O O O O O,32
521,3918,"The other five variants were new Gd ( - ) Laghouat ( four cases ) , Gd ( - ) Blida ( one case ) , Gd ( - ) Thenia ( one case ) , Gd ( - ) Titteri ( one case ) , and Gd ( - ) Alger ( two brothers ) .",O O O O O O O O O O O O O O O O O O O O O O O O O O O O O O O O O O O O O O O O O O O O O O O O O O O O O O O O O,32
7358,11778,Nonsignificant increases in similarity with regard to age at disease onset and all of the disease severity scores assessed were noted in disease - concordant MZ twins compared with concordant DZ twins .,O O O O O O O O O O O O O O O O O O O O O O O O O O O O O O O O O,39
5693,10455,"Mutations at codon 172 of the rds gene have been identified in three families with autosomal dominantly inherited , progressive macular dystrophy .",O O O O O O O O O O O O O O O O O O O O B I O,13
5653,5991,"Among these mutations , 50 % correspond to new mutations .",O O O O O O O O O O O,13
4298,10474,"The zone of linkage disequilibrium is flanked by the i97 locus , positioned 30 kb proximal to i82 , and the HLA - F gene , found 250 kb distal to HLA - A , markers of which display no significant association with HFE .",O O O O O O O O O O O O O O O O O O O O O O O O O O O O O O O O O O O O O O O O O O O O O,13
3987,994,Implementation of this method of mutation screening in the research and clinical setting should permit rapid accrual of quantitative data on genotype - phenotype associations for the evaluation of diagnostic testing . .,O O O O O O O O O O O O O O O O O O O O O O O O O O O O O O O O O,32
242,6424,"Novel mutations in XLRS1 causing retinoschisis , including first evidence of putative leader sequence change .",O O O O O B O O O O O O O O O O,13
1984,8225,"Both small - sized and normal - sized platelets were present , suggesting that , unlike the vast majority of WAS carriers , she does not manifest nonrandom X - chromosome inactivation in the thrombopoietic cell lineage .",O O O O O O O O O O O O O O O O O O O O B O O O O O O O O O O O O O O O O O,13
9386,10001,Seven mutations lead to protein truncations at sites throughout the gene .,O O O O O O O O O O O O,13
1399,5433,Such a sex difference in AO was not apparent for any of the other APOE genotypes .,O O O O O O O O O O O O O O O O O,13
201,910,A novel mutation in the sodium / iodide symporter gene in the largest family with iodide transport defect .,O O O O O O O O O O O O O O O B I I O,32
6686,1025,"We screened 31 new unrelated patients and families for XLRS1 mutations in addition to previously reported mutations for 60 of our families ( Retinoschisis Consortium , Hum Mol Genet 1998 ; 7 1185 - 1192 ) .",O O O O O O O O O O O O O O O O O O O O O O O B O O O O O O O O O O O O O,32
6220,1448,hCds1 - mediated phosphorylation of BRCA1 regulates the DNA damage response .,O O O O O O O O O O O O,32
8314,8075,"Resolution of the two loci for autosomal dominant aniridia , AN1 and AN2 , to a single locus on chromosome 11p13 .",O O O O O O O O B O O O O O O O O O O O O O,13
1382,7978,Two - point analysis gave a peak lod score at DXS144E with a maximum lod score of 2 .,O O O O O O O O O O O O O O O O O O O,13
6796,6764,"Use of a cryptic 5 splice site in exon 8 , which results in absence or presence of 15 nucleotides specifying a VSGGG peptide motif , and / or use of a cryptic 3 splice site in exon 14 , which leads to a frameshift in the mRNA reading frame , occur as independent stochastic events in all tissues examined .",O O O O O O O O O O O O O O O O O O O O O O O O O O O O O O O O O O O O O O O O O O O O O O O O O O O O O O O O O O O O O,13
221,176,Mutation and haplotype studies of familial Mediterranean fever reveal new ancestral relationships and evidence for a high carrier frequency with reduced penetrance in the Ashkenazi Jewish population .,O O O O O B I I O O O O O O O O O O O O O O O O O O O O,32
3889,4639,The Long - Evans Cinnamon ( LEC ) rat shows similarity to Wilson disease in many clinical and biochemical features .,O O O O O O O O O O O O B I O O O O O O O,32
1109,10534,In this study we describe a three - generation family in which two siblings were affected by Duchenne muscular dystrophy ( DMD ) .,O O O O O O O O O O O O O O O O O B I I O B O O,13
6806,1208,The 4 .,O O O,32
4209,12432,"Both the protein truncation test ( PTT ) and the restriction endonuclease fingerprinting ( REF ) method were used and compared for their detection efficiency , identifying 76 % and 60 % of the mutations , respectively .",O O O O O O O O O O O O O O O O O O O O O O O O O O O O O O O O O O O O O O,39
4800,8137,"Both mutations affect evolutionarily conserved residues , suggesting that they are functionally important , while the polymorphism occurs in a nonconserved domain which is presumably not critical for enzymatic function .",O O O O O O O O O O O O O O O O O O O O O O O O O O O O O O O,13
42,8587,"We developed methods to detect the three mutations in the HEXA gene that occur with high frequency among Ashkenazi Jews two mutations cause infantile Tay - Sachs disease , and the third causes the adult - onset form of the disease .",O O O O O O O O O O O O O O O O O O O O O O O O B I I I O O O O O O O O O O O O O O,13
2831,6629,"Furthermore , the identification of this germline mutation strengthens the correlation between the 5 location of an APC disease - causing mutation and the attenuated polyposis phenotype . .",O O O O O O O O O O O O O O O O O B O O O O O O B I O O O,13
189,3126,Phenylketonuria ( PKU ) is a genetic disorder secondary to a deficiency of hepatic phenylalanine hydroxylase ( PAH ) .,B O B O O O B I O O O B I I I I O O O O,32
5787,452,"Estimates from heterogeneity tests suggest that , within Sweden , as many as 50 % of early - onset families had evidence of linkage to the HPC1 region .",O O O O O O O O O O O O O O O O O O O O O O O O O O O O O,32
9989,676,CONCLUSIONS The reproductive outcome in maternal phenylketonuria is dependent on prenatal metabolic control and postnatal environmental circumstances .,O O O O O B I O O O O O O O O O O O,32
3431,6736,These findings provide evidence that PLS and HMS are allelic variants of cathepsin C gene mutations . .,O O O O O B O B O O O O O O O O O O,13
5739,9156,Familial Prader - Willi syndrome with apparently normal chromosomes .,O B I I I O O O O O,13
5892,10740,"To examine the role of BRCA1 in normal tissue growth and differentiation , and to generate a potential model for the cancer susceptibility associated with loss of BRCA1 function , we have created a mouse line carrying a mutation in one Brca1 allele .",O O O O O O O O O O O O O O O O O O O O O B O O O O O O O O O O O O O O O O O O O O O O,13
3883,6121,Likelihood - based analysis of segregation distortion in the single sperm data using the SPERMSEG program also showed no support for segregation distortion at the gamete level in this patient population .,O O O O O O O O O O O O O O O O O O O O O O O O O O O O O O O O,13
9234,11981,Preliminary in vivo footprinting data gave evidence for protein - DNA contact in normal genes at an Sp1 consensus binding site upstream of the CTG repeat and for a significant reduction of this interaction in cells with a hypermethylated DMPK gene . .,O O O O O O O O O O O O O O O O O O O O O O O O O O O O O O O O O O O O O O O O O O O,39
7408,3684,The mutations creating these alleles act by inactivating copies of a recessive oncogene located within band q14 of chromosome 13 and termed the RB1 locus .,O O O O O O O O O O O O O O O O O O O O O O O O O O,32
9821,501,"The salient exceptions were spleen , thymus , and red blood cells , which had almost equal numbers of cells expressing the wild - type or the recombined allele , implying that GPI - linked proteins are not essential for the derivation of these tissues .",O O O O O O O O O O O O O O O O O O O O O O O O O O O O O O O O O O O O O O O O O O O O O O,32
7679,2234,"Together with a recently identified allele responsible for Hex A pseudodeficiency ( Triggs - Raine et al . Am J Hum Genet , 1992 ) , these two alleles accounted for almost 50 % ( 29 / 64 ) of TSD or carrier alleles ascertained by enzyme screening tests in non - Jewish Caucasians . .",O O O O O O O O O O O O O O O O O O O O O O O O O O O O O O O O O O O O O O O O B O O O O O O O O O O O O O O O,32
2448,11236,"We have determined the genomic organization of CHRNA4 , which consists of six exons distributed over approximately 17 kb of genomic DNA .",O O O O O O O O O O O O O O O O O O O O O O O,13
4100,5932,"METHODS We examined genomic DNA from 83 ( for BRCA1 185delAG ) or 82 ( for BRCA2 6174delT ) Ashkenazi Jewish prostate cancer patients , most of whom were treated at a relatively young age , for the most common germline mutation in each gene seen in the Ashkenazi population .",O O O O O O O O O O O O O O O O O O O O O B I O O O O O O O O O O O O O O O O O O O O O O O O O O O O,13
1519,10619,Recombinant vWF containing the observed amino acid substitution was expressed in COS - 1 cells .,O O O O O O O O O O O O O O O O,13
1761,12615,"In EDMD , the additional absence of lamin B1 from heart and skeletal muscle nuclei which already lack emerin may offer an alternative explanation of why these tissues are particularly affected . .",O B O O O O O O O O O O O O O O O O O O O O O O O O O O O O O O O,39
4492,1613,Our three models carrying different sizes of CTG repeat provide insight on the different factors modulating the CTG repeat instability . .,O O O O O O O O O O O O O O O O O O O O O O,32
8821,11641,"Marker haplotype studies of the C6 and C7 gene region and Southern blots show that the Irish family with the splice defect also segregate for the deletion , which is not easily detected in heterozygotes .",O O O O O O O O O O O O O O O O O O O O O O O O O O O O O O O O O O O O,13
9639,3097,"Thus , use of these PCR - based assays will allow deletion detection and prenatal diagnosis for most DMD / BMD patients in a fraction of the time required for Southern blot analysis . .",O O O O O O O O O O O O O O O O O O B O B O O O O O O O O O O O O O O,32
454,1875,We postulate that altered metabolism of a natural toxin or antigen by the CYP2D6 gene may increase susceptibility to AS .,O O O O O O O O O O O O O O O O O O O B O,32
5639,10865,The most common phenotype of ALD is the cerebral form ( 45 % ) that develops in boys between 5 - 12 yr .,O O O O O B O O O O O O O O O O O O O O O O O O,13
4234,5929,Common mutations in BRCA1 and BRCA2 do not contribute to early prostate cancer in Jewish men .,O O O O O O O O O O O B I O O O O,13
10020,11756,Hereditary deficiency of the fifth component of complement in man .,B I I I I I I I O O O,39
10039,651,"A 50 - year - old man showed progressive muscular atrophy , choreic movement , elevated level of serum creatinine kinase , and acanthocytosis .",O O O O O O O O O B I O B I O O O O O O O O O B O,32
8210,8481,12 ( D11S144 ) .,O O O O O,13
8418,6265,"A boy developed contractures of the Achilles tendons at 3 years and of the postcervical muscles at 7 years , although neither contractures of the elbows nor cardiac abnormality were recognized by the age of 9 years .",O O O B I I I I O O O O O O O O O O O O O O B I I I O B I O O O O O O O O O,13
1098,7316,These studies demonstrate for the first time that a complex ultrastructural cell defect can be corrected both morphologically and functionally by in vivo gene transfer . .,O O O O O O O O O O O O O O O O O O O O O O O O O O O,13
598,5364,Atelosteogenesis type II is caused by mutations in the diastrophic dysplasia sulfate - transporter gene ( DTDST ) : evidence for a phenotypic series involving three chondrodysplasias .,B I I O O O O O O B I O O O O O O O O O O O O O O O B O,32
1001,9237,A 51 / 2 - year - old black girl with recurrent meningococcal meningitis and absence of the sixth component of complement ( C6 ) is reported .,O O O O O O O O O O O O B I O B I I I I I I O O O O O O,13
10072,12114,Identification of three novel mutations and a high frequency of the Arg778Leu mutation in Korean patients with Wilson disease .,O O O O O O O O O O O O O O O O O B I O,39
9157,5607,"The C282Y mutation occurs on a haplotype that extends < / = 6 Mb , suggesting that this mutation has arisen during the past 2 , 000 years .",O O O O O O O O O O O O O O O O O O O O O O O O O O O O O,13
5987,10090,"Causative mutations in the CHM gene were detected in at least 12 families , indicating that a substantial part of the mutations can be identified by this approach .",O O O O B O O O O O O O O O O O O O O O O O O O O O O O O,13
2604,1452,It is not known whether BRCA1 phosphorylation and dispersion and its function in DNA damage response are related .,O O O O O O O O O O O O O O O O O O O,32
6828,10452,Macular dystrophy associated with mutations at codon 172 in the human retinal degeneration slow gene .,B I O O O O O O O O O B I O O O,13
4606,12369,All exon / intron boundaries conform to the GT / AG rule .,O O O O O O O O O O O O O,39
10057,3553,One or more exons were deleted in 60 % of patients .,O O O O O O O O O O O O,32
1418,1584,"Mutations in the human homolog of Foxc1 , FKHL7 , cause dominant anterior segment defects and glaucoma in various families .",O O O O O O O O O O O O B I I O B O O O O,32
779,5525,"Nineteen of the detected mutations were presumed to be novel , thus emphasizing the heterogeneity of the mutational spectrum in Korean FAP patients .",O O O O O O O O O O O O O O O O O O O O O B O O,13
1593,859,We present a child in whom phenylketonuria was apparently caused by homozygosity for the mutation E390G in exon 11 of the phenylalanine hydroxylase ( PAH ) gene .,O O O O O O B O O O O O O O O O O O O O O O O O O O O O,32
9634,9943,The KHK proteins show a high level of sequence conservation relative to rat KHK .,O O O O O O O O O O O O O O O,13
9482,2306,A study was undertaken to characterize the mutation ( s ) responsible for Tay - Sachs disease ( TSD ) in a Cajun population in southwest Louisiana and to identify the origins of these mutations .,O O O O O O O O O O O O O B I I I O B O O O O O O O O O O O O O O O O O,32
2529,9947,Neither mutation was seen in a sample of 52 unrelated control individuals .,O O O O O O O O O O O O O,13
2630,2912,Phenylketonuria ( PKU ) is a metabolic disease caused by recessive mutations of the gene encoding the hepatic enzyme phenylalanine hydroxylase ( PAH ) .,B O B O O O B I O O O O O O O O O O O O O O O O O,32
6925,8985,Sjogren - Larsson syndrome .,B I I I O,13
6426,7718,In 12 patients altered PCR fragments were detected which were studied in detail by direct sequencing .,O O O O O O O O O O O O O O O O O,13
1106,10711,"The evidence for linkage to loci on both 18p and 18q was strongest in the 11 paternal pedigrees , i .",O O O O O O O O O O O O O O O O O O O O O,13
31,6184,Studies at the transcript and protein level are needed for a better assessment . .,O O O O O O O O O O O O O O O,13
9556,8054,Mild developmental delay was noted in three out of six classical cases studied in detail .,O B I O O O O O O O O O O O O O,13
2343,967,"Late - onset familial Mediterranean fever ( FMF ) : a subset with distinct clinical , demographic , and molecular genetic characteristics .",O O O B I I O B O O O O O O O O O O O O O O O,32
462,7977,Further analysis with markers on the long arm of the X chromosome showed evidence of linkage to DXS144E and F9 with no recombination with either of these markers .,O O O O O O O O O O O O O O O O O O O O O O O O O O O O O,13
5528,3645,The other six mutants investigated were all associated with enzyme deficiency .,O O O O O O O O O B I O,32
8781,12193,"As has been reported by others , mutations that lead to exon skipping or premature protein truncation were also predominant in our mutants .",O O O O O O O O O O O O O O O O O O O O O O O O,39
9167,11517,Kniest dysplasia : Dr . W .,B I O O O O O,13
4649,7779,5 - kb mRNA that also is transcribed from the DMD gene .,O O O O O O O O O O B O O,13
7842,10708,The affected - sibpair analyses indicated excess allele sharing for markers on 18p within the region reported previously .,O O O O O O O O O O O O O O O O O O O,13
4852,7898,"The results indicate close linkage between the WAS and OATL1 loci ( Z = 6 . 08 at theta = 0 . 00 ) and localize the TIMP , OATL1 , DXS255 , and WAS loci distal to DXS146 and the OATL1 and WAS loci proximal to TIMP .",O O O O O O O B O O O O O O O O O O O O O O O O O O O O O O O O O O B O O O O O O O O B O O O O O,13
2124,573,"Overall , it accounts for 60 - 70 % of mutant chromosomes , but there are significant differences in its relative frequency in individual populations .",O O O O O O O O O O O O O O O O O O O O O O O O O O,32
7570,4400,"Thus OCRL converts inositol 1 , 4 , 5 - trisphosphate to inositol 1 , 4 - bisphosphate , and it converts inositol 1 , 3 , 4 , 5 - tetrakisphosphate to inositol 1 , 3 , 4 - trisphosphate .",O O O O O O O O O O O O O O O O O O O O O O O O O O O O O O O O O O O O O O O O O O,32
