Unnamed: 0.1,Unnamed: 0,text,labels,txt_len
9432,2307,Eleven of 12 infantile TSD alleles examined in six families had the beta - hexosaminidase A ( Hex A ) alpha - subunit exon 11 insertion mutation that is present in approximately 70 % of Ashkenazi Jewish TSD heterozygotes .,O O O O B O O O O O O O O O O O O O O O O O O O O O O O O O O O O O O O O B O O,32
5651,6301,"Although hereditary TP53 mutation is very rare in different human cancers , it has been frequently reported in Li - Fraumeni syndrome .",O O O O O O O O O O B O O O O O O O B I I I O,13
8463,11612,"These results suggest that even in a referral clinic specializing in screening women from high - risk families , the majority of tests for BRCA1 mutations will be negative and therefore uninformative . .",O O O O O O O O O O O O O O O O O O O O O O O O O O O O O O O O O O,13
9309,4298,Variant SSCP bands were subcloned and sequenced .,O O O O O O O O,32
3996,4128,Polymerase chain reaction amplification of VLCAD mRNA and genomic exons defined the molecular defects in two patients with VLCAD deficiency who presented with unexplained cardiac arrest and cardiomyopathy .,O O O O O O O O O O O O O O O O O O B I O O O O B I O B O,32
6280,587,"To investigate the nature of somatic von Hippel - Lindau ( VHL ) mutations , we analyzed 173 primary sporadic human renal cell carcinomas for mutations of the VHL tumor suppressor gene , using polymerase chain reaction ( PCR ) and single - strand conformational polymorphism analysis ( SSCP ) of DNA .",O O O O O O B I I I O B O O O O O O O O O B I I O O O O B I O O O O O O O O O O O O O O O O O O O O O O O,32
2674,7336,"In this study , we have characterized MAGEL2 ( also known as NDNL1 ) , a gene with 51 % amino acid sequence similarity to necdin and located 41 kb distal to NDN in the PWS deletion region .",O O O O O O O O O O O O O O O O O O O O O O O O O O O O O O O O O O O B O O O,13
7642,1175,Van der Woude syndrome ( VWS ) is an autosomal dominant craniofacial disorder with high penetrance and variable expression .,B I I I O B O O O B I I I O O O O O O O,32
1831,797,We therefore hypothesized that A - T is due to oxidative damage resulting from loss of function of the A - T gene product .,O O O O B I I O O O O O O O O O O O O B I I O O O,32
7811,11177,"Thus , it appears that severe G6PD deficiency affects adversely the proliferation or the survival of nucleated blood cells and that this phenotypic characteristic is critical during hematopoiesis . .",O O O O O O B I O O O O O O O O O O O O O O O O O O O O O O,13
1821,11514,Thus the most common polymorphisms of the BRCA1 gene do not make a significant contribution to breast or ovarian cancer risk .,O O O O O O O O O O O O O O O O B I I I O O,13
9163,1389,"Deletions and other abnormalities of human chromosome 15q11 - q13 are associated with two developmental disorders , Prader - Willi syndrome ( PWS ) and Angelman syndrome ( AS ) .",O O O O O O O O O O O O O O O O O B I I I O B O O B I O B O O,32
2695,11154,An animal model for Norrie disease ( ND ) : gene targeting of the mouse ND gene .,O O O O B I O B O O O O O O O B O O,13
9727,2104,"Heterozygotes for the gene for A - T are thought to comprise about 1 % of the general population and , therefore , it is important to know whether this gene also predisposes the heterozygous carrier to cancers .",O O O O O B I I O O O O O O O O O O O O O O O O O O O O O O O O O O O O O B O,32
7074,4290,The other 6 .,O O O O,32
9282,10527,Detection of a novel arginine vasopressin defect by dideoxy fingerprinting .,O O O O O O O O O O O,13
1420,7612,Mutations at the phenylalanine hydroxylase ( PAH ) locus are the major cause of hyperphenylalaninemia .,O O O O O O O O O O O O O O B O,13
4497,4353,"MRI lesions were associated with impaired psychometric performance , but MRI and molecular findings were only weakly related .",O O O O O O O O O O O O O O O O O O O,32
10119,6092,"This heritable - deletion mouse model will be particularly useful for the identification of the etiological genes and mechanisms , phenotypic basis , and investigation of therapeutic approaches for PWS . .",O O O O O O O O O O O O O O O O O O O O O O O O O O O O O B O O,13
8596,4593,A total of eight putative disease - causing alterations were identified four of these are frameshifts and two are nonsense mutations .,O O O O O O O O O O O O O O O O O O O O O O,32
8347,10836,Type II human complement C2 deficiency .,B I I I I I O,13
8739,9371,"The results of segregation analyses in 75 families where the proband had ankylosing spondylitis , are presented .",O O O O O O O O O O O O B I O O O O,13
8773,11384,Identification of a RING protein that can interact in vivo with the BRCA1 gene product .,O O O O O O O O O O O O O O O O,13
120,12533,Diagnosis of hemochromatosis .,O O B O,39
6562,166,"N . , Irrinki , A . , Feder , J . N . , and Enns , C . A . ( 1998 ) J . Biol . Chem . 273 , 22068 - 22074 ; Feder , J . N . , Penny , D . M . , Irrinki , A . , Lee , V . K . , Lebron , J . A . , Watson , N . , Tsuchihashi , Z . , Sigal , E . , Bjorkman , P . J . , and Schatzman , R . C . ( 1998 ) Proc . Natl .",O O O O O O O O O O O O O O O O O O O O O O O O O O O O O O O O O O O O O O O O O O O O O O O O O O O O O O O O O O O O O O O O O O O O O O O O O O O O O O O O O O O O O O O O O O O O O O O O O O O O O O O O O O,32
1224,3135,"Abnormal color vision has been observed in 12 of 27 patients with adrenomyeloneuropathy ( AMN ) , a milder form of ALD .",B I I O O O O O O O O O B O B O O O O O O B O,32
6751,4431,The first known human kindred with hereditary deficiency of the fifth component of complement ( C5 ) was documented in the accompanying report .,O O O O O O B I I I I I I I O O O O O O O O O O,32
6863,529,"BACKGROUND Families with a high incidence of hereditary breast cancer , and subsequently shown to have terminating mutations in BRCA1 or BRCA2 , appear to have a higher incidence of prostate cancer among male relatives .",O O O O O O O B I I O O O O O O O O O O O O O O O O O O O O B I O O O O,32
2125,11652,"On all D - 2 alleles N314D occurred in cis with two intronic sequence changes , on the D - 1 alleles in cis with a neutral mutation in exon 7 .",O O O O O O O O O O O O O O O O O O O O O O O O O O O O O O O O,13
1482,3730,The mapping of a cDNA from the human X - linked Duchenne muscular dystrophy gene to the mouse X chromosome .,O O O O O O O O B I I I I I O O O O O O O,32
4147,5876,Functional consequences of mutations in the early growth response 2 gene ( EGR2 ) correlate with severity of human myelinopathies .,O O O O O O O O O O O O O O O O O O O B O,13
6657,5586,"Nevertheless , E148Q helps account for recessive inheritance in an Ashkenazi family previously reported as an unusual case of dominantly inherited FMF .",O O O O O O O O O O O O O O O O O O O O O B O,13
2602,12349,Cloning of a novel member of the low - density lipoprotein receptor family .,O O O O O O O O O O O O O O,39
1425,3760,The implications of this unusual familial occurrence for our understanding of PWS are discussed . .,O O O O O O O O O O O B O O O O,32
3563,6738,Approximately 0 .,O O O,13
5101,7923,"In the present study , we report the results of clinical , cytogenetic , and molecular studies of 14 patients with DGS .",O O O O O O O O O O O O O O O O O O O O O B O,13
4364,7857,"In addition to close linkage between HL - A and C2 deficiency , both parents were heterozygous for Bf ( HL - A linked , electrophoretic variation of B ) .",O O O O O O O O O O B I O O O O O O O O O O O O O O O O O O O,13
5295,7996,New variant in exon 3 of the proteolipid protein ( PLP ) gene in a family with Pelizaeus - Merzbacher disease .,O O O O O O O O O O O O O O O O O B I I I O,13
5119,2555,We describe a particularly instructive case which raises important issues concerning the mechanisms producing uniparental disomy and whose evaluation provides evidence that trisomy may precede uniparental disomy in a fetus .,O O O O O O O O O O O O O O B I O O O O O O O O O B I O O O O,32
473,1646,"We have undertaken a hospital - based study , to identify possible BRCA1 and BRCA2 founder mutations in the Polish population .",O O O O O O O O O O O O O O O O O O O O O O,32
804,1300,X - linked retinoschisis with point mutations in the XLRS1 gene .,B I I I O O O O O O O O,32
9437,2263,Cloning of the Huntington disease region in yeast artificial chromosomes .,O O O B I O O O O O O,32
3799,12139,More than 35 different TWIST mutations are now known in the literature .,O O O O O O O O O O O O O,39
4875,4119,The frequency of the deficiency was increasingly higher in presenile cataracts .,O O O O O O O O O O B O,32
1330,6674,"Both mutations caused an increase in RANK - mediated nuclear factor - kappaB ( NF - kappaB ) signalling in vitro , consistent with the presence of an activating mutation .",O O O O O O O O O O O O O O O O O O O O O O O O O O O O O O O,13
6756,11627,Western blot analysis was not sufficiently sensitive to permit detection of this molecule .,O O O O O O O O O O O O O O,13
8173,11064,We describe two sibs with typical PWS presenting deletion of SNRPN detected by fluorescence in situ hybridization ( FISH ) .,O O O O O O B O O O O O O O O O O O O O O,13
8118,8763,Haemolytic activity of serum was reconstituted with either pooled normal human serum or with purified C7 .,O O O O O O O O O O O O O O O O O,13
164,4554,Two complex alleles have never been demonstrated to coexist in any individual .,O O O O O O O O O O O O O,32
6215,4887,"Second , affected members of a family with dominantly inherited anterior segment malformations , including Peters anomaly are heterozygous for an R26G mutation in the PAX6 paired box .",O O O O O O O O O O B I I O O B I O O O O O O O O O O O O,32
2127,9529,Polymerase chain reaction amplification of VLCAD mRNA and genomic exons defined the molecular defects in two patients with VLCAD deficiency who presented with unexplained cardiac arrest and cardiomyopathy .,O O O O O O O O O O O O O O O O O O B I O O O O B I O B O,13
10110,6559,Four single - nucleotide polymorphisms ( SNPs ) were found in the FALDH gene .,O O O O O O O O O O O O O O O,13
5371,1726,Our data support the hypothesis that DM is a contiguous gene syndrome associated with the partial loss of both DMPK and SIX5 . .,O O O O O O B O O O O O O O O O O O O O O O O O,32
1787,4367,The propositus was an isolated case of Duchenne muscular dystrophy with marked dystrophin deficiency in muscle biopsy .,O O O O O O O B I I O O B I O O O O,32
3373,9171,Genetically determined C3 deficiency in Brittany spaniel dogs shares a number of biochemical and clinical characteristics with the human disorder .,O O B I O O O O O O O O O O O O O O O O O,13
1883,7183,"In contrast , mild mutations were mostly located on the surface of the GALNS protein .",O O O O O O O O O O O O O O O O,13
8912,7259,"1 , between the microsatellites at D8S270 and D8S514 .",O O O O O O O O O O,13
1772,6136,"For genetic counseling and predictive testing in families with inherited breast - ovarian cancer , penetrances and expressions of the underlying mutations should be known .",O O O O O O O O O B I I I I O O O O O O O O O O O O,13
6924,6732,This mutation segregates with HMS in four nuclear families .,O O O O B O O O O O,13
6110,4402,"The relative ability of OCRL to catalyze the three reactions is different from that of 5 - phosphatase II and from that of another 5 - phosphatase isoenzyme from platelets , 5 - phosphatase I .",O O O O O O O O O O O O O O O O O O O O O O O O O O O O O O O O O O O O,32
4967,4761,"The EWS gene , involved in Ewing family of tumors , malignant melanoma of soft parts and desmoplastic small round cell tumors , codes for an RNA binding protein with novel regulatory domains .",O O O O O O B I I I O B I I I I O B I I I I O O O O O O O O O O O O,32
2334,9964,"The disease is inherited as an autosomal recessive trait and its frequency is estimated to be 1 / 40 , 000 live births .",O O O O O O O O O O O O O O O O O O O O O O O O,13
5067,7166,"Consistent with the tissue specificity of expression , complete sequencing and analysis of upstream regulatory regions of MEFV revealed homology to myeloid - specific promoters and to more broadly expressed inflammatory promoter elements .",O O O O O O O O O O O O O O O O O O O O O O O O O O O O O O O O O O,13
7939,12557,Skin photosensitivity may also be present .,O O O O O O O,39
5444,4253,"No linkage or molecular genetic data are as yet available on myotonia levior characterized by milder symptoms and later onset of myotonia than in Thomsens disease , and absence of muscle hypertrophy .",O O O O O O O O O O O B I O O O O O O O O B O O B I O O O O B I O,32
5323,11192,"Using 3 - RACE analysis of HMGIC fusion transcripts in lipoma cell line Li - 501 / SV40 , ectopic genetic sequences were obtained , which by CASH ( chromosome assignment using somatic cell hybrids ) and FISH ( fluorescence in situ hybridization ) analysis were found to originate from chromosome segment 3q27 - q28 .",O O O O O O O O O O B O O O O O O O O O O O O O O O O O O O O O O O O O O O O O O O O O O O O O O O O O O O O O,13
3103,2056,"We have characterised a novel missense mutation , G5260A , in exon 32 in a family segregating for EA - 2 .",O O O O O O O O O O O O O O O O O O B I I O,32
1139,8430,"It showed , furthermore , that phenotypic differences between ALD and AMN are not necessarily the consequence of allelic heterogeneity due to different mutations within the same gene .",O O O O O O O O O B O B O O O O O O O O O O O O O O O O O,13
3143,6040,"The gene for ataxia - telangiectasia , ATM , spans about 150 kb of genomic DNA .",O O O B I I O O O O O O O O O O O,13
3378,5370,The severity of the phenotype appears to be correlated with the predicted effect of the mutations on the residual activity of the DTDST protein . .,O O O O O O O O O O O O O O O O O O O O O O O O O O,32
5703,4740,"An abbreviated Wechsler Adult Intelligence Scale Revised ( WAIS - R ) was used to assess verbal and arithmetical cognitive performance in 55 subjects with myotonic dystrophy ( DM ) , covering all grades of disease severity , and 31 controls at 50 % risk of inheriting DM .",O O O O O O O O O O O O O O O O O O O O O O O O O B I O B O O O O O O O O O O O O O O O O O O B O,32
1428,1485,We now provide strong evidence of a second FRDA locus .,O O O O O O O O B O O,32
9045,11167,"Using the RCAS retroviral vector , we have introduced the PAX3 - FKHR gene into chicken embryo fibroblasts .",O O O O O O O O O O O O O O O O O O O,13
6258,9152,Conservation of the Duchenne muscular dystrophy gene in mice and humans .,O O O B I I O O O O O O,13
8503,12486,This study reports on six cases of deficiency in the human complement regulatory protein Factor H ( FH ) in the context of an acute renal disease .,O O O O O O O B I I I I I I I I O O O O O O O O B I I O,39
1909,5516,GCH1 mutation in a patient with adult - onset oromandibular dystonia .,O O O O O O O O O B I O,13
6668,8813,Previously demonstrated close linkage with locus DXYS1 was confirmed ( lod 11 . 44 at 0 recombination distance ) .,O O O O O O O O O O O O O O O O O O O O,13
650,2564,1 - p22 .,O O O O,32
3364,1085,"In this family of disorders , a normally polymorphic CAG repeat becomes expanded , resulting in expression of an expanded polyglutamine domain in the disease gene product .",O O O O O O O O O O O O O O O O O O O O O O O O O O O O,32
6967,3671,"Recombinant virus was detected in the culture medium of the transfected psi 2 cells , which is capable of transmitting the human PAH gene into mouse NIH 3T3 cells by infection leading to stable incorporation of the recombinant provirus .",O O O O O O O O O O O O O O O O O O O O O O O O O O O O O O O O O O O O O O O O,32
9269,1802,"2 domain , in which most FMF - associated mutations have been found in human MEFV .",O O O O O O B O O O O O O O O O O,32
788,3633,The activity alteration was detected in blood but can also be observed in other tissue extracts .,O O O O O O O O O O O O O O O O O,32
8038,4188,"One novel missense mutation was an G - to - A transition in exon 8 , resulting in the substitution of arginine by histidine at the codon 231 ( R231H ) .",O O O O O O O O O O O O O O O O O O O O O O O O O O O O O O O O,32
7557,4726,"Three point mutations - - 693C - - > A , 854A - - > C , and 914C - - > A - - were identified in the coding sequence .",O O O O O O O O O O O O O O O O O O O O O O O O O O O O O O O O,32
7335,3970,"The results of segregation analyses in 75 families where the proband had ankylosing spondylitis , are presented .",O O O O O O O O O O O O B I O O O O,32
4189,5947,"Hereditary progressive dystonia with marked diurnal fluctuation ( HPD ; dopa - responsive dystonia , DRD ) have been recently found to be caused by a genetic defect in the GTP cyclohydrolase I ( GCH1 ) gene .",B I I O O O O O B O B I I I O B O O O O O O O O O O B I O O O O O O O O O O,13
7700,9018,We report four children with hepatoblastoma from four unrelated families with Gardner syndrome ( GS ) .,O O O O O B O O O O O B I O B O O,13
7653,7307,Restoration of photoreceptor ultrastructure and function in retinal degeneration slow mice by gene therapy .,O O O O O O O B I O O O O O O,13
6360,4873,Germline mutation in APC at 5q21 - 22 results in the dominantly inherited syndrome adenomatous polyposis coli ( APC ) .,O O O O O O O O O O O O O O B I I O B O O,32
9406,2066,Histidinemia .,B O,32
6287,6877,"To investigate a possible physiological role for emerin , we examined the ultrastructural localization of the protein in human skeletal muscle and HeLa cells , using ultrathin cryosections .",O O O O O O O O O O O O O O O O O O O O O O O O O O O O O,13
6575,6624,"Mutations located at the extreme 5 end of the APC gene , however , are associated with a less severe disease known as attenuated adenomatous polyposis coli ( AAPC ) .",O O O O O O O O O B O O O O O O O O O O O O O B I I I O B O O,13
8046,2313,Mutations in the candidate gene for Norrie disease .,O O O O O O B I O,32
6942,11257,"In addition , ATM - / - mouse thymocytes are more resistant to apoptosis induced by gamma - irradiation than normal thymocytes .",O O O O O O O O O O O O O O O O O O O O O O O,13
5702,4621,"The BRCA1 region is also subject to allelic loss in sporadic breast and ovarian cancers , an indication that BRCA1 mutations may occur somatically in these tumors .",O O O O O O O O O O B I I I I O O O O O O O O O O O B O,32
6160,9048,"Single point mutations were also found in G6PD Metaponto ( Southern Italy ) and in G6PD Ilesha ( Nigeria ) , which are asymptomatic , and in G6PD Chatham , which was observed in an Indian boy with neonatal jaundice .",O O O O O O O O O O O O O O O O O O O O O O O O O O O O O O O O O O O O O O B I O,13
7269,10706,"We have studied 28 nuclear families selected for apparent unilineal transmission of the BPAD phenotype , by using 31 polymorphic markers spanning chromosome 18 .",O O O O O O O O O O O O O B O O O O O O O O O O O,13
1663,5513,CONCLUSIONS Lorenzos oil therapy had no effect on patients with evidence of inflammatory brain lesions .,O O O O O O O O O O O O B I I O,13
3339,5203,"Employing polymerase chain reaction ( PCR ) , single strand conformation polymorphism ( SSCP ) analysis , and direct DNA sequencing , different mutations have been identified in 6 patients .",O O O O O O O O O O O O O O O O O O O O O O O O O O O O O O O,32
8636,8434,This made a prenatal or presymptomatic diagnosis and heterozygote detection by DNA analysis with this marker reliable .,O O O O O O O O O O O O O O O O O O,13
410,9269,One boy with G6PD Ube was Korean,O O O O O O O,13
2370,9102,This approach now allows HPRT mutation detection in 50 percent of the cases of Lesch - Nyhan syndrome .,O O O O O O O O O O O O O O B I I I O,13
9962,5989,We detected abnormal SSCP pattern in 73 samples .,O O O O O O O O O,13
4063,11040,"Thus , at least five different eye phenotypes are associated with changes in PAX6 expression .",O O O O O O O O O O O O O O O O,13
6495,9126,Phenotype heterogeneity among hemizygotes in a family biochemically screened for adrenoleukodystrophy .,O O O O O O O O O O B O,13
5288,1076,A total of 31 homozygous deletions and 36 point alterations were identified .,O O O O O O O O O O O O O,32
6297,9728,"The mutation , an arginine - to - cysteine exchange at residue 24 , was part of the CDK4 peptide recognized by CTLs and prevented binding of the CDK4 inhibitor p16INK4a , but not of p21 or of p27KIP1 .",O O O O O O O O O O O O O O O O O O O O O O O O O O O O O O O O O O O O O O O O,13
1627,4513,"The SCA3 candidate region has now been refined by linkage analysis with four new microsatellite markers ( D14S256 , D14S291 , D14S280 , and AFM343vf1 ) in the same two families , in which 19 additional individuals were genotyped , and in a third French family .",O O O O O O O O O O O O O O O O O O O O O O O O O O O O O O O O O O O O O O O O O O O O O O O,32
3696,4988,"Ophthalmic examinations in all five boys had normal findings , yet an abnormal negative ERG was recorded for each subject .",O O O O O O O O O O O O O O O O O O O O O,32
1137,11179,"Meiotic drive at the myotonic dystrophy ( DM ) locus has recently been suggested as being responsible for maintaining the frequency , in the human population , of DM chromosomes capable of expansion to the disease state .",O O O O B I O B O O O O O O O O O O O O O O O O O O O O B O O O O O O O O O,13
9625,7525,The patients parents were remotely related .,O O O O O O O,13
4341,10336,Recombinations in individuals homozygous by descent localize the Friedreich ataxia locus in a cloned 450 - kb interval .,O O O O O O O O B I O O O O O O O O O,13
5912,5658,"Most colon cancers arise from mutations in the gene encoding adenomatous polyposis coli ( APC ) , a protein required for ubiquitin - mediated degradation of beta - catenin , but a small percentage of colon and some other cancers harbour beta - catenin - stabilizing mutations .",O B I O O O O O O O B I I O B O O O O O O O O O O O O O O O O O O O O B I I I I O O O O O O O O,13
2185,10039,The LEC rat has a deletion in the copper transporting ATPase gene homologous to the Wilson disease gene .,O O O O O O O O O O O O O O O B I O O,13
4861,2331,"In neuroblastoma , higher levels of p19 / nm23 , which are associated with amplification of the N - myc oncogene , large tumor mass , and metastasis , were observed in advanced stage tumors compared with limited stage disease .",O B O O O O O O O O O O O O O O O O O O O O O B O O O O O O O O O O B O O O O O O,32
2658,4811,"Analysis of the ARSA gene in this patient revealed heterozygosity for two new mutant alleles in one allele , deletion of C 447 in exon 2 leads to a frameshift and to a premature stop codon at amino acid position 105 ; in the second allele , a G - - > A transition in exon 5 causes a Gly309 - - > Ser substitution .",O O O O O O O O O O O O O O O O O O O O O O O O O O O O O O O O O O O O O O O O O O O O O O O O O O O O O O O O O O O O O O O O O O,32
3916,10586,"Mice containing this allele display all of the hallmarks of human hypobetalipoproteinemia they produce a truncated apoB protein , apoB70 , and have markedly decreased plasma concentrations of apoB , beta - lipoproteins , and total cholesterol .",O O O O O O O O O O O B O O O O O O O O O O O O O O O O O O O O O O O O O O,13
7340,8495,We describe oligonucleotide primer sequences that can be used to amplify eight exons plus the muscle promoter of the dystrophin gene in a single multiplex polymerase chain reaction ( PCR ) .,O O O O O O O O O O O O O O O O O O O O O O O O O O O O O O O O,13
3047,3080,12 ( D11S144 ) .,O O O O O,32
2363,10629,Each was negative for CEA .,O O O O O O,13
7334,6270,The dark - adapted electroretinogram ( ERG ) of patients with Duchenne and Becker muscular dystrophy ( DMD / BMD ) shows a marked reduction in b - wave amplitude .,O O O O O O O O O O O B I I I I O B O B O O O O O O O O O O O,13
6432,10465,The hemochromatosis gene ( HFE ) maps to 6p21 .,O B O O O O O O O O,13
2346,12314,"In patients 2 and 3 , the autopsy findings showed massive demyelination of the cerebral white matter with sparing of the U - fibers , compatible with the findings of childhood ALD .",O O O O O O O O O O O B I I I I I O O O O O O O O O O O O O O B O,39
762,2164,Together these data define the obligate region containing the NDP gene to a chromosomal segment less than 150 kb .,O O O O O O O O O O O O O O O O O O O O,32
6203,10802,BRCA1 is secreted and exhibits properties of a granin .,O O O O O O O O O O,13
6833,8247,"We have previously reported a patient with this disease , who had normal apoB - 48 but no apoB - 100 .",O O O O O O O O O O O O O O O O O O O O O O,13
7500,1497,Linkage analysis of the data from 12 microsatellite markers surrounding the Xp21 .,O O O O O O O O O O O O O,32
3438,1581,"Anterior segment developmental disorders , including Axenfeld - Rieger anomaly ( ARA ) , variably associate with harmfully elevated intraocular pressure ( IOP ) , which causes glaucoma .",B I I I O O B I I I O B O O O O O O O O O O O O O O O B O,32
3057,8148,"Denys - Drash syndrome is a rare human condition in which severe urogenital aberrations result in renal failure , pseudohermaphroditism , and Wilms tumor ( nephroblastoma ) .",B I I I O O O O O O O O B I O O B I O B O O B I O B O O,13
9527,2875,"The amplified products were analyzed , by electrophoresis in nondenaturing polyacrylamide gels , for the presence of either heteroduplexes , derived from the annealing of normal and mutant DNA strands , or single - strand conformational polymorphisms ( SSCP ) , derived from the renaturation of single - stranded DNA .",O O O O O O O O O O O O O O O O O O O O O O O O O O O O O O O O O O O O O O O O O O O O O O O O O O O,32
