Unnamed: 0.1,Unnamed: 0,text,labels,txt_len
5278,1088,"The monoclonal antibody 1C2 is known preferentially to bind expanded polyglutamine , but we find that it also binds a fragment of ataxin - 3 containing a normal glutamine repeat .",O O O O O O O O O O O O O O O O O O O O O O O O O O O O O O O,32
6510,2616,Six additional pseudodeficient subjects were found to have the C739 - to - T mutation .,O O O O O O O O O O O O O O O O,32
5581,4597,Confirmation of BRCA1 by analysis of germline mutations linked to breast and ovarian cancer in ten families .,O O O O O O O O O O B I I I O O O O,32
8082,8465,The plasma cholesteryl - ester transfer protein ( CETP ) catalyzes the transfer of cholesteryl esters from high - density lipoprotein ( HDL ) to other lipoproteins .,O O O O O O O O O O O O O O O O O O O O O O O O O O O O,13
1550,6603,Papillon - Lefevre syndrome ( PLS ) is an autosomal recessive disorder characterised by palmoplantar hyperkeratosis and severe early onset periodontitis that results in the premature loss of the primary and secondary dentitions .,B I I I O B O O O B I I O O B I O O O O B O O O O O O O O O O O O O,13
191,11389,Detection of heterozygous mutations in BRCA1 using high density oligonucleotide arrays and two - colour fluorescence analysis .,O O O O O O O O O O O O O O O O O O,13
3453,11654,Isolation of full - length ATM cDNA and correction of the ataxia - telangiectasia cellular phenotype .,O O O O O O O O O O O B I I O O O,13
8731,7992,A family with inherited deficiency of complement factor 2 ( C2 ) is described in which two family members with homozygous C2 deficiency developed cutaneous vasculitis and sicca syndrome .,O O O B I I I I I O O O O O O O O O O O O B I O B I O B I O,13
4503,5526,"In the initial 48 patients , SSCP analysis was followed by PTT for those patients for whom no detectable mutations were found by SSCP .",O O O O O O O O O O O O O O O O O O O O O O O O O,13
3447,544,"Genes Chromosomes Cancer 25 399 - 402 , 1999 . .",O O O O O O O O O O O,32
250,2411,"1 % ( 1 of 94 ) was G to T mutation at nt 392 , and 1 .",O O O O O O O O O O O O O O O O O O O,32
6427,4140,"Analysis of 80 interspecific backcross offspring was used to position Atp7b close to D8Mit3 and another ATPase locus , Atp4b , on mouse chromosome 8 .",O O O O O O O O O O O O O O O O O O O O O O O O O O,32
1004,9803,"The relative ability of OCRL to catalyze the three reactions is different from that of 5 - phosphatase II and from that of another 5 - phosphatase isoenzyme from platelets , 5 - phosphatase I .",O O O O O O O O O O O O O O O O O O O O O O O O O O O O O O O O O O O O,13
2178,856,Large heterozygous deletion masquerading as homozygous missense mutation : a pitfall in diagnostic mutation analysis .,O O O O O O O O O O O O O O O O,32
1995,6413,This is the first report of diagnosis of maternal UPD ( 14 ) based on clinical features .,O O O O O O O O O B O O O O O O O O,13
6527,5720,"These analyses also demonstrated that the nucleotide substitutions in HGO do not involve CpG dinucleotides , which illustrates important differences between HGO and other genes for the occurrence of mutation at specific short - sequence motifs .",O O O O O O O O O O O O O O O O O O O O O O O O O O O O O O O O O O O O O,13
3181,9521,"In the G6PD - deficient group , the incidence of cortical and total cataracts was also increased .",O O B I I O O O O O B I I I O O O O,13
5194,3798,We have brought together information on 864 affected individuals in 164 families ( including three new pedigrees ) reported in the 137 year period since 1845 when Demarquay first described a family with what was later called van der Woude syndrome ( VWS ) .,O O O O O O O O O O O O O O O O O O O O O O O O O O O O O O O O O O O O O B I I I O B O O,32
2355,12444,"Autosomal recessive Alport syndrome is a progressive hematuric glomerulonephritis characterized by glomerular basement membrane abnormalities and associated with mutations in either the COL4A3 or the COL4A4 gene , which encode the alpha3 and alpha4 type IV collagen chains , respectively .",B I I I O O O B I O O B I I I O O O O O O O O O O O O O O O O O O O O O O O O O O,39
722,8490,No impairment of cellular immunity or immunoglobulin deficiency could be found .,O B I I I O B I O O O O,13
6910,12243,"The observed phenotype matched the predicted phenotype in 79 % of the cases , and in only 5 of 184 patients was the observed phenotype more than one category away from that expected .",O O O O O O O O O O O O O O O O O O O O O O O O O O O O O O O O O O,39
2885,4374,We searched for criteria that could indicate breast cancer families with a high prior probability of being caused by the breast / ovarian cancer susceptibility locus BRCA1 on chromosome 17 .,O O O O O O O B I O O O O O O O O O O O B I I I O O O O O O O,32
1305,10351,We report herein the occurrence of three separate phenotypes within a single family with a novel 3 - base pair deletion of codon 153 or 154 of the peripherin / RDS gene .,O O O O O O O O O O O O O O O O O O O O O O O O O O O O O O O O O,13
3830,3987,The Tay - Sachs disease gene in North American Jewish populations : geographic variations and origin .,O B I I I O O O O O O O O O O O O,32
9030,5544,"J . , Ellis , M .",O O O O O O O,13
3906,2119,"For a person of either sex with HL - A W27 , there appears to be about a 20 per cent chance that ankylosing spondylitis will develop , suggesting a prevalence of 10 to 15 per thousand .",O O O O O O O O O O O O O O O O O O O O O O O B I O O O O O O O O O O O O O,32
690,7660,"The patient has a previously uncharacterized submicroscopic deletion encompassing the CCG repeat , the entire FMR1 gene and about 2 .",O O O O O O O O O O O O O O O O O O O O O,13
8668,2344,48 are lost .,O O O O,32
5347,7376,"Functional analysis showed that 4666insA , a common somatic mutation in APC ( AS9 ) in these tumors , did not inactivate the wild - type APC .",O O O O O O O O O O O O O O O O O B O O O O O O O O O O,13
2940,2658,We report a novel TSD allele in the French - Canadian population associated with the infantile form of the disease .,O O O O B O O O O O O O O O O O O O O O O,32
8588,11120,None of these tumours showed abnormal migration patterns .,O O O B O O O O O,13
4116,9703,A 40 - bp deletion was detected in a patient who developed intra - abdominal carcinomatosis 1 year after prophylactic oophorectomy .,O O O O O O O O O O O O B I I I O O O O O O,13
2470,4722,"It appears , therefore , that SPG2 and PMD are allelic disorders",O O O O O O O O B O B I,32
4411,267,PDS encodes a putative transmembrane protein designated pendrin .,O O O O O O O O O,32
9841,712,Segregation distortion has been reported to occur in a number of the trinucleotide repeat disorders .,O O O O O O O O O O O O B I I O,32
1626,3632,A mouse with X - linked glucose - 6 - phosphate dehydrogenase ( G6PD ) deficiency has been recovered in offspring of 1 - ethyl - 1 - nitrosourea - treated male mice .,O O O B I I I I I I I I I I I I O O O O O O O O O O O O O O O O O O,32
776,4096,One patient showed gradually decreasing renal function beginning after two years of TF therapy .,O O O O O O O O O O O O O O O,32
6818,6847,"Binding of Cdc42 to the GTPase - binding domain causes a dramatic conformational change , resulting in disruption of the hydrophobic core and release of the C terminus , enabling its interaction with the actin regulatory machinery .",O O O O O O O O O O O O O O O O O O O O O O O O O O O O O O O O O O O O O O,13
6336,8916,Both of these cloned segments were described as tightly linked to the locus and were capable of detecting deletions in the DNA of boys affected with DMD .,O O O O O O O O O O O O O O O O O O O O O O O O O O B O,13
6236,5125,"In addition , the frequency at which we have found PAX6 mutations suggests that lesions in PAX6 will account for most cases of aniridia . .",O O O O O O O O O O O O O O O O O O O O O O O B O O,32
230,2400,"Analysis of nine obligate carriers from seven unrelated families showed that four harbor the delta F304 / 305 mutation , two the Arg170 - - - - Gln mutation , and one the Tyr180 - - - - Stop mutation .",O O O O O O O O O O O O O O O O O O O O O O O O O O O O O O O O O O O O O O O O O,32
6945,1765,"Consistent with the tissue specificity of expression , complete sequencing and analysis of upstream regulatory regions of MEFV revealed homology to myeloid - specific promoters and to more broadly expressed inflammatory promoter elements .",O O O O O O O O O O O O O O O O O O O O O O O O O O O O O O O O O O,32
87,6075,Those who were untreated or treated late had lower than average IQ scores for their group of mutation combinations .,O O O O O O O O O O O O O O O O O O O O,13
246,7454,Several different missense mutations have been identified in patients with FHM .,O O O O O O O O O O B O,13
499,494,A somatic mutation in the X linked PIGA gene is responsible for the deficiency of glycosyl phosphatidylinositol ( GPI ) - anchored proteins on blood cells from patients with paroxysmal nocturnal hemoglobinuria .,O O O O O O O O O O O O O B I I I I I I I I I O O O O O O B I I O,32
1279,8701,We have excluded linkage ( zeta less than - 2 at theta less than 0 . 18 ) between the aniridia and the chromosome 2p25 marker D2S1 ( linked to ACP1 ) .,O O O O O O O O O O O O O O O O O O O O B O O O O O O O O O O O O,13
3213,9852,Antibodies to PTS1R inhibit peroxisomal protein - import of PTS1 - containing proteins in a permeabilized CHO cell system .,O O O O O O O O O O O O O O O O O O O O,13
7656,7098,PWS is due to a lack of paternal genetic information at 15q11 - q13 ( ref . 2 ) .,B O O O O O O O O O O O O O O O O O O O,13
4760,5476,Familial gastric cancer is genetically heterogeneous and it is not clear what proportion of gastric cancer susceptibility in non - Maori populations is due to germline CDH1 mutations .,B I I O O O O O O O O O O O B I O O O O O O O O O O O O O,13
4063,11040,"Thus , at least five different eye phenotypes are associated with changes in PAX6 expression .",O O O O O O O O O O O O O O O O,13
7436,8300,"We have previously described a disorder , normotriglyceridemic abetalipoproteinemia , that is characterized by the virtual absence of plasma low density lipoproteins and complete absence of apoB - 100 , but with apparently normal secretion of triglyceride - rich lipoproteins containing apoB - 48 .",O O O O O O O B I O O O O O O O O O O O O O O O O O O O O O O O O O O O O O O O O O O O O,13
5400,11677,"Finally - and in contrast to prior predictions - atm and p53 do not appear to interact in acute radiation toxicity , suggesting a separate atm effector pathway for this DNA damage response and having implications for the prognosis and treatment of human tumours . .",O O O O O O O O O O O O O O O O O O B I I O O O O O O O O O O O O O O O O O O O O O O B O O,13
8393,6336,Frataxin function is still unknown but the knockout of the yeast frataxin homologue gene ( YFH1 ) showed a severe defect of mitochondrial respiration and loss of mtDNA associated with elevated intramitochondrial iron .,O O O O O O O O O O O O O O O O O O O O O O O O O O O O O O O O O O,13
7707,4676,"CDCA treatment at a dose of 300 mg / day reduced serum cholestanol ( 67 . 3 % reduction ) , lathosterol ( 50 . 8 % ) , campesterol ( 61 . 7 % ) and sitosterol ( 12 . 7 % ) .",O O O O O O O O O O O O O O O O O O O O O O O O O O O O O O O O O O O O O O O O O O O O O,32
4420,2509,Common sequence motifs at the rearrangement sites of a constitutional X / autosome translocation and associated deletion .,O O O O O O O O O O O O O O O O O O,32
636,10747,"Defective beta - oxidation of saturated very long chain fatty acids ( VLCFAs ; C22 0 - C26 0 ) in peroxisomes has been shown to lead to an accumulation of VLCFAs in leukoid areas of the central nervous system , peripheral nerves , adrenal gland , and blood .",O O O O O O O O O O O O O O O O O O O O O O O O O O O O O O O O O O O O O O O O O O O O O O O O O O,13
8797,12023,"However , these observations would need to be confirmed by studying a larger number of CD families .",O O O O O O O O O O O O O O O B O O,39
1970,4053,"With a new method we measured the saturated very long chain fatty acids in the plasma of adrenoleukodystrophy ( ALD ) hemizygotes , ALD heterozygotes , and controls .",O O O O O O O O O O O O O O O O O B O B O O O B O O O O O,32
7979,5809,Cytoplasmic vacuolisation was evident in four .,O O O O O O O,13
3589,7317,Mutations in the fibrinogen aalpha gene account for the majority of cases of congenital afibrinogenemia .,O O O O O O O O O O O O O B I O,13
3687,9280,"The patients fibroblasts were even more efficient in the metabolism of 8 - 14C - guanine , which was utilized to the extent of 27 % , over 80 % of which was converted to guanine and adenine nucleotides .",O O O O O O O O O O O O O O O O O O O O O O O O O O O O O O O O O O O O O O O O,13
663,9500,Wiskott - Aldrich syndrome : cellular impairments and their implication for carrier detection .,B I I I O O O O O O O O O O,13
10063,1008,Two years later he was re - examined because we thought his features fitted the PWS - like phenotype associated with maternal UPD ( 14 ) .,O O O O O O O O O O O O O O O B O O O O O O B O O O O,32
7198,4693,In the remaining 11 Danish and Swedish families at least 8 causative mutations were found by PCR - SSCP analysis and direct sequencing .,O O O O O O O O O O O O O O O O O O O O O O O O,32
6115,12047,These estimates were not substantially affected either by changing the assumed penetrance model for BRCA1 or by including or excluding BRCA1 mutation data .,O O O O O O O O O O O O O O O O O O O O O O O O,39
1875,8923,How the resulting alterations in purine metabolism lead to the severe symptoms characteristic of Lesch - Nyhan patients is still not understood .,O O O O O O O O O O O O O O B I I O O O O O O,13
5824,1645,Founder mutations in the BRCA1 gene in Polish families with breast - ovarian cancer .,O O O O O O O O O O B I I I O,32
8408,5454,Genotype and phenotype in patients with dihydropyrimidine dehydrogenase deficiency .,O O O O O O B I I O,13
247,10997,Our results indicate that DMPK may be necessary for the maintenance of skeletal muscle structure and function and suggest that a decrease in DMPK levels may contribute to DM pathology . .,O O O O O O O O O O O O O O O O O O O O O O O O O O O O B O O O,13
1583,6856,We show that hCds1 and BRCA1 interact and co - localize within discrete nuclear foci but separate after gamma irradiation .,O O O O O O O O O O O O O O O O O O O O O,13
7010,121,We adopted both single - strand conformation polymorphism ( SSCP ) analysis and a method of analysis involving the reverse transcription - polymerase chain reaction ( RT - PCR ) followed by a protein truncation test ( PTT ) .,O O O O O O O O O O O O O O O O O O O O O O O O O O O O O O O O O O O O O O O O,32
10089,6514,"Relevance of this model was suggested by verification that three of these genes ( IGFBP5 , HSIX1 , and Slug ) were also expressed in alveolar rhabdomyosarcoma cell lines .",O O O O O O O O O O O O O O O O O O O O O O O O O B I O O O,13
4848,9965,The gene of ARSA has been cloned and up to now eight mutations causing MLD have been reported .,O O O O O O O O O O O O O O B O O O O,13
1926,12371,The genomic structure was determined using DNA from several sources including multiple large - insert libaries and genomic DNA from Finnish CLD patients and controls .,O O O O O O O O O O O O O O O O O O O O O B O O O O,39
1182,10009,"In contrast , the low reproductive fitness of individuals with congenital DM ( the endpoint of genetic anticipation in myotonic dystrophy ) suggests a higher rate of new mutations .",O O O O O O O O O O O B O O O O O O O B I O O O O O O O O O,13
9479,4421,"The enzyme was found to catalyze the major part of mitochondrial palmitoylcoenzyme A dehydrogenation in liver , heart , skeletal muscle , and skin fibroblasts ( 89 - 97 , 86 - 99 , 96 - 99 , and 78 - 87 % , respectively ) .",O O O O O O O O O O O O O O O O O O O O O O O O O O O O O O O O O O O O O O O O O O O O O O O,32
7524,6497,"The phenotype is likely to be a contiguous gene syndrome involving genes which are paternally expressed only , located in the human 15q11 - q13 region .",O O O O O O O B I I O O O O O O O O O O O O O O O O O,13
3081,8794,"The result of the present study and results of previous studies suggest that genes for ornithine transcarbamylase ( OTC ) , DMD , and GK and putative genes responsible for congenital adrenal hypoplasia ( AHC ) and GTD are arranged from telomere to centromere as pter - - GTD - - AHC - - GK - - DMD - - OTC - - cen",O O O O O O O O O O O O O O O O O O O O O B O O O O O O O O B I I O B O O B O O O O O O O O O O O O O O O O O O O O O O O O O O,13
9836,6064,OBJECTIVE To examine the relationship of phenylalanine hydroxylase ( PAH ) genotypes to biochemical phenotype and cognitive development in maternal phenylketonuria ( PKU ) .,O O O O O O O O O O O O O O O O O O O B I O B O O,13
7739,4343,This is the first demonstration of a mutation causing VLCAD deficiency .,O O O O O O O O O B I O,32
878,5407,"Like APC , APC2 regulates the formation of active betacatenin - Tcf complexes , as demonstrated using transient transcriptional activation assays in APC - / - colon carcinoma cells .",O O O O O O O O O O O O O O O O O O O O O O O O O O B I O O,13
10015,61,"Fibroblast growth factor homologous factor 2 ( FHF2 ) : gene structure , expression and mapping to the Borjeson - Forssman - Lehmann syndrome region in Xq26 delineated by a duplication breakpoint in a BFLS - like patient .",O O O O O O O O O O O O O O O O O O B I I I I I O O O O O O O O O O B O O O O,32
604,12300,The control women were enrolled regardless of whether or not they had either mutation .,O O O O O O O O O O O O O O O,39
4219,10314,"Considering conserved synteny , we were able to map the human gene to chromosome 3q in six alkaptonuria pedigrees of Slovak origin . .",O O O O O O O O O O O O O O O O O B O O O O O O,13
951,6123,All of the French patients were heterozygous for this polymorphism .,O O O O O O O O O O O,13
8968,11940,5 h in the presence or absence of 10 microg cycloheximide per ml .,O O O O O O O O O O O O O O,39
8877,11640,"In the other Irish family , exons 7 and 8 failed to amplify and they were shown to be deleted .",O O O O O O O O O O O O O O O O O O O O O,13
2198,12258,We have used single strand conformation polymorphism analysis to study the 27 exons of the RB1 gene in individuals from a family showing mild expression of the retinoblastoma phenotype .,O O O O O O O O O O O O O O O O O O O O O O O O O O O B O O,39
9478,11418,BRCA1 R841W : a strong candidate for a common mutation with moderate phenotype .,O O O O O O O O O O O O O O,13
3887,7550,"The fragile site is not associated with mental retardation , it does not give abnormal results when subjected to Southern analysis with probe pfxa3 which detects the unstable DNA sequence characteristic of fragile X syndrome .",O O O O O O O B I O O O O O O O O O O O O O O O O O O O O O O O B I I O,13
1956,4105,The proportion of the latter progenitors was significantly higher among more primitive progenitors ( those giving rise to later appearing colonies ) .,O O O O O O O O O O O O O O O O O O O O O O O,32
3710,7572,Twelve of the missense mutations apparently result from the methylation and subsequent deamination of highly mutagenic CpG dinucleotides .,O O O O O O O O O O O O O O O O O O O,13
1752,10597,"From these 43 samples , we have identified five different types of nucleotide substitutions in the G6PD gene at cDNA 1388 from G to A ( Arg to His ) ; at cDNA 1376 from G to T ( Arg to Leu ) ; at cDNA 1024 from C to T ( Leu to Phe ) ; at cDNA 392 from G to T ( Gly to Val ) ; at cDNA 95 from A to G ( His to Arg ) .",O O O O O O O O O O O O O O O O O O O O O O O O O O O O O O O O O O O O O O O O O O O O O O O O O O O O O O O O O O O O O O O O O O O O O O O O O O O O O O O O O O O,13
1951,1502,"Indeed , a six - marker haplotype extending over a region of 5 .",O O O O O O O O O O O O O O,32
4851,4525,Breast Cancer Linkage Consortium .,B I O O O,32
7891,8263,"Normal amounts of liver PAH protein are present in homozygous patients , but no catalytic activity can be detected .",O O O O O O O O O O O O O O O O O O O O,13
2533,12143,Mutation analysis of UBE3A in Angelman syndrome patients .,O O O O O B I O O,39
883,7016,"Friedreich ataxia ( FRDA ) , the most common autosomal recessive ataxia , is caused in almost all cases by homozygous intronic expansions resulting in the loss of frataxin , a mitochondrial protein conserved through evolution , and involved in mitochondrial iron homeostasis .",B I O B O O O O O B I I O O O O O O O O O O O O O O O O O O O O O O O O O O O O O O O O,13
5509,2847,"To elucidate the genetic abnormalities in this family , we studied the linkage of apoB gene using three genetic markers .",O O O B I O O O O O O O O O O O O O O O O,32
4684,11164,"PAX3 codes for a transcriptional regulator that controls developmental programs , and FKHR codes for a forkhead - winged helix protein , also a likely transcription factor .",O O O O O O O O O O O O O O O O O O O O O O O O O O O O,13
8649,3490,Segregation analysis of a marker localised Xp21 . 2 - Xp21 . 3 in Duchenne and Becker muscular dystrophy families .,O O O O O O O O O O O O O O B I I I I O O,32
3999,4765,Sequence analysis of this cDNA revealed differential splicing involving two exons encoding 72 amino acids .,O O O O O O O O O O O O O O O O,32
7970,11600,No additional introns were detected in exons 6 and 10 .,O O O O O O O O O O O,13
3870,7771,"Although gastric cancer is the most common cancer in the world , genetic changes during its carcinogenesis are not well understood .",O B I O O O O B O O O O O O O O O O O O O O,13
4896,7570,One splicing mutation results in a 3 amino acid in - frame insertion .,O O O O O O O O O O O O O O,13
3307,12202,"Mutations in the HEXA gene , encoding the alpha - subunit of beta - hexosaminidase A ( Hex A ) , that abolish Hex A enzyme activity cause Tay - Sachs disease ( TSD ) , the fatal infantile form of G ( M2 ) gangliosidosis , Type 1 .",O O O O O O O O O O O O O O O O O O O O O O O O O O O O B I I I O B O O O O B I I I I I I I I I I O,39
5222,4403,"The recombinant OCRL protein hydrolyzes the phospholipid substrate 10 - to 30 - fold better than 5 - phosphatase II , and 5 - phosphatase I does not cleave the lipid at all .",O O O O O O O O O O O O O O O O O O O O O O O O O O O O O O O O O O,32
7094,263,"This percentage of CTNNB1 mutations is greater than in all other human tumours examined thus far , and directly implicates beta - catenin / LEF misregulation as the major cause of hair matrix cell tumorigenesis in humans . .",O O O O O O O O O O O O B O O O O O O O O O O O O O O O O O O O O O O O O O O,32
6469,6973,These observations link ATM and p95 / nbs1 in a common signalling pathway and provide an explanation for phenotypic similarities in these two diseases . .,O O O O O O O O O O O O O O O O O O O O O O O O O O,13
9663,6569,"The PLS locus has been mapped to chromosome 11q14 - q21 ( refs 7 , 8 , 9 ) .",O O O O O O O O O O O O O O O O O O O O,13
1608,10921,Previous investigations by Southern blot hybridization and PCR fragment - length analysis had revealed mutations in 48 patients .,O O O O O O O O O O O O O O O O O O O,13
5653,5991,"Among these mutations , 50 % correspond to new mutations .",O O O O O O O O O O O,13
5326,4812,Transient expression of the mutant Ser309 - ARSA resulted in only 13 % enzyme activity of that observed in cells expressing normal ARSA .,O O O O O O O O O O O O O O O O O O O O O O O O,32
6357,8798,C4d was normal in all patients studied .,O O O O O O O O,13
5152,1962,We found no exon variants .,O O O O O O,32
52,1244,"Pendred syndrome comprises congenital sensorineural hearing loss , thyroid goiter , and positive perchlorate discharge test .",B I O B I I I O B I O O O O O O O,32
4768,7503,Malignant neoplasms in the families of patients with ataxia - telangiectasia .,B I O O O O O O B I I O,13
7753,8871,"Here we used field inversion gel electrophoresis ( FIGE ) to construct a restriction map of approximately 1 , 000 kb of DNA surrounding the RB1 locus and to detect the translocation breakpoints in three retinoblastoma patients .",O O O O O O O O O O O O O O O O O O O O O O O O O O O O O O O O O O O B O O,13
4905,11444,The remaining eight cases ( 89 % ) of male breast cancer with a family history of breast / ovarian cancer in first - degree relatives remain unaccounted for by mutations in either the BRCA1 gene or the BRCA2 gene . .,O O O O O O O O O B I I O O O O O B I I I O O O O O O O O O O O O O O O O O O O O O,13
4500,6076,Females with moderate or mild PKU who were treated early and treated for > 6 years showed IQ scores 10 points above average for their group .,O O O O O B O O O O O O O O O O O O O O O O O O O O O,13
2465,8410,"The distance between APOC2 , CKM and DM ( of the order of 2 million base pairs ) and their known orientation should permit directional chromosome walking and jumping .",O O O O O O O B O O O O O O O O O O O O O O O O O O O O O O,13
5556,156,"C . , Brunke , K .",O O O O O O O,32
8455,2735,"The polymorphism , in contrast , has near normal activity .",O O O O O O O O O O O,32
70,307,"Mutant fibroblasts contain multiple , functional centrosomes , which lead to unequal chromosome segregation , abnormal nuclear division , and aneuploidy .",O O O O O O O O O O O O O O O O O O O O B O,32
8216,10497,An extensive DNA and protein sequence comparison between the human NDP gene and related genes from the database revealed homology with cysteine - rich protein - binding domains of immediate - - early genes implicated in the regulation of cell proliferation .,O O O O O O O O O O B O O O O O O O O O O O O O O O O O O O O O O O O O O O O O O O,13
