Unnamed: 0.1,Unnamed: 0,text,labels,txt_len
8459,10337,"The locus for Friedreich ataxia ( FRDA ) , a severe neurodegenerative disease , is tightly linked to markers D9S5 and D9S15 , and analysis of rare recombination events has suggested the order cen - FRDA - D9S5 - D9S15 - qter .",O O O B I O B O O O O B I O O O O O O O O O O O O O O O O O O O O O O O O O O O O O O,13
4232,7617,"Following the birth of two infants with Tay - Sachs disease ( TSD ) , a non - Jewish , Pennsylvania Dutch kindred was screened for TSD carriers using the biochemical assay .",O O O O O O O B I I I O B O O O O O O O O O O O O O B O O O O O O,13
2060,4745,"The correlation of IQ difference and CTG expansion difference in both the DM parent - child pairs and normal sib - affected sib pairs was poor , indicating that CTG expansion is not a reliable predictor of IQ either in individual persons or families .",O O O O O O O O O O O O B O O O O O O O O O O O O O O O O O O O O O O O O O O O O O O O O,32
456,10788,Emerin deficiency at the nuclear membrane in patients with Emery - Dreifuss muscular dystrophy .,B I O O O O O O O B I I I I O,13
2325,4501,"The cascade was found to proceed asynchronously in the different branches , mainly because of an unequal number of generations with mild disease .",O O O O O O O O O O O O O O O O O O O O O O O O,32
2922,2050,Detection of a novel missense mutation and second recurrent mutation in the CACNA1A gene in individuals with EA - 2 and FHM .,O O O O O O O O O O O O O O O O O B I I O B O,32
10060,124,"Nineteen of the detected mutations were presumed to be novel , thus emphasizing the heterogeneity of the mutational spectrum in Korean FAP patients .",O O O O O O O O O O O O O O O O O O O O O B O O,32
382,2591,A family with inherited deficiency of complement factor 2 ( C2 ) is described in which two family members with homozygous C2 deficiency developed cutaneous vasculitis and sicca syndrome .,O O O B I I I I I O O O O O O O O O O O O B I O B I O B I O,32
8009,675,Females with moderate or mild PKU who were treated early and treated for > 6 years showed IQ scores 10 points above average for their group .,O O O O O B O O O O O O O O O O O O O O O O O O O O O,32
4076,11367,Germline mutations in the adenomatous polyposis coli ( APC ) gene are responsible for most cases of FAP .,O O O O B I I O B O O O O O O O O B O,13
1739,2655,"In contrast to previous reports of this condition , one of our severely affected cases is a male . .",O O O O O O O O O O O O O O O O O O O O,32
2384,10426,Immunoreactive DM - kinase protein of 53 kD is present at low levels in skeletal and cardiac muscle extracts of DM patients and normal controls .,O O O O O O O O O O O O O O O O O O O O B O O O O O,13
9906,4360,"In the patient with the clinical phenotype of AMN , a nonsense mutation in codon 212 , along with a second site mutation at codon 178 , was observed .",O O O O O O O O B O O O O O O O O O O O O O O O O O O O O O,32
8755,9367,Only in one family was there no possibility of useful linkage analysis .,O O O O O O O O O O O O O,13
6968,1153,"Among these patients , 49 different mutations - including 10 deletions , 2 insertions , 22 amino acid substitutions , 3 nonsense mutations , 9 splice - site defects , and 3 complex mutations - were found .",O O O O O O O O O O O O O O O O O O O O O O O O O O O O O O O O O O O O O O,32
1376,12555,Hereditary coproporphyria ( HC ) is an acute hepatic porphyria with autosomal dominant inheritance caused by deficient activity of coproporphyrinogen III oxidase ( CPO ) .,B I O B O O O O B I O O O O O O B I I I I I O O O O,39
3140,9688,"0 kb in the GALNS gene , including some exons .",O O O O O O O O O O O,13
4351,7468,Classical and atypical form in siblings .,O O O O O O O,13
3962,3583,These techniques should prove useful in identifying carriers of severe von Willebrand disease and also in defining patients predictably at risk of developing alloantibodies to vWF .,O O O O O O O O O B I I I O O O O O O O O O O O O O O,32
9903,11487,These findings are consistent with a role for the ATM protein in ensuring the fidelity of DNA repair and cell cycle regulation following genome damage . .,O O O O O O O O O O O O O O O O O O O O O O O O O O O,13
8052,12200,This suggests that these two founder mutations may be predominant among Japanese ATM mutant alleles .,O O O O O O O O O O O O O O O O,39
1042,6821,Our findings give evidence of a gonadal mosaicism in the unaffected mother .,O O O O O O O O O O O O O,13
4736,5102,These findings suggest that the expression of HD is modulated by the normal HD allele or by a closely linked locus . .,O O O O O O O B O O O O O B O O O O O O O O O,32
6488,7567,Mutations in the human phenylalanine hydroxylase gene producing phenylketonuria or hyperphenylalaninemia have now been identified in many patients from various ethnic groups .,O O O O O O O O B O B O O O O O O O O O O O O,13
342,2598,It is concordant with the disease in this family .,O O O O O O O O O O,32
9754,2514,RFLP and Southern analyses indicate that the de novo translocation is a paternal origin and that the fathers X chromosome contains the DNA that is deleted in the derivative X .,O O O O O O O O O O O O O O O O O O O O O O O O O O O O O O O,32
3427,8078,"Linkage analysis between the aniridia phenotype and ACP1 does not support the original linkage results , excluding linkage up to theta = 0 .",O O O O B O O O O O O O O O O O O O O O O O O O,13
9829,12428,"To our knowledge , this is the first report regarding effects on pre - mRNA splicing of a mutation at the - 2 position of a 5 splice site .",O O O O O O O O O O O O O O O O O O O O O O O O O O O O O O,39
5533,9306,A family is described in which three children had homozygous deficiency of C3 and in which both parents and two other children were heterozygous for the C3 null gene .,O O O O O O O O O O B I I O O O O O O O O O O O O O O O O O,13
5591,786,A significant number of these mutations are premature stop codons .,O O O O O O O O O O O,32
2079,4670,"In four D442G homozygotes , mean HDL - C levels ( 86 + / - 26 mg / dl ) were lower than in Int14 A homozygotes ( 158 + / - 35 mg / dl ) , reflecting residual CETP activity in plasma .",O O O O O O O O O O O O O O O O O O O O O O O O O O O O O O O O O O O O O O O O O O O O O,32
6890,2347,Familial direct insertions should be considered as a cause of recurrent microdeletion syndromes .,O O O O O O O O O O O O O O,32
9877,7816,"We compared G6PD activity among different mutations , without discovering significant differences between them .",O O O O O O O O O O O O O O O,13
4466,1660,We identified four novel mutations in three unrelated patients .,O O O O O O O O O O,32
202,6813,"11 ( 1 - LOD support interval . 04 - . 19 ) , compared with HLODs of 0 in the remaining 281 families .",O O O O O O O O O O O O O O O O O O O O O O O O O,13
167,8401,Molecular studies with the DNA probe pML34 confirmed that only a single Prader Willi critical region ( PWCR 15q11 . 2 - q12 ) copy was present .,O O O O O O O O O O O O B I O O O O O O O O O O O O O O,13
8071,246,"The remaining 26 patients were identified as having 21 independent mutations , including 12 novel mutations resulting in small nucleotide alterations in the ALD gene .",O O O O O O O O O O O O O O O O O O O O O O O B O O,32
7373,1504,"Resequencing of the GK gene in family members led to the discovery of a N288D missense mutation in exon 10 , which resulted in the substitution of a highly conserved asparagine residue by a negatively charged aspartic acid .",O O O O O O O O O O O O O O O O O O O O O O O O O O O O O O O O O O O O O O O,32
2937,4205,These results support the theory that human aniridia is caused by haploinsufficiency of PAX6 . .,O O O O O O O B O O O B I I O O,32
6737,2728,"To determine the molecular basis of type I C2 deficiency , the C2 gene and cDNA were characterized from a homozygous type I C2 - deficient individual with the common associated haplotype / complotype .",O O O O O O B I I I O O O O O O O O O O O B I I I I O O O O O O O O O,32
6470,12097,All tested Ashkenazi mutation carriers share the same allelic pattern at the BRCA1 locus .,O O O O O O O O O O O O O O O,39
5490,313,These data suggest that intracytoplasmic CD95 mutations in ALPS impair apoptosis chiefly by disrupting death - domain interactions with the signaling protein FADD / MORT1 . .,O O O O O O O O B O O O O O O O O O O O O O O O O O O,32
9480,11983,We recently reported the positional cloning of a candidate gene for hereditary hemochromatosis called HFE .,O O O O O O O O O O O B I O O O,39
1538,9553,Terminal complement component deficiency predisposes to meningococcal infection and is inherited in an autosomal co - dominant manner .,B I I I O O B I O O O O O O O O O O O,13
5733,2724,A 28 - base pair gene deletion causes skipping of exon 6 during RNA splicing .,O O O O O O O O O O O O O O O O,32
1731,1206,"The CTSC message is expressed at high levels in a variety of immune cells including polymorphonuclear leucocytes , macrophages , and their precursors .",O O O O O O O O O O O O O O O O O O O O O O O O,32
3884,8677,69 at theta = 0 .,O O O O O O,13
2555,4061,057 + / - 0 .,O O O O O O,32
2996,11827,A novel common missense mutation G301C in the N - acetylgalactosamine - 6 - sulfate sulfatase gene in mucopolysaccharidosis IVA .,O O O O O O O O O O O O O O O O O O B I O,39
6169,2054,At least two of these mutations have been identified on two different chromosome 19p13 haplotypes and thus represent recurrent mutations .,O O O O O O O O O O O O O O O O O O O O O,32
3119,1394,Seven new paternally expressed transcripts localize to an approximately 1 .,O O O O O O O O O O O,32
1535,487,"All published mutations affect the signal peptide or the neurophysin - II carrier protein and are presumed to interfere with processing of the preprohormone , leading to neuronal damage .",O O O O O O O O O O O O O O O O O O O O O O O O O O O B I O,32
9783,9375,"Such known factors are HLA B27 associated disease susceptibility , susceptibility to psoriatic arthropathy and susceptibility to entero - arthropathy .",O O O O O O O O O O O O B I O O O B I I O,13
7041,4601,One missense mutation ( which occurred independently in two families ) leads to loss of a cysteine in the zinc binding domain .,O O O O O O O O O O O O O O O O O O O O O O O,32
441,7272,Homozygosity for poor metabolizer alleles was found to be associated with AS .,O O O O O O O O O O O B O,13
3743,1010,DNA analysis showed maternal heterodisomy for chromosome 14 .,O O O B I O O O O,32
6091,9207,"However , there is an excess of less severely affected individuals among transmitters and a deficiency of more severely affected , brought about by a proband bias and differential fecundity .",O O O O O O O O O O O O O O O O O O O O O O O O O O O O O O O,13
2086,4314,"A mathematical model incorporating the measured selective advantage against malaria suggests that a counterbalancing selective disadvantage , associated with this enzyme deficiency , has retarded its rise in frequency in malaria - endemic regions .",O O O O O O O O O B O O O O O O O O O O B I O O O O O O O O B O O O O,32
8844,11789,"Here we show that the steady - state levels of BARD1 , unlike those of BRCA1 , remain relatively constant during cell cycle progression .",O O O O O O O O O O O O O O O O O O O O O O O O O,39
3549,9000,These studies show that this female has transmitted three distinct types of X chromosome to her offspring .,O O O O O O O O O O O O O O O O O O,13
6288,11689,"Mutations have been found throughout the gene ; however , these genetic alterations do not appear to be homogeneously distributed .",O O O O O O O O O O O O O O O O O O O O O,13
945,2235,Aberrant splicing of the CHM gene is a significant cause of choroideremia .,O O O O B O O O O O O B O,32
6724,9210,45 % ; that of transmitting lower lip pits is 23 .,O O O O O O O B I O O O,13
4937,7080,"In this case , PWS does not become evident as long as the deletion is passed through the matrilineal line .",O O O O B O O O O O O O O O O O O O O O O,13
9065,3933,ALD is characterized by abnormally high plasma levels of very long chain fatty acids ( VLCFA ) as a result of impaired capacity to degrade them .,B O O O O O O O O O O O O O O O O O O O O O O O O O O,32
5891,512,"Interestingly , although liver iron stores are greatly increased , splenic iron is decreased .",O O O O O O O O O O O O O O O,32
2383,9694,This is the first documentation of a common double deletion a gene that is not a member of a gene cluster .,O O O O O O O O O O O O O O O O O O O O O O,13
8579,817,Molecular analysis may be of particular value in such atypical cases . .,O O O O O O O O O O O O O,32
3979,8921,A potential animal model for Lesch - Nyhan syndrome through introduction of HPRT mutations into mice .,O O O O O B I I I O O O O O O O O,13
7807,2206,These mutations segregated with mutant haplotype 12 alleles in nuclear families but were not present on normal or other mutant alleles .,O O O O O O O O O O O O O O O O O O O O O O,32
6740,7390,"Each multimer consists of approximately 60 subunits and can sequester > 3 , 000 atoms of iron .",O O O O O O O O O O O O O O O O O O,13
5068,8389,Glucose / galactose malabsorption caused by a defect in the Na + / glucose cotransporter .,B I I I O O O O O O O O O O O O,13
9565,10994,"Dmpk - / - mice develop a late - onset , progressive skeletal myopathy that shares some pathological features with DM .",O O O O O O O O O O O B I I O O O O O O B O,13
1348,5614,"We have retrospectively analyzed 837 random anonymized dried blood spot ( DBS ) samples from neonatal screening programs in Scandinavia for mutations in HFE , the candidate gene for hemochromatosis .",O O O O O O O O O O O O O O O O O O O O O O O O O O O O O B O,13
8002,435,"This method , also called "" antibody test , "" uses monoclonal antibodies against the FMR1 gene product ( FMRP ) and is based on absence of FMRP in patients cells .",O O O O O O O O O O O O O O O O O O O O O O O O O O O O O O O O,32
5723,1590,"Despite the abnormalities in ocular drainage structures in Foxc1 ( + / - ) mice , IOP was normal in almost all mice analyzed , on all genetic backgrounds and at all ages .",O O O O O O O O O O O O O O O O O O O O O O O O O O O O O O O O O O,32
9968,648,Defining polymorphic sites as well as mutations in the ATM gene will be of great importance in designing automated methods for detecting mutations . .,O O O O O O O O O O O O O O O O O O O O O O O O O,32
1079,11740,Constitutional RB1 - gene mutations in patients with isolated unilateral retinoblastoma .,O O O O O O O O O B I O,39
6570,699,"The innermost four markers were found to be tightly linked to one another , with no evidence for recombination .",O O O O O O O O O O O O O O O O O O O O,32
9976,12386,This mans leucocyte DNA showed one normal allele and one allele of approximately 100 repeats .,O O O O O O O O O O O O O O O O,39
2611,6962,"To evaluate the role of the HMG I - C component , the three DNA - binding domains of HMG I - C have now been expressed in transgenic mice .",O O O O O O O O O O O O O O O O O O O O O O O O O O O O O O O,13
2038,6831,We discuss these findings in the context of the hypothesis that abnormal development of Purkinje cells and lymphocytes contributes to the pathogenesis of A - T . .,O O O O O O O O O O O O O O O O O O O O O O O B I I O O,13
4489,984,"We conclude that the onset of FMF in a late age defines a milder form of disease with typical clinical , demographic , and molecular genetic characteristics",O O O O O O B O O O O O O O O O O O O O O O O O O O O,32
1976,851,"Eleven of the 16 homozygous subjects underwent liver biopsy ; 3 had hepatic fibrosis , and 1 , who had a history of excessive alcohol consumption , had cirrhosis and mild microvesicular steatosis .",O O O O O O O O O O O O B I O O O O O O O O O B I I O O B O O B I O,32
7632,10595,"To fill this gap , we sequenced the G6PD gene of 43 G6PD - deficient Chinese whose G6PD was well characterized biochemically .",O O O O O O O O O O O O B I I O O O O O O O O,13
194,2969,"All three of these variants , believed on the basis of biochemical characterization and population origin to be unique , have the G - - - - A transition at nucleotide 202 and the A - - - - G transition at nucleotide 376 , mutations that we now recognize to be characteristic of G6PD A - .",O O O O O O O O O O O O O O O O O O O O O O O O O O O O O O O O O O O O O O O O O O O O O O O O O O O O O O O O O O,32
9418,2849,"By contrast , an American case had a point substitution in the apoB gene generating an in - frame stop codon .",O O O O O O O O O O O O O O O O O O O O O O,32
8526,10784,DNA sequence analysis revealed that the mouse and human coding regions are 75 % identical at the nucleotide level while the predicted amino acid identity is only 58 % .,O O O O O O O O O O O O O O O O O O O O O O O O O O O O O O,13
9946,12470,Two altered Dp71 transcripts and two deleted Dp140 DNA sequences were found in four patients with severe cerebral dysfunction .,O O O O O O O O O O O O O O O O O B I O,39
4024,10128,"The 693C - - > A and 914C - - > A base changes , resulting in nonsense tyr231 - - > ter and missense ala305 - - > glu mutations , respectively , lead to complete loss of ASPA activity in in vitro expression studies .",O O O O O O O O O O O O O O O O O O O O O O O O O O O O O O O O O O O O O O O O O O O O O O O,13
7978,3769,Genetic analysis of an inherited deficiency of the third component of complement in Brittany spaniel dogs .,O O O O O B I I I I I I O O O O O,32
8841,11047,"To answer these questions , we have established a yeast system for the coexpression of epitope - tagged alleles of human GALT and investigated both the extent of specific GALT subunit interactions and the activity of defined heterodimer pools .",O O O O O O O O O O O O O O O O O O O O O O O O O O O O O O O O O O O O O O O O,13
5442,8661,Six tumours retained the paternal allele and three retained the maternal allele .,O B O O O O O O O O O O O,13
3311,11660,Fusion genes resulting from alternative chromosomal translocations are overexpressed by gene - specific mechanisms in alveolar rhabdomyosarcoma .,O O O O O O O O O O O O O O O B I O,13
4570,11182,"Using statistical models specifically designed to study single - sperm segregation data , we find no evidence of meiotic segregation distortion .",O O O O O O O O O O O O O O O O O O O O O O,13
2407,10735,It is expected that the majority of clear examples of the breast - ovarian syndrome will be associated with germ - line mutations in the coding region of BRCA1 . .,O O O O O O O O O O O B I I I O O O O O O O O O O O O O O O O,13
6162,7174,"To date we have identified 65 missense mutations in the GALNS gene from MPS IVA patients , but the correlation between genotype and phenotype has remained unclear .",O O O O O O O O O O O O O B I O O O O O O O O O O O O O,13
9359,7853,Family study of a further case .,O O O O O O O,13
2100,6620,"We describe three novel mutations ( R58fs , R330S , and H371R ) and one common AKU mutation ( M368V ) , detected by mutational and polymorphism analysis of the HGO gene in five Finnish AKU pedigrees .",O O O O O O O O O O O O O O O O B O O O O O O O O O O O O O O O O O O B O O,13
6372,12496,"To investigate whether a founder chromosome for the DM mutation exists in the Japanese population , we genotyped families using polymorphic markers near the ( CTG ) n repeat region and constructed haplotypes .",O O O O O O O O B O O O O O O O O O O O O O O O O O O O O O O O O O,39
129,8455,No other endocrinologic dysfunction was identified . .,O O B I O O O O,13
8848,2403,We have developed a rapid and simple method to diagnose the molecular defects of glucose - 6 - phosphate dehydrogenase ( G6PD ) deficiency in Chinese in Taiwan .,O O O O O O O O O O O O O O B I I I I I I I I I O O O O O,32
6410,5440,Opsonization and generation of chemotactic activity functioned normally .,O O O O O O O O O,13
1670,3716,These observations suggest that sialophorin functions in T cell activation . .,O O O O O O O O O O O O,32
117,12521,These findings are consistent with the hypothesis that certain alleles could prevent or modify the clinical manifestations of BPAD and perhaps other related affective disorders .,O O O O O O O O O O O O O O O O O O B O O O O B I O,39
7933,10182,The human ASPA locus was further mapped in the 17p13 - ter region by fluorescence in situ hybridization .,O O O O O O O O O O O O O O O O O O O,13
9638,7193,Alterations of the length or amino acid composition of the A - T gene product affect the A - T clinical phenotype in different ways .,O O O O O O O O O O B I I O O O O B I I O O O O O O,13
4239,8471,"Family members homozygous for CETP deficiency ( n = 10 ) had moderate hypercholesterolemia ( mean total cholesterol level [ + / - SD ] , 7 . 01 + / - 0 . 83 mmol per liter ) , markedly increased levels of HDL cholesterol ( 4 . 24 + / - 1 . 01 mmol per liter ) and apolipoprotein A - I , and decreased levels of low - density lipoprotein cholesterol ( 1 . 99 + / - 0 . 80 mmol per liter ) and apolipoprotein B .",O O O O B I O O O O O O O B O O O O O O O O O O O O O O O O O O O O O O O O O O O O O O O O O O O O O O O O O O O O O O O O O O O O O O O O O O O O O O O O O O O O O O O O O O O O O O O,13
7453,7584,This allowed the detection of some residual activity ( 12 % of the positive control ) when the mutant alpha - cDNA replaced its wild - type counterpart .,O O O O O O O O O O O O O O O O O O O O O O O O O O O O O,13
5946,1925,"Consequently , 86 % of afibrinogenemia alleles analyzed to date have truncating mutations of FGA , though mutations in all 3 fibrinogen genes , FGG , FGA , and FGB , might be predicted to cause congenital afibrinogenemia . .",O O O O O B O O O O O O O O O O O O O O O O O O O O O O O O O O O O O O B I O O,32
5064,1642,The only instance of disassociation of B27 and spondylitis in a family was where the proband had ulcerative colitis as well as spondylitis .,O O O O O O O O B O O O O O O O O B I O O O B O,32
8890,7180,"Sulfatases , including GALNS , are members of a highly conserved gene family sharing an extensive sequence homology .",O O O O O O O O O O O O O O O O O O O,13
3029,7403,"Interestingly , Arg - 610 is located within one of the two pleckstrin homology ( PH ) domains of the FGD1 gene and it corresponds to a highly conserved residue which has been involved in InsP binding in PH domains of other proteins .",O O O O O O O O O O O O O O O O O O O O O O O O O O O O O O O O O O O O O O O O O O O O,13
3010,331,A diagnosis of Pelizaeus - Merzbacher disease ( MIM 312080 ) was made in a young boy .,O O O B I I I O O O O O O O O O O O,32
6929,1125,Somatic rearrangement of chromosome 14 in human lymphocytes .,O O O O O O O O O,32
8200,9874,"To study the potential role of BRCA1 in sporadic carcinogenesis , we analysed the genomic DNA of tumour and normal fractions of 47 ovarian cancers for mutations in BRCA1 using the single - strand conformation polymorphism technique .",O O O O O O O O O O O O O O O O O B O O O O O B I O O O O O O O O O O O O O,13
7787,5253,"First , MJD is associated with expansion fo the array from the normal range of 14 - 37 repeats to 68 - 84 repeats in most Japanese and Caucasian subjects , but no subjects were observed with expansions intermediate in size between those of the normal and MJD affected groups .",O O B O O O O O O O O O O O O O O O O O O O O O O O O O O O O O O O O O O O O O O O O O O O O B O O O,32
5381,11416,"G6PD Santamaria might have been produced by recombination between G6PD A and G6PD Malaga ; however haplotype analysis , including the use of a new silent polymorphism , suggests that the same 542 A - - > T mutation has taken place independently in a G6PD B gene to give G6PD Malaga and in a G6PD A gene to give G6PD Santamaria .",O O O O O O O O O O O O O O O O O O O O O O O O O O O O O O O O O O O O O O O O O O O O O O O O O O O O O O O O O O O O O O O,13
3697,3137,This led us to propose that a single DNA rearrangement could underlie both ALD and abnormal color vision in these patients .,O O O O O O O O O O O O O B O B I I O O O O,32
7009,10887,"An exception is BRCA1 , which contributes to a significant fraction of familial breast and ovarian cancer , but undergoes mutation at very low rates in sporadic breast and ovarian cancers .",O O O O O O O O O O O O B I I I I O O O O O O O O O B I I I I O,13
892,3049,"Pituitary - adrenal function studies were performed in 10 family members , including two affected males and four females identified as carriers of ALD / AMN .",O O O O O O O O O O O O O O O O O O O O O O O B O B O,32
8975,2294,With each single mutation we found a slight decrease in both the specific activity and the yield of enzyme when compared to G6PD B .,O O O O O O O O O O O O O O O O O O O O O O O O O,32
4487,4524,An evaluation of genetic heterogeneity in 145 breast - ovarian cancer families .,O O O O O O O B I I I O O,32
2178,856,Large heterozygous deletion masquerading as homozygous missense mutation : a pitfall in diagnostic mutation analysis .,O O O O O O O O O O O O O O O O,32
7263,3642,"However , until now , their precise molecular basis has remained unknown .",O O O O O O O O O O O O O,32
6953,1654,The single family with a BRCA2 mutation had the breast - ovarian cancer syndrome .,O O O O O O O O O B I I I I O,32
4200,9729,The same mutation was found in one additional melanoma among 28 melanomas analyzed .,O O O O O O O O B O O B O O,13
918,132,"To determine the prevalence of heterozygous carriers of the Arg95Stop mutation in a Japanese population , we collected DNA samples from 300 individuals in two of the four main islands of Japan .",O O O O O O O O O O O O O O O O O O O O O O O O O O O O O O O O O,32
