Unnamed: 0.1,Unnamed: 0,text,labels,txt_len
9415,7896,The Wiskott - Aldrich syndrome ( WAS ) has previously been mapped to the proximal short arm of the X chromosome between the DXS14 and DXS7 loci .,O B I I I O B O O O O O O O O O O O O O O O O O O O O O,13
8498,1995,A mutation in the pleckstrin homology ( PH ) domain of the FGD1 gene in an Italian family with faciogenital dysplasia ( Aarskog - Scott syndrome ) .,O O O O O O O O O O O O O O O O O O O B I O B I I I O O,32
4798,8091,Locus D11S325 gives a lod score of Z = 1 .,O O O O O O O O O O O,13
2569,5367,DTD is caused by mutations in the recently identified diastrophic dysplasia sulfate - transporter gene ( DTDST ) .,B O O O O O O O O B I O O O O O O O O,32
4858,9730,These results suggest that mutation of CDK4 can create a tumor - specific antigen and can disrupt the cell - cycle regulation exerted by the tumor suppressor p16INK4a . .,O O O O O O O O O O B O O O O O O O O O O O O O O B O O O O,13
9414,7604,"Most mutations are linked to specific haplotypes , as defined by eight polymorphic restriction sites in the PAH gene .",O O O O O O O O O O O O O O O O O O O O,13
9579,8934,"A deletion in an individual with retinoblastoma was reported to separate the closely linked ESD and retinoblastoma ( RB1 ) loci , placing ESD proximal to RB1 .",O O O O O O B O O O O O O O O O B O O O O O O O O O O O,13
7218,12111,6 A crystal structure of HFE reveals the locations of hemochromatosis mutations and a patch of histidines that could be involved in pH - dependent interactions .,O O O O O O O O O O B O O O O O O O O O O O O O O O O,39
2376,10380,"Thus , the range of phenotypic expression observed among affected patients may result in part from different allelic manifestations of APC mutations . .",O O O O O O O O O O O O O O O O O O O O B O O O,13
836,459,"There was a G - to - A transition in the affected cat cDNA that predicted an E351K substitution , destroyed a BssSI site , and eliminated GUSB enzymatic activity in expression studies .",O O O O O O O O O O O O O O O O O O O O O O O O O O O O O O O O O O,32
190,5123,"In this paper we describe four additional PAX6 point mutations in aniridia patients , both sporadic and familial .",O O O O O O O O O O O B O O O O O O O,32
6993,918,"A patient who showed an intermediate saliva / serum technetium ratio ( 14 . 0 ; normal , > or = 20 ) and was considered to have a partial or less severe defect in the previous report ( IX - 24 ) did not have a NIS gene mutation .",O O O O O O O O O O O O O O O O O O O O O O O O O O O O O O O O O O O O O O O O O O O O O O O O O O O,32
4558,6170,"Wiskott - Aldrich syndrome ( WAS ) is an X - linked recessive immunodeficiency characterized by thrombocytopenia , eczema , and recurrent infections , and caused by mutations in the WAS protein ( WASP ) gene .",B I I I O B O O O B I I I I O O B O B O O O O O O O O O O O B O O O O O O,13
3304,3345,"We describe here a Pelizaeus - Merzbacher pedigree of the classical type , with X - linked inheritance , a typical clinical progression , and a pathologic loss of myelinating cells and myelin in the central nervous system .",O O O O B I I O O O O O O O O O O O O O O O O O O O O O O O O O O O O O O O O,32
8182,11887,"Sixteen different p16 germline mutations were found in 21 families , while one germline mutation , Arg24His , was detected in the CDK4 gene .",O O O O O O O O O O O O O O O O O O O O O O O O O,39
6842,8446,"Both linkage analysis and DNA fingerprint analysis revealed that each twin has two different X chromosomes , eliminating the possibility of uniparental disomy as a mechanism for DMD expression .",O O O O O O O O O O O O O O O O O O O O O B I O O O O B O O,13
3814,2865,"We described a 15 - year - old boy with Gardner syndrome ( GS ) , mental retardation , and craniofacial abnormalities .",O O O O O O O O O O B I O B O O B I O O B I O,32
5283,5640,Adult - onset cerebral ALD also presents with rapidly progressive neurologic dysfunction .,O O O B I O O O O O B I O,13
1893,2286,Both mutations in G6PD A - are necessary to produce the G6PD deficient phenotype .,O O O O O O O O O O O B I O O,32
839,4130,"The second patient was a compound heterozygote , with a missense mutation , C1837 - - > T , changing the arginine at residue 613 to tryptophan on one allele and a single base deletion at the intron - exon 6 boundary as the second mutation .",O O O O O O O O O O O O O O O O O O O O O O O O O O O O O O O O O O O O O O O O O O O O O O O,32
6681,2041,We screened 49 potential FAP families and identified 26 different germline APC mutations in 30 families .,O O O O B O O O O O O B O O O O O,32
48,9834,"The proband , who has inactive systemic lupus erythematosus is completely lacking C5 , while her healthy half - sister has 1 - 2 % of normal levels .",O O O O O O B I I O O O O O O O O O O O O O O O O O O O O,13
8324,8157,"We have performed linkage analysis with the DNA markers DXS52 and the clotting factor VIII gene ( F8C ) , in several large families with X - linked adrenoleukodystrophy ( ALD ) .",O O O O O O O O O O O O O O O O O O O O O O O O O B I I I O B O O,13
4656,3439,"DXS42 was mapped to the derivative chromosome X containing Xpterq25 , and DXS10 was mapped to the derivative chromosome 3 containing Xq25 - qter .",O O O O O O O O O O O O O O O O O O O O O O O O O,32
1746,2779,We report carrier identification and a prenatal diagnosis using DNA polymorphisms in 2 families with X - linked Pelizaeus - Merzbacher disease ( PMD ) .,O O O O O O O O O O O O O O O B I I I I I I O B O O,32
4433,9709,"Glucose - 6 - phosphate dehydrogenase ( G6PD ) deficiency , the most common enzymopathy of humans , affects over 400 million people .",B I I I I I I I I I O O O O B O O O O O O O O O,13
4085,5549,"S . , Lauer , P . , Lee , V .",O O O O O O O O O O O O,13
1941,10098,"The phenotypic expression is highly variable , childhood cerebral ALD ( CCALD ) and adrenomyeloneuropathy ( AMN ) being the main variants .",O O O O O O O B I I O B O O B O B O O O O O O,13
1351,4694,"Interestingly , all CHM gene mutations detected thus far in choroideremia patients give rise to the introduction of a premature stop codon . .",O O O B O O O O O O B O O O O O O O O O O O O O,32
4527,6268,"These results confirmed the diagnosis of X - linked Emery - Dreifuss muscular dystrophy ( EDMD ) , and reinforce the necessity of molecular genetic diagnosis of the membrane protein emerin in younger patients with possible EDMD before appearance of the typical symptoms , to avoid sudden cardiac death . .",O O O O O O B I I I I I I I O B O O O O O O O O O O O O O O O O O O O O B O O O O O O O O O B I I O O,13
1603,2376,"The known Duchenne muscular dystrophy ( DMD ) gene products , the muscle - and brain - type dystrophin isoforms , are 427 - kDa proteins translated from 14 - kilobase ( kb ) mRNAs .",O O B I I O B O O O O O O O O O O O O O O O O O O O O O O O O O O O O O,32
5453,12267,"The patient ( J . B . ) , a 17 - year - old white male with PWS , was found to have 47 chromosomes with a supernumerary , paternal der ( 15 ) consisting of the short arm and the proximal long arm of chromosome 15 , and distal chromosome arm 3p .",O O O O O O O O O O O O O O O O O O B O O O O O O O O O O O O O O O O O O O O O O O O O O O O O O O O O O O O,39
2395,8960,No infectious agent could be demonstrated .,O O O O O O O,13
3125,12567,"The two other siblings , apparently healthy at 12 ( 1 / 2 ) and 15 years , respectively , and their father , apparently healthy as well , presented ARSA and GS values within the range of MLD patients .",O O O O O O O O O O O O O O O O O O O O O O O O O O O O O O O O O O O O O O B O O,39
1645,5438,"Her fresh serum lacked complement - mediated bactericidal activity against Neisseria gonorrhoeae , but the addition of fresh normal serum or purified C7 restored bactericidal activity as well as hemolytic activity .",O O O O O O O O O O O O O O O O O O O O O O O O O O O O O O O O,13
1831,797,We therefore hypothesized that A - T is due to oxidative damage resulting from loss of function of the A - T gene product .,O O O O B I I O O O O O O O O O O O O B I I O O O,32
7389,2844,Genetic analysis of a Japanese family with normotriglyceridemic abetalipoproteinemia indicates a lack of linkage to the apolipoprotein B gene .,O O O O O O O B I O O O O O O O O O O O,32
8859,9579,The ability of the expansion mutation to alter accumulation of poly ( A ) + RNA in trans suggests that myotonic dystrophy may be the first example of a dominant - negative mutation manifested at the RNA level . .,O O O O O O O O O O O O O O O O O O O O B I O O O O O O O O O O O O O O O O O O,13
1654,9491,No correlation was revealed between clinical and biochemical polymorphism . .,O O O O O O O O O O O,13
1829,7278,"The PDS gene encodes a transmembrane protein , known as pendrin , which functions as a transporter of iodide and chloride .",O B O O O O O O O O O O O O O O O O O O O O,13
6065,5819,"Finally , one frameshift mutation , 2799delC , modifies the C - terminal part of OCRL1 , with an extension of six amino acids .",O O O O O O O O O O O O O O O O O O O O O O O O O,13
8081,6214,Homozygosity for a novel DTDST mutation in a child with a ' broad bone - platyspondylic ' variant of diastrophic dysplasia .,O O O O O O O O O O O O O O O O O O O B I O,13
5919,9404,"A previously healthy 40 - year - old man presenting with fever , arthritis , and cutaneous vasculitis was found to have chronic meningococcemia .",O O O O O O O O O O O B O B O O B I O O O O B I O,13
9067,11439,Nine ( 17 % ) of the patients had a family history of breast and / or ovarian cancer in at least one first - degree relative .,O O O O O O O O O O O O O B I I I I I O O O O O O O O O,13
7448,7645,Germline intronic and exonic mutations in the Wilms ' tumour gene ( WT1 ) affecting urogenital development .,O O O O O O O B I I O O O O O O O O,13
9792,5857,beta - Glucuronidase activity was undetectable in affected cat fibroblasts and restored by retroviral gene transfer of rat beta - glucuronidase cDNA .,O O O O O O O O O O O O O O O O O O O O O O O,13
4967,4761,"The EWS gene , involved in Ewing family of tumors , malignant melanoma of soft parts and desmoplastic small round cell tumors , codes for an RNA binding protein with novel regulatory domains .",O O O O O O B I I I O B I I I I O B I I I I O O O O O O O O O O O O,32
8588,11120,None of these tumours showed abnormal migration patterns .,O O O B O O O O O,13
8302,8619,These results have implications for genetic counselling and prenatal diagnosis in families with Becker muscular dystrophy . .,O O O O O O O O O O O O O B I I O O,13
9271,8504,6 % .,O O O,13
6694,4991,The authors believe the unique ERG recorded for the human subjects is a manifestation of DMD associated with defects at the dystrophin gene locus and represents a new clinical entity .,O O O O O O O O O O O O O O O B O O O O O O O O O O O O O O O,32
4513,3087,"We describe the first cases , to our knowledge , of C9 deficiency in Europe that were detected in a Swiss family , of which two members - - one with a complete deficiency and the other with approximately half - normal C9 levels - - experienced bacterial meningitis .",O O O O O O O O O O O B I O O O O O O O O O O O O O O O O O O O O O O O O O O O O O O O O O O B I O,32
7237,2224,A mutation common in non - Jewish Tay - Sachs disease : frequency and RNA studies .,O O O O O O O B I I I O O O O O O,32
1870,3898,An obligate carrier of the Wiskott - Aldrich syndrome ( WAS ) who was also heterozygous for the A and B types of X - linked glucose - 6 - phosphate dehydrogenase was found .,O O O O O B I I I O B O O O O O O O O O O O O O O O O O O O O O O O O,32
2470,4722,"It appears , therefore , that SPG2 and PMD are allelic disorders",O O O O O O O O B O B I,32
7307,4191,"In seven Japanese families ( 14 alleles for classic form and one allele for Duarte variant ) with GALT deficiency , the R231H and 318A - - > G mutations were found only on both alleles of the proband .",O O O O O O O O O O O O O O O O O O B I O O O O O O O O O O O O O O O O O O O O,32
6604,537,Hepatoblastoma is a rare malignant tumor of the liver that occurs in children at an average age of 2 to 3 years .,B O O O B I I I I O O O O O O O O O O O O O O,32
8046,2313,Mutations in the candidate gene for Norrie disease .,O O O O O O B I O,32
7343,8714,"Each of four germ line mutations involved a small deletion or duplication , while three somatic mutations were point mutations leading to splice alterations and loss of an exon from the mature RB1 mRNA .",O O O O O O O O O O O O O O O O O O O O O O O O O O O O O O O O O O O,13
3410,11215,Muscle expression of glucose - 6 - phosphate dehydrogenase deficiency in different variants .,O O O B I I I I I I O O O O,13
4191,6246,The subjects were followed for up to four years .,O O O O O O O O O O,13
9454,7363,We found no exon variants .,O O O O O O,13
7750,9101,Distinctive ribonuclease A cleavage patterns were identified in messenger RNA from 5 of 14 Lesch - Nyhan patients who were chosen because no HPRT Southern or Northern blotting pattern changes had been found .,O O O O O O O O O O O O O O B I I O O O O O O O O O O O O O O O O O,13
4833,5999,"Thus , mutations resulting in truncated proteins may lead to a higher risk of RCC in VHL patients",O O O O O O O O O O O O O O B O B O,13
7916,7339,"The orthologous mouse gene ( Magel2 ) is located within 150 kb of NDN , is imprinted with paternal - only expression and is expressed predominantly in late developmental stages and adult brain as shown by northern blotting , RT - PCR and whole - mount RNA in situ hybridization .",O O O O O O O O O O O O O O O O O O O O O O O O O O O O O O O O O O O O O O O O O O O O O O O O O O O,13
6636,12643,"Compared with the frequency in two separate population control groups , the APC I1307K allele is associated with an estimated relative risk of 1 .",O O O O O O O O O O O O O O O O O O O O O O O O O,39
9488,6223,"Clues from attenuated polyposis , missense germline variants with mild disease and the somatic mutation cluster region ( codons 1 , 250 - 1 , 450 ) indicate , however , that APC mutations might not result in simple loss of protein function .",O O B I O O O O O O O O O O O O O O O O O O O O O O O O O O O O B O O O O O O O O O O O,13
7561,10720,"We compared galactose - 1 - phosphate uridyltransferase among erythrocytes , leukocytes , and transformed lymphoblasts , as well as total body oxidation of D - ( 13C ) - galactose to 13CO2 among three genotypes for GALT ( S135L / S135L , Q188R / Q188R , and Normal / Normal ) .",O O O O O O O O O O O O O O O O O O O O O O O O O O O O O O O O O O O O O O O O O O O O O O O O O O O O O,13
3806,11359,"Cumulative mutation data have revealed that WASP genotypes are also highly variable among WAS patients , but the relationship of phenotype with genotype in this disease remains unclear .",O O O O O O O O O O O O O B O O O O O O O O O O O O O O O,13
2263,7663,We also found random X - inactivation in the mother of the patient who was shown to be a carrier of this deletion .,O O O O O O O O O O O O O O O O O O O O O O O O,13
4013,11510,3 % .,O O O,13
2847,673,"Of the patients with PKU , 92 % had been treated during childhood .",O O O O B O O O O O O O O O,32
10010,412,"The oculocerebrorenal syndrome of Lowe ( OCRL ) is an X - linked disorder characterized by major abnormalities of eyes , nervous system , and kidneys .",O B I I I O B O O O B I I I O O O B I I I I I I I I O,32
8269,11879,Growth retardation of the Smad4 - deficient embryos results from reduced cell proliferation rather than increased apoptosis .,B I O O O O O O O O O O O O O O O O,39
8748,332,No mutation in the coding region of the proteolipid protein ( PLP ) gene had been found .,O O O O O O O O O O O O O O O O O O,32
692,3422,"Renal cell carcinomas constitute a particularly frequent cause of death in this disorder , occurring as bilateral and multifocal tumours , and presenting at an earlier age than in sporadic , non - familial cases of this tumour type .",B I I O O O O O O O O O O O O O B I I I O O O O O O O O O O O O O O O O O B O O,32
2849,5129,"To determine the molecular basis of autosomal dominant neurohypophyseal diabetes insipidus , the AVP genes of members of a large kindred were analyzed .",O O O O O O B I I I I O O O O O O O O O O O O O,32
4772,12636,CONCLUSIONS Extended genotype - phenotype correlations made in this study may have the potential to determine the most appropriate surveillance and prophylactic treatment regimens for those patients with mutations associated with life threatening conditions .,O O O O O O O O O O O O O O O O O O O O O O O O O O O O O O O O O O O,39
3919,563,We used heteroduplex analysis to identify sequence anomalies in five individuals with Kniest dysplasia .,O O O O O O O O O O O O B I O,32
1567,879,"The mutation causing myotonic dystrophy ( DM ) has been identified as a CTG expansion in the 3 - untranslated region ( 3 - UTR ) of the DM protein kinase gene ( DMPK ) , but the mechanism ( s ) of pathogenesis remain unknown .",O O O B I O B O O O O O O O O O O O O O O O O O O O O O B O O O O O O O O O O O O O O O O O O,32
8808,7158,Familial Mediterranean fever ( FMF ) is a recessive disorder characterized by episodes of fever and neutrophil - mediated serosal inflammation .,B I I O B O O O B I O O O O B O B I I I I O,13
377,12219,Pendred patients in three non - consanguineous families were shown to be compound heterozygotes for L236P and T416P .,B O O O O O O O O O O O O O O O O O O,39
4643,3655,"In a subset of families , the relevant segment of the APOE gene was enzymatically amplified to increase the sensitivity of the method .",O O O O O O O O O O O O O O O O O O O O O O O O,32
6012,7163,The prepromyelocytic cell line HL60 expressed MEFV only at granulocytic and monocytic differentiation .,O O O O O O O O O O O O O O,13
4256,4342,The deletion seems to occur due to exon skipping during processing of VLCAD pre - mRNA .,O O O O O O O O O O O O O O O O O,32
1235,12130,"In one of the families , affected individuals presented a novel nonsense mutation in exon 3 of the gene , consisting in a G to T transition at nucleotide 2101 , which produces a stop signal in codon 82 ( Glu ) of NPII .",O O O O O O O O O O O O O O O O O O O O O O O O O O O O O O O O O O O O O O O O O O O O O,39
5849,7601,Two missense mutations causing mild hyperphenylalaninemia associated with DNA haplotype 12 .,O O O O O B O O O O O O,13
6313,5007,"3 region , to examine these markers for association with the Wilson disease gene ( WND ) .",O O O O O O O O O O O B I O O B O O,32
10035,2918,Linkage of aspartylglucosaminuria ( AGU ) to marker loci on the long arm of chromosome 4 .,O O B O B O O O O O O O O O O O O,32
6316,1784,Mutations at the ataxia - telangiectasia locus and clinical phenotypes of A - T patients .,O O O B I I O O O O O B I I O O,32
7988,6105,"Using homologous recombination to disrupt the normal translation of ATP7B , we have generated a strain of mice that are homozygous mutants ( null ) for the Wilson disease gene .",O O O O O O O O O O O O O O O O O O O O O O O O O O O B I O O,13
8508,2617,This allele accounted for 32 % ( 20 / 62 ) of non - Jewish enzyme - defined Tay - Sachs disease carriers but for none of 36 Jewish enzyme - defined carriers who did not have one of three known mutations common to this group .,O O O O O O O O O O O O O O O O O O B I I I O O O O O O O O O O O O O O O O O O O O O O O O O,32
6554,3516,"In an attempt to determine more precisely the occurrence of these deletions within a large population of DMD patients and the accuracy of one of the segments , DXS164 ( pERT87 ) , in determining the inheritance of the DMD X chromosome , the subclones 1 , 8 and 15 were made available to many investigators throughout the world .",O O O O O O O O O O O O O O O O O B O O O O O O O O O O O O O O O O O O O O O B O O O O O O O O O O O O O O O O O O O O,32
8355,12307,"A Japanese family with adrenoleukodystrophy with a codon 291 deletion : a clinical , biochemical , pathological , and genetic report .",O O O O B O O O O O O O O O O O O O O O O O,39
9090,3309,Mutations in the RB1 gene and their effects on transcription .,O O O O O O O O O O O,32
9313,6614,All PLS patients were homozygous for cathepsin C mutations inherited from a common ancestor .,O B O O O O O O O O O O O O O,13
5820,6566,Keratosis also affects other sites such as elbows and knees .,B O O O O O O O O O O,13
265,1203,A major gene locus for PLS has been mapped to a 2 .,O O O O O B O O O O O O O,32
2293,846,"RESULTS Sixteen of the subjects ( 0 . 5 percent ) were homozygous for the C282Y mutation , and 424 ( 14 . 1 percent ) were heterozygous .",O O O O O O O O O O O O O O O O O O O O O O O O O O O O O,32
6625,2763,"DNA analysis appeared to be of use in determination of the carrier status of females at risk , for the determination of the origin of the mutation in a particular family , and for prenatal diagnosis .",O O O O O O O O O O O O O O O O O O O O O O O O O O O O O O O O O O O O O,32
3900,4037,"( 2 ) Although G6PD Mediterranean is very frequent , it presents a relatively high degree of polymorphism .",O O O O O O O O O O O O O O O O O O O,32
3873,9220,"No deficiency in the opsonic activity of the serum was found , and the results of basic coagulation studies of the plasma were normal .",O O O O O O O O O O O O O O O O O O O O O O O O O,13
5270,958,DNA was also screened for structural rearrangements ( deletions and duplications ) and point mutations in mtDNA .,O O O O O O O O O O O O O O O O O O,32
159,9266,"G6PD Konan had fast electrophoretic mobility as compared with normal levels , G6PD Kiwa had slightly elevated electrophoretic mobility , and G6PD Kamiube had normal electrophoretic mobility .",O O O O O O O O O O O O O O O O O O O O O O O O O O O O,13
565,11223,198 198 .,O O O,13
4644,8818,"Given that at least 105 female meioses transmitting TCD have occurred since 1650 in these kindreds , extremely close linkage between TCD , DXYS1 and DXYS12 is suggested .",O O O O O O O O B O O O O O O O O O O O O B O O O O O O O,13
2167,5821,"We also identified two new microsatellite markers for the OCRL1 locus , and we detected a germline mosaicism in one family .",O O O O O O O O O O O O O O O O O O O O O O,13
4816,5806,"Of 44 patients , nine ( 20 % ) had facial angiofibromas , tumours primarily occurring in association with tuberous sclerosis .",O O O O O O O O O O B I O B O O O O O B I O,13
230,2400,"Analysis of nine obligate carriers from seven unrelated families showed that four harbor the delta F304 / 305 mutation , two the Arg170 - - - - Gln mutation , and one the Tyr180 - - - - Stop mutation .",O O O O O O O O O O O O O O O O O O O O O O O O O O O O O O O O O O O O O O O O O,32
3482,4634,"The map comprises a contig of 137 overlapping yeast artificial chromosomes and P1 clones , onto which we have placed 112 PCR markers .",O O O O O O O O O O O O O O O O O O O O O O O O,32
6101,2414,"Aside from showing that G to T change at nt 1376 is the most common mutation , our research indicates that nt 493 mutation is a frequent mutation among Chinese in Taiwan .",O O O O O O O O O O O O O O O O O O O O O O O O O O O O O O O O O,32
5481,1517,"This article reviews the clinical and molecular genetics of primary dystonias , critically discusses present findings , and proposes referring to the known forms , most of which can be distinguished by genetic criteria , as dystonias 1 - 12 .",O O O O O O O O O B I O O O O O O O O O O O O O O O O O O O O O O O O O B I I I O,32
4041,6515,This study utilizes cDNA microarrays to elucidate the pattern of gene expression induced by an oncogenic transcription factor and demonstrates the profound myogenic properties of PAX3 - FKHR in NIH 3T3 cells . .,O O O O O O O O O O O O O O O O O O O O O O O O O O O O O O O O O O,13
9442,97,"Here , we tested the hypothesis that HFE - / - mice have increased duodenal expression of the divalent metal transporter ( DMT1 ) .",O O O O O O O O O O O O O O O O O O O O O O O O O,32
8497,9242,Deficiency of the fifth component of complement in human subjects .,B I I I I I I O O O O,13
1644,11938,This acceptor splice - site mutation led to the formation of aberrant transcripts present at extremely low levels .,O O O O O O O O O O O O O O O O O O O,39
5399,1247,A widened vestibular aqueduct was found in all patients who underwent computed tomography ( CT ) scan exploration of the inner ear .,O B I I O O O O O O O O O O O O O O O O O O O,32
3311,11660,Fusion genes resulting from alternative chromosomal translocations are overexpressed by gene - specific mechanisms in alveolar rhabdomyosarcoma .,O O O O O O O O O O O O O O O B I O,13
8155,12545,We assessed the I1307K prevalence in Israeli Jews of differing ethnic origin and risk for colorectal cancer .,O O O O O O O O O O O O O O O B I O,39
9210,6402,"After birth he showed hypotonia with poor sucking , for which gavage feeding was needed .",O O O O B O O O O O O O O O O O,13
6531,1752,Those with hereditary cancers had improved survival compared with the nonhereditary group ( P = . 004 ) .,O O B I O O O O O O O O O O O O O O O,32
1467,7274,Significant within - family association of CYP2D6 * 4 alleles and AS was demonstrated .,O O O O O O O O O O O B O O O,13
1118,1459,Machado - Joseph disease ( MJD ) belongs to a group of clinically and genetically heterogeneous neurodegenerative disorders characterized by progressive cerebellar ataxia .,B I I I O B O O O O O O O O O O B I O O B I I O,32
9143,2448,These results support the Pax - 6 homologue as a strong candidate for the AN2 gene .,O O O O O O O O O O O O O O O O O,32
9947,9844,"Two peroxisomal targeting signals , PTS1 and PTS2 , are involved in the import of proteins into the peroxisome matrix .",O O O O O O O O O O O O O O O O O O O O O,13
9235,8047,Craniofrontonasal dysplasia .,B I O,13
9562,10137,8 % of the Canavan chromosomes of Ashkenazi Jewish origin .,O O O O B O O O O O O,13
