Unnamed: 0.1,Unnamed: 0,text,labels,txt_len
5311,1952,Study of the voltage - gated sodium channel beta 1 subunit gene ( SCN1B ) in the benign familial infantile convulsions syndrome ( BFIC ) .,O O O O O O O O O O O O O O O O O B I I I I O B O O,32
5010,11159,"The outer plexiform layer disappears occasionally , resulting in a juxtaposed inner and outer nuclear layer .",O O O O O O O O O O O O O O O O O,13
3284,515,"Direct sequencing of the emerin gene in 22 families with Emery - Dreifuss muscular dystrophy ( EMD ) revealed mutations in 21 ( 95 % ) , confirming that emerin mutations can be identified in the majority of families with X - linked EMD .",O O O O O O O O O O B I I I I O B O O O O O O O O O O O O O O O O O O O O O O O B I I I O,32
369,12112,"We also demonstrate that soluble TfR and HFE bind tightly at the basic pH of the cell surface , but not at the acidic pH of intracellular vesicles .",O O O O O O O O O O O O O O O O O O O O O O O O O O O O O,39
7190,11029,A striking clustering of missense mutations in the first four exons contrasted with a random distribution of nonsense mutations .,O O O O O O O O O O O O O O O O O O O O,13
1759,6518,"Indeed , within the well defined , mainly peptide - binding , MHC class I family of molecules , HFE seems to perform an unusual yet essential function .",O O O O O O O O O O O O O O O O O O O O O O O O O O O O O,13
6641,7743,Molecular genetic and fluorescent hybridisation studies have shown that loci D5S37 and D5S98 are outside the deletion whereas loci detected by probes EF5 .,O O O O O O O O O O O O O O O O O O O O O O O O,13
8955,1115,Experimental hemochromatosis due to MHC class I HFE deficiency : immune status and iron metabolism .,O B O O O O O B I O O O O O O O,32
2246,7949,Late - onset metachromatic leukodystrophy : molecular pathology in two siblings .,O O O B I O O O O O O O,13
9933,11034,Influence of PAX6 gene dosage on development : overexpression causes severe eye abnormalities .,O O O O O O O O O O O B I O,13
2187,12102,BRCA1 allelic patterns were determined for four of these individuals and for 12 additional non - Ashkenazi 185delAG mutation carriers who had breast / ovarian cancer .,O O O O O O O O O O O O O O O O O O O O O O B I I I O,39
6633,981,"The overall severity score indicated a mild disease , P < 0 .",O O O O O O O O O O O O O,32
6940,1326,Parental consanguinity is a characteristic of many cases of both conditions .,O O O O O O O O O O O O,32
4764,2221,"The second , a C - - > T transition at nucleotide 739 ( Arg247Trp ) , has been shown by Triggs - Raine et al .",O O O O O O O O O O O O O O O O O O O O O O O O O O O,32
5187,5503,"Duodenal expression of DMT1 ( non - IRE ) was not increased , nor was hepatic expression of DMT1 increased .",O O O O O O O O O O O O O O O O O O O O O,13
879,11394,"Fourteen of fifteen patient samples with known mutations were accurately diagnosed , and no false positive mutations were identified in 20 control samples .",O O O O O O O O O O O O O O O O O O O O O O O O,13
10006,6357,"mtDNA deletions have been described , and a gene ( WFS1 ) recently has been identified , on chromosome 4p16 , encoding a predicted 890 amino acid transmembrane protein .",O O O O O O O O O O O O O O O O O O O O O O O O O O O O O O,13
9293,4236,We studied cultured skin fibroblasts from 2 brothers with Pelizaeus - Merzbacher disease who exhibited no detectable exonic mutation of the PLP gene .,O O O O O O O O O B I I I O O O O O O O O O O O,32
3560,3374,"These data are most consistent with a mutation in the coding portion of the apoB gene in HBL patients , leading to an abnormal apoB protein and apoB mRNA instability .",O O O O O O O O O O O O O O O O O B O O O O O O O O O O O O O,32
2813,809,"Counselling was given for a recessive disorder , thereby considerably reducing the probability of affected offspring .",O O O O O B I O O O O O O O O O O,32
6615,9551,"Haplotype analysis supports previous data which suggest some BRCA1 mutation carriers have common ancestors ; however , we have found at least two examples where recurrent mutations appear to have arisen independently . .",O O O O O O O O O O O O O O O O O O O O O O O O O O O O O O O O O O,13
4529,4936,"The locus for Friedreich ataxia ( FRDA ) , a severe neurodegenerative disease , is tightly linked to markers D9S5 and D9S15 , and analysis of rare recombination events has suggested the order cen - FRDA - D9S5 - D9S15 - qter .",O O O B I O B O O O O B I O O O O O O O O O O O O O O O O O O O O O O O O O O O O O O,32
909,956,"mtDNA deletions have been described , and a gene ( WFS1 ) recently has been identified , on chromosome 4p16 , encoding a predicted 890 amino acid transmembrane protein .",O O O O O O O O O O O O O O O O O O O O O O O O O O O O O O,32
7927,3061,Physical assignment of FRDA will allow us to identify hybrid cell lines containing the mutated gene .,O O O O O O O O O O O O O O O O O,32
543,9578,"Our findings are consistent with a novel molecular pathogenetic mechanism for myotonic dystrophy both the normal and expanded DM kinase genes are transcribed in patient muscle , but the abnormal expansion - containing RNA has a dominant effect on RNA metabolism by preventing the accumulation of poly ( A ) + RNA .",O O O O O O O O O O O B I O O O O O B O O O O O O O O O O O O O O O O O O O O O O O O O O O O O O O O O O,13
5808,12110,The 2 .,O O O,39
9205,7165,"Among peripheral blood leukocytes , MEFV expression was detected in neutrophils , eosinophils , and to varying degrees , monocytes .",O O O O O O O O O O O O O O O O O O O O O,13
1223,2405,Ninety - four Chinese males with G6PD deficiency were studied .,O O O O O O B I O O O,32
1325,7821,In this study we used denaturing gradient gel electrophoresis ( DGGE ) .,O O O O O O O O O O O O O,13
2245,12419,Dysfunction of this pathway may be a general phenomenon in the majority of cases of hereditary breast and / or ovarian cancer . .,O O O O O O O O O O O O O O O B I I I I I I O O,39
1713,3305,This is confirmed by other recombinants where DM segregates with distal probes .,O O O O O O O B O O O O O,32
5432,1599,We observed that the YAC transgene supported production of the human protein ( FMRP ) which was present at levels 10 to 15 times that of endogenous protein and was expressed in a cell - and tissue - specific manner .,O O O O O O O O O O O O O O O O O O O O O O O O O O O O O O O O O O O O O O O O O,32
8437,5205,Structure and genomic sequence of the myotonic dystrophy ( DM kinase ) gene .,O O O O O O B I O B O O O O,32
6404,11129,"From these results , together with sequence and structural homologies between emerin , thymopoietins and the nuclear lamina - associated protein , LAP2 , we suggest that emerin will prove to be one member of a family of inner nuclear membrane proteins . .",O O O O O O O O O O O O O O O O O O O O O O O O O O O O O O O O O O O O O O O O O O O O,13
358,1097,Four mouse models of PWS have been reported but these do not definitively allow the delineation of the critical region and the associated genes involved in the aetiology of PWS .,O O O O B O O O O O O O O O O O O O O O O O O O O O O O O B O,32
7930,10110,McLeod syndrome is an X - linked multisystem disorder characterized by abnormalities in the neuromuscular and hematopoietic systems .,B I O O B I I I I O O O O O O O O O O,13
4939,10021,"Loss of heterozygosity data from familial tumors suggest that BRCA1 , a gene that confers susceptibility to ovarian and early - onset breast cancer , encodes a tumor suppressor .",O O O O O B I O O O O O O O O O O B I I I I B I O O O B O O,13
754,6022,"67 - 1 / 10 , 000 births , these deletions represent a common structural chromosome change in the human genome .",O O O O O O O O O O O O O O O O O O O O O O,13
6502,12532,This study provides further evidence that the DM expansion tends to be transmitted preferentially .,O O O O O O O B O O O O O O O,39
5550,11572,"Twelve aniridia patients , five with a family history and seven presumed to be sporadic , were exhaustively screened in order to test what proportion of people with aniridia , uncomplicated by associated anomalies , carry mutations in the human PAX6 gene .",O B O O O O O O O O O O O O O O O O O O O O O O O O O O B O O O O O O O O O O O O O O,13
9255,3008,"The closest proximal markers are APOC2 ( apolipoprotein C - II ) and CKM ( creatine kinase , muscle ) approximately 3 cM and 2 cM from the DM gene respectively , in the order APOC2 - CKM - DM .",O O O O O O O O O O O O O O O O O O O O O O O O O O O O B O O O O O O O O O O O O,32
1606,11333,"In patients with stage II disease whose tumors expressed DCC , the five - year survival rate was 94 .",O O O O O O O B O O O O O O O O O O O O,13
10091,8647,"Consequently , the three most informative RFLPs have been found to be BanI , TaqI , and either BglI , AvaII , or NcoI polymorphisms .",O O O O O O O O O O O O O O O O O O O O O O O O O O,13
9138,6339,Our results show that FRDA is a nuclear - encoded mitochondrial disorder affecting oxidative phosphorylation and give a rationale for treatments aimed to improve mitochondrial function in this condition . .,O O O O B O O O O O B I O O O O O O O O O O O O O O O O O O O,13
4522,12333,"Heterozygous mutations in the human PAX6 gene result in various phenotypes , including aniridia , Peters anomaly , autosomal dominant keratitis , and familial foveal dysplasia .",O O O O O O O O O O O O O B O B I O B I I O O B I I O,39
3072,3115,Sequence analyses demonstrated that each of these polymorphisms resulted from single base pair substitutions and that neither substitution would probably cause or contribute to the C5 deficiency .,O O O O O O O O O O O O O O O O O O O O O O O O O B I O,32
8063,12389,"These data suggest that expansion occurs in two stages , the first during meiosis followed by a second mitotic expansion .",O O O O O O O O O O O O O O O O O O O O O,39
2811,270,We were unable to detect evidence of sulfate transport following the expression of pendrin in Xenopus laevis oocytes by microinjection of PDS cRNA or in Sf9 cells following infection with PDS - recombinant baculovirus .,O O O O O O O O O O O O O O O O O O O O O O O O O O O O O O O O O O O,32
9794,4846,Characteristics of intergenerational contractions of the CTG repeat in myotonic dystrophy .,O O O O O O O O O B I O,32
6898,18,These findings suggested a founder effect within Newfoundland similar to that reported by others for two MLH1 mutations in Finnish HNPCC families .,O O O O O O O O O O O O O O O O O O O O B O O,32
1551,7168,Induction by IFN - gamma occurred rapidly and was resistant to cycloheximide .,O O O O O O O O O O O O O,13
2635,9132,The recent discovery of sequences at the site of the Duchenne muscular dystrophy ( DMD ) gene in humans has opened up the possibility of a detailed molecular analysis of the genes in humans and in related mammalian species .,O O O O O O O O O O B I I O B O O O O O O O O O O O O O O O O O O O O O O O O O,13
7514,3428,"Tightly linked flanking markers for the Lowe oculocerebrorenal syndrome , with application to carrier assessment .",O O O O O O B I I O O O O O O O,32
1607,8345,Recombination data and two - point linkage analysis support a locus order of centromere - pi 227 - C11P11 - ECB27 - L5 .,O O O O O O O O O O O O O O O O O O O O O O O O,13
3722,3497,Studies in families also segregating for the DNA marker 754 support the previously reported physical order of these loci as X centromere - 754 - DMD - BMD - C7 - X telomere .,O O O O O O O O O O O O O O O O O O O O O O O O O O O O O O O O O O,32
4077,9802,"Most important , the enzyme converts phosphatidylinositol 4 , 5 - bisphosphate to phosphatidylinositol 4 - phosphate .",O O O O O O O O O O O O O O O O O O,13
3613,104,Neurophysiologic follow - up of long - term dietary treatment in adult - onset adrenoleukodystrophy .,O O O O O O O O O O O O O O B O,32
7792,5133,In this study we describe a three - generation family in which two siblings were affected by Duchenne muscular dystrophy ( DMD ) .,O O O O O O O O O O O O O O O O O B I I O B O O,32
1591,822,"Clues from attenuated polyposis , missense germline variants with mild disease and the somatic mutation cluster region ( codons 1 , 250 - 1 , 450 ) indicate , however , that APC mutations might not result in simple loss of protein function .",O O B I O O O O O O O O O O O O O O O O O O O O O O O O O O O O B O O O O O O O O O O O,32
2238,9138,Localization of the region homologous to the Duchenne muscular dystrophy locus on the mouse X chromosome .,O O O O O O O B I I O O O O O O O,13
8349,5739,Patients with familial APC ( FAP ) carry germ - line mutations in the APC gene and develop multiple colorectal adenomas and subsequent carcinomas early in life .,O O B I O B O O O O O O O O B O O O O B I O O B O O O O,13
6133,9905,We further examined the extent and causes of gene loss in this pedigree .,O O O O O O O O O O O O O O,13
898,7215,Another three affected males from the family had similar findings .,O O O O O O O O O O O,13
4119,1320,"Further , Atm - and Bax - dependent apoptosis in the CNS also required caspase - 3 activation .",O O O O O O O O O O O O O O O O O O O,32
9100,1094,The human MAGEL2 gene and its mouse homologue are paternally expressed and mapped to the Prader - Willi region .,O O O O O O O O O O O O O O O B I I O O,32
9361,7602,The genetic defects responsible for most phenylketonuria ( PKU ) and hyperphenylalaninemia ( HPA ) cases are located in the phenylalanine hydroxylase ( PAH ) gene .,O B I O O O B O B O O B O B O O O O O O O O O O O O O,13
417,264,The Pendred syndrome gene encodes a chloride - iodide transport protein .,O B I O O O O O O O O O,32
4363,298,The pathognomonic accumulation of very long chain fatty acids could also be prevented by overexpression of ALDRP in immortalized X - ALD cells .,O O O O O O O O O O O O O O O O O O O O O O O O,32
8551,1647,"The study group consisted of 66 Polish families with cancer who have at least three related females affected with breast or ovarian cancer and who had cancer diagnosed , in at least one of the three affected females , at age < 50 years .",O O O O O O O O O B O O O O O O O O O B I I I O O O B O O O O O O O O O O O O O O O O O O,32
2867,2323,We report the case of a nonsense mutation in a Duchenne patient identified by this approach .,O O O O O O O O O O B O O O O O O,32
7085,10974,"To clarify whether colchicine is excreted in breast milk , and to compare its concentrations in the serum and breast milk of lactating women who have familial Mediterranean fever ( FMF ) .",O O O O O O O O O O O O O O O O O O O O O O O O O O B I I O B O O,13
6916,12502,"Deficiency of the sixth component of human complement ( C6 ) has been reported in a number of families from the western Cape , South Africa .",B I I I I I I I O O O O O O O O O O O O O O O O O O O,39
5364,8252,Localisation of the gene for Norrie disease to between DXS7 and DXS426 on Xp .,O O O O O B I O O O O O O O O,13
7551,4789,A correlation has been demonstrated between the increase in the repeat number of this sequence and the severity of the disease .,O O O O O O O O O O O O O O O O O O O O O O,32
9506,12656,"Conversely , BRCA1 expression was reduced or undetectable in the majority of high - grade , ductal carcinomas , suggesting that absence of BRCA1 may contribute to the pathogenesis of a significant percentage of sporadic breast cancers . .",O O O O O O O O O O O O O O O O B I O O O O O O O O O O O O O O O O B I I O O,39
9757,481,A combination of DNA - binding assays and transcriptional analysis was used to determine the functional consequences of these mutations .,O O O O O O O O O O O O O O O O O O O O O,32
1623,3606,Mouse Dmd mRNA was detectable in skeletal and cardiac muscle and at a level approximately 90 percent lower in brain .,O O O O O O O O O O O O O O O O O O O O O,32
6046,3647,"Single point mutations were also found in G6PD Metaponto ( Southern Italy ) and in G6PD Ilesha ( Nigeria ) , which are asymptomatic , and in G6PD Chatham , which was observed in an Indian boy with neonatal jaundice .",O O O O O O O O O O O O O O O O O O O O O O O O O O O O O O O O O O O O O O B I O,32
9402,7328,The mechanism by which ( CTG ) n expansion in the 3 UTR of the DMPK gene causes myotonic dystrophy ( DM ) is unknown .,O O O O O O O O O O O O O O O O O O B I O B O O O O,13
4176,2987,Our results are compatible with this hypothesis in that the PKU mutation might have occurred in northern Mongoloids and subsequently spread to the Chinese and Japanese populations .,O O O O O O O O O O B O O O O O O O O O O O O O O O O O,32
7126,1302,"Recently , a gene responsible for this disease , designated XLRS1 , was identified , and several deleterious gene mutations were reported .",O O O O O O O O O O O O O O O O O O O O O O O,32
5996,6278,The human genotype - phenotype correlations are consistent with a role for Dp260 in normal retinal electrophysiology and may also reflect the expression of other C - terminal dystrophin isoforms and their contributions to retinal signal transmission . .,O O O O O O O O O O O O O O O O O O O O O O O O O O O O O O O O O O O O O O O,13
5226,3790,Type I von Willebrand disease ( vWD ) is characterized by equally low plasma concentrations of von Willebrand factor antigen ( vWF Ag ) and ristocetin cofactor ( RiCof ) and by the presence of all vWF multimers in sodium dodecyl sulfate ( SDS ) - agarose gel electrophoresis .,B I I I I O B O O O O O O O O O B I O O O O O O O O O O O O O O O O O O O O O O O O O O O O O O O O,32
750,2805,Two new arylsulfatase A ( ARSA ) mutations in a juvenile metachromatic leukodystrophy ( MLD ) patient .,O O O O O O O O O O O B I O B O O O,32
8132,2888,"This second mutation appears to be rare , since it was found only in the patient we sequenced .",O O O O O O O O O O O O O O O O O O O,32
4424,11267,The infertility of ATM - / - mice results from meiotic failure .,O B O O O O O O O O O O O,13
7377,8673,Huntington disease : no evidence for locus heterogeneity .,B I O O O O O O O,13
7970,11600,No additional introns were detected in exons 6 and 10 .,O O O O O O O O O O O,13
9298,1451,BRCA1 exists in nuclear foci but is hyperphosphorylated and disperses after DNA damage .,O O O O O O O O O O O O O O,32
8925,847,The serum transferrin saturation was 45 percent or higher in 15 of the 16 who were homozygous ; in 1 subject it was 43 percent .,O O O O O O O O O O O O O O O O O O O O O O O O O O,32
1154,10517,Deletions and point mutations also affected splice junctions .,O O O O O O O O O,13
986,165,"At the cell surface , HFE complexes with transferrin receptor ( TfR ) , increasing the dissociation constant of transferrin ( Tf ) for its receptor 10 - fold ( Gross , C .",O O O O O O O O O O O O O O O O O O O O O O O O O O O O O O O O O O,32
5489,8769,Homozygous hypobetalipoproteinemia : a disease distinct from abetalipoproproteinemia at the molecular level .,B I O O O O O B O O O O O,13
5324,6129,The human PAX6 gene produces two alternative splice isoforms that have the distinct structure of the paired domain .,O O O O O O O O O O O O O O O O O O O,13
377,12219,Pendred patients in three non - consanguineous families were shown to be compound heterozygotes for L236P and T416P .,B O O O O O O O O O O O O O O O O O O,39
8956,6594,Analysis of genomic DNA from 22 Sit ( a ) - negative normal individuals showed that the Thr ( 799 ) is encoded by ACG ( 2532 ) ( 90 . 9 % ) or ACA ( 2532 ) ( 9 . 1 % ) .,O O O O O O O O O O O O O O O O O O O O O O O O O O O O O O O O O O O O O O O O O O O O O O,13
7233,5584,"Among approximately 200 anonymous Ashkenazi Jewish DNA samples , the MEFV carrier frequency was 21 % , with E148Q the most common mutation .",O O O O O O O O O O O O O O O O O O O O O O O O,13
4930,5747,BRCA1 interacts with components of the histone deacetylase complex .,O O O O O O O O O O,13
1572,11037,"To investigate the role of gene dosage in more detail , we have generated yeast artificial chromosome transgenic mice carrying the human PAX6 locus .",O O O O O O O O O O O O O O O O O O O O O O O O O,13
4850,11537,3 - q21 .,O O O O,13
7040,7725,The mutation introduces a termination codon within exon 8 of the dystrophin gene .,O O O O O O O O O O O O O O,13
1792,12034,"Twenty - eight percent of identified PAX6 mutations are C - T changes at CpG dinucleotides , 20 % are splicing errors , and more than 30 % are deletion or insertion events .",O O O O O O O O O O O O O O O O O O O O O O O O O O O O O O O O O O,39
1254,11925,"Here , it is shown that reintroduction of the wild - type VHL gene restores the ability of VHL - negative RCC cancer cells to exit the cell cycle and enter G0 / quiescence in low serum .",O O O O O O O O O O O O B O O O O O O O O B I O O O O O O O O O O O O O O O,39
7808,1478,"Emerin stayed on the cytoplasmic surface of the nuclear lamina , even after detergent treatment that solubilizes membrane lipids and washes out membrane proteins .",O O O O O O O O O O O O O O O O O O O O O O O O O,32
7292,11928,"We propose that the loss of wild - type VHL gene results in a specific cellular defect in serum - dependent growth control , which may initiate tumor formation .",O O O O O O O O O B O O O O O O O O O O O O O O O O O B O O,39
9649,7749,Chromosome mapping of the rod photoreceptor cGMP phosphodiesterase beta - subunit gene in mouse and human : tight linkage to the Huntington disease region ( 4p16 . 3 ) .,O O O O O O O O O O O O O O O O O O O O O B I O O O O O O O,13
3246,12347,"Her ventricular hypertrophy resolved significantly over 1 year , and cognitively , she is in the superior range for age .",O O O O O O O O O O O O O O O O O O O O O,39
2039,5363,This comparative study confirms that the relative location of the BRCA1 gene has been conserved between mice and humans .,O O O O O O O O O O O O O O O O O O O O,32
7753,8871,"Here we used field inversion gel electrophoresis ( FIGE ) to construct a restriction map of approximately 1 , 000 kb of DNA surrounding the RB1 locus and to detect the translocation breakpoints in three retinoblastoma patients .",O O O O O O O O O O O O O O O O O O O O O O O O O O O O O O O O O O O B O O,13
2687,11486,"Exposure of normal human cells to gamma - irradiation and the radiomimetic drug neocarzinostatin had no effect on ATM protein levels , in contrast to a noted rise in p53 levels over the same time interval .",O O O O O O O O O O O O O O O O O O O O O O O O O O O O O O O O O O O O O,13
2823,886,Genetic analysis and the Cre - loxP system were used to clearly demonstrate that the myoblast fusion defect could be rescued by eliminating the expression of the mutant DMPK 3 - UTR transcript .,O O O O O O O O O O O O O O O O O O O O O O O O O O O O O O O O O O,32
4198,6231,Mxi1 is thought to negatively regulate Myc function and may therefore be a potential tumor suppressor gene .,O O O O O O O O O O O O O O B O O O,13
6915,3637,"Kinetic properties , such as the Km for glucose - 6 - phosphate or for NADP and the relative utilization of substrate analogues , showed no differences between wild types and mutants with the exception of the relative utilization of deamino - NADP which was significantly lower in mutants .",O O O O O O O O O O O O O O O O O O O O O O O O O O O O O O O O O O O O O O O O O O O O O O O O O O,32
3281,5219,"The mutant vWF was processed and secreted normally , and was functionally equivalent to wild - type vWF in its ability to bind to platelets .",O O O O O O O O O O O O O O O O O O O O O O O O O O,32
8072,7462,Analbuminemia in a neonate .,B O O O O,13
4165,8685,88 .,O O,13
5930,8352,No recombinants were identified between APC and either EF5 .,O O O O O O O O O O,13
7701,6451,Most fragile X syndrome patients have expansion of a ( CGG ) ( n ) sequence with > 200 repeats ( full mutation ) in the FMR1 gene responsible for this condition .,O B I I O O O O O O O O O O O O O O O O O O O O O O O O O O O O O,13
1543,7922,Cytogenetic studies support the presence of a DGS critical region in band 22q11 .,O O O O O O O B O O O O O O,13
5774,3435,07 .,O O,32
491,6829,These findings establish that some neuropathological abnormalities seen in A - T patients also are present in Atm mutant mice .,O O O O O B I O O B I I O O O O O O O O O,13
7860,12282,"The follow - up observation of an identical and unique pattern of progressive bone dysplasia in the two patients ( one with SJS type 2 , one with SWS ) surviving beyond infancy adds to the evidence in favor of identity .",O O O O O O O O O O O O O B I O O O O O O O B I I O O O B O O O O O O O O O O O O O,39
1303,5371,Haplotype and phenotype analysis of six recurrent BRCA1 mutations in 61 families : results of an international study .,O O O O O O O O O O O O O O O O O O O,32
2294,8708,The data presented here cannot determine whether DM is proximal or distal to CKMM .,O O O O O O O B O O O O O O O,13
6757,1173,In two of these families we used a functional assay to demonstrate an almost total loss of cathepsin C activity in PLS patients and reduced activity in obligate carriers .,O O O O O O O O O O O O O O O O O O O O O B O O O O O O O O,32
2455,8666,Haplotype analysis of the phenylalanine hydroxylase gene in Turkish phenylketonuria families .,O O O O O O O O O B O O,13
7777,12632,"METHODS The APC gene was analysed in 190 unrelated FAP and 15 non - FAP colorectal cancer patients using denaturing gradient gel electrophoresis , the protein truncation test , and direct sequencing .",O O B O O O O O O B O O O O O B I O O O O O O O O O O O O O O O O,39
8921,137,7 % ( 20 / 300 ) .,O O O O O O O O,32
4530,3820,"On investigation of the patients family , two sisters were found to have the same deficiency but were otherwise in good health .",O O O O O O O O O O O O O O O O O O O O O O O,32
5983,11865,Low levels of beta hexosaminidase A in healthy individuals with apparent deficiency of this enzyme .,O O O O O O O O O O O O O O O O,39
