Unnamed: 0.1,Unnamed: 0,text,labels,txt_len
4056,2044,"Of these four rearrangements , one resulted in the deletion of exons 11 and 12 and two others resulted in either complete or partial deletion of exon 14 .",O O O O O O O O O O O O O O O O O O O O O O O O O O O O O,32
7729,2111,"The incidence of ovarian , gastric , and biliary system carcinomas and of leukemia and lymphoma was increased in these A - T families .",O O O B I I I I I I I O O B O B O O O O B I I O O,32
3397,172,"Therefore , HFE appears to reduce cellular acquisition of iron from Tf within endocytic compartments .",O O O O O O O O O O O O O O O O,32
3778,11586,"Alleles positively associated with IDDM in INS region were the same as those positively - associated with IDDM in Caucasian population , although positively - associated alleles are very common ( allele frequencies > 0 . 9 ) in the Japanese general population .",O O O O B O O O O O O O O O O O O B O O O O O O O O O O O O O O O O O O O O O O O O O O,13
2125,11652,"On all D - 2 alleles N314D occurred in cis with two intronic sequence changes , on the D - 1 alleles in cis with a neutral mutation in exon 7 .",O O O O O O O O O O O O O O O O O O O O O O O O O O O O O O O O,13
6307,12644,5 - 1 .,O O O O,39
6699,9820,Mitochondrial very - long - chain acyl - coenzyme A dehydrogenase ( VLCAD ) was purified from human liver .,O O O O O O O O O O O O O O O O O O O O,13
7590,5838,"Expression of FMRP in hair roots was studied by use of an FMRP - specific antibody test , and the percentage of FMRP - expressing hair roots in controls and in male fragile X patients was determined .",O O O O O O O O O O O O O O O O O O O O O O O O O O O O O O O O B I O O O O,13
5972,2159,"28 , serves as a flanking marker centromeric to the disease gene .",O O O O O O O O O O O O O,32
4138,8549,A 47 - year - old woman with paroxysmal nocturnal haemoglobinuria ( PNH ) was found to have an inherited deficiency in the ninth complement component ( C9 ) .,O O O O O O O O B I I O B O O O O O O B I I I I I I O O O O,13
4819,8617,A normal male with an inherited deletion of one exon within the DMD gene .,O O O O O O O O O O O O B O O,13
5570,6865,"However , the C - terminal end of the putative protein differs strongly from the published human sequence .",O O O O O O O O O O O O O O O O O O O,13
6116,11984,"The gene product , a member of the major histocompatibility complex class I - like family , was found to have a mutation , Cys - 282 - - > Tyr ( C282Y ) , in 85 % of patient chromosomes .",O O O O O O O O O O O O O O O O O O O O O O O O O O O O O O O O O O O O O O O O O O,39
158,2378,5 - kb mRNA that also is transcribed from the DMD gene .,O O O O O O O O O O B O O,32
7102,12355,"Both human and mouse LRP5 cDNAs have been isolated and the encoded mature proteins are 95 % identical , indicating a high degree of evolutionary conservation . .",O O O O O O O O O O O O O O O O O O O O O O O O O O O O,39
7677,6342,In order to investigate the molecular basis for argininemia in four unrelated Portuguese patients ( two from northern Portugal and two from Madeira Island ) we performed a DNA sequence analysis of all the exons and exon / intron boundaries of the liver - type arginase gene ( ARG1 ) .,O O O O O O O O B O O O O O O O O O O O O O O O O O O O O O O O O O O O O O O O O O O O O O O O O O O,13
8047,234,"One family is homozygous , three families are compound heterozygotes , and two families are heterozygous but with no other mutation detected .",O O O O O O O O O O O O O O O O O O O O O O O,32
8354,1227,The observation of the same APC mutation in five families from the same geographic area demonstrates a founder effect .,O O O O O B O O O O O O O O O O O O O O,32
693,9253,"In 19 of 30 family members , levels of hemolytic C5 ranged from 13 to 64 per cent of normal .",O O O O O O O O O O O O O O O O O O O O O,13
5731,371,Van der Woude syndrome ( VWS ) is an autosomal dominant disorder comprising cleft lip and / or cleft palate and lip pits .,B I I I O B O O O B I I O B I O O O B I O B I O,32
3466,3030,The maximal lod score for linkage of the ALD / AMN gene and the multiallelic anonymous DNA marker at DXS52 was 3 .,O O O O O O O O B O B O O O O O O O O O O O O,32
3267,9130,These findings should be taken into consideration when counseling families in which cases with clinically expressed ALD are represented in several generations . .,O O O O O O O O O O O O O O O O B O O O O O O O,13
3677,5850,"The evidence of linkage to this region originated almost exclusively from the subset of 12 early - onset ( age < 65 years ) families , which yielded a maximum LOD score of 2 .",O O O O O O O O O O O O O O O O O O O O O O O O O O O O O O O O O O O,13
5560,8660,We have determined the parental origin of the retained allele in nine retinoblastoma tumours from eight unrelated non - familial cases by using RB1 - linked genetic markers .,O O O O O O O O O O O O B I O O O O O O O O O O O O O O O,13
4155,8371,Two other Mexican males with G6PD deficiency were found to have the same mutation .,O O O O O B I O O O O O O O O,13
2786,2708,"Interestingly , the 487 G - - - - A and 493 A - - - - G mutations create Alu I and Ava II recognition sites , respectively , which enabled us to rapidly detect these two mutations by PCR / restriction enzyme ( RE ) digestion method .",O O O O O O O O O O O O O O O O O O O O O O O O O O O O O O O O O O O O O O O O O O O O O O O O O O,32
9306,11613,Mutations in the arginine - rich protein gene ( ARP ) in pancreatic cancer .,O O O O O O O O O O O O B I O,13
6910,12243,"The observed phenotype matched the predicted phenotype in 79 % of the cases , and in only 5 of 184 patients was the observed phenotype more than one category away from that expected .",O O O O O O O O O O O O O O O O O O O O O O O O O O O O O O O O O O,39
53,5638,"BACKGROUND X - linked adrenoleukodystrophy ( ALD ) is an inherited disease characterized by progressive neurologic dysfunction , occasionally associated with adrenal insufficiency .",O B I I I O B O O O B I O O O B I O O O O B I O,13
9940,6033,Both the occurrence of CL / P and CP within the same genealogy and a recurrence risk < 40 % for CP among descendants with VWS have suggested that the development of clefts in this syndrome is influenced by modifying genes at other loci .,O O O O B I I O B O O O O O O O O O O O O B O O O B O O O O O O B O O O O O O O O O O O O,13
3182,9812,"Numerous haplotypes , not previously described in Europeans , were , however , found .",O O O O O O O O O O O O O O O,13
407,2904,"006 g / ml lipoprotein fraction , in both the postprandial and postabsorptive state , are bimodally distributed .",O O O O O O O O O O O O O O O O O O O,32
7585,1140,The results suggest that the two syndromes originate from the same WT1 gene abnormality .,O O O O O O O O O O O B I I O,32
6795,3122,"D2 / nSnJ , were analyzed .",O O O O O O O,32
251,7878,"A candidate Wilms tumor gene , WT1 , from the 11p13 chromosome region has recently been cloned .",O O B I O O O O O O O O O O O O O O,13
4793,7655,Characterization of the DM region of both species reveals another active gene ( DMR - N9 ) in close proximity to the kinase gene .,O O O B O O O O O O O O O O O O O O O O O O O O O,13
8003,6652,We report on a 4 - year - old boy with Knobloch syndrome .,O O O O O O O O O O O B I O,13
1902,5069,"In the present report , 66 hemochromatosis families yielding 151 hemochromatosis chromosomes and 182 normal chromosomes were RFLP - typed with a battery of probes , including two newly derived polymorphic markers from the 6 .",O O O O O O B O O O B O O O O O O O O O O O O O O O O O O O O O O O O O,32
2753,8216,"A collection of DNA samples from known or suspected MLD patients , members of their families , and normal controls was screened for these mutations .",O O O O O O O O O B O O O O O O O O O O O O O O O O,13
514,2131,Deletion of the KIT and PDGFRA genes in a patient with piebaldism .,O O O O O O O O O O O B O,32
2548,1511,"To date gene loci have been identified in at least six autosomal dominant forms , i . e . , in idiopathic torsion dystonia ( 9q34 ) , focal dystonia ( 18p ) , adult - onset idiopathic torsion dystonia of mixed type ( 8p21 - q22 ) , dopa - responsive dystonia ( 14q22 . 1 - q22 . 2 ) , and paroxysmal dystonic choreoathetosis ( 2q25 - q33 ; 1p21 - p13 . 3 ) .",O O O O O O O O O O O O O O O O O O O O O B I I O O O O B I O O O O O O O B I I O O O O O O O O O B I I I O O O O O O O O O O O B I I O O O O O O O O O O O O,32
485,1437,The mutations 2871delC and R778L have been previously reported in a relatively large number of Japanese patients .,O O O O O O O O O O O O O O O O O O,32
9144,2984,"8 % of northern Chinese and 27 % of Japanese PKU alleles , but it is rare in southern Chinese ( 2 . 2 % ) and is absent in the Caucasian population .",O O O O O O O O O O B O O O O O O O O O O O O O O O O O O O O O O O,32
6014,11926,Both VHL - positive and VHL - negative RCC cells exit the cell cycle by contact inhibition .,O O O O O O O O B O O O O O O O O O,39
456,10788,Emerin deficiency at the nuclear membrane in patients with Emery - Dreifuss muscular dystrophy .,B I O O O O O O O B I I I I O,13
4279,799,"We show that organs which develop pathologic changes in the Atm - deficient mice are targets of oxidative damage , and that cerebellar Purkinje cells are particularly affected .",O O O O O O O O O O O O O O O O O O O O O O O O O O O O O,32
4666,12587,"Here we present four novel PAX6 missense mutations , two in association with atypical phenotypes ectopia pupillae ( displaced pupils ) and congenital nystagmus ( searching gaze ) , and two in association with more recognizable aniridia phenotypes .",O O O O O O O O O O O O O O O B I O B I O O B I O B I O O O O O O O O O B O O,39
6529,3862,5 % and classified into four groups .,O O O O O O O O,32
2272,7714,Mutations in the candidate gene for Norrie disease .,O O O O O O B I O,13
4887,69,3 and is composed of at least seven exons .,O O O O O O O O O O,32
7209,8567,RFLP and quantitative Southern blot analyses revealed a grandpaternal origin of duplication in four families and grandmaternal origin in one family .,O O O O O O O O O O O O O O O O O O O O O O,13
4555,11961,"The phenotypes and genotypes in one of these three families showed the father to be hypohaptoglobinemic ( Hp2 ) and Hp2 / Hpdel , the mother to be Hp2 - 1 and Hp1 / Hp2 , one of the two children to be hypohaptoglobinemic ( Hp2 ) and Hp2 / Hpdel , and the other child to be Hp1 and Hp1 / Hpdel , showing an anomalous inheritance of Hp phenotypes in the child with Hp1 .",O O O O O O O O O O O O O O O B O O O O O O O O O O O O O O O O O O O O O O O O O O O B O O O O O O O O O O O O O O O O O O O O O O O O O O O O O O O O O,39
478,3595,SLS represents the first inherited disorder in man associated with an isolated abnormality in fatty alcohol metabolism . .,B O O O B I O O O O O O B I I I I O O,32
3480,9847,"We have cloned and sequenced the human cDNA homologue ( PTS1R ) of the Pichia pastoris PAS8 gene , the PTS1 receptor ( McCollum , D . , E . Monosov , and S . Subramani . 1993 . J . Cell Biol . 121 761 - 774 ) .",O O O O O O O O O O O O O O O O O O O O O O O O O O O O O O O O O O O O O O O O O O O O O O O O O O,13
9511,10524,"In this paper we describe four additional PAX6 point mutations in aniridia patients , both sporadic and familial .",O O O O O O O O O O O B O O O O O O O,13
3295,2557,Chromosome analysis of amniocytes obtained at 15 wk was normal in over 100 cells studied .,O O O O O O O O O O O O O O O O,32
5424,7891,"Here , Luria and Delbrucks classical methods for analysing bacterial cultures are adapted to the study of human isolated founder populations in order to estimate ( i ) the recombination fraction between a disease locus and a marker ; ( ii ) the expected degree of allelic homogeneity in a population ; and ( iii ) the mutation rate of marker loci .",O O O O O O O O O O O O O O O O O O O O O O O O O O O O O O O O O O O O O O O O O O O O O O O O O O O O O O O O O O O O O O O,13
4280,8590,"In 216 Ashkenazi carriers identified by the enzyme test , DNA analysis showed that 177 ( 82 percent ) had one of the identified mutations .",O O O O O O O O O O O O O O O O O O O O O O O O O O,13
6361,11063,The small nuclear ribonucleoprotein polypeptide N ( SNRPN ) gene is regarded as one of the candidates for Prader - Willi syndrome ( PWS ) .,O O O O O O O O O O O O O O O O O O B I I I O B O O,13
4251,10189,"Myotonic dystrophy ( DM ) is a progressive neuromuscular disorder which results from elongations of an unstable ( CTG ) n repeat , located in the 3 untranslated region of the DM gene .",B I O B O O O O B I O O O O O O O O O O O O O O O O O O O O O B O O,13
3753,11533,The positions of 122 conserved amino acids could be determined by multiple sequence alignment .,O O O O O O O O O O O O O O O,13
2993,6127,The gene encodes a transcriptional regulator that recognizes target genes through its paired - type DNA - binding domain .,O O O O O O O O O O O O O O O O O O O O,13
9334,7149,"MAIN OUTCOME MEASURES Age at diagnosis , surgical stage , histologic cell type and grade , and surgical outcome ; and response to chemotherapy and survival for advanced - stage ( II and IV ) cases .",O O O O O O O O O O O O O O O O O O O O O O O O O O O O O O O O O O O O O,13
5070,2749,"In ten independent cases of Denys - Drash syndrome , point mutations in the zinc finger domains of one WT1 gene copy were found .",O O O O O B I I I O O O O O O O O O O O O O O O O,32
6801,2546,In the second family the mutation in codon 675 is a G - - - - T transversion that converts a glutamine ( GAA ) to a stop ( TAA ) codon .,O O O O O O O O O O O O O O O O O O O O O O O O O O O O O O O O O,32
9669,5935,CONCLUSIONS The incidence of each of the germline mutations in these prostate cancer patients closely matched their incidence ( about 1 % ) in the general Ashkenazi Jewish population .,O O O O O O O O O O O B I O O O O O O O O O O O O O O O O O,13
8104,8448,Adrenoleukodystrophy and adrenomyeloneuropathy associated with partial adrenal insufficiency in three generations of a kindred .,B O B O O O B I O O O O O O O,13
6498,4685,"In all of 7 patients , the progression of disease was arrested , but dramatic effects on clinical manifestations , xanthoma , and electrophysiological findings could not be found after the treatment of these drugs",O O O O O O O O O O O O O O O O O O O O B O O O O O O O O O O O O O O,32
3948,4661,Genetic determinants of HDL cholesterol ( HDL - C ) levels in the general population are poorly understood .,O O O O O O O O O O O O O O O O O O O,32
9335,3103,6 % .,O O O,32
1580,4959,The son had onset of macular degeneration at age 44 years .,O O O O O B I O O O O O,32
2430,8608,Glucose - 6 - phosphate dehydrogenase ( G6PD ; E . C . 1 . 1 . 1 . 49 ) deficiency is the most common human enzymopathy ; more than 300 different biochemical variants of the enzyme have been described .,B I I I I I I I I I I I I I I I I I I I I I O O O O O B O O O O O O O O O O O O O O,13
5097,6632,The gene for Alstrom syndrome ( ALMS1 ) has been previously localized to human chromosome 2p13 by homozygosity mapping in two distinct isolated populations - French Acadian and North African .,O O O B I O O O O O O O O O O O O O O O O O O O O O O O O O O,13
4667,1124,"Finally , an extensive phenotyping of primary and secondary lymphoid organs including the gut provides no compelling evidence for an obvious immune - linked function for HFE . .",O O O O O O O O O O O O O O O O O O O O O O O O O O O O O,32
6673,6980,These studies will not only help to illuminate the molecular basis of the general class of human diseases with trinucleotide repeat expansion but also provide an avenue to understand aspects of human cognition and intelligence . .,O O O O O O O O O O O O O O O O O O O O O O O O O O O O O O O O O O O O O,13
9567,6597,Polymerase chain reaction - restriction fragment length polymorphism analysis on DNA derived from 100 donors using the restriction enzyme Mae III showed that the Met ( 799 ) form of GPIa is restricted to Sit ( a ) ( + ) phenotype .,O O O O O O O O O O O O O O O O O O O O O O O O O O O O O O O O O O O O O O O O O O O,13
1962,3196,The high density lipoprotein - cholesterol levels of the probands exceeded 150 mg / dl .,O O O O O O O O O O O O O O O O,32
3872,9792,Comparison of 940 - bp sequence 5 to the putative translation start site reveals a highly conserved region ( 78 . 8 % nucleotide identity ) between Hdh and the HD gene from nucleotide - 56 to - 206 ( of Hdh ) .,O O O O O O O O O O O O O O O O O O O O O O O O O O O O O O B O O O O O O O O O O O O O,13
3066,7855,We present here a pedigree of a 31 - year - old C2 - deficient individual with clinical manifestations of Hodgkins disease .,O O O O O O O O O O O O B I I O O O O O B I O,13
7317,11676,This implies that the irradiation - induced atm and p53 apoptotic pathways are not completely congruent .,O O O O O O O O O O O O O O O O O,13
6285,10200,This implies a size - and sex - dependent meiotic instability .,O O O O O O O O O O O O,13
1012,8431,The maximal lod score for linkage of the ALD / AMN gene and the multiallelic anonymous DNA marker at DXS52 was 3 .,O O O O O O O O B O B O O O O O O O O O O O O,13
487,9037,"The mutation does not affect the electrophoretic migration , the isoelectric point , or the thermal stability .",O O O O O O O O O O O O O O O O O O,13
1713,3305,This is confirmed by other recombinants where DM segregates with distal probes .,O O O O O O O B O O O O O,32
3229,11761,C5 was undetectable in her serum by both immunodiffusion and hemolytic assays .,O O O O O O O O O O O O O,39
7144,7077,"The grandmother of the cousins is deceased and not available for study , and their grandfather is not deleted for SNRPN .",O O O O O O O O O O O O O O O O O O O O O O,13
788,3633,The activity alteration was detected in blood but can also be observed in other tissue extracts .,O O O O O O O O O O O O O O O O O,32
1424,9685,Mucopolysaccharidosis IVA ( MPS IVA ) is an autosomal recessive disorder caused by a deficiency in N - acetylgalactosamine - 6 - sulfatase ( GALNS ) .,B I O B I O O O B I I O O O B I I I I I I I I O O O O,13
1773,1694,Structural information of GLDC and psiGLDC should facilitate the molecular analysis of NKH .,O O O O O O O O O O O O B O,32
9946,12470,Two altered Dp71 transcripts and two deleted Dp140 DNA sequences were found in four patients with severe cerebral dysfunction .,O O O O O O O O O O O O O O O O O B I O,39
3527,5387,Emerin deficiency at the nuclear membrane in patients with Emery - Dreifuss muscular dystrophy .,B I O O O O O O O B I I I I O,32
1822,8346,62 - APC - EF5 62 - APC - EF5 .,O O O O O O O O O O O,13
2668,10131,5 % of the activity expressed by the wild - type enzyme .,O O O O O O O O O O O O O,13
6099,5898,We generated mice in which two loxP sites flank part of Piga exon 2 .,O O O O O O O O O O O O O O O,13
9592,12251,The trinucleotide repeat instability mechanisms involved in DM and other human genetic diseases are unknown .,O O O O O O O B O O O B I O O O,39
5131,578,"In vitro expression results are discrepant , but some individuals carrying S135L appear to exhibit GALT activity in some tissues .",O O O O O O O O O O O O O O O O O O O O O,32
8966,883,"Our data show that a mutant DMPK 3 - UTR , with as few as 57 CTGs , had a negative cis effect on protein expression and resulted in the aggregation of reporter transcripts into discrete nuclear foci .",O O O O O O O O O O O O O O O O O O O O O O O O O O O O O O O O O O O O O O O,32
517,2200,Two missense mutations causing mild hyperphenylalaninemia associated with DNA haplotype 12 .,O O O O O B O O O O O O,32
614,4657,"Here , using an interspecific backcross , we have mapped both Hdh and the mouse homologue of human alpha - adducin ( Add1 ) , a membrane - associated cytoskeletal protein gene .",O O O O O O O O O O O O O O O O O O O O O O O O O O O O O O O O O,32
4911,1692,These results suggest a large homozygous deletion ( at least 30 kb ) in the patient .,O O O O O O O O O O O O O O O O O,32
4021,1371,"Twenty - eight index patients with protein S deficiency and a PROS1 gene defect were studied , together with 109 first - degree relatives .",O O O O O O B I I O O B I I O O O O O O O O O O O,32
5367,2093,Prenatal diagnosis of Wolman disease .,O O O B I O,32
2249,10840,To determine the molecular basis of Type II deficiency the two Type II C2Q0 genes were isolated and transfected separately into L - cells .,O O O O O O B I I O O O O O O O O O O O O O O O O,13
3039,1467,The mature transcript is approximately 6 kb in length .,O O O O O O O O O O,32
7756,7906,It is flanked by the tightly linked genetic markers ERCC1 proximally and D19S51 distally ; these define the DM critical region .,O O O O O O O O O O O O O O O O O O B O O O,13
9519,1343,A high percentage of ATM germline mutations was demonstrated among patients with sporadic breast cancer .,O O O O O O O O O O O O B I I O,32
5220,6297,We suggest that Coats telangiectasis is secondary to somatic mutation in the NDP gene which results in a deficiency of norrin ( the protein product of the NDP gene ) within the developing retina .,O O O B I O O O O O O O O O O O O O B I I O O O O O O O O O O O O O O,13
946,6310,The gene alterations in TP53 and P16INK4A genes may be used as tumor markers in our family . .,O O O O O O O O O O O O B O O O O O O,13
3239,5728,"The mutational spectrum included five missense mutations ( C202W , C223G , N224D , R301Q , and Q327K ) and one splice - site mutation [ IVS3 G ( - 1 ) - - > C ] .",O O O O O O O O O O O O O O O O O O O O O O O O O O O O O O O O O O O O O O,13
132,6853,It is not known whether BRCA1 phosphorylation and dispersion and its function in DNA damage response are related .,O O O O O O O O O O O O O O O O O O O,13
4590,281,8 % of HH chromosomes that were neither C282Y nor H63D .,O O O B O O O O O O O O,32
5151,7053,All but one of the mutations were detected within the BRCA1 gene .,O O O O O O O O O O O O O,13
5167,4506,"Out of the 46 at risk subjects in the two youngest generations , only one was found to have a full mutation .",O O O O O O O O O O O O O O O O O O O O O O O,32
9136,11899,Aspartylglucosaminuria ( AGU ) is a rare disorder of glycoprotein metabolism caused by the deficiency of the lysosomal enzyme aspartylglucosaminidase ( AGA ) .,B O B O O O O B I I I O O O B I I I I I O O O O,39
7167,1178,The aim of this study is to refine the localization of the VWS gene and to further assess possible heterogeneity .,O O O O O O O O O O O O B O O O O O O O O,32
2834,12115,"Four mutations - - R778L , A874V , L1083F , and 2304delC - - in the copper - transporting enzyme , P - type ATPase ( ATP7B ) , were identified in Korean Patients with Wilson disease .",O O O O O O O O O O O O O O O O O O O O O O O O O O O O O O O O O O O B I O,39
8023,171,"Using a HeLa cell line in which the expression of HFE is controlled by tetracycline , we show that the expression of HFE reduces 55Fe uptake from Tf by 33 % but does not affect the endocytic or exocytic rates of TfR cycling .",O O O O O O O O O O O O O O O O O O O O O O O O O O O O O O O O O O O O O O O O O O O O,32
4437,5037,08 + / - 0 .,O O O O O O,32
6345,2802,"Also , two unusual cases of CLL with BCL1 rearrangement overexpressed PRAD1 , in contrast to five CLL controls .",O O O O O O O O O O O O O O O O O O O O,32
4720,10209,High residual arylsulfatase A ( ARSA ) activity in a patient with late - infantile metachromatic leukodystrophy .,O O O O O O O O O O O O B I I I I O,13
3735,9062,Regional localization of polymorphic DNA loci on the proximal long arm of the X chromosome using deletions associated with choroideremia .,O O O O O O O O O O O O O O O O O O O B O,13
7878,9184,"To define the regional map position of the disease locus and the PAH gene on human chromosome 12 , DNA was isolated from human - hamster somatic cell hybrids with various deletions of human chromosome 12 and was analyzed by Southern blot analysis using the human cDNA PAH clone as a hybridization probe .",O O O O O O O O O O O O O O O O O O O O O O O O O O O O O O O O O O O O O O O O O O O O O O O O O O O O O O,13
590,9049,"In G6PD "" Matera , "" which is now known to be the same as G6PD A - , two separate point mutations were found , one of which is the same as in G6PD A .",O O O O O O O O O O O O O O O O O O O O O O O O O O O O O O O O O O O O O,13
8814,265,Pendred syndrome is the most common form of syndromic deafness and characterized by congenital sensorineural hearing loss and goitre .,B I O O O O O O B I O O O O B I I O B O,32
6484,5038,"27 d ( controls 4 . 74 + / - 0 . 65 days ) ; however , the residence time of apoA - II was even shorter at 1 .",O O O O O O O O O O O O O O O O O O O O O O O O O O O O O O O,32
8250,5562,R .,O O,13
5837,5073,"The zone of linkage disequilibrium is flanked by the i97 locus , positioned 30 kb proximal to i82 , and the HLA - F gene , found 250 kb distal to HLA - A , markers of which display no significant association with HFE .",O O O O O O O O O O O O O O O O O O O O O O O O O O O O O O O O O O O O O O O O O O O O O,32
6943,7546,The probability that a mutation will cause disease tends to be higher when the missense mutation is within a functionally important sequence . .,O O O O O O O O O O O O O O O O O O O O O O O O,13
9837,4596,"The heterogeneity of mutations , coupled with the large size of the gene , indicates that clinical application of BRCA1 mutation testing will be technically challenging . .",O O O O O O O O O O O O O O O O O O O O O O O O O O O O,32
