Unnamed: 0.1,Unnamed: 0,text,labels,txt_len
3207,5277,Two of the mutations and three of the rare sequence variants were found among the 39 women who reported no family history of breast or ovarian cancer .,O O O O O O O O O O O O O O O O O O O O O O O B I I I O,32
9510,9447,"The enzymatic characteristics were examined when he was 5 years old , and his G6PD showed faster - than - normal electrophoretic mobility , low Km G6P , high Km NADP , low Ki NADPH , normal utilization of substrate analogues , heat instability , and a normal pH optimum curve .",O O O O O O O O O O O O O O O O O O O O O O O O O O O O O O O O O O O O O O O O O O O O O O O O O O O O,13
2503,1696,"Prader - Willi syndrome ( PWS ) is a neurogenetic disease characterized by infantile hypotonia , gonadal hypoplasia , obsessive behaviour and neonatal feeding difficulties followed by hyperphagia , leading to profound obesity .",B I I I O B O O O B I O O B I O B I O O O O O O O O O B O O O O B O,32
20,6580,We analyzed four multiplex VWS families .,O O O O B O O,13
8334,3329,This establishes CKMM as a useful marker for myotonic dystrophy,O O O O O O O O B I,32
5403,6990,"Thus , abnormalities in extracellular matrix synthesis or organization may contribute to development of the ocular phenotypes .",O O O O O O O O O O O O O O O O O O,13
8873,3098,Genetic heterogeneity at the glucose - 6 - phosphate dehydrogenase locus in southern Italy : a study on a population from the Matera district .,O O O O O O O O O O O O O O O O O O O O O O O O O,32
6165,3562,"Properdin factor B was 702 ( normal 175 to 275 ) mug / ml , and was not cleaver upon addition of zymosan or cobra venom factor .",O O O O O O O O O O O O O O O O O O O O O O O O O O O O,32
2615,8412,Localization of histidase to human chromosome region 12q22 - - - - q24 . 1 and mouse chromosome region 10C2 - - - - D1 .,O O O O O O O O O O O O O O O O O O O O O O O O O O,13
7642,1175,Van der Woude syndrome ( VWS ) is an autosomal dominant craniofacial disorder with high penetrance and variable expression .,B I I I O B O O O B I I I O O O O O O O,32
4918,3286,Haplotype and multipoint linkage analysis in Finnish choroideremia families .,O O O O O O O B O O,32
7542,11765,"C5 levels of other family members were either normal or approximately half - normal , consistent with autosomal codominant inheritance of the gene determining C5 deficiency .",O O O O O O O O O O O O O O O O O O O O O O O O B I O,39
2894,608,"Proteolipoprotein gene analysis in 82 patients with sporadic Pelizaeus - Merzbacher Disease : duplications , the major cause of the disease , originate more frequently in male germ cells , but point mutations do not .",O O O O O O O O B I I I O O O O O O O O O O O O O O O O O O O O O O O O,32
7977,10869,"To evaluate this prevalence , we performed biochemical analysis of very long chain fatty acids in 14 male patients ( age ranging from 12 - 45 yr at diagnosis ) previously diagnosed as having primary idiopathic adrenocortical insufficiency .",O O O O O O O O O O O O O O O O O O O O O O O O O O O O O O O O O O O O B I O,13
3229,11761,C5 was undetectable in her serum by both immunodiffusion and hemolytic assays .,O O O O O O O O O O O O O,39
435,6707,RESULTS Point mutations in the XLRS1 gene were identified in all 10 patients .,O O O O O O O O O O O O O O,13
9374,11501,"It differs from this and both the classical and connatal forms of PMD in that it is relatively mild in form , onset is delayed beyond age 2 years , nystagmus is absent , tremors are prominent , mental retardation is not severe , some patients show dementia or personality disorders , the disease is progressive rather than static in some , and several females show signs of disease .",O O O O O O O O O O O O B O O O O O O O O O O O O O O O O O B O O O B O O O B I O O O O O O O B O B I O O O O O O O O O O O O O O O O O O O,13
1929,11819,The identification of the second mutational event in 10 ( 43 % ) tumors establishes PTEN / MMAC1 as a main inactivation target of 10q loss in sporadic prostate cancer . .,O O O O O O O O O O O O O B O O O O O O O O O O O O O B I I O O,39
9682,668,The sample sizes were large enough for statistical testing in four groups with at least one mutation that completely abolishes enzyme activity .,O O O O O O O O O O O O O O O O O O O O O O O,32
3411,3251,"Considerable genetic continuity was demonstrated between these widely dispersed populations , since three common haplotypes ( 4 , 1 , and 7 ) constituted over 95 % of alleles .",O O O O O O O O O O O O O O O O O O O O O O O O O O O O O O,32
3758,7970,04 04 .,O O O,13
4206,8887,We have now used DNA polymorphisms associated with the AAT gene to investigate the origin of the PI Z allele .,O O O O O O O O O O O O O O O O O O O O O,13
4647,4605,The mutation causing myotonic dystrophy ( DM ) has been identified as an amplification of an unstable trinucleotide ( CTG ) n repeat in over 99 % of the global DM population .,O O O B I O B O O O O O O O O O O O O O O O O O O O O O O O B O O,32
9037,10292,Huntington disease ( HD ) has been shown to be associated with an expanded CAG repeat within a novel gene on 4p16 .,B I O B O O O O O O O O O O O O O O O O O O O,13
3980,6892,Glycerol as a correlate of impaired glucose tolerance : dissection of a complex system by use of a simple genetic trait .,O O O O O B I I O O O O O O O O O O O O O O,13
3605,5165,"Combining our data with the consensus genetic map of the proximal short arm of the X chromosome , we propose the physical order Xcen - DXS14 - DXS255 - ( DXS426 , TIMP ) - ( DXS742 - ( [ MAOB - MAOA - DXS7 ] , NDP ) - DXS77 - DXS228 ) - DXS209 - DXS148 - DXS196 - + + + Xpter .",O O O O O O O O O O O O O O O O O O O O O O O O O O O O O O O O O O O O O O O O O O O O O O O O O O O O O O O O O O O O O O O O O O,32
7749,10565,"This novel sequence , cpXr318 ( DXS742 ) , detects a new submicroscopic deletion interval at the Norrie disease locus ( NDP ) .",O O O O O O O O O O O O O O O O O B I O O O O O,13
8924,6407,"Chromosomal analysis was normal ( 46 , XY ) .",O O O O O O O O O O,13
2369,1794,"Isolation , genomic organization , and expression analysis of the mouse and rat homologs of MEFV , the gene for familial mediterranean fever .",O O O O O O O O O O O O O O O O O O O O B I I O,32
5622,3867,"The other variant was G6PD Ube , which we had previously found in Yamaguchi ( Nakashima et al . , 1977 ) .",O O O O O O O O O O O O O O O O O O O O O O O,32
8490,8268,"The breakpoints in the present case and in 3 previously reported 5q - patients with adenomatous polyposis coli suggest that the gene responsible for GS / or familial polyposis coli ( FPC ) is in the 5q22 region , a result consistent with the findings of linkage studies",O O O O O O O O O O O O O O O B I I O O O O O O B O O B I I O B O O O O O O O O O O O O O O O O,13
2312,6071,RESULTS The biochemical phenotype predicted from the genotype in functionally hemizygous patients was related significantly to the assigned phenylalanine level .,O O O O O O O O O O O O O O O O O O O O O,13
8086,3939,They distribute by gene drift supported by natural selection .,O O O O O O O O O O,32
6276,8391,The consequent severe diarrhoea and dehydration are usually fatal unless these sugars are eliminated from the diet .,O O O B O B O O O O O O O O O O O O,13
8444,3636,"The mutation does not affect the electrophoretic migration , the isoelectric point , or the thermal stability .",O O O O O O O O O O O O O O O O O O,32
390,10488,"The DNA sequence in the 5 region of the gene has features of a CpG - rich island and lacks canonical promoter elements , such as TATA and CCAAT consensus sequences .",O O O O O O O O O O O O O O O O O O O O O O O O O O O O O O O O,13
4309,10111,We have assembled a cosmid contig of 360 kb that encompasses the McLeod gene locus .,O O O O O O O O O O O O B O O O,13
851,4579,We used SSCP to analyze an amplified genomic DNA fragment containing exon 12 from seven individuals with Kniest dysplasia .,O O O O O O O O O O O O O O O O O B I O,32
5804,8980,"The second group was comprised of a family in which there was a complete heterozygous deletion of the vWF gene in the proband and one asymptomatic parent , suggesting that a different type of genetic abnormality was inherited from the other parent .",O O O O O O O O O O O O O O O O O O O O O O O O O O O O O O O O O O B I O O O O O O O,13
8311,4824,This is consistent with the very low ARSA activity measured in these patients and their uniformly severe clinical presentation,O O O O O O O O O O O O O O O O O O O,32
4795,10804,"However , the function of the BRCA1 protein has remained elusive .",O O O O O O O O O O O O,13
3911,7845,"The mother , who has aniridia , was also found to carry a deletion including both the aniridia candidate gene ( AN2 ) and the Wilms tumor predisposition gene ( WT1 ) .",O O O O O B O O O O O O O O O O O B O O O O O O O B I O O O O O O,13
8464,5796,6 6 .,O O O,13
3881,9967,The PD mutation is frequent in all populations .,O O O O O O O O O,13
15,1942,"X - linked retinoschisis is characterized by microcystic - like changes of the macular region and schisis within the inner retinal layers , leading to visual deterioration in males .",B I I I O O O O O O O O O O O O O O O O O O O O O B I O O O,32
2573,10175,"Canavan disease , or spongy degeneration of the brain , is a severe leukodystrophy caused by the deficiency of aspartoacylase ( ASPA ) .",B I O O B I I I I O O O O B O O O B I I O O O O,13
3347,7569,"About 50 of these mutations are single - base substitutions , including six nonsense mutations and eight splicing mutations , with the remainder being missense mutations .",O O O O O O O O O O O O O O O O O O O O O O O O O O O,13
7507,9201,89 and .,O O O,13
7207,8498,"Thus , use of these PCR - based assays will allow deletion detection and prenatal diagnosis for most DMD / BMD patients in a fraction of the time required for Southern blot analysis . .",O O O O O O O O O O O O O O O O O O B O B O O O O O O O O O O O O O O,13
5589,7398,"A gene , FGD1 , altered in a patient with AAS phenotype , has been identified and found to encode a protein with homology to Rho / Rac guanine nucleotide exchange factors ( Rho / Rac GEF ) .",O O O O O O O O O O B O O O O O O O O O O O O O O O O O O O O O O O O O O O O,13
8405,1262,"Mutations in TNFRSF11A , affecting the signal peptide of RANK , cause familial expansile osteolysis .",O O O O O O O O O O O O B I I O,32
1080,5587,The presence of three frequent MEFV mutations in multiple Mediterranean populations strongly suggests a heterozygote advantage in this geographic region .,O O O O O O O O O O O O O O O O O O O O O,13
9279,7438,Genomic rearrangements of the APC tumor - suppressor gene in familial adenomatous polyposis .,O O O O B I O O O O B I I O,13
2550,1318,"Although many of the same regions of the CNS in both Bax - / - and Atm - / - mice were radioresistant , mice nullizygous for both Bax and Atm showed additional reduction in IR - induced apoptosis in the CNS .",O O O O O O O O O O O O O O O O O O O O O O O O O O O O O O O O O O O O O O O O O O O,32
6572,5829,"In several instances , family studies provided molecular evidence for pseudodominant transmission and incomplete penetrance of the disease phenotype .",O O O O O O O O O O O O O O O O O O O O,13
5709,9055,"Synthetic oligonucleotides , designed to discriminate between APOE alleles epsilon 3 and epsilon 4 , enabled us to distinguish heterozygous carriers in a hybridization assay .",O O O O O O O O O O O O O O O O O O O O O O O O O O,13
436,1563,"These findings demonstrate that the DNA - binding domains of HMG I - C , in the absence of a C - terminal fusion partner , are sufficient to perturb adipogenesis and predispose to lipomas .",O O O O O O O O O O O O O O O O O O O O O O O O O O O O O O O O O O B O,32
2059,10267,"We conclude that DM patients can be considered gonosomal mosaics , i .",O O O B O O O O O O O O O,13
4548,7958,Chromosome analysis of amniocytes obtained at 15 wk was normal in over 100 cells studied .,O O O O O O O O O O O O O O O O,13
6512,1604,These findings have significant implications for gene therapy for fragile X syndrome since overexpression of the gene may harbor its own phenotype . .,O O O O O O O O O B I I O O O O O O O O O O O O,32
3693,9733,"We have used the protein truncation test ( PTT ) to screen for mutations in exon 11 , which encodes 61 % of BRCA1 .",O O O O O O O O O O O O O O O O O O O O O O O O O,13
8584,10381,The effects of dystrophin gene mutations on the ERG in mice and humans .,O O O O O O O O O O O O O O,13
4762,10563,4 - - > p11 .,O O O O O O,13
4446,1490,The observation of typical mutations in STM7 / X25 ( GAA expansions ) in this patient demonstrates that the two genetically different forms of FRDA cannot be distinguished clinically . .,O O O O O O O O O O O O O O O O O O O O O O O O B O O O O O O,32
5973,6818,A recurrent expansion of a maternal allele with 36 CAG repeats causes Huntington disease in two sisters .,O O O O O O O O O O O O B I O O O O,13
499,494,A somatic mutation in the X linked PIGA gene is responsible for the deficiency of glycosyl phosphatidylinositol ( GPI ) - anchored proteins on blood cells from patients with paroxysmal nocturnal hemoglobinuria .,O O O O O O O O O O O O O B I I I I I I I I I O O O O O O B I I O,32
3318,5662,"We found nuclear LEF - 1 in the dividing tumour cells , providing biochemical evidence that pilomatricomas are derived from hair matrix cells .",O O O O O O O O O B O O O O O O B O O O O O O O,13
3997,2840,We identified a KIT gene mutation in a proband with classic autosomal dominant piebaldism .,O O O O O O O O O O O O O B O,32
2300,1929,We propose that the ( CUG ) n is an essential cis acting element for this splicing event .,O O O O O O O O O O O O O O O O O O O,32
9764,9169,"To our knowledge this is the first report of heterozygous C2 deficiency in association with this combination of autoimmune disorders , and we discuss the aetiological implications . .",O O O O O O O O O O B I O O O O O O B I O O O O O O O O O,13
1793,9623,"Huntingtin appears to particularly associate with microtubules , although some is also associated with synaptic vesicles .",O O O O O O O O O O O O O O O O O,13
3494,5988,"To investigate the nature of somatic von Hippel - Lindau ( VHL ) mutations , we analyzed 173 primary sporadic human renal cell carcinomas for mutations of the VHL tumor suppressor gene , using polymerase chain reaction ( PCR ) and single - strand conformational polymorphism analysis ( SSCP ) of DNA .",O O O O O O B I I I O B O O O O O O O O O B I I O O O O B I O O O O O O O O O O O O O O O O O O O O O O O,13
1288,12634,"Amino acid changes were identified in four patients , three of whom belonged to the non - FAP group of colorectal cancer patients .",O O O O O O O O O O O O O O O O O O O O B I O O,39
5795,8413,"The human gene for histidase ( histidine ammonia - lyase ; HAL ) , the enzyme deficient in histidinemia , was assigned to human chromosome 12 by Southern blot analysis of human X mouse somatic cell hybrid DNA .",O O O O O O O O O O O O O O O O O O B O O O O O O O O O O O O O O O O O O O O,13
569,11404,"Twenty microsatellite markers in the HRPT2 region were typed , in addition to markers in the multiple endocrine neoplasia ( MEN ) types 1 and 2 regions at 11q13 and 10q11 .",O O O O O O O O O O O O O O O O B I I I I I I I I I O O O O O O,13
1350,9508,"Linkage studies in this family revealed one example of probable recombination between the loci for WAS and G - 6 - PD among three informative subjects , suggesting that these two loci may not be closely linked on the X - chromosome . .",O O O O O O O O O O O O O O O B O O O O O O O O O O O O O O O O O O O O O O O O O O O O,13
5283,5640,Adult - onset cerebral ALD also presents with rapidly progressive neurologic dysfunction .,O O O B I O O O O O B I O,13
6848,259,"Given that the skin of these adult mice also exhibits signs of de novo hair - follicle morphogenesis , we wondered whether human pilomatricomas might originate from hair matrix cells and whether they might possess beta - catenin - stabilizing mutations .",O O O O O O O O O O O O O O O O O O O O O O O B O O O O O O O O O O O O O O O O O O,32
7340,8495,We describe oligonucleotide primer sequences that can be used to amplify eight exons plus the muscle promoter of the dystrophin gene in a single multiplex polymerase chain reaction ( PCR ) .,O O O O O O O O O O O O O O O O O O O O O O O O O O O O O O O O,13
5016,2648,Seven classical cases had facial features suggestive of frontonasal dysplasia and coronal craniosynostosis .,O O O O O O O O B I O B I O,32
3938,1808,The proteolipid protein gene ( PLP ) is normally present at chromosome Xq22 .,O O O O O O O O O O O O O O,32
6726,3966,Only in one family was there no possibility of useful linkage analysis .,O O O O O O O O O O O O O,32
4665,1061,"455 - 473 , McGraw - Hill , 1998 ] .",O O O O O O O O O O O,32
4789,11307,HPRT - deficient mice generated using mouse embryonic stem cells exhibit none of the behavioral symptoms associated with the Lesch - Nyhan syndrome .,B I I O O O O O O O O O O O O O O O O B I I I O,13
8563,8609,In many parts of the world the Mediterranean type of G6PD deficiency is prevalent .,O O O O O O O O O O B I O O O,13
554,861,"Presence of a large deletion involving exons 9 , 10 and 11 of the phenylalanine hydroxylase gene was confirmed by long - range PCR .",O O O O O O O O O O O O O O O O O O O O O O O O O,32
10107,1349,"We conclude that ATM heterozygotes have an approximately ninefold - increased risk of developing a type of breast cancer characterized by frequent bilateral occurrence , early age at onset , and long - term survival .",O O O O O O O O O O O O O O O O O O O O O O O O O O O O O O O O O O O O,32
6504,579,"Duarte 1 ( or Los Angeles ) and Duarte 2 ( or Duarte ) variants carry the same amino acid substitution , N314D , even though D1 is associated with increased erythrocyte GALT activity and D2 with reduced activity .",O O O O O O O O O O O O O O O O O O O O O O O O O O O O O O O O O O O O O O O O,32
10036,6145,Both penetrance and expression ( breast cancer vs . ovarian cancer ) were different from those in reports of the Ashkenazi founder mutations .,O O O O O B I O O B I O O O O O O O O O O O O O,13
8604,6899,3 GK gene resulted in a peak LOD score of 3 .,O O O O O O O O O O O O,13
1258,6979,We discuss here the recent progress made towards understanding the molecular mechanism of CGG repeat expansion and physiological function ( s ) of FMRP .,O O O O O O O O O O O O O O O O O O O O O O O O O,13
3774,7125,"Thus , altered ion homeostasis within the lens may contribute to cataract formation .",O O O O O O O O O O O B O O,13
5468,9945,"In a well - characterized family , in which three of eight siblings have fructosuria , all affected individuals are compound heterozygotes for two mutations Gly40Arg and Ala43Thr .",O O O O O O O O O O O O O O B O O O O O O O O O O O O O O,13
3779,8634,Cloning of breakpoints of a chromosome translocation identifies the AN2 locus .,O O O O O O O O O O O O,13
4664,12645,7 for colorectal neoplasia ( both P = . 01 ) .,O O B I O O O O O O O O,39
39,8812,"Linkage studies using restriction fragment length polymorphisms were conducted in the X - linked disorder , choroideremia , designated TCD for Progressive Tapeto - Choroidal Dystrophy .",O O O O O O O O O O O B I I I O B O O B O B I I I I O,13
2918,8594,The increased specificity and predictive value of the DNA - based test make it a useful adjunct to the diagnostic tests currently used to screen for carriers of Tay - Sachs disease .,O O O O O O O O O O O O O O O O O O O O O O O O O O O O B I I I O,13
3053,9498,An additional patient was identified who died with renal failure without having received TF .,O O O O O O O O B I O O O O O,13
5546,6608,"By RT - PCR , we found CTSC is also expressed in epithelial regions commonly affected by PLS , including the palms , soles , knees , and oral keratinised gingiva .",O O O O O O O O O O O O O O O O O B O O O O O O O O O O O O O O,13
267,3022,"This investigation further verifies this heterogeneity and identifies insertions , deletions , and point mutations .",O O O O O O O O O O O O O O O O,32
10073,10484,The nucleotide sequence of the exons is identical to that of the previously described cDNA .,O O O O O O O O O O O O O O O O,13
478,3595,SLS represents the first inherited disorder in man associated with an isolated abnormality in fatty alcohol metabolism . .,B O O O B I O O O O O O B I I I I O O,32
9821,501,"The salient exceptions were spleen , thymus , and red blood cells , which had almost equal numbers of cells expressing the wild - type or the recombined allele , implying that GPI - linked proteins are not essential for the derivation of these tissues .",O O O O O O O O O O O O O O O O O O O O O O O O O O O O O O O O O O O O O O O O O O O O O O,32
2166,115,GCH1 mutation in a patient with adult - onset oromandibular dystonia .,O O O O O O O O O B I O,32
6380,5532,Genetic analyses of Japanese C9 deficiency have shown that a C - to - T transition leading to TGA stop codon for Arg95 in exon 4 of the C9 gene ( Arg95Stop ) is common in Japanese C9 deficiency .,O O O O B I O O O O O O O O O O O O O O O O O O O O O O O O O O O O O O O B I O,13
8044,2583,"PKU is a highly heterogeneous disorder , with more than 60 molecular lesions identified in the PAH gene .",B O O O O O O O O O O O O O O O O O O,32
6828,10452,Macular dystrophy associated with mutations at codon 172 in the human retinal degeneration slow gene .,B I O O O O O O O O O B I O O O,13
5356,11632,Three patients with a family history of cancer were carrying a Gly160Cys germline substitution .,O O O O O O O B O O O O O O O,13
9234,11981,Preliminary in vivo footprinting data gave evidence for protein - DNA contact in normal genes at an Sp1 consensus binding site upstream of the CTG repeat and for a significant reduction of this interaction in cells with a hypermethylated DMPK gene . .,O O O O O O O O O O O O O O O O O O O O O O O O O O O O O O O O O O O O O O O O O O O,39
623,7435,"Mice that expressed expanded CUG repeats developed myotonia and myopathy , whereas mice expressing a nonexpanded repeat did not .",O O O O O O O B O B O O O O O O O O O O,13
9205,7165,"Among peripheral blood leukocytes , MEFV expression was detected in neutrophils , eosinophils , and to varying degrees , monocytes .",O O O O O O O O O O O O O O O O O O O O O,13
9415,7896,The Wiskott - Aldrich syndrome ( WAS ) has previously been mapped to the proximal short arm of the X chromosome between the DXS14 and DXS7 loci .,O B I I I O B O O O O O O O O O O O O O O O O O O O O O,13
3160,11342,Association of anxiety - related traits with a polymorphism in the serotonin transporter gene regulatory region .,O O B I I I O O O O O O O O O O O,13
8921,137,7 % ( 20 / 300 ) .,O O O O O O O O,32
3502,3916,"Among them , only one , the Gd ( - ) Kabyle variant , had been previously described .",O O O O O O O O O O O O O O O O O O O,32
5586,2647,We report on nine patients with craniofrontonasal dysplasia ( CFND ) .,O O O O O O B I O B O O,32
2015,616,"Moreover , we observed the occurrence of de novo mutations between parental and grandparental generations in 17 three - generation families , which allowed a direct estimation of the k value ( k = 11 ) .",O O O O O O O O O O O O O O O O O O O O O O O O O O O O O O O O O O O O O,32
5806,1650,"The entire coding region of BRCA1 and BRCA2 was screened for the presence of germline mutations , by use of SSCP followed by direct sequencing of observed variants .",O O O O O O O O O O O O O O O O O O O O O O O O O O O O O,32
3146,5201,Identification of mutations in Danish choroideremia families .,O O O O O B O O,32
3299,240,Milder phenotypes such as adrenomyeloneuropathy and Addison disease only also have been recognized .,O O O O B O B I O O O O O O,32
3110,2409,"4 % ( 7 of 94 ) were A to G mutation at nt 95 , 4 .",O O O O O O O O O O O O O O O O O O,32
8830,8369,"We have now examined the DNA of three previously reported electrophoretically fast Mexican G6PD variants , - G6PD Distrito Federal , G6PD Tepic , and G6PD Castilla .",O O O O O O O O O O O O O O O O O O O O O O O O O O O O,13
549,9888,Fragments of the adrenoleukodystrophy ( ALD ) cDNA from a patient with adolescent ALD were amplified by polymerase chain reaction and subcloned .,O O O B O B O O O O O O B I O O O O O O O O O,13
9167,11517,Kniest dysplasia : Dr . W .,B I O O O O O,13
1366,9731,Rapid detection of BRCA1 mutations by the protein truncation test .,O O O O O O O O O O O,13
4468,1702,The deletion chromosome has acquired a maternal methylation imprint in his somatic cells .,O O O O O O O O O O O O O O,32
582,11137,Extracts of the cell line were deficient in repair of DNA substrates containing mismatches or extra nucleotides .,O O O O O O O O O O O O O O O O O O,13
7528,11310,"Although the doubly - deficient mice excrete adenine and its highly insoluble derivative , 2 , 8 - dihydroxyadenine , which are also associated with human APRT deficiency , additional abnormalities or any self - injurious behavior were not detected .",O O O O O O O O O O O O O O O O O O O O O O O O O O B I O O O O O O O O O O O O O,13
459,6714,Atm and Bax cooperate in ionizing radiation - induced apoptosis in the central nervous system .,O O O O O O O O O O O O O O O O,13
1438,2326,The patient inherited this mutation from his mother .,O O O O O O O O O,32
7085,10974,"To clarify whether colchicine is excreted in breast milk , and to compare its concentrations in the serum and breast milk of lactating women who have familial Mediterranean fever ( FMF ) .",O O O O O O O O O O O O O O O O O O O O O O O O O O B I I O B O O,13
