Unnamed: 0.1,Unnamed: 0,text,labels,txt_len
6179,7597,When the site - specific mutagenized alpha cDNA carrying the T - - > C transition at nt 1453 was expressed in COS 1 cells hexosaminidase S activity was not detectable above background .,O O O O O O O O O O O O O O O O O O O O O O O O O O O O O O O O O O,13
193,3563,"The serum had normal immune adherence activity , but was deficient in ability to opsonize Candida albicans for uptake and Escherichia coli for killing by neurophils , generate neutrophil chemotactic factors and inhibit the growth of E . coli ; these activities were restored by purified C3 .",O O O O O O O O O O O O O O O O O O O O O O O O O O O O O O O O O O O O O O O O O O O O O O O O,32
3282,3041,Immunoblot analysis of muscle from the affected twin showed dystrophin of normal size but of reduced amount .,O O O O O O O O O O O O O O O O O O,32
2878,9348,These patients show a wide phenotypic variation .,O O O O O O O O,13
813,1770,These results refine understanding of MEFV by placing the gene in the myelomonocytic - specific proinflammatory pathway and identifying it as an IFN - gamma immediate early gene . .,O O O O O O O O O O O O O O O O O O O O O O O O O O O O O O,32
5452,4172,"The molecular mechanisms by which the expanded repeat causes the clinically variable and multisystemic disease , myotonic dystrophy , are not understood .",O O O O O O O O O O O O O B I O B I O O O O O,32
9524,7514,"Striking prevalence of ankylosing spondylitis in "" healthy "" w27 positive males and females .",O O O B I O O O O O O O O O O,13
6143,3417,"Given that at least 105 female meioses transmitting TCD have occurred since 1650 in these kindreds , extremely close linkage between TCD , DXYS1 and DXYS12 is suggested .",O O O O O O O O B O O O O O O O O O O O O B O O O O O O O,32
7550,10306,"It is possible that analogous to an activated / altered growth factor receptor oncogene , codon 877 mutant AR with altered ligand binding may provide a selective growth advantage in the genesis of a subset of advanced prostate cancer .",O O O O O O O O O O O O O O O O O O O O O O O O O O O O O O O O O O O O B I I O,13
9910,707,Morphological abnormalities resembling cirrhosis developed in the majority of the livers from homozygous mutants older than 7 months of age .,B I O B O O O O O O O O O O O O O O O O O,32
8126,2140,"This gene , designated HPRT Tokyo , had a single nucleotide change from G to A , as identified by sequencing cDNA amplified by the polymerase chain reaction .",O O O O O O O O O O O O O O O O O O O O O O O O O O O O O,32
3168,9810,South African Negroids have a CTG allelic distribution that is significantly different from that in Caucasoids and Japanese the CTG repeat lengths of > or = 19 are very rare .,O O O O O O O O O O O O O O O O O O O O O O O O O O O O O O O,13
455,2207,"Both mutations were tested in a eukaryotic expression system in which enzyme activities of different mutant PAH enzymes reflect the relative severities of the mutations , although these in vitro activities cannot be translated directly into in vivo hepatic activities .",O O O O O O O O O O O O O O O O O O O O O O O O O O O O O O O O O O O O O O O O O,32
5710,12630,BACKGROUND / AIMS The development of colorectal cancer and a variable range of extracolonic manifestations in familial adenomatous polyposis ( FAP ) is the result of the dominant inheritance of adenomatous polyposis coli ( APC ) gene mutations .,O O O O O O B I O O O O O O O O B I I O B O O O O O O O O O B I I O B O O O O,39
6595,3467,Molecular detection of chromosomal translocations that disrupt the putative retinoblastoma susceptibility locus .,O O O O O O O O O B O O O,32
7944,8331,Linkage relationships of the apolipoprotein C1 gene and a cytochrome P450 gene ( CYP2A ) to myotonic dystrophy .,O O O O O O O O O O O O O O O O B I O,13
7328,8131,"In studies of eight kindred , the 28 - base pair deletion was observed in all C2Q0 alleles associated with the common type I deficient complotype / haplotype ; this deletion was not present in normal C2 nor in type II C2 - deficient genes .",O O O O O O O O O O O O O O O O O O O O O O O O O O O O O O O O O O O O O O O B I I I I O O,13
7188,10906,The present study confirms the involvement of BRCA1 in disease predisposition for a subset of hereditary breast cancer families often characterized by ovarian cancers .,O O O O O O O O O O O O O O O B I I O O O O B I O,13
9077,3876,There was no activity of HPRT in the lysates of erythrocytes and cultured fibroblasts when analyzed in the usual manner .,O O O O O O O O O O O O O O O O O O O O O,32
10041,7076,The cousins fathers and two paternal aunts have the same deletion and are clinically normal .,O O O O O O O O O O O O O O O O,13
566,10,"A common MSH2 mutation in English and North American HNPCC families : origin , phenotypic expression , and sex specific differences in colorectal cancer .",O O O O O O O O O B O O O O O O O O O O O O B I O,32
3630,3815,Hereditary C7 deficiency .,B I I O,32
8703,1851,"A syndrome of microcephaly , progressive postnatal growth deficiency , and mental retardation was observed in two brothers and their cousin from a multiply consanguineous kindred of Lebanese descent .",O O O B O O B I I O O B I O O O O O O O O O O O O O O O O O,32
2772,1814,Another three affected males from the family had similar findings .,O O O O O O O O O O O,32
8871,2177,An mRNA - containing extract of cultured fibroblasts obtained from one of the probands was used as a template to amplify the coding sequence of the hexosaminidase A ( Hex A ) alpha - subunit .,O O O O O O O O O O O O O O O O O O O O O O O O O O O O O O O O O O O O,32
8154,10370,"We have used a cosmid probe for fluorescence in situ hybridization , which refines the localization to 22q13 .",O O O O O O O O O O O O O O O O O O O,13
2331,582,"However , there are differences in the abundance of GALT protein in lymphoblastoid cells lines from D2 and D1 individuals .",O O O O O O O O O O O O O O O O O O O O O,32
9006,2355,"3 , very close to the Huntington disease ( HD ) region .",O O O O O O B I O B O O O,32
9270,1335,These findings provide evidence that PLS and HMS are allelic variants of cathepsin C gene mutations . .,O O O O O B O B O O O O O O O O O O,32
5845,4970,"1 , and provide an example of the utility of the SGLT1 probe as a diagnostic for genetic diseases associated with translocations of chromosome 22 .",O O O O O O O O O O O O O O O O O B I O O O O O O O,32
4952,1139,The mutations found in our cases occurred in the same exon of the WT1 gene as detected in Denys - Drash syndrome ( DDS ) and could not be explained by the previously proposed mechanism .,O O O O O O O O O O O O O O O O O O B I I I O B O O O O O O O O O O O O,32
6438,7001,Macro - orchidism was absent in knockout mice carrying the YAC transgene indicating functional rescue by the human protein .,O O O O O O O O O O O O O O O O O O O O,13
9919,4203,Another splice mutation in the PST domain occurred in an aniridia patient with anosmia ( inability to smell ) .,O O O O O O O O O O B O O B O O O O O O,32
4209,12432,"Both the protein truncation test ( PTT ) and the restriction endonuclease fingerprinting ( REF ) method were used and compared for their detection efficiency , identifying 76 % and 60 % of the mutations , respectively .",O O O O O O O O O O O O O O O O O O O O O O O O O O O O O O O O O O O O O O,39
2836,10833,"The positioning of the polymerase chain reaction ( PCR ) primers was such that the resulting PCR products were of different sizes , which enabled us to analyze two different exons simultaneously and still distinguish between the banding profiles for both ( biplex analysis ) .",O O O O O O O O O O O O O O O O O O O O O O O O O O O O O O O O O O O O O O O O O O O O O O,13
2643,7852,Linkage of gene for C2 deficiency and the major histocompatibility complex MHC in man .,O O O O B I O O O O O O O O O,13
4515,1489,"In order to investigate whether retained tendon reflexes are characteristic of FRDA caused by the second locus , FRDA2 , we studied an unrelated FRDA patient with retained tendon reflexes .",O O O O O O O O O O O B O O O O O O O O O O O O B O O O O O O,32
982,7867,"In addition to loss of heterozygosity ( LOH ) at the APC locus in 30 tumors , 43 other somatic mutations were detected .",O O O O O O O O O O O B O O O B O O O O O O O O,13
2188,5397,"Here , we show that retroviral transfer of the wild - type BRCA1 gene inhibits growth in vitro of all breast and ovarian cancer cell lines tested , but not colon or lung cancer cells or fibroblasts .",O O O O O O O O O O O O O O O O O O O O B I I I O O O O O O B I I I O O O O,32
1689,7994,The mother had seropositive rheumatoid arthritis .,O O O B I I O,13
5499,2321,A combination of multiplex PCR with the single strand conformation polymorphism ( SSCP ) technique was employed to screen for point mutations in the human dystrophin gene .,O O O O O O O O O O O O O O O O O O O O O O O O O O O O,32
5249,2497,"The results indicate close linkage between the WAS and OATL1 loci ( Z = 6 . 08 at theta = 0 . 00 ) and localize the TIMP , OATL1 , DXS255 , and WAS loci distal to DXS146 and the OATL1 and WAS loci proximal to TIMP .",O O O O O O O B O O O O O O O O O O O O O O O O O O O O O O O O O O B O O O O O O O O B O O O O O,32
7555,8811,Choroideremia : close linkage to DXYS1 and DXYS12 demonstrated by segregation analysis and historical - genealogical evidence .,B O O O O O O O O O O O O O O O O O,13
7237,2224,A mutation common in non - Jewish Tay - Sachs disease : frequency and RNA studies .,O O O O O O O B I I I O O O O O O,32
5547,3866,"These three variants had normal levels of Km G6P , Km NADP , and Ki NADPH , normal utilizations of both 2 - deoxy - G6P and deamino - NAPD , normal heat stability , and a normal pH curve .",O O O O O O O O O O O O O O O O O O O O O O O O O O O O O O O O O O O O O O O O O,32
6873,2609,"Surprisingly , rumpshaker mice , although myelin - deficient , have normal longevity and a full complement of morphologically normal oligodendrocytes .",O O O O O O B I I O O O O O O O O O O O O O,32
8208,3324,We have studied genetic linkage between the gene for creatine kinase muscle type ( CKMM ) and the gene for myotonic dystrophy ( DM ) .,O O O O O O O O O O O O O O O O O O O O B I O B O O,32
9831,9939,"This enzyme catalyses the first step of metabolism of dietary fructose , conversion of fructose to fructose - 1 - phosphate .",O O O O O O O O O O O O O O O O O O O O O O,13
5427,2364,An initial inguinal lymph node biopsy surprisingly revealed Kaposi sarcoma .,O O O O O O O O B I O,32
9272,4658,"Both of these genes map in the same position on mouse chromosome 5 in a region associated with ancestral chromosomal rearrangements and show no recombination with D5H4S43 , D5H4S115 , and D5H4S62 , the murine homologues of D4S43 , D4S115 , and D4S62 , respectively .",O O O O O O O O O O O O O O O O O O O O O O O O O O O O O O O O O O O O O O O O O O O O O O,32
4012,2488,Linkage disequilibrium mapping in isolated founder populations : diastrophic dysplasia in Finland .,O O O O O O O O B I O O O,32
9625,7525,The patients parents were remotely related .,O O O O O O O,13
5109,3006,The resulting genetic map is supported by the localisation of the DNA markers in a panel of somatic cell hybrids .,O O O O O O O O O O O O O O O O O O O O O,32
1947,1744,"DESIGN AND SETTING Retrospective cohort study of a consecutive series of 933 ovarian cancers diagnosed and treated at our institution , which is a comprehensive cancer center as designated by the National Cancer Institute , over a 12 - year period ( December 1986 to August 1998 ) .",O O O O O O O O O O O O B I O O O O O O O O O O O B O O O O O O B O O O O O O O O O O O O O O O O,32
9852,9208,The expression of VWS is significantly modified by the genetic background More extreme phenotypes in parents tend to produce more extreme expression in their children .,O O O B O O O O O O O O O O O O O O O O O O O O O O,13
9707,8860,A new glucose - 6 - phosphate dehydrogenase ( G6PD ) variant with severe erythrocytic G6PD deficiency and a unique pH optimum is described in a young patient with chronic nonspherocytic hemolytic anemia ( CNSHA ) and familial amyloidotic polyneuropathy ( FAP ) .,O O O O O O O O O O O O O O B I I O O O O O O O O O O O O B I I I O B O O B I I O B O O,13
4148,6924,Diagnosis is usually based on the VLCFA levels in plasma or cultured skin fibroblasts in both patients and carriers .,O O O O O O O O O O O O O O O O O O O O,13
5304,51,The cancer incidence among the siblings or the parents did not differ from the average cancer incidence in the Finnish population .,O B O O O O O O O O O O O O O B O O O O O O,32
9835,3533,"A deletion in an individual with retinoblastoma was reported to separate the closely linked ESD and retinoblastoma ( RB1 ) loci , placing ESD proximal to RB1 .",O O O O O O B O O O O O O O O O B O O O O O O O O O O O,32
6867,4281,"In homozygous subjects , CETP activity ranged from 37 % to 62 % of the normal value , which was consistent with the results obtained from the transient expression experiment previously reported ; however , the specific activity of CETP was not as low as expected .",O O O O O O O O O O O O O O O O O O O O O O O O O O O O O O O O O O O O O O O O O O O O O O O,32
8627,11661,Chromosomal translocations identified in hematopoietic and solid tumors result in deregulated expression of protooncogenes or creation of chimeric proteins with tumorigenic potential .,O O O O B I I I O O O O O O O O O O O O O O O,13
5742,6213,This observation confirms the existence of this entity and assigns it to the phenotypic spectrum associated with mutations at the DTDST locus . .,O O O O O O O O O O O O O O O O O O O O O O O O,13
8621,9337,In 28 families with G6PD deficiency living in 3 settlements of Shekii district of Azerbaijan 11 G6PD variants of II and III classes differing by kinetic properties were identified according WHO program .,O O O O B I O O O O O O O O O O O O O O O O O O O O O O O O O O O,13
2458,3178,"We analysed the age incidence curves for symptomatic renal cell carcinoma ( n = 26 ) and cerebellar haemangioblastoma ( n = 68 ) in 109 patients with von Hippel - Lindau ( VHL ) disease , and compared them to 104 patients with sporadic renal cell carcinoma and 43 patients with sporadic cerebellar haemangioblastoma .",O O O O O O O O B I I O O O O O O B I O O O O O O O O O B I I I I I I I O O O O O O O O B I I I O O O O B I I O,32
695,10276,Both types of mutation are concentrated in the 5 half of exon 15 .,O O O O O O O O O O O O O O,13
8711,2506,We report the isolation of an expressed sequence from this region which detects a DNA fragment that is larger in affected individuals than in normal siblings or unaffected controls .,O O O O O O O O O O O O O O O O O O O O O O O O O O O O O O,32
4408,3468,"A candidate DNA sequence with many of the properties predicted for the retinoblastoma susceptibility ( RB1 ) locus has been cloned ( S . H . Friend , R . Bernards , S . Rogelj , R . A . Weinberg , J . M . Rapaport , D . M . Albert , and T . P . Dryja , Nature [ London ] 323 643 - 645 , 1986 ) .",O O O O O O O O O O O O B O O O O O O O O O O O O O O O O O O O O O O O O O O O O O O O O O O O O O O O O O O O O O O O O O O O O O O O O O O O O,32
4643,3655,"In a subset of families , the relevant segment of the APOE gene was enzymatically amplified to increase the sensitivity of the method .",O O O O O O O O O O O O O O O O O O O O O O O O,32
7175,4679,Combined treatment with CDCA and pravastatin showed good overlapping of the effects of each drug alone .,O O O O O O O O O O O O O O O O O,32
3383,8895,"In DMD families four crossovers were observed in 38 informative meioses between C7 and the DMD locus ( theta = 0 . 12 , z max = + 2 . 72 ) .",O B O O O O O O O O O O O O O B O O O O O O O O O O O O O O O O O,13
391,5221,"The family we describe demonstrates the recessive inheritance of a recently recognized class of genetic bleeding disorders , we call "" autosomal hemophilia .",O O O O O O O O O O O O O O O O O O O O O O B O,32
8820,8877,Inherited C3 deficiency with recurrent infections and glomerulonephritis .,O B I O O O O B O,13
4602,9717,The alveolar rhabdomyosarcoma PAX3 / FKHR fusion protein is a transcriptional activator .,O B I O O O O O O O O O O,13
6805,3856,Incidence and characteristics of glucose - 6 - phosphate dehydrogenase variants in Japan .,O O O O O O O O O O O O O O,32
4177,12284,A mouse model of severe von Willebrand disease : defects in hemostasis and thrombosis .,O O O O O B I I O O O O O B O,39
9755,5892,"Measured by radioimmunoassay with a synthetic Leu - AVP standard , serum Leu - AVP levels were elevated in all three children and further increased during water deprivation to as high as 30 times normal .",O O O O O O O O O O O O O O O O O O O O O O O O O O O O O O O O O O O O,13
6816,2966,Some Mexican glucose - 6 - phosphate dehydrogenase variants revisited .,O O O O O O O O O O O,32
4563,811,"A few other patients and families with features similar to our proband have been described previously and considered to have autosomal recessive MED ( EDM4 , McKusick 226900 ) .",O O O O O O O O O O O O O O O O O O O O O O B O B O O O O O,32
1239,4229,Instability of the expanded triplet repeat was not found to be affected by sex of the parent transmitting the mutation .,O O O O O O O O O O O O O O O O O O O O O,32
168,4712,"The mRNA expression pattern of one of them , designated as XK , correlates closely to the McLeod phenotype .",O O O O O O O O O O O O O O O O O B O O,32
9964,6842,Autoinhibition and activation mechanisms of the Wiskott - Aldrich syndrome protein .,O O O O O O B I I I O O,13
2429,11531,The cDNA of mouse HGO has an overall identity of 41 % to the corresponding gene hmgA from Aspergillus .,O O O O O O O O O O O O O O O O O O O O,13
3350,10766,"Atelosteogenesis type II ( AO II ) is a neonatally lethal chondrodysplasia whose clinical and histological characteristics resemble those of another chondrodysplasia , the much less severe diastrophic dysplasia ( DTD ) .",B I I O B I O O O O O B O O O O O O O O O B O O O O O B I O B O O,13
6813,6048,This is the most comprehensive compilation of ATM polymorphisms assembled to date .,O O O O O O O O O O O O O,13
9414,7604,"Most mutations are linked to specific haplotypes , as defined by eight polymorphic restriction sites in the PAH gene .",O O O O O O O O O O O O O O O O O O O O,13
7761,12519,"To determine whether there could be protective alleles that prevent or reduce the risk of developing BPAD , similar to what is observed in other genetic disorders , we used mental health wellness ( absence of any psychiatric disorder ) as the phenotype in our genome - wide linkage scan of several large multigeneration Old Order Amish pedigrees exhibiting an extremely high incidence of BPAD .",O O O O O O O O O O O O O O O O B O O O O O O O O B I O O O O O O O O O O B I O O O O O O O O O O O O O O O O O O O O O O O O O B O,39
3964,133,"Heterozygote detection was performed with an allele - specific polymerase chain reaction ( PCR ) system designed to detect exclusively only one of the normal and mutant alleles , followed by confirmation with PCR / single - strand conformation polymorphism ( SSCP ) analysis and direct sequencing .",O O O O O O O O O O O O O O O O O O O O O O O O O O O O O O O O O O O O O O O O O O O O O O O O,32
5997,10883,"These data functionally define a novel genetic locus , designated PAC1 , for prostate adenocarcinoma 1 , involved in tumor suppression of human prostate carcinoma and furthermore strongly suggest that the cell death pathway can be functionally restored in prostatic adenocarcinoma . .",O O O O O O O O O O O O O O O O O O O O O O O B I O O O O O O O O O O O O O O B I O O,13
2196,4734,"The glu285 - - > ala mutation was predominant ( 82 . 9 % ) in this population , followed by the tyr231 - - > ter ( 14 . 8 % ) and 433 - - 2 ( A - - > G ) ( 1 . 1 % ) mutations .",O O O O O O O O O O O O O O O O O O O O O O O O O O O O O O O O O O O O O O O O O O O O O O O O O O O O O,32
5857,9352,Bone marrow transplant lowered the plasma C26 0 level but failed to arrest neurological progression . .,O O O O O O O O O O O O O O O O O,13
7969,5216,The patient was found to be homozygous for a single point mutation causing a Thr - - > Met substitution at amino acid position 28 in the mature vWF subunit .,O O O O O O O O O O O O O O O O O O O O O O O O O O O O O O O,32
6195,428,"In several instances , family studies provided molecular evidence for pseudodominant transmission and incomplete penetrance of the disease phenotype .",O O O O O O O O O O O O O O O O O O O O,32
6692,7420,"Asef , a link between the tumor suppressor APC and G - protein signaling .",O O O O O O B O O O O O O O O,13
7735,4304,These results provide further evidence that inherited breast and ovarian cancer can occur as a consequence of a wide array of BRCA1 mutations .,O O O O O O B I I I I O O O O O O O O O O O O O,32
139,8600,Two patients were homozygous for a G - to - A change at the 5 - splice donor site of the intron 14 .,O O O O O O O O O O O O O O O O O O O O O O O O,13
3908,8547,The single case of blue cone monochromacy may therefore be a fortuitous coincidence of two diseases . .,O O O O O O O O O O O O O O O O O O,13
8591,3873,He has been found to have a variant of hypoxanthine guanine phosphoribosyl transferase ( HPRT ; E . C . 2 . 4 . 2 . 8 ) distinct from the enzyme present in patients with the Lesch - Nyhan syndrome .,O O O O O O O O O O O O O O O O O O O O O O O O O O O O O O O O O O O O O B I I I O,32
3786,6952,The factor X ( F10 ) genes of 14 unrelated individuals with factor X deficiency ( 12 familial and two sporadic cases ) were sequenced yielding a total of 13 novel mutations .,O O O O O O O O O O O O B I I O O O O O O O O O O O O O O O O O O,13
8266,8187,"One of the new genes contained sequence identical to SRP19 , the gene coding for the 19 kd component of the ribosomal signal recognition particle .",O O O O O O O O O O O O O O O O O O O O O O O O O O,13
10050,12017,Genotype - phenotype studies were not performed on this small group of BZS families .,O O O O O O O O O O O O B O O,39
5417,3120,"Six C5 - deficient strains , A / HeJ , AKR / J , DBA / 2J , NZB / B1NJ , SWR / J , and B10 .",O B I I O O O O O O O O O O O O O O O O O O O O O O O O O,32
8867,560,"Mutations in the gene that encodes type II collagen ( COL2A1 ) , the predominant protein of cartilage , have been identified in a number of individuals with Kniest dysplasia .",O O O O O O O O O O O O O O O O O O O O O O O O O O O O B I O,32
4628,1475,"The gene for EDMD on Xq28 encodes a novel protein named emerin that localizes at the nuclear membrane of skeletal , cardiac and smooth muscles and some other non - muscle tissues .",O O O B O O O O O O O O O O O O O O O O O O O O O O O O O O O O O,32
1854,2077,Glucose - 6 - phosphate dehydrogenase variants from Italian subjects associated with severe neonatal jaundice .,O O O O O O O O O O O O B I I O,32
8130,10947,The majority of patients with Canavan disease are from an Ashkenazi Jewish background .,O O O O O B I O O O O O O O,13
4947,12396,The ARSA enzyme activity in subjects with and without the R496H mutation was determined and found to be normal .,O O O O O O O O O O O O O O O O O O O O,39
1913,3354,"By use of an adaptation of the polymerase chain reaction , vWF mRNA was amplified and sequenced from peripheral blood platelets .",O O O O O O O O O O O O O O O O O O O O O O,32
1904,11820,Risk reversals in predictive testing for Huntington disease .,O O O O O O B I O,39
144,2339,"We report familial adenomatous polyposis coli ( FAPC ) with epidermoid cysts , osteomata , and areas of congenital hypertrophy of the retinal pigment epithelium ( CHRPEs ) in a male patient and his maternal aunt , both of whom suffered a mild to moderate degree of mental handicap .",O O B I I I O B O O B I O B O O O O B I I I I I I O B O O O O O O O O O O O O O O O O O O O O B I O,32
4806,4630,A compound heterozygote had severe craniofacial and central nervous system defects and no eyes .,O O O O O B I I I I I O B I O,32
7103,11557,A clinical overview of WT1 gene mutations .,O O O O O O O O,13
6057,12430,Germline mutations in the ATM gene are responsible for the autosomal recessive disorder ataxia - telangiectasia ( A - T ) .,O O O O O O O O O O B I I B I I O B I I O O,39
1632,5181,Targeted modification of the apolipoprotein B gene results in hypobetalipoproteinemia and developmental abnormalities in mice .,O O O O O O O O O B O B I O O O,32
672,5185,"Mice containing this allele display all of the hallmarks of human hypobetalipoproteinemia they produce a truncated apoB protein , apoB70 , and have markedly decreased plasma concentrations of apoB , beta - lipoproteins , and total cholesterol .",O O O O O O O O O O O B O O O O O O O O O O O O O O O O O O O O O O O O O O,32
7614,5145,"Mutations in the EDH17B2 gene , therefore do not appear to be responsible for the hereditary breast - ovarian cancer syndrome .",O O O O O O O O O O O O O O O B I I I I I O,32
5388,2700,"Although greater than 400 variants have been described based on clinical and biochemical criteria , little is known about the molecular basis of these G6PD deficiencies .",O O O O O O O O O O O O O O O O O O O O O O O O B I O,32
3280,9775,We searched for criteria that could indicate breast cancer families with a high prior probability of being caused by the breast / ovarian cancer susceptibility locus BRCA1 on chromosome 17 .,O O O O O O O B I O O O O O O O O O O O B I I I O O O O O O O,13
436,1563,"These findings demonstrate that the DNA - binding domains of HMG I - C , in the absence of a C - terminal fusion partner , are sufficient to perturb adipogenesis and predispose to lipomas .",O O O O O O O O O O O O O O O O O O O O O O O O O O O O O O O O O O B O,32
