Unnamed: 0.1,Unnamed: 0,text,labels,txt_len
2036,5836,"This method , also called "" antibody test , "" uses monoclonal antibodies against the FMR1 gene product ( FMRP ) and is based on absence of FMRP in patients cells .",O O O O O O O O O O O O O O O O O O O O O O O O O O O O O O O O,13
8283,3284,88 .,O O,32
4705,9819,Purification of human very - long - chain acyl - coenzyme A dehydrogenase and characterization of its deficiency in seven patients .,O O O O O O O O O O O O O O O O O O O O O O,13
8227,4145,"Mutations in the BRCA1 gene , discovered in 1994 , are associated with an 80 - 90 % lifetime risk of breast cancer .",O O O O O O O O O O O O O O O O O O O O O B I O,32
2841,6175,All missense mutations were located in exons 1 - 4 .,O O O O O O O O O O O,13
2867,2323,We report the case of a nonsense mutation in a Duchenne patient identified by this approach .,O O O O O O O O O O B O O O O O O,32
790,688,"We report here the characterization of a transgene insertion ( Epstein - Barr virus Latent Membrane Protein 2A , LMP2A ) into mouse chromosome 7C , which has resulted in mouse models for PWS and AS dependent on the sex of the transmitting parent .",O O O O O O O O O O O O O O O O O O O O O O O O O O O O O O O O O B O B O O O O O O O O O,32
5835,12183,"Imprinting in the 15q11 - q13 region involves an imprinting centre ( IC ) , mapping in part to the promoter and first exon of SNRPN .",O O O O O O O O O O O O O O O O O O O O O O O O O O O,39
5555,3975,"Radiographical sacro - iliitis was restricted to HLA B27 positive relatives , and was more frequently found in relatives to probands with psoriasis than in relatives to probands without psoriasis .",O B I I O O O O O O O O O O O O O O O O O O B O O O O O O B O,32
3362,8949,"Other patients with similar exon deletions , or smaller deletions , show the more severe phenotype typical of DMD .",O O O O O O O O O O O O O O O O O O B O,13
6402,6354,The application of blood leucocytes can be a simple technique on analysing a constructive abnormality of CYP27 mRNA . .,O O O O O O O O O O O O O O B I I O O O,13
3155,5439,The absence of functional C7 activity could not be accounted for on the basis of an inhibitor .,O B I I I O O O O O O O O O O O O O,13
8718,12442,All patients manifested classical A - T and increased cellular radioresistant DNA synthesis .,O O O O B I I O O O O O O O,39
919,976,001 001 .,O O O,32
9972,3660,"These results suggest that , in addition to APOC2 , APOE is a useful marker for presymptomatic DM diagnosis .",O O O O O O O O O O O O O O O O O B O O,32
1099,5427,Age of onset in Huntington disease : sex specific influence of apolipoprotein E genotype and normal CAG repeat length .,O O O O B I O O O O O O O O O O O O O O,13
9175,3751,Conservation of the Duchenne muscular dystrophy gene in mice and humans .,O O O B I I O O O O O O,32
8347,10836,Type II human complement C2 deficiency .,B I I I I I O,13
2317,10382,PURPOSE .,O O,13
6068,1164,"Palmoplantar keratosis , varying from mild psoriasiform scaly skin to overt hyperkeratosis , typically develops within the first three years of life .",B I O O O O O O O O O B O O O O O O O O O O O,32
2536,7920,A genetic etiology for DiGeorge syndrome : consistent deletions and microdeletions of 22q11 .,O O O O B I O O O O O O O O,13
7067,8114,This mutation causes a G to A change at nucleotide 1388 that produces an ( 463 ) Arg to His substitution .,O O O O O O O O O O O O O O O O O O O O O O,13
1448,8113,"Finally , two affected Chinese were identified as having the fourth mutation ( 1388 G - - - - A ) .",O O O O O O O O O O O O O O O O O O O O O O,13
5136,724,Missense mutation in the alternative splice region of the PAX6 gene in eye anomalies .,O O O O O O O O O O O O B I O,32
8790,844,We recommended liver biopsy for subjects with serum ferritin levels of 300 ng per milliliter or higher .,O O O O O O O O O O O O O O O O O O,32
3035,10975,"Using a specific radioimmunoassay , we determined colchicine concentrations in the serum and breast milk of 4 patients at various time points , following oral administration of the drug .",O O O O O O O O O O O O O O O O O O O O O O O O O O O O O O,13
5808,12110,The 2 .,O O O,39
3506,12408,A gene encoding a transmembrane protein is mutated in patients with diabetes mellitus and optic atrophy ( Wolfram syndrome ) .,O O O O O O O O O O O B I O B I O B I O O,39
8708,8070,"Assignment of the aspartylglucosaminidase gene ( AGA ) to 4q33 - - - - q35 based on decreased activity in a girl with a 46 , XX , del ( 4 ) ( q33 ) karyotype .",O O O O O O O O O O O O O O O O O O O O O O O O O O O O O O O O O O O O O,13
3062,4583,Protein microsequencing demonstrated expression of the abnormal allele in cartilage .,O O O O O O O O O O O,32
10070,439,"Mentally retarded female patients with a full mutation showed FMRP expression in only some of their hair roots ( < 55 % ) , and no overlap with normal female controls was observed .",B I O O O O O O O O O O O O O O O O O O O O O O O O O O O O O O O O,32
3996,4128,Polymerase chain reaction amplification of VLCAD mRNA and genomic exons defined the molecular defects in two patients with VLCAD deficiency who presented with unexplained cardiac arrest and cardiomyopathy .,O O O O O O O O O O O O O O O O O O B I O O O O B I O B O,32
283,6189,Exposure of mdx myotubes to gentamicin led to the expression and localization of dystrophin to the cell membrane .,O O O O O O O O O O O O O O O O O O O,13
9118,12035,There is a noticeably elevated level of mutation in the paired domain compared with the rest of the gene .,O O O O O O O O O O O O O O O O O O O O,39
1016,9575,"Here we use muscle biopsies from classical adult - onset myotonic dystrophy patients to study the accumulation of transcripts from both the normal and expanded DM kinase genes in patient muscle , and compare the results to normal and myopathic controls .",O O O O O O O O O O B I O O O O O O O O O O O O O B O O O O O O O O O O O O O B O O,13
2967,5066,The unambiguous identification of a crossover event within hemochromatosis families is very difficult ; it is particularly hampered by the variability of the phenotypic expression as well as by the sex - and age - related penetrance of the disease .,O O O O O O O O B O O O O O O O O O O O O O O O O O O O O O O O O O O O O O O O O,32
8275,11082,"However , it is not yet clear what proportion of hereditary breast cancer is explained by BRCA1 and BRCA2 or by some other unidentified susceptibility gene ( s ) .",O O O O O O O O O O B I I O O O O O O O O O O O O O O O O O,13
329,1398,This study provides the means for further investigation of additional genes that cause or modify the phenotypes associated with rearrangements of 15q11 - q13 .,O O O O O O O O O O O O O O O O O O O O O O O O O,32
1756,11786,"When resting cells are induced to proliferate , the steady - state levels of BRCA1 increase in late G1 and reach a maximum during S phase .",O O O O O O O O O O O O O O O O O O O O O O O O O O O,39
6580,5938,Hepatoblastoma is a rare malignant tumor of the liver that occurs in children at an average age of 2 to 3 years .,B O O O B I I I I O O O O O O O O O O O O O O,13
3524,11277,"Moreover , human VLCAD and human acyl - CoA oxidase showed extensive sequence homology corroborating the notion that these genes are evolutionarily related .",O O O O O O O O O O O O O O O O O O O O O O O O,13
4044,5593,Similar defects were found in a Fas - negative cell line transfected with cDNAs bearing each of the mutations .,O O O O O O O O O O O O O O O O O O O O,13
1797,10448,Similar findings in two other brothers suggested strongly that they were all suffering from an X linked recessive thrombocytopenic disorder .,O O O O O O O O O O O O O O O B I I I I O,13
7845,6126,"The PAX6 gene is involved in ocular morphogenesis , and PAX6 mutations have been detected in various types of ocular anomalies , including aniridia , Peters anomaly , corneal dystrophy , congenital cataract , and foveal hypoplasia .",O O O O O O O O O O O O O O O O O O O B I O O B O B I O B I O B I O O B I O,13
6135,11821,The first predictive testing for Huntington disease ( HD ) was based on analysis of linked polymorphic DNA markers to estimate the likelihood of inheriting the mutation for HD .,O O O O O B I O B O O O O O O O O O O O O O O O O O O O B O,39
1465,2161,The apparent order of these loci is telomere .,O O O O O O O O O,32
1688,4647,"It encodes a new member of the "" ABC "" superfamily of membrane - associated transporters that shows , in particular , significant homology to the 70 - kDa peroxisomal membrane protein ( PMP70 ) .",O O O O O O O O O O O O O O O O O O O O O O O O O O O O O O O O O O O O,32
8451,9041,Glucose - 6 - phosphate dehydrogenase ( G6PD ; EC 1 . 1 . 1 . 49 ) deficiency is a common genetic abnormality affecting an estimated 400 million people worldwide .,B I I I I I I I I I I I I I I I I I I O O O B I O O O O O O O O,13
1531,4329,These results suggest that mutation of CDK4 can create a tumor - specific antigen and can disrupt the cell - cycle regulation exerted by the tumor suppressor p16INK4a . .,O O O O O O O O O O B O O O O O O O O O O O O O O B O O O O,32
2522,4216,"We used polyclonal and monoclonal anti - fusion protein antibodies to identify native huntingtin in rat , monkey , and human .",O O O O O O O O O O O O O O O O O O O O O O,32
5629,552,"Pendred syndrome is the most common form of syndromic deafness , characterized by dyshormonogenic goiter associated with sensory - neural deafness .",B I O O O O O O B I O O O B I O O B I I I O,32
5707,3688,Sequence analysis of this cDNA provides little insight into its normal functional role . .,O O O O O O O O O O O O O O O,32
8822,596,"We then analyzed the occurrence of RCC in VHL families , based on the nature of mutations .",O O O O O O B O B O O O O O O O O O,32
3918,10146,"The correlation of IQ difference and CTG expansion difference in both the DM parent - child pairs and normal sib - affected sib pairs was poor , indicating that CTG expansion is not a reliable predictor of IQ either in individual persons or families .",O O O O O O O O O O O O B O O O O O O O O O O O O O O O O O O O O O O O O O O O O O O O O,13
8647,9460,"C25 , C24 , and C23 fatty acids were also increased , but the C22 and C20 fatty acids were normal .",O O O O O O O O O O O O O O O O O O O O O O,13
5315,9541,"Analysis of 80 interspecific backcross offspring was used to position Atp7b close to D8Mit3 and another ATPase locus , Atp4b , on mouse chromosome 8 .",O O O O O O O O O O O O O O O O O O O O O O O O O O,13
7504,6461,"Am . Med . Assoc . , 273 564 - 570 , 1995 ; E . A . Maher and W . G . Kaelin , Jr . , Medicine ( Baltimore ) , 76 381 - 391 , 1997 ; W . M . Linehan and R . D . Klausner , In B . Vogelstein and K . Kinzler ( eds . ) , The Genetic Basis of Human Cancer , pp .",O O O O O O O O O O O O O O O O O O O O O O O O O O O O O O O O O O O O O O O O O O O O O O O O O O O O O O O O O O O O O O O O O O O O O O O O O O O,13
8685,7194,Mutation analysis at the A - T locus may help estimate the prognosis of A - T patients . .,O O O O B I I O O O O O O O B I I O O O,13
2672,878,Cis and trans effects of the myotonic dystrophy ( DM ) mutation in a cell culture model .,O O O O O O B I O B O O O O O O O O,32
6611,12156,"The present study used PCR and restriction - enzyme digestion to analyze the frequency of the 845 G - - > A and 187 C - - > G mutations in HLA - typed samples from non - Caucasian populations , comprising Australian Aboriginal , Chinese , and Pacific Islanders .",O O O O O O O O O O O O O O O O O O O O O O O O O O O O O O O O O O O O O O O O O O O O O O O O O O O,39
2171,2618,"The C739 - to - T allele , together with a "" true "" Tay - Sachs disease allele , causes Hex A pseudodeficiency .",O O O O O O O O O O O O O O B I I I O O O O O O O,32
5170,9732,"More than 75 % of the reported mutations in the hereditary breast and ovarian cancer gene , BRCA1 , result in truncated proteins .",O O O O O O O O O O B I I I I O O O O O O O O O,13
9678,8805,PKU is a common inborn error of amino - acid metabolism in caucasian populations and approximately 1 in 50 individuals are carriers of a PKU allele .,B O O O B I I I I I I O O O O O O O O O O O O O B O O,13
4390,193,"In cotransfection experiments , Fas constructs with either intra - or extracellular mutations caused dominant inhibition of apoptosis mediated by wild - type Fas .",O O O O O O O O O O O O O O O O O O O O O O O O O,32
2190,9143,"Both sequences map to the region of 10 centimorgan lying between the Tabby ( Ta ) and St14 - 1 ( DxPas8 ) loci , close to the phosphorylase b kinase locus ( Phk ) .",O O O O O O O O O O O O O O O O O O O O O O O O O O O O O O O O O O O O,13
9226,3564,A transfusion of 320 ml 1 - hour - old normal whole blood on the fifty - second day resulted in transitory elevation of the C3 level to 25 mg / dl with a fall - off ( approximately 2 1 / 2 % per hour ) to undetectable levels by 69 hours ; it was followed by disappearance of the skin rash and arthralgias and return to normal of the previously elevated temperature and CRP levels .,O O O O O O O O O O O O O O O O O O O O O O O O O O O O O O O O O O O O O O O O O O O O O O O O O O O O O O O O O O O O O B I O B O O O O O O O O O O O O O,32
5374,3047,Adrenoleukodystrophy and adrenomyeloneuropathy associated with partial adrenal insufficiency in three generations of a kindred .,B O B O O O B I O O O O O O O,32
4412,12474,"Interestingly , the I1307K APC polymorphism , associated with an increased risk of colorectal cancer , is also present in this family .",O O O O O O O O O O O O O B I O O O O O O O O,39
3816,5374,Tests of both mutations and family - specific differences in age at diagnosis were not significant .,O O O O O O O O O O O O O O O O O,32
8588,11120,None of these tumours showed abnormal migration patterns .,O O O B O O O O O,13
4791,9788,We have previously cloned and characterized the murine homologue of the Huntington disease ( HD ) gene and shown that it maps to mouse chromosome 5 within a region of conserved synteny with human chromosome 4p16 .,O O O O O O O O O O O B I O B O O O O O O O O O O O O O O O O O O O O O O,13
9929,11637,Molecular bases of C7 deficiency : three different defects .,O O O B I O O O O O,13
2503,1696,"Prader - Willi syndrome ( PWS ) is a neurogenetic disease characterized by infantile hypotonia , gonadal hypoplasia , obsessive behaviour and neonatal feeding difficulties followed by hyperphagia , leading to profound obesity .",B I I I O B O O O B I O O B I O B I O O O O O O O O O B O O O O B O,32
330,1483,"The disease locus was assigned to chromosome 9 and the disease gene , STM7 / X25 , has been isolated .",O O O O O O O O O O O O O O O O O O O O O,32
3104,9871,We propose that the PAX6 gene on the rearranged chromosome 11 is in an inappropriate chromatin environment for normal expression and therefore that a position effect is the underlying mechanism of disease in these families . .,O O O O O O O O O O O O O O O O O O O O O O O O O O O O O O O O O O O O O,13
149,6343,All patients were found to be homozygous for a newly identified C - > T transition in codon 21 ( exon 2 ) substituting arginine for a premature stop codon ( R21X CGA to TGA ) and generating a NlaIII restriction site .,O O O O O O O O O O O O O O O O O O O O O O O O O O O O O O O O O O O O O O O O O O O,13
2617,2393,It is well known that an elevated frequency of TSD mutations exists among Ashkenazi Jews .,O O O O O O O O O B O O O O O O,32
4047,7067,We verified these events by in vivo splicing experiments and transient expression analysis of mutant cDNAs .,O O O O O O O O O O O O O O O O O,13
9850,8506,"2 % on the Ionian Coast to zero on the eastern side of the Lucanian Apennines , appears to be inversely related to the distance of each town examined from the Ionian Coast , suggesting that this geographic distribution may reflect , at least in part , gene flow from Greek settlers .",O O O O O O O O O O O O O O O O O O O O O O O O O O O O O O O O O O O O O O O O O O O O O O O O O O O O O,13
455,2207,"Both mutations were tested in a eukaryotic expression system in which enzyme activities of different mutant PAH enzymes reflect the relative severities of the mutations , although these in vitro activities cannot be translated directly into in vivo hepatic activities .",O O O O O O O O O O O O O O O O O O O O O O O O O O O O O O O O O O O O O O O O O,32
3382,3703,Two new variants of glucose - 6 - phosphate dehydrogenase associated with hereditary non - spherocytic hemolytic anemia : G6PD Wayne and G6PD Huron .,O O O O O O O O O O O O B I I I I I O O O O O O O,32
8493,4423,"The seven deficient fibroblast lines were characterized by measuring acyl - coenzyme A dehydrogenation activities , overall palmitic acid oxidation , and VLCAD protein synthesis using pulse - chase , further confirming the diagnosis of VLCAD deficiency .",O O O O O O O O O O O O O O O O O O O O O O O O O O O O O O O O O O O B I O,32
6926,4477,"We have characterized expression of the familial breast and ovarian cancer gene , BRCA1 , in cases of non - hereditary ( sporadic ) breast cancer and analyzed the effect of antisense inhibition of BRCA1 on the proliferative rate of mammary epithelial cells .",O O O O O O B I I I I O O O O O O O B I I I I I I I O O O O O O O O O O O O O O O O O O,32
8369,3016,10 Robertsonian translocation .,O O O O,32
5403,6990,"Thus , abnormalities in extracellular matrix synthesis or organization may contribute to development of the ocular phenotypes .",O O O O O O O O O O O O O O O O O O,13
9365,5473,The FHF2 gene localisation and tissue - specific expression pattern suggest it to be a candidate gene for familial cases of the BFLS syndrome and other syndromal and non - specific forms of X - linked mental retardation mapping to the region .,O O O O O O O O O O O O O O O O O O O O O O B I O O O O O O O O O B I I I I O O O O O,13
7013,11325,"Furthermore , we demonstrate that the Atm protein exists as two discrete molecular species , and that loss of one or of both of these can lead to the development of the disease . .",O O O O O O O O O O O O O O O O O O O O O O O O O O O O O O O O O O O,13
10001,10168,"Because EWS proteins contain putative conserved RNA binding motifs , we studied the RNA binding properties of the EWS protein .",O O O O O O O O O O O O O O O O O O O O O,13
10089,6514,"Relevance of this model was suggested by verification that three of these genes ( IGFBP5 , HSIX1 , and Slug ) were also expressed in alveolar rhabdomyosarcoma cell lines .",O O O O O O O O O O O O O O O O O O O O O O O O O B I O O O,13
4100,5932,"METHODS We examined genomic DNA from 83 ( for BRCA1 185delAG ) or 82 ( for BRCA2 6174delT ) Ashkenazi Jewish prostate cancer patients , most of whom were treated at a relatively young age , for the most common germline mutation in each gene seen in the Ashkenazi population .",O O O O O O O O O O O O O O O O O O O O O B I O O O O O O O O O O O O O O O O O O O O O O O O O O O O,13
409,8196,"PRAD1 , a candidate BCL1 oncogene : mapping and expression in centrocytic lymphoma .",O O O O O O O O O O O B I O,13
6576,9673,0049 in the Japanese general population .,O O O O O O O,13
9636,7009,"Furthermore , tissues from DM patients exhibit somatic mosaicism that increases with age .",O O O O B O O O O O O O O O,13
6871,11875,"Mutations in the SMAD4 / DPC4 tumor suppressor gene , a key signal transducer in most TGFbeta - related pathways , are involved in 50 % of pancreatic cancers .",O O O O O O B O O O O O O O O O O O O O O O O O O O O B I O,39
9202,1231,The gene for Alstrom syndrome ( ALMS1 ) has been previously localized to human chromosome 2p13 by homozygosity mapping in two distinct isolated populations - French Acadian and North African .,O O O B I O O O O O O O O O O O O O O O O O O O O O O O O O O,32
856,6219,The type of somatic mutation at APC in familial adenomatous polyposis is determined by the site of the germline mutation : a new facet to Knudson ' s ' two - hit ' hypothesis .,O O O O O O O O B I I O O O O O O O O O O O O O O O O O O O O O O O O,13
9676,3382,The reversion event involves a second major HPRT gene rearrangement where most or all of the duplicated portion of the mutant gene is deleted .,O O O O O O O O O O O O O O O O O O O O O O O O O,32
178,8709,The consequences of this probe order for antenatal diagnosis and future research aiming to isolate the gene which is affected in DM are discussed .,O O O O O O O O O O O O O O O O O O O O O B O O O,13
4048,6760,Constitutive and regulated modes of splicing produce six major myotonic dystrophy protein kinase ( DMPK ) isoforms with distinct properties .,O O O O O O O O O B I O O O O O O O O O O,13
3197,8082,Markers that have been isolated from the chromosome 11p13 region were then analyzed in this aniridia family .,O O O O O O O O O O O O O O O B O O,13
3233,9972,The mutation is a transition G > A destroying the splice donor site of exon 2 .,O O O O O O O O O O O O O O O O O,13
8569,9070,"A full - length human PAH cDNA sequence has been inserted into pzip - neoSV ( X ) , which is a retroviral vector containing the bacterial neo gene .",O O O O O O O O O O O O O O O O O O O O O O O O O O O O O O,13
7440,7795,"More recently it has become apparent that elevated carrier frequencies for TSD also occur in several other ethnic groups , including Moroccan Jews , a subgroup of Sephardic Jews .",O O O O O O O O O O O B O O O O O O O O O O O O O O O O O O,13
459,6714,Atm and Bax cooperate in ionizing radiation - induced apoptosis in the central nervous system .,O O O O O O O O O O O O O O O O,13
965,3897,Allelic exclusion of glucose - 6 - phosphate dehydrogenase in platelets and T lymphocytes from a Wiskott - Aldrich syndrome carrier .,O O O O O O O O O O O O O O O O B I I I O O,32
6261,9066,"One probe , p31 , was shown to cover one of the breakpoints of the smallest deletion .",O O O O O O O O O O O O O O O O O O,13
6065,5819,"Finally , one frameshift mutation , 2799delC , modifies the C - terminal part of OCRL1 , with an extension of six amino acids .",O O O O O O O O O O O O O O O O O O O O O O O O O,13
5342,7831,"Starting from the MCC gene , a strategy was undertaken to identify constitutional submicroscopic deletions in familial adenomatous polyposis patients that might considerably narrow down the position of the APC gene .",O O O O O O O O O O O O O O O O B I I O O O O O O O O O O B O O,13
2771,8896,In BMD families no recombinants were observed in the 16 informative meioses studied .,O B O O O O O O O O O O O O,13
930,765,"PEX1 mutations were detected in all four patients , including a 1 - bp insertion ( c . 2097insT ) in exon 13 that was present in three of the four patients .",O O O O O O O O O O O O O O O O O O O O O O O O O O O O O O O O O,32
1088,11361,"By analysis of these compiled mutation data , we demonstrated clustering of WASP mutations within the four most N - terminal exons of the gene and also identified several sites within this region as hotspots for WASP mutation .",O O O O O O O O O O O O O O O O O O O O O O O O O O O O O O O O O O O O O O O,13
6506,11688,"A wide spectrum of mutations , ranging from point mutations to large deletions , have been described in the retinoblastoma gene ( RB1 ) .",O O O O O O O O O O O O O O O O O O O B O O O O O,13
2670,10480,"Overall , the establishment of a likely "" hemochromatosis critical region "" centromeric boundary and the identification of a linkage - disequilibrium zone both significantly contribute to a reduction in the amount of DNA required to be searched for novel coding sequences constituting the HFE defect",O O O O O O O O B O O O O O O O O O O O O O O O O O O O O O O O O O O O O O O O O O O O B I,13
6581,4325,1 - restricted autologous cytolytic T lymphocytes ( CTLs ) in a human melanoma .,O O O O O O O O O O O O O B O,32
2720,9355,"Of these , G6PD Mediterranean type was a polymorphic variant and G6PD Corinth occurred with high frequency .",O O O O O O O O O O O O O O O O O O,13
7284,726,The gene encodes a transcriptional regulator that recognizes target genes through its paired - type DNA - binding domain .,O O O O O O O O O O O O O O O O O O O O,32
2705,11430,A - T carriers were reported to be moderately cancer - prone .,B I I O O O O O O B I I O,13
3833,6374,"These patients were mostly men , of non - North African origin , P < 0 .",O O O O O O O O O O O O O O O O O,13
357,9232,"Several possible molecular mechanisms to account for the findings were considered , but insufficient direct data were available to choose among them .",O O O O O O O O O O O O O O O O O O O O O O O,13
9008,2534,Endocrine neoplasms have been reported occasionally in patients with familial adenomatous polyposis ( FAP ) .,B I O O O O O O O B I I O B O O,32
1823,8159,5 at 1 cM .,O O O O O,13
1786,5016,5 Mb in length .,O O O O O,32
3458,4481,Additional case of female monozygotic twins discordant for the clinical manifestations of Duchenne muscular dystrophy due to opposite X - chromosome inactivation .,O O O O O O O O O O O O B I I O O O O O O O O,32
10040,8720,The clinical features were similar and there were no obvious stigmata of Langer - Giedion syndrome ( LGS ) .,O O O O O O O O O O O O B I I I O B O O,13
712,9189,These results not only provide a regionalized map position for a major human disease locus but also can serve as a reference point for linkage analysis with other DNA markers on human chromosome 12,O O O O O O O O O O O O O O O O O O O O O O O O O O O O O O O O O O,13
61,10385,METHODS .,O O,13
2722,1624,Type 1 disease is panethnic but is more prevalent in individuals of Ashkenazi Jewish ( AJ ) descent .,O O O O O O O O O O O O O O O O O O O,32
4914,1896,Determination of carrier status for the Wiskott - Aldrich syndrome by flow cytometric analysis of Wiskott - Aldrich syndrome protein expression in peripheral blood mononuclear cells .,O O O O O O B I I I O O O O O B I I I O O O O O O O O,32
