Unnamed: 0.1,Unnamed: 0,text,labels,txt_len
9472,3038,"With cDNA probes to the DMD gene , a gene deletion was detected in the twins and their mother .",O O O O O B O O O O O O O O O O O O O O,32
1747,2454,We present here a pedigree of a 31 - year - old C2 - deficient individual with clinical manifestations of Hodgkins disease .,O O O O O O O O O O O O B I I O O O O O B I O,32
8471,3772,The current study used allotype analysis of canine C3 in order to demonstrate that the gene for C3 deficiency in these dogs is also a null gene allelic to the structural gene for C3 .,O O O O O O O O O O O O O O O O O B I O O O O O O O O O O O O O O O O,32
7448,7645,Germline intronic and exonic mutations in the Wilms ' tumour gene ( WT1 ) affecting urogenital development .,O O O O O O O B I I O O O O O O O O,13
1244,10310,Alkaptonuria ( AKU ; McKusick no . 203500 ) is a rare autosomal recessive disorder caused by the lack of homogentisic acid oxidase activity .,B O B O O O O O O O O O B I I O O O O O O O O O O,13
7307,4191,"In seven Japanese families ( 14 alleles for classic form and one allele for Duarte variant ) with GALT deficiency , the R231H and 318A - - > G mutations were found only on both alleles of the proband .",O O O O O O O O O O O O O O O O O O B I O O O O O O O O O O O O O O O O O O O O,32
2674,7336,"In this study , we have characterized MAGEL2 ( also known as NDNL1 ) , a gene with 51 % amino acid sequence similarity to necdin and located 41 kb distal to NDN in the PWS deletion region .",O O O O O O O O O O O O O O O O O O O O O O O O O O O O O O O O O O O B O O O,13
2814,5575,These results explain the decreased ferritin levels seen in our HeLa cell system and demonstrate the specific control of HFE over the Tf - mediated pathway of iron uptake .,O O O O O O O O O O O O O O O O O O O O O O O O O O O O O O,13
9056,11401,"In the second family , JT was found in three of the five affected individuals and two affected members also exhibited polycystic kidney disease .",O O O O O B O O O O O O O O O O O O O O O B I I O,13
79,10418,All seven breast tumour / blood pairs examined from this family show loss of heterozygosity in the tumours .,O O B I O O O O O O O O O O O O O B O,13
5085,8863,"6 % and 63 % of normal activity in erythrocytes and leucocytes , respectively .",O O O O O O O O O O O O O O O,13
2838,6079,"The significant relationship among genotype , biochemical phenotype , and cognitive performance observed in the present study is of importance for the development of an optimal strategy for future treatment of females with PKU who plan pregnancy . .",O O O O O O O O O O O O O O O O O O O O O O O O O O O O O O O O O B O O O O O,13
3772,5667,This disorder was mapped to chromosome 7 and the gene causing Pendred syndrome ( PDS ) was subsequently identified by positional cloning .,O O O O O O O O O O O B I O B O O O O O O O O,13
5969,7984,"PKU is a highly heterogeneous disorder , with more than 60 molecular lesions identified in the PAH gene .",B O O O O O O O O O O O O O O O O O O,13
4486,3334,"These observations confirm our earlier impression that the frequency of abnormal color vision is increased in these kindreds , and it supports our contentions that ( 1 ) AMN ( and its companion , adrenoleukodystrophy ) are very closely linked to the visual pigment loci at Xq28 and ( 2 ) this proximity might provide the opportunity to observe contiguous gene defects . .",O O O O O O O O O O B I I O O O O O O O O O O O O O O O B O O O O O B O O O O O O O O O O O O O O O O O O O O O O O O B I I O O,32
3107,5187,An unexpected finding is that the modified Apob allele is strongly associated with exencephalus and hydrocephalus .,O O O O O O O O O O O O O B O B O,32
5208,8856,"One example is the island of Sardinia , where careful clinical and biochemical studies have identified four different G6PD variants .",O O O O O O O O O O O O O O O O O O O O O,13
2297,9469,5 + / - 3 .,O O O O O O,13
6444,2756,"We have performed linkage analysis with the DNA markers DXS52 and the clotting factor VIII gene ( F8C ) , in several large families with X - linked adrenoleukodystrophy ( ALD ) .",O O O O O O O O O O O O O O O O O O O O O O O O O B I I I O B O O,32
4784,12611,"Although emerin was abundant in the membranes of cardiomyocyte nuclei , it was absent from many non - myocyte cells in the heart .",O O O O O O O O O O O O O O O O O O O O O O O O,39
7730,9636,"PLP messenger RNA is specifically expressed in central nervous system tissue , whereas DM20 messenger RNA is found in central nervous system , cardiac , and other tissues .",O O O O O O O O O O O O O O O O O O O O O O O O O O O O O,13
8095,5710,"Defective CD95 / APO - 1 / Fas signal complex formation in the human autoimmune lymphoproliferative syndrome , type Ia .",O O O O O O O O O O O O O O B I I I I I O,13
9608,5095,"By PCR analysis , we found that expression of the NDP gene was not confined to the eye or to the brain .",O O O O O O O O O O B O O O O O O O O O O O O,32
3046,7737,"Treatment of mitotically stimulated lymphocytes with cyclosporin , which inhibits proliferation , blocked the increase in p19 / nm23 ; treatment of the leukemia cell line HL - 60 with dimethylsulfoxide , which induces terminal differentiation , resulted in diminished levels of p19 / nm23 .",O O O O O O O O O O O O O O O O O O O O O O O B O O O O O O O O O O O O O O O O O O O O O O,13
9267,8917,"In an attempt to determine more precisely the occurrence of these deletions within a large population of DMD patients and the accuracy of one of the segments , DXS164 ( pERT87 ) , in determining the inheritance of the DMD X chromosome , the subclones 1 , 8 and 15 were made available to many investigators throughout the world .",O O O O O O O O O O O O O O O O O B O O O O O O O O O O O O O O O O O O O O O B O O O O O O O O O O O O O O O O O O O O,13
8213,2142,This mutation would lead to an amino acid substitution of Asp for Gly at the amino acid position 140 located within the putative 5 - phosphoribosyl - 1 - pyrophosphate ( PRPP ) binding region .,O O O O O O O O O O O O O O O O O O O O O O O O O O O O O O O O O O O O,32
804,1300,X - linked retinoschisis with point mutations in the XLRS1 gene .,B I I I O O O O O O O O,32
9874,7361,"BFIC and GEFS + have clinical features in common , therefore SCN1B is a candidate gene for BFIC .",B O O O O O O O O O O O O O O O O B O,13
569,11404,"Twenty microsatellite markers in the HRPT2 region were typed , in addition to markers in the multiple endocrine neoplasia ( MEN ) types 1 and 2 regions at 11q13 and 10q11 .",O O O O O O O O O O O O O O O O B I I I I I I I I I O O O O O O,13
9020,6960,Transgenic mice expressing a truncated form of the high mobility group I - C protein develop adiposity and an abnormally high prevalence of lipomas .,O O O O O O O O O O O O O O O O O O O O O O O B O,13
2347,12341,Reversal of severe hypertrophic cardiomyopathy and excellent neuropsychologic outcome in very - long - chain acyl - coenzyme A dehydrogenase deficiency .,O O O B I O O O O O B I I I I I I I I I I O,39
9200,11980,"In most of these patients , the onset of the disease was congenital .",O O O O O O O O O O O O O O,39
6799,11518,"Kniest , his patient , the molecular defect .",O O O O O O O O O,13
5731,371,Van der Woude syndrome ( VWS ) is an autosomal dominant disorder comprising cleft lip and / or cleft palate and lip pits .,B I I I O B O O O B I I O B I O O O B I O B I O,32
7229,3727,The assay consisted in the determination of very - long - chain fatty acids in lyophilized and reconstituted plasma .,O O O O O O O O O O O O O O O O O O O O,32
5940,8008,The unexplained phenotype of these mutations includes degeneration and premature cell death of oligodendrocytes with associated hypomyelination .,O O O O O O O B I I I I I I O O B O,13
490,5475,Inherited mutations in the E - cadherin gene ( CDH1 ) were described recently in three Maori kindreds with familial gastric cancer .,O O O O O O O O O O O O O O O O O O O B I I O,13
5690,9258,A total of 3000 men living in Yamaguchi were screened for glucose - 6 - phosphate dehydrogenase ( G6PD ) deficiency using Beutlers spot test and three types of starch gel electrophoresis .,O O O O O O O O O O O B I I I I I I I I I O O O O O O O O O O O O,13
7180,199,"Thus , the location of mutations within APT1 strongly influences the development and the severity of ALPS .",O O O O O O O O O O O O O O O O B O,32
8094,10283,"The frequent association of a severe phenotype with fresh mutation may explain the apparent conflict of a high mutation rate ( 20 - 30 % ) in a condition , which on average , is lethal at a post - reproductive age . .",O O O O O O O O O O O O O O O O O O O O O O O O O O O O O O O O O O O O O O O O O O O O,13
1099,5427,Age of onset in Huntington disease : sex specific influence of apolipoprotein E genotype and normal CAG repeat length .,O O O O B I O O O O O O O O O O O O O O,13
3130,1819,The identification of three separate families in which PLP is duplicated at a noncontiguous site suggests that such duplications could be a relatively common but previously undetected cause of genetic disorders .,O O O O O O O O O O O O O O O O O O O O O O O O O O O O O B I O,32
9342,11719,This difference in mutation sites may affect the clinical features of GLD .,O O O O O O O O O O O B O,13
5600,9268,"The other variant was G6PD Ube , which we had previously found in Yamaguchi ( Nakashima et al . , 1977 ) .",O O O O O O O O O O O O O O O O O O O O O O O,13
820,12501,"The molecular basis of C6 deficiency in the western Cape , South Africa .",O O O O B I O O O O O O O O,39
8023,171,"Using a HeLa cell line in which the expression of HFE is controlled by tetracycline , we show that the expression of HFE reduces 55Fe uptake from Tf by 33 % but does not affect the endocytic or exocytic rates of TfR cycling .",O O O O O O O O O O O O O O O O O O O O O O O O O O O O O O O O O O O O O O O O O O O O,32
9973,843,We evaluated all subjects who had persistently elevated transferrin - saturation values ( 45 percent or higher ) or were homozygous for the C282Y mutation .,O O O O O O O O O O O O O O O O O O O O O O O O O O,32
3544,8058,Mutations at the hexosaminidase A ( HEXA ) gene which cause Tay - Sachs disease ( TSD ) have elevated frequency in the Ashkenazi Jewish and French - Canadian populations .,O O O O O O O O O O O B I I I O B O O O O O O O O O O O O O O,13
1840,7955,"Uniparental disomy has recently been recognized to cause human disorders , including Prader - Willi syndrome ( PWS ) .",B I O O O O O O O O O O B I I I O B O O,13
60,5976,"Globally , K285N is rarer , but in many European populations it can be found on 25 - 40 % of mutant chromosomes .",O O O O O O O O O O O O O O O O O O O O O O O O,13
1832,10359,Her peripheral visual field was preserved but her ERG was moderately abnormal .,O O O O O O O O O O O O O,13
7006,3506,Four of these eight sublocalized to band 15q11 .,O O O O O O O O O,32
7851,10900,"Four novel Swedish founding mutations were identified the nucleotide 2595 deletion A was found in five families , the C 1806 T nonsense mutation in three families , the 3166 insertion TGAGA in three families , and the nucleotide 1201 deletion 11 in two families .",O O O O O O O O O O O O O O O O O O O O O O O O O O O O O O O O O O O O O O O O O O O O O O,13
6161,2516,Short regions of sequence homology were present at the three sites .,O O O O O O O O O O O O,32
1915,12549,6 % of 188 non - European Jews ( P = 0 . 08 ) .,O O O O O O O O O O O O O O O O,39
3105,4354,Disease duration influenced the appearance and amount of white matter lesions on MRI .,O O O O O O O O B I I O O O,32
5300,8517,Sequence analyses of C5 sufficient and deficient cDNAs revealed a 2 base - pair deletion in the deficient cDNAs .,O O O O O O O O O O O O O O O O O O O O,13
9424,2725,Two variants of a genetic deficiency of complement protein C2 ( C2D ) have been previously identified .,O O O O O B I I I I O O O O O O O O,32
8378,11883,Prevalence of p16 and CDK4 germline mutations in 48 melanoma - prone families in France .,O O O O O O O O O B O O O O O O,39
6930,2999,"We report a child with PWS and a de novo unbalanced karyotype - 45 , XY , - 9 , - 15 , + der ( 9 ) t ( 9 ; 15 ) ( q34 ; q13 ) .",O O O O O B O O O O O O O O O O O O O O O O O O O O O O O O O O O O O O O O O O,32
8299,6561,Our results demonstrate that SLS is caused by a strikingly heterogeneous group of mutations in the FALDH gene and provide a framework for understanding the genetic basis of SLS and the development of DNA - based diagnostic tests . .,O O O O B O O O O O O O O O O O O O O O O O O O O O O O B O O O O O O O O O O O,13
7950,5868,"In order to determine whether there are particular regions on 22q11 that are prone to rearrangements , the deletion end - points in a large number of VCFS / DGS patients were defined by haplotype analysis .",O O O O O O O O O O O O O O O O O O O O O O O O O O O B O B O O O O O O O,13
7084,10172,"An EWS - erg chimeric protein , which is found in Ewings sarcoma cells , functions as a transcriptional activator .",O O O O O O O O O O O B I O O O O O O O O,13
6120,7614,"Here we report ( 1 ) identification of another mutation , on a haplotype 9 chromosome , which converts codon 65 from isoleucine ( ATT ) to threonine ( ACT ) , ( 2 ) expression analysis of the I65T mutation in COS cells demonstrating 75 % loss of both immunoreactive protein and enzyme activity , and ( 3 ) expression analysis of the most prevalent PKU allele ( M1V ) in eastern Quebec , showing nondetectable levels of PAH protein and activity , a finding compatible with a mutation in the translation initiation codon .",O O O O O O O O O O O O O O O O O O O O O O O O O O O O O O O O O O O O O O O O O O O O O O O O O O O O O O O O O O O O O O O O O O B O O O O O O O O O O O O O O O O O O O O O O O O O O O O O,13
8222,3677,A novel procedure is presented to estimate the ratio of male to female mutation rates for Duchenne muscular dystrophy ( DMD ) .,O O O O O O O O O O O O O O O O B I I O B O O,32
8523,4951,"DESIGN Case reports with clinical features , fluorescein angiography , kinetic perimetry , electrophysiological studies , and molecular genetics .",O O O O O O O O O O O O O O O O O O O O,32
9905,5467,"Database searches and analysis of available genomic DNA sequence from the region revealed the presence of the fibroblast growth factor homologous factor gene , FHF2 , within the duplication breakpoint interval .",O O O O O O O O O O O O O O O O O O O O O O O O O O O O O O O O,13
8085,10354,"PATIENTS A 75 - year - old woman , her two daughters ( aged 44 and 50 years ) , and her 49 - year - old son were screened for peripherin / RDS mutations because of the presence of multiple phenotypes within the same family .",O O O O O O O O O O O O O O O O O O O O O O O O O O O O O O O O O O O O O O O O O O O O O O O,13
8305,11045,"Furthermore , the broad range of phenotypic severity observed in these patients raises the possibility that allelic combination , not just allelic constitution , may play some role in determining outcome .",O O O O O O O O O O O O O O O O O O O O O O O O O O O O O O O O,13
3320,2013,"Germline mutations in the tumor suppressor gene , BRCA1 , predispose individuals to breast and ovarian cancers .",O O O O B O O O O O O O O B I I I O,32
8033,2669,"Assignment of the aspartylglucosaminidase gene ( AGA ) to 4q33 - - - - q35 based on decreased activity in a girl with a 46 , XX , del ( 4 ) ( q33 ) karyotype .",O O O O O O O O O O O O O O O O O O O O O O O O O O O O O O O O O O O O O,32
3121,10930,"The spectrum comprises 15 % large deletions , 26 % small length alterations , and 42 % base substitutions .",O O O O O O O O O O O O O O O O O O O O,13
1804,3478,"Cellular and humoral immunity were normal , as were polymorphonuclear leukocyte chemotaxis and bactericidal activities .",O O O O O O O O O O O O O O O O,32
4298,10474,"The zone of linkage disequilibrium is flanked by the i97 locus , positioned 30 kb proximal to i82 , and the HLA - F gene , found 250 kb distal to HLA - A , markers of which display no significant association with HFE .",O O O O O O O O O O O O O O O O O O O O O O O O O O O O O O O O O O O O O O O O O O O O O,13
1782,6029,"Furthermore , we propose that active transcription of these repeats in male and female germ cells may facilitate the homologous recombination process .",O O O O O O O O O O O O O O O O O O O O O O O,13
9958,1943,Many missense and protein - truncating mutations of the causative gene RS1 have now been identified and are thought to be inactivating .,O O O O O O O O O O O O O O O O O O O O O O O,32
6379,8067,The most recent ancestors common to obligate carriers of this mutation were from the Charlevoix region of the province of Quebec .,O O O O O O O O O O O O O O O O O O O O O O,13
3076,10080,Combined treatment with CDCA and pravastatin showed good overlapping of the effects of each drug alone .,O O O O O O O O O O O O O O O O O,13
9013,12372,Exon - specific primers developed in this study will facilitate mutation screening studies of patients with the disease .,O O O O O O O O O O O O O O O O O O O,39
1945,2682,Two RFLPs at the D11S323 locus give significant evidence for linkage .,O O O O O O O O O O O O,32
6742,7531,"These findings suggest a "" thalassemia "" - like mutation for this disorder . .",O O O O O B O O O O O O O O O,13
6146,3566,"Thus , this child is a unique individual with inherited C3 deficiency presenting with absence of repeated infections , whose symptoms of fever , skin rash , and arthralgia were abated by whole blood transfusion . .",O O O O O O O O O B I I O O O O O O O O O O B O B I O O B O O O O O O O O,32
718,12203,"Less severe , subacute ( juvenile - onset ) and chronic ( adult - onset ) variants are characterized by a broad spectrum of clinical manifestations and are associated with residual levels of Hex A enzyme activity .",O O O O O O O O O O O O O O O O O O O O O O O O O O O O O O O O O O O O O O,39
7218,12111,6 A crystal structure of HFE reveals the locations of hemochromatosis mutations and a patch of histidines that could be involved in pH - dependent interactions .,O O O O O O O O O O B O O O O O O O O O O O O O O O O,39
525,3433,63 ; and for DXS10 theta = 0 .,O O O O O O O O O,32
7020,1946,A screen of human tissues with this antibody reveals retinoschisin to be retina specific and the antibody detects a protein of similar size in bovine and murine retinae .,O O O O O O O O O O O O O O O O O O O O O O O O O O O O O,32
1920,4157,Complement screening should be carried out in any individual suffering recurrent meningococcal infection or infection with an uncommon meningococcal serogroup .,O O O O O O O O O O O B I O O O O O B O O,32
5235,4438,"In addition , C5D serum was capable of promoting normal phagocytosis and intracellular killing of Staphylococcus aureus .",O O O B O O O O O O O O O O O O O O,32
7775,3921,The Kabyle variant may be common in this country .,O O O O O O O O O O,32
5672,3762,Monoclonal antibodies which recognize different epitopes on either titin or nebulin show normal staining patterns on frozen sections of three muscle biopsies of Duchenne muscular dystrophy ( DMD ) .,O O O O O O O O O O O O O O O O O O O O O O O B I I O B O O,32
5793,9446,5 % of normal .,O O O O O,13
4623,1944,"RS1 encodes a 224 amino acid protein , retinoschisin , which contains a discoidin domain but is of unknown function .",O O O O O O O O O O O O O O O O O O O O O,32
6164,11175,"We found that in fractionated blood cell types ( including erythroid , myeloid , and lymphoid cell lineages ) there was a significant excess of G6PD - normal cells .",O O O O O O O O O O O O O O O O O O O O O O O O O O O O O O,13
6906,8056,"In contrast to previous reports of this condition , one of our severely affected cases is a male . .",O O O O O O O O O O O O O O O O O O O O,13
1585,7146,PATIENTS The study was restricted to patients of Jewish origin because of the ease of BRCA1 and BRCA2 genotyping in this ethnic group .,O O O O O O O O O O O O O O O O O O O O O O O O,13
8512,9071,"The recombinant has been transfected into psi 2 cells , which provide synthesis of the retroviral capsid .",O O O O O O O O O O O O O O O O O O,13
1811,951,The sequencing of the patients cDNA fragment disclosed a direct conjuction of exon 6 and exon 8 .,O O O O O O O O O O O O O O O O O O,32
9279,7438,Genomic rearrangements of the APC tumor - suppressor gene in familial adenomatous polyposis .,O O O O B I O O O O B I I O,13
146,39,Opsonization and generation of chemotactic activity functioned normally .,O O O O O O O O O,32
9991,6619,So far 17 mutations have been characterised in AKU patients of different ethnic origin .,O O O O O O O O B O O O O O O,13
3103,2056,"We have characterised a novel missense mutation , G5260A , in exon 32 in a family segregating for EA - 2 .",O O O O O O O O O O O O O O O O O O B I I O,32
9593,446,"In the complete set of families , a maximum two - point LOD score of 1 .",O O O O O O O O O O O O O O O O O,32
731,9999,We provide genetic evidence supporting the identity of the candidate gene for BRCA1 through the characterization of germline mutations in 63 breast cancer patients and 10 ovarian cancer patients in ten families with cancer linked to chromosome 17q21 .,O O O O O O O O O O O O O O O O O O O O O B I O O O B I O O O O O B O O O O O,13
8061,10077,"CDCA treatment at a dose of 300 mg / day reduced serum cholestanol ( 67 . 3 % reduction ) , lathosterol ( 50 . 8 % ) , campesterol ( 61 . 7 % ) and sitosterol ( 12 . 7 % ) .",O O O O O O O O O O O O O O O O O O O O O O O O O O O O O O O O O O O O O O O O O O O O O,13
9038,7057,"In total , recurrent mutations were found in 33 ( 94 % ) of the 35 families with detected mutations .",O O O O O O O O O O O O O O O O O O O O O,13
6305,8581,These data are compatible with the VHL gene functioning as a recessive tumour suppressor gene .,O O O O O O B O O O O O B O O O,13
8609,3488,"Extensive linkage disequilibrium occurs throughout the probed region with the PI Z allele , but not with normal PI M alleles .",O O O O O O O O O O O O O O O O O O O O O O,32
2732,11594,"To identify the genetic basis of C9 deficiency , we developed an approach using exon - specific PCR and direct DNA sequencing .",O O O O O O B I O O O O O O O O O O O O O O O,13
6430,607,This observation may provide insight into the role of CTLA - 4 in humans . .,O O O O O O O O O O O O O O O O,32
7538,1288,"A total of 2 , 952 single sperm from the six donors were analyzed .",O O O O O O O O O O O O O O O,32
141,10211,Fibroblasts of the patient show significant sulfatide degradation activity exceeding that of adult MLD patients .,O O O O O O O O O O O O B I O O,13
8948,12620,"The ATP7B gene has been excluded in the much rarer human copper overload disease non - Indian childhood cirrhosis , indicating genetic heterogeneity .",O O O O O O O O O O O B I O B I I I I O O O O O,39
4006,626,"One of five PWS / AS patients analyzed to date has an identifiable , rearranged HERC2 transcript derived from the deletion event .",O O O B O B O O O O O O O O O O O O O O O O O,32
4426,6198,We therefore hypothesized that A - T is due to oxidative damage resulting from loss of function of the A - T gene product .,O O O O B I I O O O O O O O O O O O O B I I O O O,13
2703,145,"M . , Jones , N .",O O O O O O O,32
2919,2854,"23 , has been used to refine further the localisation of the gene for Norrie disease ( NDP ) .",O O O O O O O O O O O O O O B I O B O O,32
8211,3567,"Glucose - 6 - phosphate dehydrogenase variants and their frequency in Guangdong , China .",O O O O O O O O O O O O O O O,32
3432,10516,Small deletions were the second most common abnormality and most often created a downstream stop codon as the result of a reading frameshift .,O O O O O O O O O O O O O O O O O O O O O O O O,13
13,1657,"Three BRCA1 abnormalities - 5382insC , C61G , and 4153delA - accounted for 51 % , 20 % , and 11 % of the identified mutations , respectively . .",O B I O O O O O O O O O O O O O O O O O O O O O O O O O O O,32
10004,6411,DNA analysis showed maternal heterodisomy for chromosome 14 .,O O O B I O O O O,13
9888,5826,"Renal amyloidosis , prevented by colchicine , is the most severe complication of FMF , a disorder associated with mutations in the MEFV gene .",B I O O O O O O O O O O O B O O O O O O O O O O O,13
1489,749,"To characterize the functional and structural properties of the COLIA1 / PDGFB fusion protein , we generated a stable NIH3T3 cell line that contained a tumor - derived chimeric gene resulting from a COIA1 intron 7 - PDGFB intron 1 fusion .",O O O O O O O O O O O O O O O O O O O O O O O O O O O O O O O O O O O O O O O O O O,32
4942,5906,"The first mutation deletes a large portion of the coding sequence , generating a null allele .",O O O O O O O O O O O O O O O O O,13
9816,5105,"It was found more frequently in subjects of Irish , Scottish , and Welsh origin compared with English origin ( 63 % and 31 % respectively ) .",O O O O O O O O O O O O O O O O O O O O O O O O O O O O,32
5562,1433,"In this study , we analyzed mutations of the responsible gene , ATP7B , in four Japanese patients with WD .",O O O O O O O O O O O O O O O O O O O B O,32
2558,3183,A comparison of DNA - based and enzyme - based tests .,O O O O O O O O O O O O,32
5533,9306,A family is described in which three children had homozygous deficiency of C3 and in which both parents and two other children were heterozygous for the C3 null gene .,O O O O O O O O O O B I I O O O O O O O O O O O O O O O O O,13
8255,2507,"The size of this fragment varies between affected siblings , and increases in size through generations in parallel with increasing severity of the disease .",O O O O O O O O O O O O O O O O O O O O O O O O O,32
8086,3939,They distribute by gene drift supported by natural selection .,O O O O O O O O O O,32
