Unnamed: 0.1,Unnamed: 0,text,labels,txt_len
6715,2366,"Studies of biopsied tissue for the presence of Epstein - Barr virus and cytomegalovirus were negative , as were studies of blood , including the polymerase chain reaction , for the presence of the human immunodeficiency virus ( HIV ) .",O O O O O O O O B I I I O B O O O O O O O O O O O O O O O O O O O O B I I O B O O,32
5413,9591,"The other was a splicing mutation , an A - to - G transition at the 38th nucleotide in exon 3 ( 318A - - > G ) , resulting in a 38 - bp deletion in the GALT cDNA by activating a cryptic splice acceptor site .",O O O O O O O O O O O O O O O O O O O O O O O O O O O O O O O O O O O O O O O O O O O O O O O O,13
1486,143,"J . , Ellis , M .",O O O O O O O,32
9184,4060,"C26 levels were also increased in most ALD heterozygotes , with a mean level 0 .",O O O O O O O B O O O O O O O O,32
2200,6444,"Of the 17 point mutations so far described , three appear to be more common .",O O O O O O O O O O O O O O O O,13
8782,12223,X - linked dilated cardiomyopathy ( XLDCM ) is a clinical phenotype of dystrophinopathy which is characterized by preferential myocardial involvement without any overt clinical signs of skeletal myopathy .,B I I I I O B O O O O O O B O O O O O B I O O O O O O B I O,39
2824,1632,This finding is consistent with the presence of the N370S mutation in the non - Jewish European population prior to the founding of the AJ population .,O O O O O O O O O O O O O O O O O O O O O O O O O O O,32
4704,6660,"The cellular features resulting from these hMRE11 mutations are similar to those seen in A - T as well as NBS and include hypersensitivity to ionizing radiation , radioresistant DNA synthesis , and abrogation of ATM - dependent events , such as the activation of Jun kinase following exposure to gamma irradiation .",O O O O O O O O O O O O O O B I I O O O B O O B I I I O O O O O O O O O O O O O O O O O O O O O O O O O O,13
2804,6661,"Although the mutant hMre11 proteins retain some ability to interact with hRad50 and Nbs1 , formation of ionizing radiation - induced hMre11 and Nbs1 foci was absent in hMRE11 mutant cells .",O O O O O O O O O O O O O O O O O O O O O O O O O O O O O O O O,13
8967,6501,"In this manuscript , we report the characterization of MAGEL2 and its mouse homologue Magel2 .",O O O O O O O O O O O O O O O O,13
5392,12597,04 .,O O,39
5995,8488,"We describe the first cases , to our knowledge , of C9 deficiency in Europe that were detected in a Swiss family , of which two members - - one with a complete deficiency and the other with approximately half - normal C9 levels - - experienced bacterial meningitis .",O O O O O O O O O O O B I O O O O O O O O O O O O O O O O O O O O O O O O O O O O O O O O O O B I O,13
9108,4963,Assignment of the human Na + / glucose cotransporter gene SGLT1 to chromosome 22q13 . 1 .,O O O O O O O O O O O O O O O O O,32
889,4142,The assignment of Atp7b to mouse chromosome 8 identifies a previously unrecognized region of homology between this chromosome and human chromosome 13 .,O O O O O O O O O O O O O O O O O O O O O O O,32
4191,6246,The subjects were followed for up to four years .,O O O O O O O O O O,13
132,6853,It is not known whether BRCA1 phosphorylation and dispersion and its function in DNA damage response are related .,O O O O O O O O O O O O O O O O O O O,13
9546,496,"Because conventional Piga gene knockout is associated with high embryonic lethality in chimeric mice , we used the Cre / loxP system .",O O O O O O O O O B I O O O O O O O O O O O O,32
5037,8374,Hereditary deficiency of C5 in association with discoid lupus erythematosus .,O B I I O O O B I I O,13
4141,2240,We have screened the remaining five families for point mutations .,O O O O O O O O O O O,32
4441,5391,"Using both antisera , we found positive nuclear membrane staining in skeletal , cardiac and smooth muscles in the normal controls and in patients with neuromuscular diseases other than EDMD .",O O O O O O O O O O O O O O O O O O O O O O O O O B I O O B O,32
2061,10773,Several BRCA1 mutations have now been found to occur in geographically diverse breast and ovarian cancer families .,O O O O O O O O O O O O B I I I O O,13
2973,2527,"A third locus , D22S66 , is deleted in the eight DGS probands tested .",O O O O O O O O O O O B O O O,32
1364,3416,"All 36 patients and 48 carriers tested from the three kindreds had the same haplotype ( TCD / DXYS1 , 11kb / DXYS12 , 1 . 6kb ) .",O O O O O O O O O O O O O O O O B O O O O O O O O O O O O,32
9584,5276,Four additional rare sequence variants of unknown functional importance were also identified .,O O O O O O O O O O O O O,32
8879,10032,The pattern of malformations is similar to that in homozygous Sey mice and suggests a critical role for PAX6 in controlling the migration and differentiation of specific neuronal progenitor cells in the brain . .,O O O O O O O O O O O O O O O O O O O O O O O O O O O O O O O O O O O,13
4047,7067,We verified these events by in vivo splicing experiments and transient expression analysis of mutant cDNAs .,O O O O O O O O O O O O O O O O O,13
7551,4789,A correlation has been demonstrated between the increase in the repeat number of this sequence and the severity of the disease .,O O O O O O O O O O O O O O O O O O O O O O,32
8377,4018,"Chemotaxis and random migration of the patients granulocytes were normal as were myeloperoxidase , leukocyte alkaline phosphatase ( LAP ) , and ultrastructural features .",O O O O O O O O O O O O O O O O O O O O O O O O O,32
498,8251,These results indicate that this disorder can be caused by defect ( s ) of either an apoB gene or other genes . .,O O O O O O O O O O O O O O O O O O O O O O O O,13
1674,11396,DNA chip - based assays may provide a valuable new technology for high - throughput cost - efficient detection of genetic alterations .,O O O O O O O O O O O O O O O O O O O O O O O,13
7196,6868,The mature transcript is approximately 6 kb in length .,O O O O O O O O O O,13
2552,5603,"In northwestern Europe , > 80 % of GH patients are homozygous for one mutation , the substitution of tyrosine for cysteine at position 282 ( C282Y ) in the unprocessed protein .",O O O O O O O O B O O O O O O O O O O O O O O O O O O O O O O O O,13
533,12196,"The others were minute deletions , 4649delA in exon 33 and 7883del5 in exon 55 .",O O O O O O O O O O O O O O O O,39
9112,8133,Molecular characterization of two galactosemia mutations and one polymorphism : implications for structure - function analysis of human galactose - 1 - phosphate uridyltransferase .,O O O O B O O O O O O O O O O O O O O O O O O O O,13
4330,7030,"Of note , the presence of different divergent haplotypes suggested the occurrence of de novo , recurrent N370S mutations .",O O O O O O O O O O O O O O O O O O O O,13
8416,8746,"We describe here a Pelizaeus - Merzbacher pedigree of the classical type , with X - linked inheritance , a typical clinical progression , and a pathologic loss of myelinating cells and myelin in the central nervous system .",O O O O B I I O O O O O O O O O O O O O O O O O O O O O O O O O O O O O O O O,13
8817,7635,"Together with a recently identified allele responsible for Hex A pseudodeficiency ( Triggs - Raine et al . Am J Hum Genet , 1992 ) , these two alleles accounted for almost 50 % ( 29 / 64 ) of TSD or carrier alleles ascertained by enzyme screening tests in non - Jewish Caucasians . .",O O O O O O O O O O O O O O O O O O O O O O O O O O O O O O O O O O O O O O O O B O O O O O O O O O O O O O O O,13
9148,1668,This is an example of an exonic mutation which affects exon - splicing . .,O O O O O O O O O O O O O O O,32
2361,6693,Friedreich ataxia : an overview .,B I O O O O,13
5751,11233,Exon - intron structure of the human neuronal nicotinic acetylcholine receptor alpha 4 subunit ( CHRNA4 ) .,O O O O O O O O O O O O O O O O O O,13
4420,2509,Common sequence motifs at the rearrangement sites of a constitutional X / autosome translocation and associated deletion .,O O O O O O O O O O O O O O O O O O,32
6730,1956,"The seizures usually spontaneously cease after one year without treatment , leaving no neurological abnormalities .",O O O O O O O O O O O O O B I O,32
823,3186,"We developed methods to detect the three mutations in the HEXA gene that occur with high frequency among Ashkenazi Jews two mutations cause infantile Tay - Sachs disease , and the third causes the adult - onset form of the disease .",O O O O O O O O O O O O O O O O O O O O O O O O B I I I O O O O O O O O O O O O O O,32
5754,5543,"A . , Basava , A . , Dormishian , F . , Domingo , R .",O O O O O O O O O O O O O O O O O,13
5447,11949,"To determine if the occurrence of 4003delTC in these unrelated families signifies propagation of an ancestral allele or a mutational hot spot , haplotypes were determined for polymorphisms both within and flanking COL17A1 .",O O O O O O O O O O O O O O O O O O O O O O O O O O O O O O O O O O,39
5379,11774,"Clinical and radiographic examinations were performed to establish diagnoses , and disease severity was assessed using a combination of validated scoring systems .",O O O O O O O O O O O O O O O O O O O O O O O,39
6639,2941,One hundred fifty - five typed members of nine FAP kindred provided more than 90 meioses for linkage analysis .,O O O O O O O O O B O O O O O O O O O O,32
9207,4867,"e e . , combined somatic and germ - line tissue mosaics .",O O O O O O O O O O O O O,32
4805,3100,We have identified 43 subjects with a G6PD variant .,O O O O O O O O O O,32
7186,9771,"However , other interpretations are possible .",O O O O O O O,13
9991,6619,So far 17 mutations have been characterised in AKU patients of different ethnic origin .,O O O O O O O O B O O O O O O,13
8717,8259,"We report a mutation within the phenylalanine hydroxylase ( PAH ) gene that causes aberrant splicing of the mRNA and that is in tight association with chromosomal haplotypes 6 , 10 , and 36 .",O O O O O O O O O O O O O O O O O O O O O O O O O O O O O O O O O O O,13
8726,6165,"To address the molecular basis of disease in Zellweger syndrome patients from CG1 , we examined all 24 PEX1 exons in four patients , including both patients that have mutations in PMP70 .",O O O O O O O O B I O O O O O O O O O O O O O O O O O O O O O O O,13
6872,12579,"We have identified three offspring in a hereditary nonpolyposis colorectal cancer family who developed hematological malignancy at a very early age , and at least two of them displayed signs of neurofibromatosis type 1 ( NF1 ) .",O O O O O O O B I I I O O O B I O O O O O O O O O O O O O O O B I I O B O O,39
7341,7544,Missense mutations in human HPRT deficient patients thus far reported tend to accumulate in this functionally active region .,O O O O B I O O O O O O O O O O O O O,13
3083,11845,"4 years , whereas the family harbouring the missense mutation had an average age of onset of 51 .",O O O O O O O O O O O O O O O O O O O,39
2103,10092,"Thus , in one patient , the deletion resulted in the absence of only one exon , while in another the deletion comprised the entire CHM gene .",O O O O O O O O O O O O O O O O O O O O O O O O O B O O,13
5750,6259,This can be problematic when only part of the gene is examined or when relevant DNA alterations are not recognized by standard methods .,O O O O O O O O O O O O O O O O O O O O O O O O,13
3585,687,"The central part of mouse chromosome 7 is homologous to human 15q11 - q13 , with conservation of both gene order and imprinted features .",O O O O O O O O O O O O O O O O O O O O O O O O O,32
1914,4328,The same mutation was found in one additional melanoma among 28 melanomas analyzed .,O O O O O O O O B O O B O O,32
5212,6384,"01 , compared to our regular FMF population .",O O O O O O B O O,13
9585,9501,A family in which two male siblings were affected with Wiskott - Aldrich syndrome ( WAS ) was studied using G - 6 - PD isoenzymes as an X - linked marker in order to investigate the nature of cellular abnormalities .,O O O O O O O O O O B I I I O B O O O O O O O O O O O O O O O O O O O O O O O O O O,13
2095,175,"These results also have implications for the understanding of cellular iron homeostasis in organs such as the liver , pancreas , heart , and spleen that are iron loaded in hereditary hemochromatotic individuals lacking functional HFE .",O O O O O O O O O O O O O O O O O O O O O O O O O O O O O O B I O O O O O,32
10026,6164,"Furthermore , mutations in the PMP70 gene have also been identified in two Zellweger syndrome patients from CG1 , raising the possibility that CG1 patients may represent a mixture of PEX1 - deficient and PMP70 - deficient individuals .",O O O O O O O O O O O O O B I O O O O O O O O O O O O O O O O O O O O O O O O,13
7460,3763,Gel electrophoresis and immunoblotting performed on two of these muscle biopsies show the normal pattern of titin and nebulin polypeptides .,O O O O O O O O O O O O O O O O O O O O O,32
8452,5970,"Classical galactosemia is caused by a deficiency in activity of the enzyme galactose - 1 - phosphate uridyl transferase ( GALT ) , which , in turn , is caused by mutations at the GALT gene .",B I O O O O O O O O O O O O O O O O O O O O O O O O O O O O O O O O O O O,13
3408,10468,"For these practical considerations , traditional linkage analysis could prove of limited value in further refining the extrapolated physical position of HFE .",O O O O O O O O O O O O O O O O O O O O O O O,13
9661,8909,"Heteroduplex analysis of two of these clones , which grew on DB1257 but not on LE392 , revealed stem - loop structures in the inserts , indicative of inverted , repeated DNA elements .",O O O O O O O O O O O O O O O O O O O O O O O O O O O O O O O O O O,13
28,11113,One possibility might be that individuals who are compound heterozygotes for ATM mutations are more common than we realize . .,O O O O O O O O O O O O O O O O O O O O O,13
5542,5340,"Analysis of mice homozygous for the mutant allele indicate that Brca1 is critical for normal development , as these mice died in utero between 10 and 13 days of gestation ( E10 - E13 ) .",O O O O O O O O O O O O O O O O O O O O O O O O O O O O O O O O O O O O,32
6503,9089,Sequence analysis of this cDNA provides little insight into its normal functional role . .,O O O O O O O O O O O O O O O,13
760,12342,Very - long - chain acyl - coenzyme A dehydrogenase ( VLCAD ) deficiency is a disorder of fatty acid beta oxidation that reportedly has high rates of morbidity and mortality .,B I I I I I I I I I I I I I O O O O O O O O O O O O O O O O O O,39
4839,1430,We discuss these findings in the context of the hypothesis that abnormal development of Purkinje cells and lymphocytes contributes to the pathogenesis of A - T . .,O O O O O O O O O O O O O O O O O O O O O O O B I I O O,32
4196,4763,"In these tumors , the EWS is fused to genes encoding transcriptional activators / repressors , like Fli - 1 or erg or ATF 1 or wt1 .",O O B O O O O O O O O O O O O O O O O O O O O O O O O O,32
2322,10318,We have mapped the entire human SGLT1 Na + / glucose cotransporter gene from cosmid and lambda phage clones representing a genomic region of 112 kilobases .,O O O O O O O O O O O O O O O O O O O O O O O O O O O,13
10118,8470,Analysis of restriction - fragment - length polymorphisms of the mutant CETP allele showed that all probands were homozygous for the identical haplotype .,O O O O O O O O O O O O O O O O O O O O O O O O,13
4476,5183,A benefit of hypobetalipoproteinemia is that mildly affected individuals may be protected from coronary vascular disease .,O O O B O O O O O O O O O B I I O,32
5314,5891,Leu - AVP was a weak agonist with approximately 30 - fold reduced binding to the human V2 receptor .,O O O O O O O O O O O O O O O O O O O O,13
9710,10269,"Most remarkably , we observed multiple cases where the length distributions of intermediate - or small - sized alleles in fathers sperm were significantly different from that in their offsprings blood .",O O O O O O O O O O O O O O O O O O O O O O O O O O O O O O O O,13
5031,7671,"Although almost half of the YACs appear to contain chimeric inserts and several contain internal deletions or other rearrangements , we were able to obtain over 2 .",O O O O O O O O O O O O O O O O O O O O O O O O O O O O,13
3222,9983,The mutation was not observed in DNA from either of the clinically unaffected parents of the proband .,O O O O O O O O O O O O O O O O O O,13
6653,4215,"The Huntington disease ( HD ) phenotype is associated with expansion of a trinucleotide repeat in the IT15 gene , which is predicted to encode a 348 - kDa protein named huntington .",O B I O B O O O O O O O O O O O O O O O O O O O O O O O O O O O O,32
2505,657,"Here , it is shown that BRCA1 interacts in vitro and in vivo with hRad50 , which forms a complex with hMre11 and p95 / nibrin .",O O O O O O O O O O O O O O O O O O O O O O O O O O O,32
4827,10905,"In all , 12 of 16 kindreds manifesting BRCA1 mutation or linkage contained ovarian cancer , as compared with only 6 of the remaining 31 families ( P < . 001 ) .",O O O O O O O O O O O O O B I O O O O O O O O O O O O O O O O O O,13
801,5049,"Because of various features which include the presence of large and normal sized platelets ( rather than small platelets ) and freedom from significant immune deficiencies , it is likely that the X linked recessive thrombocytopenia in this family is an isolated entity quite distinct from the classical WAS phenotype .",O O O O O O O O O O O O O O O O O O O O O O O O B I O O O O O O B I I I O O O O O O O O O O O O B O O,32
9644,2262,We also found random X - inactivation in the mother of the patient who was shown to be a carrier of this deletion .,O O O O O O O O O O O O O O O O O O O O O O O O,32
1372,357,"The propositus was found to have low quantities of an abnormal C6 which was both antigenically deficient and smaller in size than normal C6 ( 110 , 000 daltons compared with 140 , 000 daltons ) and small quantities of apparently normal C7 .",O O O O O O O O O O O O O O O O O O O O O O O O O O O O O O O O O O O O O O O O O O O O,32
6446,2761,"Multipoint linkage analysis with the markers DXS304 , DXS52 , and F8C indicated that both the gene for ALD and for F8C are distal to DXS52 .",O O O O O O O O O O O O O O O O O O B O O O O O O O O,32
4643,3655,"In a subset of families , the relevant segment of the APOE gene was enzymatically amplified to increase the sensitivity of the method .",O O O O O O O O O O O O O O O O O O O O O O O O,32
487,9037,"The mutation does not affect the electrophoretic migration , the isoelectric point , or the thermal stability .",O O O O O O O O O O O O O O O O O O,13
1479,2071,Carrier detection of pyruvate carboxylase deficiency in fibroblasts and lymphocytes .,O O O B I I O O O O O,32
4203,3193,The increased specificity and predictive value of the DNA - based test make it a useful adjunct to the diagnostic tests currently used to screen for carriers of Tay - Sachs disease .,O O O O O O O O O O O O O O O O O O O O O O O O O O O O B I I I O,32
9498,1913,"Subretinal injection of recombinant adeno - associated virus ( AAV ) encoding a Prph2 transgene results in stable generation of outer segment structures and formation of new stacks of discs containing both perpherin - 2 and rhodopsin , which in many cases are morphologically similar to normal outer segments .",O O O O O O O O O O O O O O O O O O O O O O O O O O O O O O O O O O O O O O O O O O O O O O O O O O,32
2647,2906,"5 1 , similar to normal VLDL .",O O O O O O O O,32
4767,5882,A combination of DNA - binding assays and transcriptional analysis was used to determine the functional consequences of these mutations .,O O O O O O O O O O O O O O O O O O O O O,13
3099,11171,"X - chromosome inactivation in mammals is regarded as an essentially random process , but the resulting somatic - cell mosaicism creates the opportunity for cell selection .",O O O O O O O O O O O O O O O O O O O O O O O O O O O O,13
1363,6266,Muscle computed tomography scanning revealed changes characteristic of muscle involvement .,O O O O O O O O O O O,13
3530,11720,Clustering of missense mutations in the ataxia - telangiectasia gene in a sporadic T - cell leukaemia .,O O O O O O B I I O O O B I I I I O,39
6094,4932,Conventional PCR and direct sequencing then established the intron - exon borders of the mutant genomic DNA revealing two splice acceptor mutations a G - - > C substitution at position - 1 of intron 4 and an A - - > G substitution at position - 2 of intron 6 .,O O O O O O O O O O O O O O O O O O O O O O O O O O O O O O O O O O O O O O O O O O O O O O O O O O O O,32
7724,5114,"Point mutations , the majority of which were C - - > T transitions , were the most common abnormality and usually resulted in the conversion of an arginine codon to a stop codon .",O O O O O O O O O O O O O O O O O O O O O O O O O O O O O O O O O O O,32
9983,5332,A total of eight mutations were associated with a reduced quantity of BRCA1 transcript .,O O O O O O O O O O O O O O O,32
950,9671,Cholesteryl ester transfer protein ( CETP ) transfers cholesteryl ester from high density lipoprotein ( HDL ) to apo B - containing lipoproteins .,O O O O O O O O O O O O O O O O O O O O O O O O,13
7779,7798,"One of the mutations is a novel C - to - G transversion , resulting in a replacement of Tyr180 by a stop codon .",O O O O O O O O O O O O O O O O O O O O O O O O O,13
1738,8695,"This supports the previously described hypothesis that the large Northern Finnish choroideremia pedigrees , comprising a total of over 80 living patients representing more than a fifth of all TCD patients described worldwide , carry the same mutation .",O O O O O O O O O O O B O O O O O O O O O O O O O O O O O B O O O O O O O O O,13
6588,8762,The patients serum lacked the 85 kDa C7 chain .,O O O O O O O O O O,13
5744,11265,Initial evaluation of the ATM knockout animals indicates that inactivation of the mouse ATM gene recreates much of the phenotype of ataxia - telangiectasia .,O O O O O O O O O O O O O O O O O O O O O B I I O,13
9674,10141,"An abbreviated Wechsler Adult Intelligence Scale Revised ( WAIS - R ) was used to assess verbal and arithmetical cognitive performance in 55 subjects with myotonic dystrophy ( DM ) , covering all grades of disease severity , and 31 controls at 50 % risk of inheriting DM .",O O O O O O O O O O O O O O O O O O O O O O O O O B I O B O O O O O O O O O O O O O O O O O O B O,13
8920,6938,"In contrast , all other patients were compound heterozygous for one of the following mutations R201H , R482H , G579D , IVS8 + 2T > C .",O O O O O O O O O O O O O O O O O O O O O O O O O O O,13
2201,415,We have examined the OCRL1 gene in eight unrelated patients with OCRL and have found seven new mutations and one recurrent in - frame deletion .,O O O O O O O O O O O B O O O O O O O O O O O O O O,32
4806,4630,A compound heterozygote had severe craniofacial and central nervous system defects and no eyes .,O O O O O B I I I I I O B I O,32
5599,4230,Evidence was found for somatic and gonadal mosaicism for alleles carrying expanded trinucleotide repeats .,O O O O O O O O O O O O O O O,32
1384,2836,"Finally , since none of the 98 PKU patients tested were found to carry this particular deletion , our study suggests that this molecular event probably occurred recently on the background of a haplotype 2 gene in Portugal . .",O O O O O O O B O O O O O O O O O O O O O O O O O O O O O O O O O O O O O O O O,32
6003,3401,"C4 phenotyping in 20 patients and in 26 parents showed that 90 % and 81 % , respectively , had null allotypes at either the C4A or C4B locus compared with 59 % in controls , indicating that defective expression of structural genes may contribute to the observed C4 deficiency . .",O O O O O O O O O O O O O O O O O O O O O O O O O O O O O O O O O O O O O O O O O O O O O O O O B I O O,32
8101,1119,"To advance on both of these avenues , we report the deletion of HFE alpha1 and alpha2 putative ligand binding domains in vivo .",O O O O O O O O O O O O O O O O O O O O O O O O,32
271,1662,"Immunoblot analysis revealed that VLCAD protein was undetectable in patients 2 and 3 , whereas normal - size VLCAD protein and an aberrant form of VLCAD ( 4kDa smaller ) were detected in patient 1 .",O O O O O O O O O O O O O O O O O O O O O O O O O O O O O O O O O O O O,32
7109,6909,There are at least eight clinically distinct autosomal dominant and two X - linked recessive forms .,O O O O O O O O O O O O O O O O O,13
8938,8918,Here we describe the combined results of more than 20 research laboratories with respect to the occurrence of deletions at the DXS164 locus in DNA samples isolated from patients with DMD and Becker muscular dystrophy ( BMD ) .,O O O O O O O O O O O O O O O O O O O O O O O O O O O O O O B O B I I O B O O,13
7383,3941,"Adrenoleukodystrophy : survey of 303 cases : biochemistry , diagnosis , and therapy .",B O O O O O O O O O O O O O,32
7945,10004,The four families with both breast and ovarian cancer had chain termination mutations in the N - terminal half of the protein . .,O O O O O B I I I O O O O O O O O O O O O O O O,13
3031,8019,"The C739 - to - T allele , together with a "" true "" Tay - Sachs disease allele , causes Hex A pseudodeficiency .",O O O O O O O O O O O O O O B I I I O O O O O O O,13
6182,5673,"Our results demonstrate that pendrin functions as a transporter of chloride and iodide , but not sulfate , and may provide insight into thyroid physiology and the pathophysiology of Pendred syndrome . .",O O O O O O O O O O O O O O O O O O O O O O O O O O O O O B I O O,13
5900,7651,Characterization of the myotonic dystrophy region predicts multiple protein isoform - encoding mRNAs .,O O O B I O O O O O O O O O,13
2621,4901,Frequent detection of codon 877 mutation in the androgen receptor gene in advanced prostate cancers .,O O O O O O O O O O O O B I I O,32
