Unnamed: 0.1,Unnamed: 0,text,labels,txt_len
5237,3411,"Linkage studies using restriction fragment length polymorphisms were conducted in the X - linked disorder , choroideremia , designated TCD for Progressive Tapeto - Choroidal Dystrophy .",O O O O O O O O O O O B I I I O B O O B O B I I I I O,32
9073,8302,"We have found this individual to be homozygous for a single C - to - T nucleotide substitution at apoB codon 2252 , which produces a premature in - frame stop codon .",O O O O O O O O O O O O O O O O O O O O O O O O O O O O O O O O O,13
186,2076,Neither pyruvate carboxylase nor mitochondrial PEPCK activity in lymphocytes was increased by a 21 - hr fast .,O O O O O O O O O O O O O O O O O O,32
6656,3379,This mutation is the result of an internal duplication of 16 - 20 kilobases of the gene .,O O O O O O O O O O O O O O O O O O,32
7288,5126,Detection of a novel arginine vasopressin defect by dideoxy fingerprinting .,O O O O O O O O O O O,32
1086,11873,"However , direct visualization and quantitation of hex A by the methods described may prevent false - positive prenatal diagnosis of TSD in fetuses having the incomplete hex A deficiency of the type described in the four healthy individuals",O O O O O O O O O O O O O O O O O O O O O B O O O O O B I I O O O O O O O O O,39
9439,5283,"Novel inherited mutations and variable expressivity of BRCA1 alleles , including the founder mutation 185delAG in Ashkenazi Jewish families .",O O O O O O O O O O O O O O O O O O O O,32
1106,10711,"The evidence for linkage to loci on both 18p and 18q was strongest in the 11 paternal pedigrees , i .",O O O O O O O O O O O O O O O O O O O O O,13
4674,9120,"Criteria for hypopigmentation included the presence of type I or II skin , the lightest skin type in the family by history , and iris translucency on globe transillumination .",O O B O O O O O O O O O O O O O O O O O O O O O O O O O O O,13
4199,966,"Hence , molecular screening for Wolfram syndrome in affected families and for Wolfram syndrome - carrier status in subjects with psychiatric disorders or diabetes mellitus will require complete analysis of exon 8 and upstream exons . .",O O O O O B I O O O O O B I O O O O O O B I O B I O O O O O O O O O O O O,32
1288,12634,"Amino acid changes were identified in four patients , three of whom belonged to the non - FAP group of colorectal cancer patients .",O O O O O O O O O O O O O O O O O O O O B I O O,39
4859,12605,Emerin is a nuclear membrane protein which is missing or defective in Emery - Dreifuss muscular dystrophy ( EDMD ) .,O O O O O O O O O O O O B I I I I O B O O,39
8191,10965,A distinct feature of the mouse gene is an expanded polymorphic GGA trinucleotide repeat that codes for polyglycine and varies from 15 to 17 triplets in different Mus musculus strains .,O O O O O O O O O O O O O O O O O O O O O O O O O O O O O O O,13
2119,8637,"In one kindred , the translocation is associated with a deletion , and probes for this region were used to identify and clone the breakpoints of the translocation in the second kindred .",O O O O O O O O O O O O O O O O O O O O O O O O O O O O O O O O O,13
1566,2604,"Proteolipid protein ( PLP ; M ( r ) 30 , 000 ) is a highly conserved major polytopic membrane protein in myelin but its cellular function remains obscure .",O O O O O O O O O O O O O O O O O O O O O O O O O O O O O O,32
7336,5910,Homozygosity for either mutation results in postnatal iron loading .,O O O O O O O O O O,13
8743,1681,"Human glycine decarboxylase gene ( GLDC ) and its highly conserved processed pseudogene ( psiGLDC ) : their structure and expression , and the identification of a large deletion in a family with nonketotic hyperglycinemia .",O O O O O O O O O O O O O O O O O O O O O O O O O O O O O O O O O B I O,32
749,5144,"However , direct sequencing of overlapping PCR products containing the entire EDH17B2 gene in four unrelated affected women did not uncover any sequence variation , other than previously described polymorphisms .",O O O O O O O O O O O O O O O O O O O O O O O O O O O O O O O,32
4390,193,"In cotransfection experiments , Fas constructs with either intra - or extracellular mutations caused dominant inhibition of apoptosis mediated by wild - type Fas .",O O O O O O O O O O O O O O O O O O O O O O O O O,32
8605,8152,These mutations directly affect DNA sequence recognition .,O O O O O O O O,13
1728,3905,A family is described in which three children had homozygous deficiency of C3 and in which both parents and two other children were heterozygous for the C3 null gene .,O O O O O O O O O O B I I O O O O O O O O O O O O O O O O O,32
9529,6598,"Analysis of stable Chinese hamster ovary transfectants expressing allele - specific recombinant forms of GPIa showed that anti - Sit ( a ) exclusively reacted with the Glu ( 505 ) Met ( 799 ) , but not with the Glu ( 505 ) Thr ( 799 ) and the Lys ( 505 ) Thr ( 799 ) isoforms .",O O O O O O O O O O O O O O O O O O O O O O O O O O O O O O O O O O O O O O O O O O O O O O O O O O O O O O O O O O O O,13
2321,9576,"We found relatively small decreases of DM kinase RNA in the total RNA pool from muscle ; however , these reductions were not disease specific .",O O O O O O B O O O O O O O O O O O O O O O O O O O,13
1558,8274,The rapid identification of mutations causing Tay - Sachs disease requires the capacity to readily screen the regions of the HEXA gene most likely to be affected by mutation .,O O O O O O B I I I O O O O O O O O O O O O O O O O O O O O,13
4890,4210,"Following the finding of a 185delAG frameshift mutation in several Ashkenazi Jewish breast / ovarian families , we have determined the frequency of this mutation in 858 Ashkenazim seeking genetic testing for conditions unrelated to cancer , and in 815 reference individuals not selected for ethnic origin .",O O O O O O O O O O O O O O O O O O O O O O O O O O O O O O O O O O O B O O O O O O O O O O O O,32
6872,12579,"We have identified three offspring in a hereditary nonpolyposis colorectal cancer family who developed hematological malignancy at a very early age , and at least two of them displayed signs of neurofibromatosis type 1 ( NF1 ) .",O O O O O O O B I I I O O O B I O O O O O O O O O O O O O O O B I I O B O O,39
5435,10362,Fluorescein angiography revealed punctate pigment epithelial transmission defects .,O O O O O O O O O,13
9633,6622,The identical 5 ' splice - site acceptor mutation in five attenuated APC families from Newfoundland demonstrates a founder effect .,O O O O O O O O O O O B I O O O O O O O O,13
7323,1551,The factor X ( F10 ) genes of 14 unrelated individuals with factor X deficiency ( 12 familial and two sporadic cases ) were sequenced yielding a total of 13 novel mutations .,O O O O O O O O O O O O B I I O O O O O O O O O O O O O O O O O O,32
9908,11868,5 % - 6 .,O O O O O,39
1063,6832,Novel mutations of the ATP7B gene in Japanese patients with Wilson disease .,O O O O O O O O O O B I O,13
8735,12612,"This distribution of emerin was similar to that of lamin A , a candidate gene for an autosomal form of EDMD .",O O O O O O O O O O O O O O O O O O O O B O,39
1188,3870,"The patient , H .",O O O O O,32
6275,12547,"RESULTS In persons at average risk for colorectal cancer , I1307K was found in 5 .",O O O O O O O B I O O O O O O O,39
9535,2891,The Lesch - Nyhan syndrome is a severe X chromosome - linked human disease caused by a virtual absence of hypoxanthine - guanine phosphoribosyltransferase ( HPRT ) activity .,O B I I I O O O B I I I I I O O O O B I I I I I I I I I O,32
3539,8295,"In all four patients , the only mutation identified was a single base substitution in exons 2 or 3 of the coding region , which in each case predicts a single amino acid substitution in the translated protein .",O O O O O O O O O O O O O O O O O O O O O O O O O O O O O O O O O O O O O O O,13
9812,6699,Currently there is no known treatment that alters the natural course of the disease .,O O O O O O O O O O O O O O O,13
1451,4758,We found strong evidence against linkage to BRCA1 ( lod score - 16 . 63 ) and the best estimate of the proportion of linked families was 0 % ( 95 % CI 0 - 18 % ) .,O O O O O O O O O O O O O O O O O O O O O O O O O O O O O O O O O O O O O O O,32
4758,2990,The consequent severe diarrhoea and dehydration are usually fatal unless these sugars are eliminated from the diet .,O O O B O B O O O O O O O O O O O O,32
4367,7829,Two yeast artificial chromosomes ( YACs ) spanning a total distance of 1 .,O O O O O O O O O O O O O O,13
8538,2613,Deficiency of beta - hexosaminidase A ( Hex A ) activity typically results in Tay - Sachs disease .,B I I I I I O O O O O O O O B I I I O,32
2965,7566,Molecular basis of phenylketonuria and related hyperphenylalaninemias : mutations and polymorphisms in the human phenylalanine hydroxylase gene .,O O O B O O B O O O O O O O O O O O,13
3926,1575,"In patients with fragile X syndrome , the expanded CGG triplet repeats are hypermethylated and the expression of the FMR1 gene is repressed , which leads to the absence of FMR1 protein ( FMRP ) and subsequent mental retardation .",O O O B I I O O O O O O O O O O O O O O O O O O O O O O O O O O O O O O O B I O,32
3645,8221,"The splice - site mutation following exon 7 produces late - infantile MLD when combined with other enzyme - null mutations , implying that it is completely silent enzymatically . .",O O O O O O O O O O O O B O O O O O O O O O O O O O O O O O O,13
4245,8572,"The first , of Italian extraction , suffered from severe neonatal jaundice following maternal ingestion of fresh broad beans ( Vicia fava ) both prenatally and postnatally the expression of the enzymatic defect was much more severe in the neonatal period than on retesting in adolescence , when biochemical characterization showed unique features which justify designation as a new variant Gd ( + ) Alexandra .",O O O O O O O O O O B I O O O O O O O O O O O O O O O O O O O O O O O O O O O O O O O O O O O O O O O O O O O O O O O O O O O O O O,13
2846,9533,Aberrant subcellular localization of BRCA1 in breast cancer .,O O O O O O B I O,13
7847,11339,CONCLUSIONS DCC is a prognostic marker in patients with stage II or stage III colorectal cancer .,O O O O O O O O O B I I I I I I O,13
3247,2885,It accounts for one - fourth of the galactosemia alleles studied .,O O O O O O O O B O O O,32
5589,7398,"A gene , FGD1 , altered in a patient with AAS phenotype , has been identified and found to encode a protein with homology to Rho / Rac guanine nucleotide exchange factors ( Rho / Rac GEF ) .",O O O O O O O O O O B O O O O O O O O O O O O O O O O O O O O O O O O O O O O,13
2876,11370,"Western blot analysis of lymphoblastoid cell lines derived from affected family members from this kindred , as well as from a previously reported Swiss family carrying a frameshift mutation at codon 1987 and displaying a similar attenuated phenotype , showed only the wild - type APC protein .",O O O O O O O O O O O O O O O O O O O O O O O O O O O O O O O O O O O O O O O O O O O O O B O O,13
3985,6063,"Relationship among genotype , biochemical phenotype , and cognitive performance in females with phenylalanine hydroxylase deficiency : report from the Maternal Phenylketonuria Collaborative Study .",O O O O O O O O O O O O O B I I O O O O B I O O O,13
1793,9623,"Huntingtin appears to particularly associate with microtubules , although some is also associated with synaptic vesicles .",O O O O O O O O O O O O O O O O O,13
3774,7125,"Thus , altered ion homeostasis within the lens may contribute to cataract formation .",O O O O O O O O O O O B O O,13
7212,818,The type of somatic mutation at APC in familial adenomatous polyposis is determined by the site of the germline mutation : a new facet to Knudson ' s ' two - hit ' hypothesis .,O O O O O O O O B I I O O O O O O O O O O O O O O O O O O O O O O O O,32
1532,4985,Ganzfeld ERGs were recorded in five boys with DMD after a complete ophthalmic examination .,O O O O O O O O B O O O O O O,32
9993,6491,"Fractionation and immunochemical experiments indicate that this novel conformation of intranuclear ataxin - 3 is not due to proteolysis , suggesting instead that association with nuclear protein ( s ) alters the structure of full - length ataxin - 3 which exposes the polyglutamine domain .",O O O O O O O O O O O O O O O O O O O O O O O O O O O O O O O O O O O O O O O O O O O O O O,13
2942,11234,"The human neuronal nicotinic acetylcholine receptor alpha 4 subunit gene ( CHRNA4 ) is located in the candidate region for three different phenotypes benign familial neonatal convulsions , autosomal dominant nocturnal frontal lobe epilepsy , and low - voltage EEG .",O O O O O O O O O O O O O O O O O O O O O O O B I I I O B I I I I I O O O O O O O,13
936,9912,The gene for spinal cerebellar ataxia 3 ( SCA3 ) is located in a region of approximately 3 cM on chromosome 14q24 . 3 - q32 . 2 .,O O O B I I O O O O O O O O O O O O O O O O O O O O O O O,13
1519,10619,Recombinant vWF containing the observed amino acid substitution was expressed in COS - 1 cells .,O O O O O O O O O O O O O O O O,13
611,6859,Characterization of the rat spinocerebellar ataxia type 3 gene .,O O O O O O O O O O,13
2623,756,We conclude that the COLIA1 / PDGFB fusion associated with DFSP contributes to tumor development through ectopic production of PDGF - BB and the formation of an autocrine loop .,O O O O O O O O O O B O O B O O O O O O O O O O O O O O O O,32
9105,12524,This results in infertility and congenital myotonic dystrophy ( CDM ) with the disappearance of DM in that pedigree .,O O O B O B I I O B O O O O O B O O O O,39
3361,6431,"667T - - > C ( C223R ) , respectively , present the first genetic evidence for the functional significance of the putative leader peptide sequence and for the functional significance at the carboxyl terminal of the XLRS1 protein beyond the discoidin domain .",O O O O O O O O O O O O O O O O O O O O O O O O O O O O O O O O O O O O O O O O O O O O,13
8664,10287,"First , a child with Peters anomaly is deleted for one copy of PAX6 .",O O O O O B I O O O O O O O O,13
6439,9794,The high sequence identity between Hdh and the HD gene for approximately 200 bp 5 to the putative translation start site indicates that these sequences may play a role in regulating expression of the Huntington disease gene,O O O O O O O O B O O O O O O O O O O O O O O O O O O O O O O O O O B I O,13
4064,8529,A new molecular lesion has been identified in exon 7 of the PAH gene in a Hungarian PKU patient by direct sequencing of PCR - amplified DNA .,O O B I O O O O O O O O O O O O O B O O O O O O O O O O,13
2882,731,"We ascertained a novel missense mutation in four pedigrees with Peters anomaly , congenital cataract , Axenfeldt anomaly , and / or foveal hypoplasia , which , to our knowledge , is the first mutation identified in the splice - variant region .",O O O O O O O O O O B I O B I O B I O O O O B I O O O O O O O O O O O O O O O O O O O,32
9963,12313,"His brain magnetic resonance image ( MRI ) showed abnormalities in the bilateral cerebellar hemispheres and brain stem , but not in the cerebral white matter , where marked reductions of the cerebral blood flow and oxygen metabolism were clearly demonstrated by positron emission tomography ( PET ) .",O O O O O O O O O B I I I I I O O O O O O O O O O O O O O O O O O O O O O O O O O O O O O O O O O,39
7872,2705,"The first type of mutation ( 487 G - - - - A ) was found in an affected Chinese with a G to A change at nucleotide 487 , which results in a ( 163 ) Gly to Ser substitution .",O O O O O O O O O O O O O O O O O O O O O O O O O O O O O O O O O O O O O O O O O O,32
6951,6610,7 kb CTSC gene consists of two exons .,O O O O O O O O O,13
10020,11756,Hereditary deficiency of the fifth component of complement in man .,B I I I I I I I O O O,39
9247,1328,"Recently , mutations of the cathepsin C gene have been identified as the underlying genetic defect in PLS .",O O O O O O O O O O O O O O B I O B O,32
7292,11928,"We propose that the loss of wild - type VHL gene results in a specific cellular defect in serum - dependent growth control , which may initiate tumor formation .",O O O O O O O O O B O O O O O O O O O O O O O O O O O B O O,39
2726,4226,"ADCA type I patients from families segregating SCA3 share clinical features in common with those with Machado - Joseph disease ( MJD ) , the gene of which maps to the same region .",B I I O O O O B O O O O O O O O B I I I O B O O O O O O O O O O O O,32
3699,3404,PKU is a common inborn error of amino - acid metabolism in caucasian populations and approximately 1 in 50 individuals are carriers of a PKU allele .,B O O O B I I I I I I O O O O O O O O O O O O O B O O,32
6176,4589,Southern blot analyses and genomic cloning demonstrates the existence of related genes .,O O O O O O O O O O O O O,32
7792,5133,In this study we describe a three - generation family in which two siblings were affected by Duchenne muscular dystrophy ( DMD ) .,O O O O O O O O O O O O O O O O O B I I O B O O,32
5171,4254,We report a CLCN1 Gln - 552 - Arg substitution for a family with dominant inheritance previously diagnosed to have myotonia levior .,O O O O O O O O O O O O O O O O O O O O B I O,32
1898,7785,This protein is the major DMD gene product in brain and other nonmuscle tissues but is undetectable in skeletal muscle extracts .,O O O O O B O O O O O O O O O O O O O O O O,13
739,3091,"A family study revealed complete C9 deficiency in the patients healthy brother and half - normal C9 concentrations in his sister , his son ( who also had experienced an episode of bacterial meningitis ) , and his niece , consistent with an inherited C9 deficiency .",O O O O B I I O O O O O O O O O O O O O O O O O O O O O O O O O B I O O O O O O O O O O B I O,32
6030,2278,We have therefore extended studies on their relationship through the characterisation of a 650 kb YAC isolated using L1 .,O O O O O O O O O O O O O O O O O O O O,32
2427,11999,We have analyzed additional cDNA clones and provide evidence for an additional 0 .,O O O O O O O O O O O O O O,39
4819,8617,A normal male with an inherited deletion of one exon within the DMD gene .,O O O O O O O O O O O O B O O,13
837,5854,"These results are consistent with the hypothesis of linkage to HPC1 in a subset of families with prostate cancer , particularly those with an early age at diagnosis .",O O O O O O O O O O O O O O O O O B I O O O O O O O O O O,13
949,5306,Evidence for linkage was tested with affected - sib - pair and LOD score methods under two definitions of the affected phenotype .,O O O O O O O O O O O O O O O O O O O O O O O,32
4870,5616,"3 % ( + 2 . 0 % ) ( - 1 . 3 % ) in Greenland , 4 .",O O O O O O O O O O O O O O O O O O O O O,13
959,10583,"Familial hypobetalipoproteinemia is an autosomal codominant disorder resulting in a dramatic reduction in plasma concentrations of apolipoprotein ( apo ) B , cholesterol , and beta - migrating lipoproteins .",B I O O B I I O O O O O O O O O O O O O O O O O O O O O O O,13
6980,11329,We investigated whether the expression of the DCC protein in tumor cells is a prognostic marker in colorectal carcinoma .,O O O O O O O O O O B O O O O O O B I O,13
2183,4189,GALT activity of the R231H mutant construct was reduced to 15 % of normal controls in a COS cell expression system .,O O O O O O O O O O O O O O O O O O O O O O,32
3016,9918,"70 , respectively .",O O O O,13
5823,12134,"Genetic heterogeneity of Saethre - Chotzen syndrome , due to TWIST and FGFR mutations .",O O O B I I I O O O O O O O O,39
7845,6126,"The PAX6 gene is involved in ocular morphogenesis , and PAX6 mutations have been detected in various types of ocular anomalies , including aniridia , Peters anomaly , corneal dystrophy , congenital cataract , and foveal hypoplasia .",O O O O O O O O O O O O O O O O O O O B I O O B O B I O B I O B I O O B I O,13
8416,8746,"We describe here a Pelizaeus - Merzbacher pedigree of the classical type , with X - linked inheritance , a typical clinical progression , and a pathologic loss of myelinating cells and myelin in the central nervous system .",O O O O B I I O O O O O O O O O O O O O O O O O O O O O O O O O O O O O O O O,13
8259,8229,A C - to - T transition in exon 4 of the PLP gene was found in 2 affected males and two obligate carriers in a German family with Pelizaeus - Merzbacher disease .,O O O O O O O O O O O O O O O O O O O O O O O O O O O O O B I I I O,13
7435,11400,"In the first family , renal lesions were present in five out of six affected individuals , whereas HPT and JT were seen in four and two cases , respectively .",O O O O O B I O O O O O O O O O O O B O B O O O O O O O O O O,13
1900,2683,The PvuII polymorphism detected by probe p5S1 .,O O O O O O O O,32
7214,10008,"A recent analysis utilizing this polymorphism as well as a flanking dinucleotide marker , suggested that similar to Fragile X syndrome , DM exhibited a founder effect ( Imbert et al . , 1993 Nature Genet . 4 , 72 - 76 ) .",O O O O O O O O O O O O O O O O O O B I I O B O O O O O O O O O O O O O O O O O O O O O,13
6991,6169,"Novel mutations in the Wiskott - Aldrich syndrome protein gene and their effects on transcriptional , translational , and clinical phenotypes .",O O O O B I I I O O O O O O O O O O O O O O,13
1481,12353,"These modules include a putative signal peptide for protein export , four epidermal growth factor ( EGF ) repeats with associated spacer domains , three LDL - receptor ( LDLR ) repeats , a single transmembrane spanning domain , and a cytoplasmic domain .",O O O O O O O O O O O O O O O O O O O O O O O O O O O O O O O O O O O O O O O O O O O O,39
5965,1291,"The segregation distortion favoring the mutant RB1 allele does not seem to occur during spermatogenesis , and , thus , meiotic drive may result either from various mechanisms , including a fertilization advantage or a better mobility in sperm bearing a mutant RB1 gene , or from the existence of a defectively imprinted gene located on the human X chromosome .",O O O O O O O O O O O O O O O O O O O O O O O O O O O O O O O O O O O O O O O O O O O O O O O O O O O O O O O O O O O O O,32
8680,7588,We describe three HEXA mutations associated with infantile Tay - Sachs disease ( TSD ) in three unrelated nonconsanguineous Chinese families .,O O O O O O O O B I I I O B O O O O O O O O,13
1368,12236,"These findings represent the first examples of a genetic defect within the POMC gene and define a new monogenic endocrine disorder resulting in early - onset obesity , adrenal insufficiency and red hair pigmentation . .",O O O O O O O O B I O O O O O O O O B I I O O O O O B O B I O O O O O O,39
9141,4866,"We conclude that DM patients can be considered gonosomal mosaics , i .",O O O B O O O O O O O O O,32
2991,12316,The findings in this family suggest that delGAG291 is part of the cause of Japanese ALD with phenotypic variations .,O O O O O O O O O O O O O O O B O O O O,39
2551,9934,These data suggest that the breast - ovarian cancer - family syndrome is genetically heterogeneous .,O O O O O B I I I I I I O O O O,13
8327,10071,"In four D442G homozygotes , mean HDL - C levels ( 86 + / - 26 mg / dl ) were lower than in Int14 A homozygotes ( 158 + / - 35 mg / dl ) , reflecting residual CETP activity in plasma .",O O O O O O O O O O O O O O O O O O O O O O O O O O O O O O O O O O O O O O O O O O O O O,13
344,3619,"He has an associated odontoma and pigmented ocular fundus lesions , both of which have been shown to be clinical markers of GS .",O O O O B O B I I I O O O O O O O O O O O O B O,32
7478,11976,"Using methylation - sensitive restriction enzymes , we characterized the methylation pattern on the 5 side of the CTG repeat in the DMPK gene of normal individuals and of patients affected with myotonic dystrophy , showing expansions of the repetitive sequence .",O O O O O O O O O O O O O O O O O O O O O O O O O O O O O O O O B I O O O O O O O O,39
7128,7264,Ankylosing spondylitis ( AS ) is a common and highly familial rheumatic disorder .,B I O B O O O O O O O B I O,13
4118,10831,We have analyzed the 27 exons and the promoter region of the RB1 gene in familial or sporadic bilateral retinoblastoma by using single - strand conformation polymorphism analysis .,O O O O O O O O O O O O O O O B I I I I O O O O O O O O O,13
2419,2882,"First , we identified at nucleotide 591 a transition which substitutes glutamine 188 by arginine .",O O O O O O O O O O O O O O O O,32
817,9336,[ Gd - allele distribution patterns in Azerbaijan . III . The identification of mutant forms of glucose - 6 - phosphate dehydrogenase ],O O O O O O O O O O O O O O O O O O O O O O O O,13
8395,8155,Our results provide evidence of a direct role for WT1 in Denys - Drash syndrome and thus urogenital system development . .,O O O O O O O O O O O B I I I O O O O O O O,13
6615,9551,"Haplotype analysis supports previous data which suggest some BRCA1 mutation carriers have common ancestors ; however , we have found at least two examples where recurrent mutations appear to have arisen independently . .",O O O O O O O O O O O O O O O O O O O O O O O O O O O O O O O O O O,13
3349,3410,Choroideremia : close linkage to DXYS1 and DXYS12 demonstrated by segregation analysis and historical - genealogical evidence .,B O O O O O O O O O O O O O O O O O,32
2288,6730,"To determine if a cathepsin C mutation is also responsible for HMS , we sequenced the gene in affected and unaffected subjects from the Cochin isolate in which both the PLS and HMS phenotypes appear .",O O O O O O O O O O O B O O O O O O O O O O O O O O O O O O B O B O O O,13
4191,6246,The subjects were followed for up to four years .,O O O O O O O O O O,13
8977,4392,"Neither Hdh nor the HD gene have typical TATA or CCAAT elements , but both show one putative AP2 binding site and numerous potential Sp1 binding sites .",O O O O B O O O O O O O O O O O O O O O O O O O O O O O,32
3278,1081,2 loci .,O O O,32
