Unnamed: 0.1,Unnamed: 0,text,labels,txt_len
5798,2734,Both galactosemia mutations result in reduced enzymatic activity when reconstructed in the cDNA and overexpressed .,O B O O O O O O O O O O O O O O,32
2318,638,"New mutations , polymorphisms , and rare variants in the ATM gene detected by a novel SSCP strategy .",O O O O O O O O O O O O O O O O O O O,32
2076,6572,The gene ( CTSC ) encoding the lysosomal protease cathepsin C ( or dipeptidyl aminopeptidase I ) lies within this interval .,O O O O O O O O O O O O O O O O O O O O O O,13
5547,3866,"These three variants had normal levels of Km G6P , Km NADP , and Ki NADPH , normal utilizations of both 2 - deoxy - G6P and deamino - NAPD , normal heat stability , and a normal pH curve .",O O O O O O O O O O O O O O O O O O O O O O O O O O O O O O O O O O O O O O O O O,32
5905,10040,The Long - Evans Cinnamon ( LEC ) rat shows similarity to Wilson disease in many clinical and biochemical features .,O O O O O O O O O O O O B I O O O O O O O,13
4309,10111,We have assembled a cosmid contig of 360 kb that encompasses the McLeod gene locus .,O O O O O O O O O O O O B O O O,13
9652,6923,"The principal biochemical abnormality is the accumulation of saturated very - long - chain fatty acids ( VLCFAs > C22 0 , mainly C26 0 ) , which is due to impaired capacity for beta - oxidation in peroxisomes .",O O O O O O O O O O O O O O O O O O O O O O O O O O O O O O O O O O O O O O O O,13
8630,11580,"SSCP analysis of individually amplified exons , with which nine of the 10 mutations were seen , was the most useful detection method for PAX6 . .",O O O O O O O O O O O O O O O O O O O O O O O O O O O,13
5614,2932,A peak lod score of 9 .,O O O O O O O,32
4193,1910,"A common feature of these diseases is the loss of photoreceptor function , also seen in the retinal degeneration slow ( rds or Prph2 Rd2 / Rd2 ) mouse , which is homozygous for a null mutation in Prph2 .",O O O O O O O O O O O O O O O O O B I O O O O O O O O O O O O O O O O O O O O O,32
3457,10995,"Muscles from mature mice show variation in fibre size , increased fibre degeneration and fibrosis .",O O O O O O O O O O O B I O B O,13
6115,12047,These estimates were not substantially affected either by changing the assumed penetrance model for BRCA1 or by including or excluding BRCA1 mutation data .,O O O O O O O O O O O O O O O O O O O O O O O O,39
7322,1999,We analysed 13 independent patients with clinical diagnosis of AAS .,O O O O O O O O O B O,32
667,4040,A new glucose - 6 - phosphate dehydrogenase variant ( G6PD Nagano ) associated with congenital hemolytic anemia .,O O O O O O O O O O O O O O O B I I O,32
6432,10465,The hemochromatosis gene ( HFE ) maps to 6p21 .,O B O O O O O O O O,13
3635,6893,Glycerol kinase ( GK ) represents the primary entry of glycerol into glucose and triglyceride metabolism .,O O O O O O O O O O O O O O O O O,13
5738,2203,"Most mutations are linked to specific haplotypes , as defined by eight polymorphic restriction sites in the PAH gene .",O O O O O O O O O O O O O O O O O O O O,32
9218,5699,The pathognomonic accumulation of very long chain fatty acids could also be prevented by overexpression of ALDRP in immortalized X - ALD cells .,O O O O O O O O O O O O O O O O O O O O O O O O,13
9854,338,Patients with familial APC ( FAP ) carry germ - line mutations in the APC gene and develop multiple colorectal adenomas and subsequent carcinomas early in life .,O O B I O B O O O O O O O O B O O O O B I O O B O O O O,32
8610,9448,"From these results , this was considered to be a new variant and was designated G6PD Nagano .",O O O O O O O O O O O O O O O O O O,13
4759,9607,The carrier frequency of the BRCA1 185delAG mutation is approximately 1 percent in Ashkenazi Jewish individuals .,O O O O O O O O O O O O O O O O O,13
9223,4660,Genetic cholesteryl ester transfer protein deficiency caused by two prevalent mutations as a major determinant of increased levels of high density lipoprotein cholesterol .,O B I I I I O O O O O O O O O O O O O O O O O O,32
63,4450,Part of the peroxisomal PTS1R protein is tightly bound to the peroxisomal membrane .,O O O O O O O O O O O O O O,32
1159,9950,"Gaucher disease ( GD ) is an inherited deficiency of beta - glucocerebrosidase ( EC 3 . 1 . 2 . 45 , gene symbol GBA ) .",B I O B O O O O B I I I I O O O O O O O O O O O O O O O,13
9411,5894,X inactivation and somatic cell selection rescue female mice carrying a Piga - null mutation .,O O O O O O O O O O O O O O O O,13
8623,2029,"Thus , potentiation of netrin activity by inhibitors may result from stabilization of DCC on the axons , and proteolytic activity may regulate axon migration by controlling the number of functional extracellular axon guidance receptors . .",O O O O O O O O O O O O O O O O O O O O O O O O O O O O O O O O O O O O O,32
6458,3254,"The absence of severe phenylketonuria ( PKU ) in both Polynesians and Southeast Asians is consistent with the lack of PAH haplotypes 2 and 3 , on which the severe PKU mutants have arisen among Caucasians . .",O O O O B O B O O O O O O O O O O O O O O O O O O O O O O O B O O O O O O O,32
4690,2408,"4 % ( 7 of 94 ) were A to G mutation at nt 493 , 7 .",O O O O O O O O O O O O O O O O O O,32
3763,1118,"As yet , our understanding of HFE function in iron homeostasis is only partial ; an even more open question is its possible role in the immune system .",O O O O O O O O O O O O O O O O O O O O O O O O O O O O O,32
3432,10516,Small deletions were the second most common abnormality and most often created a downstream stop codon as the result of a reading frameshift .,O O O O O O O O O O O O O O O O O O O O O O O O,13
3487,3779,"These results support the use of the human PAH probe in prenatal diagnosis and detection of carriers , to provide new opportunities for the biochemical characterization of normal and mutant enzymes , and in the investigation of alternative genetic therapies for PKU . .",O O O O O O O O O O O O O O O O O O O O O O O O O O O O O O O O O O O O O O O O O B O O,32
5365,9848,The PTS1R mRNA is expressed in all human tissues examined .,O O O O O O O O O O O,13
9884,8367,Some Mexican glucose - 6 - phosphate dehydrogenase variants revisited .,O O O O O O O O O O O,13
7490,11590,The ninth component of human complement ( C9 ) is the last of the terminal complement components creating the membrane attack complex .,O O O O O O O O O O O O O O O O O O O O O O O,13
814,3959,28 that bridge the DMD gene .,O O O O B O O,32
9663,6569,"The PLS locus has been mapped to chromosome 11q14 - q21 ( refs 7 , 8 , 9 ) .",O O O O O O O O O O O O O O O O O O O O,13
5363,5916,"Direct sequencing of the emerin gene in 22 families with Emery - Dreifuss muscular dystrophy ( EMD ) revealed mutations in 21 ( 95 % ) , confirming that emerin mutations can be identified in the majority of families with X - linked EMD .",O O O O O O O O O O B I I I I O B O O O O O O O O O O O O O O O O O O O O O O O B I I I O,13
9964,6842,Autoinhibition and activation mechanisms of the Wiskott - Aldrich syndrome protein .,O O O O O O B I I I O O,13
4022,6192,"To our knowledge , our results are the first to demonstrate that aminoglycosides can suppress stop codons not only in vitro but also in vivo .",O O O O O O O O O O O O O O O O O O O O O O O O O O,13
447,2644,"Physico - chemical and kinetic study of 10 mutant forms of G6PD , according to WHO program , led to identification of 5 variants of the II class ( Shekii , Bideiz , Shirin - Bulakh , Okhut I and Zakataly ) and 2 variants of the III class ( Okhut II and Martinique - like ) .",O O O O O O O O O O O O O O O O O O O O O O O O O O O O O O O O O O O O O O O O O O O O O O O O O O O O O O O O O O,32
6888,7073,Familial PWS is rare .,B I O O O,13
8121,101,"HFE - / - mice also demonstrated an increase in duodenal DMT1 ( IRE ) mRNA ( average 7 . 7 - fold ) , despite their elevated transferrin saturation and hepatic iron content .",O O O O O O O O O O O O O O O O O O O O O O O O O O O O O O O O O O O,32
9023,5056,"RESULTS In all but one affected member , symptoms of progressive central visual loss developed in the third or fourth decade of life accompanied by central scotoma and well - demarcated atrophy of the retinal pigment epithelium and choriocapillaris of the macula .",O O O O O O O O O O O O B I O O O O O O O O O O O B I O O O O B I I I I I O B I I I O,32
3209,941,In order to investigate the molecular basis for argininemia in four unrelated Portuguese patients ( two from northern Portugal and two from Madeira Island ) we performed a DNA sequence analysis of all the exons and exon / intron boundaries of the liver - type arginase gene ( ARG1 ) .,O O O O O O O O B O O O O O O O O O O O O O O O O O O O O O O O O O O O O O O O O O O O O O O O O O O,32
4225,11421,These common mutations have an etiological role in many breast and ovarian cancer cases and provide the opportunity to examine genotype - phenotype correlations and genotype - environment interactions in individuals with the identical BRCA1 lesion .,O O O O O O O O O B I I I O O O O O O O O O O O O O O O O O O O O O O O O,13
1593,859,We present a child in whom phenylketonuria was apparently caused by homozygosity for the mutation E390G in exon 11 of the phenylalanine hydroxylase ( PAH ) gene .,O O O O O O B O O O O O O O O O O O O O O O O O O O O O,32
7731,9409,Two siblings with chronic discoid lupus erythematosus and several family members were found with heterozygous C2 deficiency .,O O O B I I I O O O O O O O O B I O,13
2537,4545,"Both mutations result from G - - > A transitions , and each alters the same conserved region of the KHK protein .",O O O O O O O O O O O O O O O O O O O O O O O,32
3772,5667,This disorder was mapped to chromosome 7 and the gene causing Pendred syndrome ( PDS ) was subsequently identified by positional cloning .,O O O O O O O O O O O B I O B O O O O O O O O,13
5457,4113,Further evidence for heterogeneity of glucose - 6 - phosphate dehydrogenase deficiency in Papua New Guinea .,O O O O O B I I I I I I O O O O O,32
6263,5546,"M . , Jones , N .",O O O O O O O,13
9233,10848,"In one family , both alleles were normal in the parents and one sister ; thus , the mutation originated de novo in the proposita .",O O O O O O O O O O O O O O O O O O O O O O O O O O,13
9954,12505,"We also show that the 879delG and 1195delC defects are associated with characteristic C6 / C7 region DNA marker haplotypes , although small variations were observed .",O O O O O O O O O O O O O O O O O O O O O O O O O O O,39
10074,3092,"This first case of recurrent meningitis in a white patient with complete C9 deficiency suggests that this complement defect may also be a risk factor for bacterial , especially neisserial , infections . .",O O O O B I O O O O O B I I O O O B I O O O O O O O B I I I I I O O,32
4621,11552,"We tentatively isolate three different types of SJS type 1A , usually recognized in childhood , with moderate bone dysplasia , corresponding to the original descriptions of Schwartz , Jampel and Aberfeld ; type 1B , similar to type 1A but recognizable at birth , with more pronounced bone dysplasia resembling Kniest dysplasia ; and type 2 , manifest at birth , with increased mortality and bone dysplasia resembling Pyle disease .",O O O O O O O B I I O O O O O O O O B I O O O O O O O O O O O O O O O O O O O O O O O O O O O O B I O B I O O O O O O O O O O O O O B I O B I O,13
233,6505,The transcripts encode putative proteins that are homologous to the MAGE proteins and NDN .,O O O O O O O O O O O O O O O,13
2766,4931,Intronic sequences flanking exons 5 and 7 were identified using inverse PCR followed by direct sequencing .,O O O O O O O O O O O O O O O O O,32
1516,7253,"Hypotonia , chorioretinal dystrophy , and myopia were also identified .",B O B I O O B O O O O,13
5099,10432,Classic ( complete ) lecithin cholesterol acyltransferase ( LCAT ) deficiency and Fish - eye disease ( partial LCAT deficiency ) are genetic syndromes associated with markedly decreased plasma levels of high density lipoprotein ( HDL ) cholesterol but not with an increased risk of atherosclerotic cardiovascular disease .,B I I I I I I I I I I O B I I I O B I I O O O O O O O O O O O O O O O O O O O O O O O O O B I I O,13
5510,2359,Coincident Kaposi sarcoma and T - cell lymphoma in a patient with the Wiskott - Aldrich syndrome .,O B I O B I I I O O O O O B I I I O,32
2211,11143,"Chromosomal locations of the Atm ( ataxia - telangiectasia ( AT ) - mutated ) and Acat1 ( mitochondrial acetoacetyl - CoA thiolase ) genes in mouse , rat , and Syrian hamster were determined by direct R - banding FISH .",O O O O O O B I I O B O O O O O O O O O O O O O O O O O O O O O O O O O O O O O O O,13
7905,991,"In addition to the 19 mutations , a total of 15 different polymorphic variants were scored , most of which were recurring .",O O O O O O O O O O O O O O O O O O O O O O O,32
301,419,"Altogether , 70 % of missense mutations are located in exon 15 , and 52 % of all mutations cluster in exons 11 - 15 .",O O O O O O O O O O O O O O O O O O O O O O O O O O,32
2933,5753,"Moreover , the BRCT domain associates with the histone deacetylases HDAC1 and HDAC2 .",O O O O O O O O O O O O O O,13
897,1524,In 0 .,O O O,32
3524,11277,"Moreover , human VLCAD and human acyl - CoA oxidase showed extensive sequence homology corroborating the notion that these genes are evolutionarily related .",O O O O O O O O O O O O O O O O O O O O O O O O,13
1519,10619,Recombinant vWF containing the observed amino acid substitution was expressed in COS - 1 cells .,O O O O O O O O O O O O O O O O,13
1112,8551,Laser cytofluorimetry with a monoclonal antibody against decay - accelerating factor ( DAF ) revealed that 95 % of her erythrocytes were DAF - negative .,O O O O O O O O O O O O O O O O O O O O O O O O O O,13
661,5459,"A large phenotypic variability has been observed , with convulsive disorders , motor retardation and mental retardation being the most abundant manifestations .",O O O O O O O O O B I O B I O B I O O O O O O,13
3217,1514,The disease genes have been identified in two autosomal dominant forms and in one X - linked recessive form .,O O O O O O O O O O O O O O O O O O O O,32
1356,5465,Fluorescence in situ hybridisation using yeast artificial chromosome clones from Xq26 localised the duplication breakpoint to an approximately 400 - kb interval in the Xq26 .,O O O O O O O O O O O O O O O O O O O O O O O O O O,13
6449,11896,We have found a direct progression of the size heterogeneity over time related to initial CTG repeat size and the time interval and always biased towards further expansion .,O O O O O O O O O O O O O O O O O O O O O O O O O O O O O,39
269,6902,- Jean region of Quebec - a common disease haplotype was sought .,O O O O O O O O O O O O O,13
4414,10207,"The other two mutations are missense mutations in exons 10 and 11 ( respectively , L333F and E390G ) .",O O O O O O O O O O O O O O O O O O O O,13
7018,12578,The disease susceptibility of individuals who constitutionally lack both wild - type alleles is unknown .,O O O O O O O O O O O O O O O O,39
10006,6357,"mtDNA deletions have been described , and a gene ( WFS1 ) recently has been identified , on chromosome 4p16 , encoding a predicted 890 amino acid transmembrane protein .",O O O O O O O O O O O O O O O O O O O O O O O O O O O O O O,13
9309,4298,Variant SSCP bands were subcloned and sequenced .,O O O O O O O O,32
7753,8871,"Here we used field inversion gel electrophoresis ( FIGE ) to construct a restriction map of approximately 1 , 000 kb of DNA surrounding the RB1 locus and to detect the translocation breakpoints in three retinoblastoma patients .",O O O O O O O O O O O O O O O O O O O O O O O O O O O O O O O O O O O B O O,13
4739,9626,"The spinocerebellar ataxia 3 locus ( SCA3 ) for type I autosomal dominant cerebellar ataxia ( ADCA type I ) , a clinically and genetically heterogeneous group of neurodegenerative disorders , has been mapped to chromosome 14q32 .",O B I I O O B O O B I I I I I O B I I O O O O O O O O O B I O O O O O O O O,13
6854,3718,Cutaneous and ocular pigmentation were evaluated in 29 individuals with the Prader - Willi syndrome ( PWS ) .,B I I I O O O O O O O B I I I O B O O,32
8504,7522,Analbuminemia in an American Indian girl .,B O O O O O O,13
4823,5604,"In a proportion of GH patients , two mutations are present , C282Y and H63D .",O O O O B O O O O O O O O O O O,13
7561,10720,"We compared galactose - 1 - phosphate uridyltransferase among erythrocytes , leukocytes , and transformed lymphoblasts , as well as total body oxidation of D - ( 13C ) - galactose to 13CO2 among three genotypes for GALT ( S135L / S135L , Q188R / Q188R , and Normal / Normal ) .",O O O O O O O O O O O O O O O O O O O O O O O O O O O O O O O O O O O O O O O O O O O O O O O O O O O O O,13
8,11727,Two of seventeen mutated T - PLL samples had a previously reported A - T allele .,O O O O B I I O O O O O B I I O O,39
5794,9474,"In the CTX HDL , the ratio of apoAI to apoAII was high , the proportion of apoC low , and a normally minor form of apoAI increased relative to other forms .",O O B O O O O O O O O O O O O O O O O O O O O O O O O O O O O O O,13
4589,10024,Mutations were detected in 3 of 32 breast and 1 of 12 ovarian carcinomas ; all four mutations were germline alterations and occurred in early - onset cancers .,O O O O O O O O O O O O B I O O O O O O O O O O O O O B O,13
5818,11228,Three different vector systems have been examined .,O O O O O O O O,13
8272,3441,Linkage analysis with flanking markers was used to assess OCRL carrier status in women at risk .,O O O O O O O O O B O O O O O O O,32
7363,6701,X - linked retinoschisis with point mutations in the XLRS1 gene .,B I I I O O O O O O O O,13
419,392,5 and - 6 .,O O O O O,32
2587,1585,We show that Foxc1 ( + / - ) mice have anterior segment abnormalities similar to those reported in human patients .,O O O O O O O O O O O B I I O O O O O O O O,32
5492,4853,Anticipation was observed more frequently in maternal ( 85 % ) than in paternal ( 37 % ) transmissions ( P < . 001 ) .,O O O O O O O O O O O O O O O O O O O O O O O O O O,32
9756,11945,"Patients with generalized atrophic benign epidermolysis bullosa , a usually nonlethal form of junctional epidermolysis bullosa , have generalized blistering , nail dystrophy , patchy alopecia , and dental abnormalities .",O O O B I I I O O O O O O B I I O O O B O B I O B I O O B I O,39
8813,4167,5 % smaller than normal C6 .,O O O O O O O,32
4991,5118,Point mutations generally produced DNA sequences which resulted in perfect homology with endogenous sequences which lay within 14 bp . .,O O O O O O O O O O O O O O O O O O O O O,32
1349,3014,"1 by in situ hybridization , using a human histidase cDNA .",O O O O O O O O O O O O,32
7736,2782,"In the case of the prenatal diagnosis , the fetus was shown by cytogenetic analysis to be a female , who we predict will be a noncarrier of PMD based on her genotype with the PLP intragenic polymorphism . .",O O O O O O O O O O O O O O O O O O O O O O O O O O O O B O O O O O O O O O O O,32
6236,5125,"In addition , the frequency at which we have found PAX6 mutations suggests that lesions in PAX6 will account for most cases of aniridia . .",O O O O O O O O O O O O O O O O O O O O O O O B O O,32
8101,1119,"To advance on both of these avenues , we report the deletion of HFE alpha1 and alpha2 putative ligand binding domains in vivo .",O O O O O O O O O O O O O O O O O O O O O O O O,32
3350,10766,"Atelosteogenesis type II ( AO II ) is a neonatally lethal chondrodysplasia whose clinical and histological characteristics resemble those of another chondrodysplasia , the much less severe diastrophic dysplasia ( DTD ) .",B I I O B I O O O O O B O O O O O O O O O B O O O O O B I O B O O,13
995,11268,Meiosis is arrested at the zygotene / pachytene stage of prophase I as a result of abnormal chromosomal synapsis and subsequent chromosome fragmentation .,O O O O O O O O O O O O O O O O O O O O O O O O,13
3996,4128,Polymerase chain reaction amplification of VLCAD mRNA and genomic exons defined the molecular defects in two patients with VLCAD deficiency who presented with unexplained cardiac arrest and cardiomyopathy .,O O O O O O O O O O O O O O O O O O B I O O O O B I O B O,32
4085,5549,"S . , Lauer , P . , Lee , V .",O O O O O O O O O O O O,13
9280,11059,"Sequence analysis of the duplicated exons of BRCA1 and 1A1 - 3B and flanking genomic DNA reveals maintenance of the intron - exon structure and a high degree of nucleotide sequence identity , suggesting that these are non - processed pseudogenes and that the duplication is a recent event in evolutionary terms .",O O O O O O O O O O O O O O O O O O O O O O O O O O O O O O O O O O O O O O O O O O O O O O O O O O O O O,13
673,6031,"van der Woude syndrome ( VWS ) , which has been mapped to 1q32 - 41 , is characterized by pits and / or sinuses of the lower lip , cleft lip / palate ( CL / P ) , cleft palate ( CP ) , bifid uvula , and hypodontia ( H ) .",B I I I O B O O O O O O O O O O O O O O B I I I I I I I I O B I I I O B I I O O B I O B O O B I O O B O B O O,13
1350,9508,"Linkage studies in this family revealed one example of probable recombination between the loci for WAS and G - 6 - PD among three informative subjects , suggesting that these two loci may not be closely linked on the X - chromosome . .",O O O O O O O O O O O O O O O B O O O O O O O O O O O O O O O O O O O O O O O O O O O O,13
1126,5264,A deletion of 8q24 .,O O O O O,32
4036,11982,The hemochromatosis gene product complexes with the transferrin receptor and lowers its affinity for ligand binding .,O B O O O O O O O O O O O O O O O,39
2520,1052,We recently showed that transcriptional reactivation of FMR1 full mutations can be achieved by inducing DNA demethylation with 5 - azadeoxycytidine ( 5 - azadC ) .,O O O O O O O O O O O O O O O O O O O O O O O O O O O,32
2861,1373,"In this group of relatives , a low free protein S level was the most reliable predictor of a PROS1 gene defect ( sensitivity 97 . 7 % , specificity 100 % ) .",O O O O O O O O O O O O O O O O O O O B I I O O O O O O O O O O O O,32
9193,2933,"29 at 2 cM was observed for APOC1 - DM , with a lod score of 8 .",O O O O O O O O O O O O O O O O O O,32
9758,4530,All families contained at least one case of ovarian cancer .,O O O O O O O O B I O,32
8017,8819,The above haplotype is a very useful diagnostic tool in these TCD families .,O O O O O O O O O O O B O O,13
2166,115,GCH1 mutation in a patient with adult - onset oromandibular dystonia .,O O O O O O O O O B I O,32
6510,2616,Six additional pseudodeficient subjects were found to have the C739 - to - T mutation .,O O O O O O O O O O O O O O O O,32
2143,4124,beta - Oxidation of long - chain fatty acids provides the major source of energy in the heart .,O O O O O O O O O O O O O O O O O O O,32
7313,5888,"All published mutations affect the signal peptide or the neurophysin - II carrier protein and are presumed to interfere with processing of the preprohormone , leading to neuronal damage .",O O O O O O O O O O O O O O O O O O O O O O O O O O O B I O,13
7831,9320,"Strikingly , the common Mediterranean variant was not found .",O O O O O O O O O O,13
158,2378,5 - kb mRNA that also is transcribed from the DMD gene .,O O O O O O O O O O B O O,32
8602,3995,"Relative to Jews of Polish and Russian origins , there was at least a twofold increase in the TSD carrier frequency in Jews of Austrian , Hungarian , and Czechoslovakian origins ( P less than . 005 ) .",O O O O O O O O O O O O O O O O O O B O O O O O O O O O O O O O O O O O O O O,32
5064,1642,The only instance of disassociation of B27 and spondylitis in a family was where the proband had ulcerative colitis as well as spondylitis .,O O O O O O O O B O O O O O O O O B I O O O B O,32
7936,2605,Neurological mutant mice can often provide model systems for human genetic disorders .,O O O O O O O O O O B I O,32
2555,4061,057 + / - 0 .,O O O O O O,32
1028,4031,"Almost all the variants studied presented residual erythrocyte G6PD activity ranging from 0 to 10 % of normal , and five different mutants were responsible for the deficient phenotype .",O O O O O O O O O O O O O O O O O O O O O O O O O O O O O O,32
2390,3669,"A full - length human PAH cDNA sequence has been inserted into pzip - neoSV ( X ) , which is a retroviral vector containing the bacterial neo gene .",O O O O O O O O O O O O O O O O O O O O O O O O O O O O O O,32
1273,12157,"Results showed that the 845 G - - > A mutation was present in these populations ( allele frequency 0 . 32 % ) , and , furthermore , it was always seen in conjunction with HLA haplotypes common in Caucasians , suggesting that 845 G - - > A may have been introduced into these populations by Caucasian admixture .",O O O O O O O O O O O O O O O O O O O O O O O O O O O O O O O O O O O O O O O O O O O O O O O O O O O O O O O O O O O O O,39
9632,11087,The pattern of hereditary cancer in 14 ( 61 % ) of the 23 families studied was attributed to BRCA1 by a combination of linkage and mutation analyses .,O O O B I O O O O O O O O O O O O O O O O O O O O O O O O,13
3594,11593,We studied a previously described Swiss family with inherited C9 deficiency .,O O O O O O O O B I I O,13
336,5346,"Defective beta - oxidation of saturated very long chain fatty acids ( VLCFAs ; C22 0 - C26 0 ) in peroxisomes has been shown to lead to an accumulation of VLCFAs in leukoid areas of the central nervous system , peripheral nerves , adrenal gland , and blood .",O O O O O O O O O O O O O O O O O O O O O O O O O O O O O O O O O O O O O O O O O O O O O O O O O O,32
241,5919,The phenotype in these families was compared in detail with the clinical features in cases with typical null mutations .,O O O O O O O O O O O O O O O O O O O O,13
