Unnamed: 0.1,Unnamed: 0,text,labels,txt_len
8572,4757,"We have examined 22 families with at least one case of male breast cancer for linkage to the hereditary breast and ovarian cancer locus , BRCA1 , on chromosome 17q .",O O O O O O O O O O O B I I O O O O B I I I I O O O O O O O O,32
8109,1477,"We found that the immune - labeled colloidal gold particles were localized on the nucleoplasmic surface of the inner nuclear membrane , but not on the nuclear pore .",O O O O O O O O O O O O O O O O O O O O O O O O O O O O O,32
536,11237,The nucleotide sequence obtained from the genomic regions adjacent to the exon boundaries enabled us to develop a set of primer pairs for PCR amplification of the complete coding region .,O O O O O O O O O O O O O O O O O O O O O O O O O O O O O O O,13
8551,1647,"The study group consisted of 66 Polish families with cancer who have at least three related females affected with breast or ovarian cancer and who had cancer diagnosed , in at least one of the three affected females , at age < 50 years .",O O O O O O O O O B O O O O O O O O O B I I I O O O B O O O O O O O O O O O O O O O O O O,32
3427,8078,"Linkage analysis between the aniridia phenotype and ACP1 does not support the original linkage results , excluding linkage up to theta = 0 .",O O O O B O O O O O O O O O O O O O O O O O O O,13
3573,7966,3 encodes for the enamel protein amelogenin and has been implicated as the gene responsible for the inherited dental abnormality X - linked amelogenesis imperfecta ( XAI ) .,O O O O O O O O O O O O O O O O O B I I B I I I I O B O O,13
7479,12421,A novel C to A mutation in the sterol 27 - hydroxylase gene ( CYP27 ) was identified by sequencing amplified CYP27 gene products from a patient with cerebrotendinous xanthomatosis ( CTX ) .,O O O O O O O O O O O O O O O O O O O O O O O O O O O O B I O B O O,39
4332,11318,"CONCLUSIONS The DPC4 gene may play a role as a tumor - suppressor gene in a fraction of colorectal cancers ; however , while allelic loss at 18q21 is very often seen in colorectal cancers , only a minority show DPC4 mutations , suggesting that there might be another tumor - suppressor gene in this chromosome region . .",O O O O O O O O O O O O O O O O O O B I O O O O O O O O O O O O O B I O O O O O O O O O O O O O O O O O O O O O O O O,13
9154,9864,"The range of frequency of detection of germline mutations is about 20 % , indicating that other mechanisms of inactivation of RB1 should be involved .",O O O O O O O O O O O O O O O O O O O O O O O O O O,13
9613,9117,These observations suggest that sialophorin functions in T cell activation . .,O O O O O O O O O O O O,13
7551,4789,A correlation has been demonstrated between the increase in the repeat number of this sequence and the severity of the disease .,O O O O O O O O O O O O O O O O O O O O O O,32
6781,6555,All of the patients with SLS were found to carry mutations .,O O O O O B O O O O O O,13
5335,12081,"The distribution and relative frequencies of the I113F and T312S mutations in Australia corresponded to those observed in Northern Ireland and are unique to these two populations , suggesting that both mutations were probably introduced to Australia by Irish migrants during the 19th century .",O O O O O O O O O O O O O O O O O O O O O O O O O O O O O O O O O O O O O O O O O O O O O,39
5696,8066,Obligate heterozygotes for the intron 7 + 1 mutation were born in the Saguenay - Lac - St - Jean region of Quebec .,O O O O O O O O O O O O O O O O O O O O O O O O,13
10094,7276,We postulate that altered metabolism of a natural toxin or antigen by the CYP2D6 gene may increase susceptibility to AS .,O O O O O O O O O O O O O O O O O O O B O,13
1271,7682,The map derived from the YL1 .,O O O O O O O,13
7450,5981,N314D is in linkage disequilibrium with other base changes that differ on the D1 and D2 alleles .,O O O O O O O O O O O O O O O O O O,13
8150,9186,3 - - - - qter 3 - - - - qter .,O O O O O O O O O O O O O,13
7508,3469,"The large size of this gene ( ca . 200 kilobases [ kb ] ) and its multiple dispersed exons ( Wiggs et al . , N . Engl . J . Med . 318 151 - 157 , 1988 ) complicate molecular screening strategies important in prenatal and presymptomatic diagnosis and in carrier detection .",O O O O O O O O O O O O O O O O O O O O O O O O O O O O O O O O O O O O O O O O O O O O O O O O O O O O O O O O,32
3240,11843,The average age of disease onset in those families harbouring causative mutations was between 32 .,O O O O O O O O O O O O O O O O,39
656,2505,It is flanked by the tightly linked genetic markers ERCC1 proximally and D19S51 distally ; these define the DM critical region .,O O O O O O O O O O O O O O O O O O B O O O,32
6960,11362,"These characteristics were observed , however , in both severe and mild cases of the disease .",O O O O O O O O O O O O O O O O O,13
5069,12061,"In addition , a correlation between smooth pursuit gain and the number of trinucleotide repeats was found .",O O O O O O O O O O O O O O O O O O,39
7132,4782,"The bovine aspa gene has also been cloned , and its exon / intron organization is identical to that of the human gene .",O O O O O O O O O O O O O O O O O O O O O O O O,32
4642,8742,Together these data indicate that nonrandom inactivation of the cytogenetically normal paternal X chromosome and a microdeletion of the HPRT gene on an active maternal X chromosome were responsible for the absence of HPRT in this patient . .,O O O O O O O O O O O O O O O O O O O O O O O O O O O O O O O O O O O O O O O,13
1646,6462,"455 - 473 , McGraw - Hill , 1998 ] .",O O O O O O O O O O O,13
2646,1748,"MAIN OUTCOME MEASURES Age at diagnosis , surgical stage , histologic cell type and grade , and surgical outcome ; and response to chemotherapy and survival for advanced - stage ( II and IV ) cases .",O O O O O O O O O O O O O O O O O O O O O O O O O O O O O O O O O O O O O,32
3686,12361,"Recently , however , a missense variant of APC ( I1307K ) was described that confers an increased risk of colorectal tumors , including multiple adenomas , in Ashkenazim .",O O O O O O O O B O O O O O O O O O O O B I O O O B O O O O,39
5254,11550,"We found that a group of patients have mild skeletal changes which may be secondary consequences of myotonia , while another group of patients appear to have primary bone dysplasia with myotonia .",O O O O O O O O O O O O O O O O O B O O O O O O O O O O B I O B O,13
181,7273,Heterozygosity for the most frequent poor metabolizer allele ( CYP2D6 * 4 ) was not associated with increased susceptibility to AS .,O O O O O O O O O O O O O O O O O O O O B O,13
3795,4244,"Using a fingerprinting screening technique , we determined the approximate location of the mutation in 13 unrelated WAS patients with mild to severe clinical symptoms .",O O O O O O O O O O O O O O O O O B O O O O O O O O,32
8833,5042,"In summary , genetic syndromes of either complete or partial LCAT deficiency result in low levels of HDL through preferential hypercatabolism of apoA - II and HDL particles containing apoA - II .",O O O O O O O B I I I I O O O O O O O O O O O O O O O O O O O O O,32
8856,3364,Translocation t ( 5 ; 11 ) ( q13 . 1 ; p13 ) associated with familial isolated aniridia .,O O O O O O O O O O O O O O O O O B I O,32
9313,6614,All PLS patients were homozygous for cathepsin C mutations inherited from a common ancestor .,O B O O O O O O O O O O O O O,13
2626,2916,Examination of a random sample of Yemenite Jews using a molecular probe that detects the carriers of this deletion indicated a high frequency of the defective gene in this community .,O O O O O O O O O O O O O O O O O O O O O O O O O O O O O O O,32
4255,5495,Mechanism of increased iron absorption in murine model of hereditary hemochromatosis : increased duodenal expression of the iron transporter DMT1 .,O O O O O O O O O B I O O O O O O O O O O,13
6294,8582,Sporadic cerebellar haemangioblastoma and some renal cell carcinoma may arise from somatic mutations inactivating both alleles at the VHL locus . .,B I I O O B I I O O O O O O O O O O B O O O,13
4633,7475,"Fibroblasts from the patients mother and father had 42 and 34 % , respectively , of the activity of the lowest normal .",O O O O O O O O O O O O O O O O O O O O O O O,13
752,7486,"The abnormal enzymes are respectively designated as GdDcbrousse - like , GdGallura and GdAgrigento . .",O O O O O O O O O O O O O O O O,13
2192,7419,These findings reveal a direct function for BRCA1 in transcriptional control through modulation of chromatin structure . .,O O O O O O O O O O O O O O O O O O,13
2149,5744,Wild - type APC activity in beta - catenin - / Tcf - mediated transcription was strongly inhibited by a mutant APC that is truncated at codon 1309 .,O O O B O O O O O O O O O O O O O O O O O B O O O O O O O,13
4699,7237,Our data support the previously established observation that families with a germline deletion have a low risk for pheochromocytoma .,O O O O O O O O O O O O O O O O O O B O,13
4902,2820,"The splice - site mutation following exon 7 produces late - infantile MLD when combined with other enzyme - null mutations , implying that it is completely silent enzymatically . .",O O O O O O O O O O O O B O O O O O O O O O O O O O O O O O O,32
534,5491,"We report that heterozygosity for a targeted murine Wt1 allele , Wt1 ( tmT396 ) , which truncates ZF3 at codon 396 , induces mesangial sclerosis characteristic of DDS in adult heterozygous and chimeric mice .",O O O O O O O O O O O O O O O O O O O O O O O O B I O O B O O O O O O O,13
9664,1360,Myotonic dystrophy ( DM ) is the most prevalent inherited neuromuscular disease in adults .,B I O B O O O O O B I I O O O,32
1861,5204,All the mutations will interfere with the correct translation of the mRNA predicting a truncated protein or no gene product at all . .,O O O O O O O O O O O O O O O O O O O O O O O O,32
5540,10068,"Furthermore , prevalences of the D442G and Int14 A mutations were extremely high in a general sample of Japanese men ( n = 236 ) , with heterozygote frequencies of 7 % and 2 % , respectively .",O O O O O O O O O O O O O O O O O O O O O O O O O O O O O O O O O O O O O O,13
4278,7700,"Small nuclear ribonucleoprotein polypeptide N ( SNRPN ) , an expressed gene in the Prader - Willi syndrome critical region .",O O O O O O O O O O O O O O B I I I O O O,13
8720,7277,Functional differences of the PDS gene product are associated with phenotypic variation in patients with Pendred syndrome and non - syndromic hearing loss ( DFNB4 ) .,O O O O B O O O O O O O O O O B I O B I I I I O B O O,13
483,8774,No apoB was detectable in the plasma of HBL individuals with an ELISA assay .,O O O O O O O O B O O O O O O,13
3867,1552,Family studies were performed in order to distinguish the contributions of individual mutant F10 alleles to the clinical and laboratory phenotypes .,O O O O O O O O O O O O O O O O O O O O O O,32
2818,5402,"The adenomatous polyposis coli ( APC ) tumour - suppressor protein controls the Wnt signalling pathway by forming a complex with glycogen synthase kinase 3beta ( GSK - 3beta ) , axin / conductin and betacatenin .",O B I I I I I I O O O O O O O O O O O O O O O O O O O O O O O O O O O O O,13
3709,4278,17 .,O O,32
899,1167,"Some patients have only palmoplantar keratosis or periodontitis , and in rare individuals the periodontitis is mild and of late onset .",O O O O B I O B O O O O O O B O O O O O O O,32
9173,10899,The remaining mutation is a missense mutation ( Cys61Gly ) in the zinc - binding motif .,O O O O O O O O O O O O O O O O O,13
3615,3579,"The second group was comprised of a family in which there was a complete heterozygous deletion of the vWF gene in the proband and one asymptomatic parent , suggesting that a different type of genetic abnormality was inherited from the other parent .",O O O O O O O O O O O O O O O O O O O O O O O O O O O O O O O O O O B I O O O O O O O,32
4256,4342,The deletion seems to occur due to exon skipping during processing of VLCAD pre - mRNA .,O O O O O O O O O O O O O O O O O,32
1239,4229,Instability of the expanded triplet repeat was not found to be affected by sex of the parent transmitting the mutation .,O O O O O O O O O O O O O O O O O O O O O,32
6426,7718,In 12 patients altered PCR fragments were detected which were studied in detail by direct sequencing .,O O O O O O O O O O O O O O O O O,13
3640,2791,We studied the relationship between the autosomal recessive trait familial Mediterranean fever ( FMF ) and the serum amyloid A ( SAA ) genes by comparing alleles of a highly polymorphic dinucleotide repeat and a conventional restriction fragment length polymorphism ( RFLP ) in the SAA gene cluster in Israeli FMF kindreds .,O O O O O O O O O B I I O B O O O O O O O O O O O O O O O O O O O O O O O O O O O O O O O O O O O O B O O,32
8645,6876,"The gene for EDMD on Xq28 encodes a novel protein named emerin that localizes at the nuclear membrane of skeletal , cardiac and smooth muscles and some other non - muscle tissues .",O O O B O O O O O O O O O O O O O O O O O O O O O O O O O O O O O,13
7838,5681,This substitution accounted for 7 .,O O O O O O,13
249,1829,Genotype - phenotype correlations in families with deletions in the von Hippel - Lindau ( VHL ) gene .,O O O O O O O O O O B I I I O B O O O,32
9042,5848,"10 was observed at D1S413 ( at a recombination fraction [ theta ] of . 1 ) , with a maximum NPL ( nonparametric linkage ) Z score of 1 .",O O O O O O O O O O O O O O O O O O O O O O O O O O O O O O O,13
2380,9299,An obligate carrier of the Wiskott - Aldrich syndrome ( WAS ) who was also heterozygous for the A and B types of X - linked glucose - 6 - phosphate dehydrogenase was found .,O O O O O B I I I O B O O O O O O O O O O O O O O O O O O O O O O O O,13
2550,1318,"Although many of the same regions of the CNS in both Bax - / - and Atm - / - mice were radioresistant , mice nullizygous for both Bax and Atm showed additional reduction in IR - induced apoptosis in the CNS .",O O O O O O O O O O O O O O O O O O O O O O O O O O O O O O O O O O O O O O O O O O O,32
5213,6591,The Sit ( a ) alloantigen is of low frequency ( 1 / 400 ) in the German population .,O O O O O O O O O O O O O O O O O O O O,13
8355,12307,"A Japanese family with adrenoleukodystrophy with a codon 291 deletion : a clinical , biochemical , pathological , and genetic report .",O O O O B O O O O O O O O O O O O O O O O O,39
982,7867,"In addition to loss of heterozygosity ( LOH ) at the APC locus in 30 tumors , 43 other somatic mutations were detected .",O O O O O O O O O O O B O O O B O O O O O O O O,13
9246,3218,These results have implications for genetic counselling and prenatal diagnosis in families with Becker muscular dystrophy . .,O O O O O O O O O O O O O B I I O O,32
3784,11085,Genetic analysis was undertaken to establish linkage between the breast or ovarian cancer cases and markers on chromosomes 17q ( BRCA1 ) and 13q ( BRCA2 ) .,O O O O O O O O O B I I I O O O O O O O O O O O O O O O,13
4355,3817,The serum of a 44 - yr - old woman of French - Canadian descent having a B - 27 positive ankylosing spondylitis was deficient in the seventh component of complement ( C7 ) as determined by hemolytic and immunochemical methods .,O O O O O O O O O O O O O O O O O O O O O B I O B I I I I I I O O O O O O O O O O O,32
466,1977,"However , these patients develop colorectal tumors more frequently than does the general population because APC ( AS9 ) is inactivated by mutations that do not inactivate the wild - type APC . .",O O O O O B I O O O O O O O O O O O O O O O O O O O O O O O O O O O,32
9597,8363,"To test the role of SAA and APCS in MEF and MEF - amyloidosis , we studied 17 informative families ( 15 Armenians , 2 non - Ashkenazi Jews ) and 8 MEF patients with amyloidosis using a candidate gene approach .",O O O O O O O O O B O B I I O O O O O O O O O O O O O O O O O O B O O B O O O O O O,13
7402,7705,The fact that the mouse Snrpn gene is maternally imprinted in brain suggests that loss of the paternally derived SNRPN allele may be involved in the PWS phenotype . .,O O O O O O O O O O O O O O O O O O O O O O O O O O B O O O,13
6165,3562,"Properdin factor B was 702 ( normal 175 to 275 ) mug / ml , and was not cleaver upon addition of zymosan or cobra venom factor .",O O O O O O O O O O O O O O O O O O O O O O O O O O O O,32
9288,1798,"The murine gene contains ten exons with a coding sequence of 2304 bp , while the rat homolog has nine exons with a coding sequence of 2253 bp .",O O O O O O O O O O O O O O O O O O O O O O O O O O O O O,32
2142,2498,"These linkage data narrow the boundaries within which the WAS locus maps to the chromosomal region bracketed by TIMP and DXS146 and support the loci order Xpter - DXS7 - TIMP - ( OATL1 , WAS , DXS255 ) - DXS146 .",O O O O O O O O O B O O O O O O O O O O O O O O O O O O O O O O O O O O O O O O O O,32
6783,11184,"515 for all models considered , and no statistically significant difference from .",O O O O O O O O O O O O O,13
1134,1337,Approximately 0 .,O O O,32
6228,9387,"However , the hypothesis that PWS is associated with deletion of 15q11 - 12 can neither explain the apparently balanced translocations of chromosome 15 nor account for the small supernumerary metacentric chromosomes corresponding to an isochromosome 15 for band 15q11 observed in some cases . .",O O O O O B O O O O O O O O O O O O O O O O O O O O O O O O O O O O O O O O O O O O O O O O,13
1202,916,The mutation was located in the 10th transmembrane helix .,O O O O O O O O O O,32
5704,3063,BACKGROUND AND METHODS .,O O O O,32
1663,5513,CONCLUSIONS Lorenzos oil therapy had no effect on patients with evidence of inflammatory brain lesions .,O O O O O O O O O O O O B I I O,13
8515,7971,"This supports the involvement of AMELX , located close to DXS16 , in the XAI disease process ( AIH1 ) in those families .",O O O O O O O O O O O O O O B I O O O O O O O O,13
7001,1634,"The results of these studies are consistent with a significant bottleneck occurring in the AJ population during the first millennium , when the population became established in Europe .",O O O O O O O O O O O O O O O O O O O O O O O O O O O O O,32
167,8401,Molecular studies with the DNA probe pML34 confirmed that only a single Prader Willi critical region ( PWCR 15q11 . 2 - q12 ) copy was present .,O O O O O O O O O O O O B I O O O O O O O O O O O O O O,13
9038,7057,"In total , recurrent mutations were found in 33 ( 94 % ) of the 35 families with detected mutations .",O O O O O O O O O O O O O O O O O O O O O,13
5755,6775,First - degree relatives with a PROS1 gene defect had a 5 .,O O O O O O B I I O O O O,13
2045,6888,Haplotype analysis of the STM7 / X25 region of chromosome 9 demonstrated that the relevant portion of chromosome 9 differs in the patients .,O O O O O O O O O O O O O O O O O O O O O O O O,13
8968,11940,5 h in the presence or absence of 10 microg cycloheximide per ml .,O O O O O O O O O O O O O O,39
477,11964,"The other allele ( Hp2 ) of individuals with Hp2 / Hpdel was found to have , in all exons , no mutation , by DNA sequencing .",O O O O O O O O O O O O O O O O O O O O O O O O O O O O,39
9084,8222,Analysis of X - chromosome inactivation and presumptive expression of the Wiskott - Aldrich syndrome ( WAS ) gene in hematopoietic cell lineages of a thrombocytopenic carrier female of WAS .,O O O O O O O O O O O B I I I O B O O O O O O O O O O O O B O,13
8959,2948,44 could lie in the interval L5 .,O O O O O O O O,32
3537,7228,"Haplotyping showed that they are likely to derive from a common ancestor , possibly of northern British origin .",O O O O O O O O O O O O O O O O O O O,13
660,713,"On the basis of a sperm typing study performed in patients of Japanese descent with Machado - Joseph disease ( MJD ) , it was reported that disease alleles are preferentially transmitted during meiosis .",O O O O O O O O O O O O O O O B I I I O B O O O O O O O O O O O O O O,32
99,6784,Detection of FAS transcripts via real - time quantitative PCR made a severe transcriptional defect unlikely .,O O O O O O O O O O O O O O O O O,13
4727,11882,"Rescued embryos show severe anterior truncations , indicating a second important role for Smad4 in anterior patterning during embryogenesis .",O O O O O O O O O O O O O O O O O O O O,39
7703,10270,Our combined findings indicate that intergenerational length changes in the unstable CTG repeat are most likely to occur during early embryonic mitotic divisions in both somatic and germ - line tissue formation .,O O O O O O O O O O O O O O O O O O O O O O O O O O O O O O O O O,13
2941,10456,"METHODS Affected individuals underwent ophthalmic examination , scotopic perimetry , dark adaptometry , measurement of color - contrast sensitivity , and electroretinography to characterize the photoreceptor dysfunction .",O O O O O O O O O O O O O O O O O O O O O O O O O O O O,13
6122,6544,"Pendred syndrome is a recessive inherited disorder that consists of developmental abnormalities of the cochlea , sensorineural hearing loss , and diffuse thyroid enlargement ( goiter ) .",B I O O B I I O O O B I I I I O B I I O O B I I O B O O,13
7887,7568,These mutations all exhibit a high degree of association with specific restriction fragment - length polymorphism haplotypes at the PAH locus .,O O O O O O O O O O O O O O O O O O O O O O,13
3879,6944,"It is disrupted and misexpressed in a number of mesenchymal tumour cell types , including fat - cell tumours ( lipomas ) .",O O O O O O O O O B I O O O O B I I I O B O O,13
4031,10431,Markedly accelerated catabolism of apolipoprotein A - II ( ApoA - II ) and high density lipoproteins containing ApoA - II in classic lecithin : cholesterol acyltransferase deficiency and fish - eye disease .,O O O O O O O O O O O O O O O O O O O O O O O O O B I I O B I I I O,13
975,4505,"Gene loss in the patient group was complete , owing to infertility of the male patients with adult onset disease and the fact that mentally retarded patients did not procreate .",O O O O O O O O O O O B O O O O O O O O O O O O B I O O O O O,32
756,9285,Localisation of the Becker muscular dystrophy gene on the short arm of the X chromosome by linkage to cloned DNA sequences .,O O O B I I O O O O O O O O O O O O O O O O,13
9999,4072,The ratio of apoprotein ( apo ) to total cholesterol in the HDL of CTX was two to three times greater than normal .,O O O O O O O O O O O O O O B O O O O O O O O O,32
2479,509,Homozygosity for either mutation results in postnatal iron loading .,O O O O O O O O O O,32
3263,4672,"Thus , the D442G mutation acts differently to the null mutations with weaker effects on HDL in the homozygous state and stronger effects in the heterozygotes , suggesting dominant expression of a partially defective allele .",O O O O O O O O O O O O O O O O O O O O O O O O O O O O O O O O O O O O,32
8143,11151,3 cM proximal to D9Mit102 .,O O O O O O,13
141,10211,Fibroblasts of the patient show significant sulfatide degradation activity exceeding that of adult MLD patients .,O O O O O O O O O O O O B I O O,13
7800,5017,All seven breast tumour / blood pairs examined from this family show loss of heterozygosity in the tumours .,O O B I O O O O O O O O O O O O O B O,32
5139,1915,These studies demonstrate for the first time that a complex ultrastructural cell defect can be corrected both morphologically and functionally by in vivo gene transfer . .,O O O O O O O O O O O O O O O O O O O O O O O O O O O,32
6797,1310,CONCLUSIONS The discovery of new point mutations in this study increases the available information regarding the spectrum of genetic abnormalities and clinical manifestations of XLRS .,O O O O O O O O O O O O O O O O O O B I O O O O B O,32
8073,9435,Provisionally they are called G6PD Betica ( 19 cases ) and G6PD Menorca ( 1 case ) .,O O O O O O O O O O O O O O O O O O,13
776,4096,One patient showed gradually decreasing renal function beginning after two years of TF therapy .,O O O O O O O O O O O O O O O,32
2558,3183,A comparison of DNA - based and enzyme - based tests .,O O O O O O O O O O O O,32
9178,10229,Two mutations involved C - - > T transitions in CGAarg codons in exons 9 and 11 .,O O O O O O O O O O O O O O O O O O,13
3875,6628,The observation of the same APC mutation in five families from the same geographic area demonstrates a founder effect .,O O O O O B O O O O O O O O O O O O O O,13
7712,2243,Our findings provide additional evidence for the pathogenetic role of CHM mutations and provide a diagnostic tool for one fifth of the worlds known CHM patients . .,O O O O O O O O O O B O O O O O O O O O O O O O B O O O,32
6985,520,In the family with the missense mutation the phenotype was milder .,O O O O O O O O O O O O,32
977,12409,Wolfram syndrome ( WFS ; OMIM 222300 ) is an autosomal recessive neurodegenerative disorder defined by young - onset non - immune insulin - dependent diabetes mellitus and progressive optic atrophy .,B I O B O O O O O O B I I I O O O O O O O O B I I I I O O B I O,39
3811,12038,"In a gene with such extraordinarily high sequence conservation throughout evolution , there are presumed undiscovered missense mutations , these are hypothesized to exist in as - yet unidentified phenotypes . .",O O O O O O O O O O O O O O O O O O O O O O O O O O O O O O O O,39
2942,11234,"The human neuronal nicotinic acetylcholine receptor alpha 4 subunit gene ( CHRNA4 ) is located in the candidate region for three different phenotypes benign familial neonatal convulsions , autosomal dominant nocturnal frontal lobe epilepsy , and low - voltage EEG .",O O O O O O O O O O O O O O O O O O O O O O O B I I I O B I I I I I O O O O O O O,13
6295,4551,The T6433C ( L444P ) substitution is prevalent in type GD II .,O O O O O O O O O B I I O,32
4126,9300,With her it became possible to determine whether allelic exclusion occurs in particular cell - types of the WAS carrier .,O O O O O O O O O O O O O O O O O O B O O,13
