Unnamed: 0.1,Unnamed: 0,text,labels,txt_len
6206,5486,A zinc finger truncation of murine WT1 results in the characteristic urogenital abnormalities of Denys - Drash syndrome .,O O O O O O O O O O O B I O B I I I O,13
1958,3124,These data demonstrate that 1 ) there is an identical 2 - base pair deletion in an exon of the C5 gene in several different C5 - deficient mouse strains ; 2 ) the mRNA transcribed from the C5D gene retains this deletion ; and 3 ) this mutation should result in C5 protein deficiency .,O O O O O O O O O O O O O O O O O O O O O O O O O B I I O O O O O O O O O O O O O O O O O O O O O O O O B I I O,32
4538,3756,"We report on 4 sibs ( 2F , 2M ) with Prader - Willi syndrome ( PWS ) .",O O O O O O O O O O O B I I I O B O O,32
8693,9281,"The growth of the cultured fibroblasts of this patient was intermediate in media containing hypoxanthine aminopterin thymidine ( HAT ) , whereas the growth of Lesch - Nyhan cells was inhibited and normal cells grew normally .",O O O O O O O O O O O O O O O O O O O O O O O O O B I I O O O O O O O O O,13
9986,8901,C7 and 754 thus provide good bridging markers for the diagnosis of DMD and BMD,O O O O O O O O O O O O B O B,13
4866,12108,HFE is an MHC - related protein that is mutated in the iron - overload disease hereditary hemochromatosis .,O O O O O O O O O O O O B I I I B I O,39
4719,5878,"This idea is based partly on the phenotype of homozygous Krox20 ( Egr2 ) knockout mice , which display hypomyelination of the PNS and a block of Schwann cells at an early stage of differentiation .",O O O O O O O O O O O O O O O O O O O B I I I O O O O O O O O O O O O O,13
3742,7104,We have made identical findings in chimaeric mice generated from two independent embryonic stem ( ES ) cell lines harbouring a similar deletion .,O O O O O O O O O O O O O O O O O O O O O O O O,13
8916,4316,The alveolar rhabdomyosarcoma PAX3 / FKHR fusion protein is a transcriptional activator .,O B I O O O O O O O O O O,32
2604,1452,It is not known whether BRCA1 phosphorylation and dispersion and its function in DNA damage response are related .,O O O O O O O O O O O O O O O O O O O,32
2898,10935,"Most large analyses that defined the limits of the normal and pathological size ranges employed PCR assays , which included the CAG repeats and a CCG repeat tract that was thought to be invariant .",O O O O O O O O O O O O O O O O O O O O O O O O O O O O O O O O O O O,13
1560,4078,We described 6 patients ( from 3 families ) affected with cerebrotendinous xanthomatosis ( CTX ) .,O O O O O O O O O O O B I O B O O,32
9470,3291,"In Northeastern Finland , 66 / 69 chromosomes carrying TCD had the same haplotype at loci DXS72 , DXYS1 , DXYS4 , and DXYS12 .",O O O O O O O O O B O O O O O O O O O O O O O O O,32
4555,11961,"The phenotypes and genotypes in one of these three families showed the father to be hypohaptoglobinemic ( Hp2 ) and Hp2 / Hpdel , the mother to be Hp2 - 1 and Hp1 / Hp2 , one of the two children to be hypohaptoglobinemic ( Hp2 ) and Hp2 / Hpdel , and the other child to be Hp1 and Hp1 / Hpdel , showing an anomalous inheritance of Hp phenotypes in the child with Hp1 .",O O O O O O O O O O O O O O O B O O O O O O O O O O O O O O O O O O O O O O O O O O O B O O O O O O O O O O O O O O O O O O O O O O O O O O O O O O O O O,39
217,7190,"Most ( 58 / 71 , 82 % ) mutations were frameshift and nonsense mutations that are predicted to cause truncation of the A - T protein ; the less common mutation types were missense ( 9 / 71 , 13 % ) , splicing ( 3 / 71 , 4 % ) and one in - frame deletion , 2546 3 ( 1 / 71 , 1 % ) .",O O O O O O O O O O O O O O O O O O O O O O O B I I O O O O O O O O O O O O O O O O O O O O O O O O O O O O O O O O O O O O O O O O O O O O O,13
3626,11538,This corresponds well to the previous assignment of the locus for the human alkaptonuria gene ( AKU ) to the same chromosomal region by multipoint linkage analysis .,O O O O O O O O O O O O O B O O O O O O O O O O O O O O,13
10076,3802,"Cleft types ( CLP and CP ) occur in VWS in the same proportions as in the general non - VWS population , ie , about twice as many cleft - bearing individuals have CLP as have CP .",O O O B O B O O O B O O O O O O O O O O O O O O O O O O O O O O O O B O O B O,32
9562,10137,8 % of the Canavan chromosomes of Ashkenazi Jewish origin .,O O O O B O O O O O O,13
3060,9135,"But the close genetic linkage of mdx to G6PD and Hprt on the mouse X chromosome , coupled with its comparatively mild pathology , have suggested that the mdx mutation may instead correspond to Emery Dreifuss muscular dystrophy which itself is closely linked to DNA markers at Xq28 - qter in the region of G6PD on the human X chromosome .",O O O O O O O O O O O O O O O O O O O O O O O O O O O O O O O O O O B I I I O O O O O O O O O O O O O O O O O O O O O O O,13
8933,1569,Activation of the ATM kinase by ionizing radiation and induction of ATM - dependent responses in NBS cells indicated that p95 / nbs1 may not be required for signalling to ATM after ionizing radiation .,O O O O O O O O O O O O O O O O B O O O O O O O O O O O O O O O O O O,32
163,2778,Carrier detection and prenatal diagnosis of Pelizaeus - Merzbacher disease using a combination of anonymous DNA polymorphisms and the proteolipid protein ( PLP ) gene cDNA .,O O O O O O B I I I O O O O O O O O O O O O O O O O O,32
2504,8459,"We have used in situ hybridisation with MCT112 , a corresponding cosmid MJ1 , and DR47 ( D9S5 ) , coupled with mapping studies on hybrid cell panels , to define more precisely the location of the disease locus .",O O O O O O O O O O O O O O O O O O O O O O O O O O O O O O O O O O O O O O O O,13
7379,5138,Genetic mapping of the breast - ovarian cancer syndrome to a small interval on chromosome 17q12 - 21 : exclusion of candidate genes EDH17B2 and RARA .,O O O O B I I I I O O O O O O O O O O O O O O O O O O,32
7748,11993,Scatchard plots of these data indicate that the added heterodimer substantially reduced the affinity of TfR for transferrin .,O O O O O O O O O O O O O O O O O O O,39
7149,9545,Germline mutations of the BRCA1 gene in breast and ovarian cancer families provide evidence for a genotype - phenotype correlation .,O O O O O O O B I I I O O O O O O O O O O,13
9885,1072,Spectrum of hSNF5 / INI1 somatic mutations in human cancer and genotype - phenotype correlations .,O O O O O O O O O B O O O O O O,32
9685,2663,"Unambiguous diagnosis , therefore , requires allele - specific oligonucleotide hybridization to distinguish between these two mutant alleles .",O O O O O O O O O O O O O O O O O O O,32
9783,9375,"Such known factors are HLA B27 associated disease susceptibility , susceptibility to psoriatic arthropathy and susceptibility to entero - arthropathy .",O O O O O O O O O O O O B I O O O B I I O,13
3079,12054,"The lifetime risk of breast cancer appears similar to the risk in BRCA1 carriers , but there was some suggestion of a lower risk in BRCA2 carriers < 50 years of age .",O O O O B I O O O O O O O O O O O O O O O O O O O O O O O O O O O,39
1202,916,The mutation was located in the 10th transmembrane helix .,O O O O O O O O O O,32
9818,1917,"Congenital afibrinogenemia is a rare , autosomal , recessive disorder characterized by the complete absence of detectable fibrinogen .",B I O O O O B I I I O O O O O O O O O,32
398,1760,"MEFV messenger RNA was detected by reverse transcriptase - polymerase chain reaction in bone marrow leukocytes , with differential expression observed among cells by in situ hybridization .",O O O O O O O O O O O O O O O O O O O O O O O O O O O O,32
8452,5970,"Classical galactosemia is caused by a deficiency in activity of the enzyme galactose - 1 - phosphate uridyl transferase ( GALT ) , which , in turn , is caused by mutations at the GALT gene .",B I O O O O O O O O O O O O O O O O O O O O O O O O O O O O O O O O O O O,13
2538,2944,Recombination data and two - point linkage analysis support a locus order of centromere - pi 227 - C11P11 - ECB27 - L5 .,O O O O O O O O O O O O O O O O O O O O O O O O,32
5630,417,"A missense mutation , R483G , was located in the highly conserved PtdIns ( 4 , 5 ) P2 5 - phosphatase domain .",O O O O O O O O O O O O O O O O O O O O O O O O,32
3165,7492,Increased rates of chromosome damage were also observed in the fibroblasts of some phenotypically normal family members ( obligate heterozygotes and sibs ) when compared to normal controls .,O O O O O O O O O O O O O O O O O O O O O O O O O O O O O,13
8141,5624,Long - term follow - up evaluation of C282Y homozygotes and H63D / C282Y compound heterozygotes will give an indication of the penetrance of the mutations .,O O O O O O O O O O O O O O O O O O O O O O O O O O O,13
413,3168,Unequal sister - chromatid exchange is proposed to be the mechanism for the formation of these duplications . .,O O O O O O O O O O O O O O O O O O O,32
2940,2658,We report a novel TSD allele in the French - Canadian population associated with the infantile form of the disease .,O O O O B O O O O O O O O O O O O O O O O,32
854,7032,"On the basis of the linkage disequilibrium ( LD ) delta values , the non - Jewish European N370S chromosomes had greater haplotype diversity and less LD at the markers flanking the conserved haplotype than did the AJ N370S chromosomes .",O O O O O O O O O O O O O O O O O O O O O O O O O O O O O O O O O O O O O O O O O,13
58,6987,"These abnormalities include small or absent Schlemms canal , aberrantly developed trabecular meshwork , iris hypoplasia , severely eccentric pupils and displaced Schwalbes line .",O O O O O O O O O O O O O O B I O O O O O O O O O,13
3417,1130,These findings as well as data obtained by others for patients with ataxia - telangiectasia suggest that structural rearrangement of 14q is the initial chromosomal change in lymphocyte clones of patients with this disorder .,O O O O O O O O O O O O B I I O O O O O O O O O O O O O O O O O O O O,32
4879,5554,"A . , Moeller , N . , Moore , T . , Morikang , E . , Prasss , C .",O O O O O O O O O O O O O O O O O O O O O O,13
6771,9558,Complement screening should be carried out in any individual suffering recurrent meningococcal infection or infection with an uncommon meningococcal serogroup .,O O O O O O O O O O O B I O O O O O B O O,13
1240,11230,"In contrast , a vector derived from a recombinant adenovirus can restore 10 % - 80 % of normal hepatic PAH activity into PAH - deficient mice , which completely normalizes serum phenylalanine levels .",O O O O O O O O O O O O O O O O O O O O O O O B I I O O O O O O O O O,13
4659,8416,"The homologous locus in the mouse ( Hal ) was mapped to region 10C2 - - - - D1 by in situ hybridization , using a cell line from a mouse homozygous for a 1 .",O O O O O O O O O O O O O O O O O O O O O O O O O O O O O O O O O O O O,13
7593,345,"These results suggest a molecular explanation for the genotype - phenotype correlation in FAP patients and support the idea that colorectal tumor growth might be , in part , driven by selection for a mutation in the mutation cluster region . .",O O O O O O O O O O O O O B O O O O O O B I O O O O O O O O O O O O O O O O O O O O,32
4929,998,"He showed short stature , obesity , mild developmental delay , cryptorchidism , and some mild dysmorphic features .",O O B I O B O O B I O B O O O O B I O,32
5529,4055,081 + / - 0 .,O O O O O O,32
1944,9075,PAH activity is present in the cellular extracts and the entire hydroxylation system is reconstituted in the hepatoma cells infected with the recombinant viruses .,O O O O O O O O O O O O O O O O O B O O O O O O O,13
9733,4747,Adenomatous polyposis coli and a cytogenetic deletion of chromosome 5 resulting from a maternal intrachromosomal insertion .,B I I O O O O O O O O O O O O O O,32
3230,4737,The ala305 - - > glu mutation was found exclusively in non - Jewish probands of European descent and constituted 60 % of the 40 mutant chromosomes .,O O O O O O O O O O O O O O O O O O O O O O O O O O O O,32
1742,12618,"The major cause of hepatic copper accumulation in man is a dysfunctional ATP7B gene , causing Wilson disease ( WD ) .",O O O O B I I O O O O O O O O O B I O B O O,39
8683,888,These results provide evidence that the DM mutation acts in cis to reduce protein production ( consistent with DMPK haploinsufficiency ) and in trans as a riboregulator to inhibit myogenesis . .,O O O O O O B O O O O O O O O O O O B I O O O O O O O O O O O O,32
2091,4838,Two subjects shared a G - - > A transition at position + 5 of the donor splice site consensus sequence of intron 10 .,O O O O O O O O O O O O O O O O O O O O O O O O O,32
3097,2615,We analyzed the HEXA gene of one pseudodeficient subject and identified both a C739 - to - T substitution that changes Arg247 - - - - Trp on one allele and a previously identified Tay - Sachs disease mutation on the second allele .,O O O O O O O O O O O O O O O O O O O O O O O O O O O O O O O O O O B I I I O O O O O O,32
54,595,This pattern corresponds to mutations leading mainly to truncated proteins with few specific missense mutations .,O O O O O O O O O O O O O O O O,32
1884,8314,"The incidence of PKU varies widely across different geographic areas , and is highest ( about 1 in 5 , 000 live births ) in Ireland and western Scotland , and among Yemenite Jews .",O O O B O O O O O O O O O O O O O O O O O O O O O O O O O O O O O O O,13
810,10387,The dystrophin gene was analyzed by Southern blot hybridization .,O O O O O O O O O O,13
4876,8680,03 in males and 0 .,O O O O O O,13
3680,8604,"Thus , other genetic defects or metabolic factors influencing CETP expression are implicated .",O O O B I O O O O O O O O O,13
8844,11789,"Here we show that the steady - state levels of BARD1 , unlike those of BRCA1 , remain relatively constant during cell cycle progression .",O O O O O O O O O O O O O O O O O O O O O O O O O,39
865,3420,Von Hippel - Lindau disease maps to the region of chromosome 3 associated with renal cell carcinoma .,B I I I I O O O O O O O O O B I I O,32
1788,279,"In addition , our screening showed that the S65C substitution was significantly enriched in probands with at least one chromosome without an assigned mutation .",O O O O O O O O O O O O O O O O O O O O O O O O O,32
8667,141,"N . , Gnirke , A . , Thomas , W . , Tsuchihashi , Z . , Ruddy , D .",O O O O O O O O O O O O O O O O O O O O O O,32
822,12083,The other 9 novel mutations identified in these 23 patients were each limited to a single family .,O O O O O O O O O O O O O O O O O O,39
1563,2660,Cultured human fibroblasts from a compound heterozygote for this transition ( and for a deletion mutation ) produce no detectable HEXA mRNA .,O O O O O O O O O O O O O O O O O O O O O O O,32
2360,1341,"In view of this discrepancy , we examined the frequency of ATM germline mutations in a selected group of Dutch patients with breast cancer .",O O O O O O O O O O O O O O O O O O O O O O B I O,32
5466,11826,"Knowledge of the potential reasons for these changes in results and impact of these risk reversals on both patients and the counseling team can assist in the development of strategies for the prevention and , where necessary , management of a risk reversal in any predictive testing program . .",O O O O O O O O O O O O O O O O O O O O O O O O O O O O O O O O O O O O O O O O O O O O O O O O O O,39
10067,6218,Molecular analysis may be of particular value in such atypical cases . .,O O O O O O O O O O O O O,13
3011,221,7 % in Denmark .,O O O O O,32
4312,312,"Despite heterozygosity for the abnormal allele , lymphocytes from ALPS patients showed markedly decreased FADD association and a loss of caspase recruitment and activation after CD95 crosslinking .",O O O O O O O O O B O O O O O O O O O O O O O O O O O O,32
3971,8207,Fragments of the arylsulfatase A ( ARSA ) gene from a patient with juvenile - onset metachromatic leukodystrophy ( MLD ) were amplified by PCR and ligated into MP13 cloning vectors .,O O O O O O O O O O O O O O O O B I O B O O O O O O O O O O O O,13
4395,5154,"Moreover , coexpression of wild type and mutant cDNAs leads to inhibition of wild type secretion and activity .",O O O O O O O O O O O O O O O O O O O,32
834,7558,"A recombination event between a ( GT ) n polymorphism in intron 2 of the MAOB gene and the NDP locus , in a family previously reported to have a recombination between DXS7 and NDP , delineates a flanking marker telomeric to this disease gene .",O O O O O O O O O O O O O O O O O O O O O O O O O O O O O O O O O O O O O O O O O O O O O O,13
6447,10791,"To elucidate the subcellular localization of emerin , we raised two antisera against synthetic peptide fragments predicted from emerin cDNA .",O O O O O O O O O O O O O O O O O O O O O,13
1702,5781,"No deletions were detected in seven cases of popliteal pterygia syndrome , 76 cases of mixed syndromic forms of cleft lip and palate , and 178 cases of nonsyndromic cleft lip and palate .",O O O O O O O O B I I O O O O O B I I I I I I O O O O O B I I I I O,13
3946,3711,"Dual - parameter FACS analysis indicated that sialophorin is expressed on CD4 + and CD8 + lymphocytes , on a subpopulation of peripheral blood B lymphocytes , on all thymocytes , and on a subpopulation of bone marrow cells .",O O O O O O O O O O O O O O O O O O O O O O O O O O O O O O O O O O O O O O O O,32
6258,9152,Conservation of the Duchenne muscular dystrophy gene in mice and humans .,O O O B I I O O O O O O,13
9461,6837,"In contrast to these mutations found in patients with hepatic - type of early onset , the mutations A874V , R778L , and 3892delGTC were either missense mutations or in frame 1 - amino acid deletion , and occurred in the patients with hepato - neurologic type of late onset .",O O O O O O O O O O O O O O O O O O O O O O O O O O O O O O O O O O O O O O O O O O O O O O O O O O O,13
1081,7124,Six5 + / - and Six5 - / - mice show increased steady - state levels of the Na + / K + - ATPase alpha - 1 subunit and decreased Dm15 mRNA levels .,O O O O O O O O O O O O O O O O O O O O O O O O O O O O O O O O O O O,13
346,303,Germline mutations of the Brca1 tumor suppressor gene predispose women to breast and ovarian cancers .,O O O O O B O O O O O B I I I O,32
9206,6747,One splice - site mutation ( IVS10 - 6T - - > G ) was detected three times in our series .,O O O O O O O O O O O O O O O O O O O O O O,13
870,6450,Synergistic effect of histone hyperacetylation and DNA demethylation in the reactivation of the FMR1 gene .,O O O O O O O O O O O O O O O O,13
8495,10072,"In 47 D442G heterozygotes , mean HDL - C levels were 91 + / - 23 mg / dl , similar to the level in D442G homozygotes , and significantly greater than mean HDL - C levels in Int14 A heterozygotes ( 69 + / - 15 mg / dl ) .",O O O O O O O O O O O O O O O O O O O O O O O O O O O O O O O O O O O O O O O O O O O O O O O O O O O O,13
2985,1093,These data suggest that an early event in the pathogenesis of SCA3 / MJD may be an altered conformation of ataxin - 3 within the nucleus that exposes the polyglutamine domain . .,O O O O O O O O O O O B O B O O O O O O O O O O O O O O O O O O O,32
5571,9760,"In the three patients exhibiting the classical picture of severe childhood ALD we identified in the 5 portion of the X - ALD gene a 38 - bp deletion that causes a frameshift mutation , a 3 - bp deletion leading to a deletion of an amino acid in the ATP - binding domain of the ALD protein , and a missense mutation .",O O O O O O O O O O O B O O O O O O O O B I I O O O O O O O O O O O O O O O O O O O O O O O O O O O O O O O O O B O O O O O O O,13
6411,1258,"We show that hypomorphic mutations in hMRE11 , but not in ATM , are present in certain individuals with an ataxia - telangiectasia - like disorder ( ATLD ) .",O O O O O O O O O O O O O O O O O O O O B I I I I I O B O O,32
6963,4770,"Thus the amino terminal domain of EWS ( NTD - EWS ) , which is involved in chromosome translocation may regulate the specificity of RNA binding activity of EWS .",O O O O O O O O O O O O O O O O O O O O O O O O O O O O O O,32
1382,7978,Two - point analysis gave a peak lod score at DXS144E with a maximum lod score of 2 .,O O O O O O O O O O O O O O O O O O O,13
766,8603,Their lipoprotein patterns were also similar to those of the two homozygotes .,O O O O O O O O O O O O O,13
1330,6674,"Both mutations caused an increase in RANK - mediated nuclear factor - kappaB ( NF - kappaB ) signalling in vitro , consistent with the presence of an activating mutation .",O O O O O O O O O O O O O O O O O O O O O O O O O O O O O O O,13
6995,3641,"Clinical and biochemical analyses have identified many variants exhibiting a range of phenotypes , which have been well characterized from the hematological point of view .",O O O O O O O O O O O O O O O O O O O O O O O O O O,32
7233,5584,"Among approximately 200 anonymous Ashkenazi Jewish DNA samples , the MEFV carrier frequency was 21 % , with E148Q the most common mutation .",O O O O O O O O O O O O O O O O O O O O O O O O,13
3100,6144,More ovarian cancers than breast cancers were recorded .,O B I O B I O O O,13
7675,3361,The patients serum lacked the 85 kDa C7 chain .,O O O O O O O O O O,32
1960,3429,"The Lowe oculocerebrorenal syndrome ( OCRL ) is characterized by congenital cataract , mental retardation , and defective renal tubular function .",O B I I O B O O O O O B O B I O O B I I I O,32
8092,5466,3 region between DXS155 and DXS294 / DXS730 .,O O O O O O O O O,13
36,12192,"In order to define the types of disease - causing ATM mutations in Japanese A - T patients as well as to look for possible mutational hotspots , reverse - transcribed RNA derived from ten patients belonging to eight unrelated Japanese A - T families was analyzed for mutations by the restriction endonuclease fingerprinting method .",O O O O O O O O O O O O O O B I I O O O O O O O O O O O O O O O O O O O O O O O O B I I O O O O O O O O O O O O,39
3944,8743,Pelizaeus - Merzbacher disease : an X - linked neurologic disorder of myelin metabolism with a novel mutation in the gene encoding proteolipid protein .,B I I I O O B I I I I I I I O O O O O O O O O O O,13
4232,7617,"Following the birth of two infants with Tay - Sachs disease ( TSD ) , a non - Jewish , Pennsylvania Dutch kindred was screened for TSD carriers using the biochemical assay .",O O O O O O O B I I I O B O O O O O O O O O O O O O B O O O O O O,13
6684,4775,"Recently , a missense mutation was identified in human ASPA coding sequence from patients with Canavan disease .",O O O O O O O O O O O O O O O B I O,32
8545,2673,"The results indicate that the girl is a hemizygote for AGA , permitting the assignment of human AGA to the region 4q33 - - - - qter . .",O O O O O O O O O O O O O O O O O O O O O O O O O O O O O,32
7723,4859,"Myotonic dystrophy ( DM ) is caused by abnormal expansion of a polymorphic ( CTG ) n repeat , located in the DM protein kinase gene .",B I O B O O O O O O O O O O O O O O O O O O B O O O O,32
1224,3135,"Abnormal color vision has been observed in 12 of 27 patients with adrenomyeloneuropathy ( AMN ) , a milder form of ALD .",B I I O O O O O O O O O B O B O O O O O O B O,32
8543,2144,"However , a comparison of the data suggested that both missense and synonymous mutations can occur at any coding sequence of the human germ line HPRT gene , but that a limited percentage of all the missense mutations cause disease .",O O O O O O O O O O O O O O O O O O O O O O O O O O O O O O O O O O O O O O O O O,32
1816,6956,One family manifesting an autosomal dominant pattern of inheritance possessed three clinically affected members who were heterozygous for a splice - site mutation that was predicted to lead to the production of a truncated protein product .,O O O O O O O O O O O O O O O O O O O O O O O O O O O O O O O O O O O O O,13
8275,11082,"However , it is not yet clear what proportion of hereditary breast cancer is explained by BRCA1 and BRCA2 or by some other unidentified susceptibility gene ( s ) .",O O O O O O O O O O B I I O O O O O O O O O O O O O O O O O,13
5184,9167,"We describe a patient with myasthenia gravis , systemic lupus erythematosus , and angioedema associated with heterozygous complement factor 2 ( C2 ) deficiency .",O O O O O B I O B I I O O B O O O B I I I I I I O,13
424,6106,The ATP7B null mice display a gradual accumulation of hepatic copper that increases to a level 60 - fold greater than normal by 5 months of age .,O O O O O O O O O O O O O O O O O O O O O O O O O O O O,13
4827,10905,"In all , 12 of 16 kindreds manifesting BRCA1 mutation or linkage contained ovarian cancer , as compared with only 6 of the remaining 31 families ( P < . 001 ) .",O O O O O O O O O O O O O B I O O O O O O O O O O O O O O O O O O,13
6262,5862,BssSI digestion of polymerase chain reaction products amplified from genomic DNA indicated that affected cats were homozygous and cats with half - normal beta - glucuronidase activity were heterozygous for the missense mutation .,O O O O O O O O O O O O O O O O O O O O O O O O O O O O O O O O O O,13
8202,8903,Flow cytometry and recombinant DNA techniques have been used to obtain reagents for a molecular analysis of the Prader - Willi syndrome ( PWS ) .,O O O O O O O O O O O O O O O O O O B I I I O B O O,13
5687,5453,"CONCLUSIONS This study confirms an increased risk of cancer , especially non - Hodgkins lymphoma , probably attributable to defective immunity , among patients with CHH .",O O O O O O O O B O O B I I I O O O O O O O O O O B O,13
8998,927,The substitution was confirmed by restriction endonuclease analysis and was present in heterozygosis .,O O O O O O O O O O O O O O,32
1195,735,"For genetic counseling and predictive testing in families with inherited breast - ovarian cancer , penetrances and expressions of the underlying mutations should be known .",O O O O O O O O O B I I I I O O O O O O O O O O O O,32
9049,11207,"Rather , translation of the CAG is crucial for the pathogenesis of HD .",O O O O O O O O O O O O B O,13
