Unnamed: 0.1,Unnamed: 0,text,labels,txt_len
2304,8753,"von Willebrand disease ( vWD ) , the most common inherited bleeding disorder in humans , can result from either a quantitative or a qualitative defect in the adhesive glycoprotein , von Willebrand factor ( vWF ) .",B I I O B O O O O O B I I O O O O O O O O O O O O O O O O O O B I O O O O O,13
1334,7800,This mutation is at a CpG site in a Japanese infant with Tay - Sachs disease and was described elsewhere .,O O O O O O O O O O O O B I I I O O O O O,13
6437,8303,"Thus , this is a rare example of homozygous hypobetalipoproteinemia .",O O O O O O O O B I O,13
8203,1330,"Here we report identification of a mutation of cathepsin C ( exon 6 , 2127A - - > G ) that changes a highly conserved amino acid in the cathepsin C peptide .",O O O O O O O O O O O O O O O O O O O O O O O O O O O O O O O O O,32
6149,6908,They are frequently inherited as Mendelian traits .,O O O O O O O O,13
1135,4872,Regionally clustered APC mutations are associated with a severe phenotype and occur at a high frequency in new mutation cases of adenomatous polyposis coli .,O O B O O O O O O O O O O O O O O O O O O B I I O,32
6268,3810,55 % .,O O O,32
2436,10360,The son had onset of macular degeneration at age 44 years .,O O O O O B I O O O O O,13
3344,9478,Genetics of cerebrotendinous xanthomatosis ( CTX ) : an autosomal recessive trait with high gene frequency in Sephardim of Moroccan origin .,O O B I O B O O O O O O O O O O O O O O O O,13
7566,8184,Identification of deletion mutations and three new genes at the familial polyposis locus .,O O O O O O O O O O B I O O,13
1493,5688,One hundred and seven ovarian cancer cases were analyzed for BRCA1 alterations using the RNase mismatch cleavage assay followed by direct sequencing .,O O O O B I O O O O O O O O O O O O O O O O O,13
1538,9553,Terminal complement component deficiency predisposes to meningococcal infection and is inherited in an autosomal co - dominant manner .,B I I I O O B I O O O O O O O O O O O,13
1489,749,"To characterize the functional and structural properties of the COLIA1 / PDGFB fusion protein , we generated a stable NIH3T3 cell line that contained a tumor - derived chimeric gene resulting from a COIA1 intron 7 - PDGFB intron 1 fusion .",O O O O O O O O O O O O O O O O O O O O O O O O O O O O O O O O O O O O O O O O O O,32
8974,3913,2 % of the male population living in the urban area of Algiers .,O O O O O O O O O O O O O O,32
6178,8968,"Glucose - 6 - phosphate dehydrogenase variants and their frequency in Guangdong , China .",O O O O O O O O O O O O O O O,13
9598,12041,"The contribution of BRCA1 and BRCA2 to inherited breast cancer was assessed by linkage and mutation analysis in 237 families , each with at least four cases of breast cancer , collected by the Breast Cancer Linkage Consortium .",O O O O O O O B I I O O O O O O O O O O O O O O O O O O B I O O O O B I O O O,39
9548,5606,"The distribution of the two mutations differ , C282Y being limited to those of northwestern European ancestry and H63D being found at allele frequencies > 5 % , in Europe , in countries bordering the Mediterranean , in the Middle East , and in the Indian subcontinent .",O O O O O O O O O O O O O O O O O O O O O O O O O O O O O O O O O O O O O O O O O O O O O O O O,13
10024,3742,"Both sequences map to the region of 10 centimorgan lying between the Tabby ( Ta ) and St14 - 1 ( DxPas8 ) loci , close to the phosphorylase b kinase locus ( Phk ) .",O O O O O O O O O O O O O O O O O O O O O O O O O O O O O O O O O O O O,32
5348,4025,Biochemical characterization of G6PD purified from these subjects has revealed 13 new variants and several copies of previously described forms of G6PD .,O O O O O O O O O O O O O O O O O O O O O O O,32
4927,10371,"1 , and provide an example of the utility of the SGLT1 probe as a diagnostic for genetic diseases associated with translocations of chromosome 22 .",O O O O O O O O O O O O O O O O O B I O O O O O O O,13
8667,141,"N . , Gnirke , A . , Thomas , W . , Tsuchihashi , Z . , Ruddy , D .",O O O O O O O O O O O O O O O O O O O O O O,32
60,5976,"Globally , K285N is rarer , but in many European populations it can be found on 25 - 40 % of mutant chromosomes .",O O O O O O O O O O O O O O O O O O O O O O O O,13
1049,3248,This represents the first evidence of linkage disequilibrium between APOC2 and the DM locus .,O O O O O O O O O O O O B O O,32
1510,1980,Frataxin is a nuclear - encoded mitochondrial protein that is widely conserved among eukaryotes .,O O O O O O O O O O O O O O O,32
3891,1773,"To date we have identified 65 missense mutations in the GALNS gene from MPS IVA patients , but the correlation between genotype and phenotype has remained unclear .",O O O O O O O O O O O O O B I O O O O O O O O O O O O O,32
1702,5781,"No deletions were detected in seven cases of popliteal pterygia syndrome , 76 cases of mixed syndromic forms of cleft lip and palate , and 178 cases of nonsyndromic cleft lip and palate .",O O O O O O O O B I I O O O O O B I I I I I I O O O O O B I I I I O,13
5252,6254,"CONCLUSIONS In a population of white adults of northern European ancestry , 0 .",O O O O O O O O O O O O O O,13
1336,2233,"Numerous additional splice products were detected , most involving skipping of one or more surrounding exons .",O O O O O O O O O O O O O O O O O,32
9731,11529,One clone from this library contained the complete cDNA - insert for HGO as determined by sequencing .,O O O O O O O O O O O O O O O O O O,13
8042,7632,No normally spliced RNA was detected in PCR products generated from reverse transcription of RNA carrying the IVS - 9 mutation .,O O O O O O O O O O O O O O O O O O O O O O,13
9065,3933,ALD is characterized by abnormally high plasma levels of very long chain fatty acids ( VLCFA ) as a result of impaired capacity to degrade them .,B O O O O O O O O O O O O O O O O O O O O O O O O O O,32
7547,4261,"The probes identified the carrier status of female family members , aided by an RFLP carried by the mothers normal X - chromosome . .",O O O O O O O O O O O O O O O O O O O O O O O O O,32
8636,8434,This made a prenatal or presymptomatic diagnosis and heterozygote detection by DNA analysis with this marker reliable .,O O O O O O O O O O O O O O O O O O,13
6011,835,"We discovered a missense mutation , GCA to GTA ( Ala 54 Val ) , in exon 2 in a neurofibrosarcoma patient ( case 1 ) , two missense mutations , AAA to CAA ( Lys 118 Gln ) and GAA to GGA ( Glu 154 Gly ) in exon 5 of another neurofibrosarcoma patient ( case 2 ) , and 3 amino acid substitutions , GTG to GCG ( Val 179 Ala ) , GTT to GCT ( Val 181 Ala ) and TTC to CTC ( Phe 186 Leu ) , in a third neurofibrosarcoma patient ( case 3 ) .",O O O O O O O O O O O O O O O O O O O O B O O O O O O O O O O O O O O O O O O O O O O O O O O O O O O O O B O O O O O O O O O O O O O O O O O O O O O O O O O O O O O O O O O O O O O O O O O O B O O O O O O,32
603,4369,Myotonic dystrophy could interfere to some extent with the progression of Duchenne dystrophy .,B I O O O O O O O O O B I O,32
3436,8732,The relationship between abnormal color vision and adrenomyeloneuropathy ( AMN ) was investigated in 27 AMN patients and 31 age - matched controls by using the Farnsworth - Munsell 100 Hue test .,O O O B I I O B O B O O O O O B O O O O O O O O O O O O O O O O O,13
2923,7638,12 % of unrelated male patients carry deletions of the partially cloned CHM gene .,O O O O O O O O O O O O B O O,13
456,10788,Emerin deficiency at the nuclear membrane in patients with Emery - Dreifuss muscular dystrophy .,B I O O O O O O O B I I I I O,13
6371,3781,"Phenylketonuria ( PKU ) is an autosomal recessive disorder of amino acid metabolism caused by a deficiency of the hepatic enzyme phenylalanine hydroxylase ( PAH ; phenylalanine 4 - monooxygenase , EC 1 . 14 . 16 . 1 ) .",B O B O O O B I I O O O O O O O B I I I I I I O O O O O O O O O O O O O O O O O O,32
7400,3238,"Sequences at the chromosome 11 breakpoint are conserved in multiple species , suggesting that the translocation falls within the AN2 gene . .",O O O O O O O O O O O O O O O O O O O O O O O,32
634,12303,"5 ( 95 percent confidence interval , 0 . 3 to 0 . 8 ) .",O O O O O O O O O O O O O O O O,39
2518,12492,These observations suggest a role for FH and / or FH receptors in the pathogenesis of idiopathic HUS . .,O O O O O O O O O O O O O O O O O B O O,39
3665,10466,"3 and is less than 1 cM from the HLA class I genes ; however , the precise physical location of the gene has remained elusive and controversial .",O O O O O O O O O O O O O O O O O O O O O O O O O O O O O,13
8361,1458,Characterization of the rat spinocerebellar ataxia type 3 gene .,O O O O O O O O O O,32
6541,71,Northern blot hybridisation showed highest expression in brain and skeletal muscle .,O O O O O O O O O O O O,32
5852,3853,No linkage for C5 deficiency and the A or B loci of the major histocompatibility complex could be found .,O O O B I O O O O O O O O O O O O O O O,32
7350,11663,"In this report , we demonstrate that in addition to functional alterations these translocations are associated with fusion product overexpression .",O O O O O O O O O O O O O O O O O O O O O,13
84,4331,"More than 75 % of the reported mutations in the hereditary breast and ovarian cancer gene , BRCA1 , result in truncated proteins .",O O O O O O O O O O B I I I I O O O O O O O O O,32
5291,6983,"Clinically observed dysgenesis does not correlate with IOP , however , and the etiology of glaucoma development is not understood .",O O O O O O O O O O O O O O O B O O O O O,13
2541,8853,Two point mutations are responsible for G6PD polymorphism in Sardinia .,O O O O O O O O O O O,13
7093,12596,A lod score of 13 was calculated for linkage between C2 deficiency and HLA - B at a maximum likelihood value of the recombinant fraction of 0 .,O O O O O O O O O O B I O O O O O O O O O O O O O O O O,39
131,7255,"Because of absence of a distinctive facial appearance , the degree of mental retardation , and short stature , the initially considered clinical diagnosis of Cohen syndrome was withdrawn and a novel genetic entity was assumed .",O O O O O O O O O O O O B I O O B I O O O O O O O B I O O O O O O O O O O,13
9248,1041,"About 98 % of mutant alleles have an expansion of a GAA trinucleotide repeat in intron 1 of the affected gene , FRDA .",O O O O O O O O O O O O O O O O O O O O O O O O,32
5905,10040,The Long - Evans Cinnamon ( LEC ) rat shows similarity to Wilson disease in many clinical and biochemical features .,O O O O O O O O O O O O B I O O O O O O O,13
4974,9722,We show that the native PAX3 / FKHR protein present in tumor cells with this translocation has transcriptional characteristics similar to the in vitro expressed protein .,O O O O O O O O O O O B O O O O O O O O O O O O O O O,13
3157,12384,"Occasionally , a fully expanded allele has been found to arise from a premutation of 100 or less triplet repeats .",O O O O O O O O O O O O O O O O O O O O O,39
1027,10087,Mutation spectrum in the CHM gene of Danish and Swedish choroideremia patients .,O O O O B O O O O O B O O,13
7877,10722,The S135L mutation was not found in 84 white patients with G / G galactosemia nor in 87 white control subjects without galactosemia .,O O O O O O O O O O O O O O B O O O O O O O B O,13
730,6945,In addition Hmgic - / - mice have a deficiency in fat tissue .,O O O O O O O O O O O O O O,13
9403,8084,The PvuII polymorphism detected by probe p5S1 .,O O O O O O O O,13
4216,8105,Our results indicate that at least four types of mutation are responsible for the G6PD polymorphism in Taiwan .,O O O O O O O O O O O O O O O O O O O,13
4212,10408,"3 region , to examine these markers for association with the Wilson disease gene ( WND ) .",O O O O O O O O O O O B I O O B O O,13
811,4966,The 75 - kDa glycoprotein is localized in the brush border of the intestinal epithelium and is predicted to comprise 12 membrane spans .,O O O O O O O O O O O O O O O O O O O O O O O O,32
8366,4472,The BRCA1 gene on chromosome 17q21 is responsible for an autosomal dominant syndrome of increased susceptibility to breast and ovarian cancer but no somatic mutations in tumours have yet been described .,O O O O O O O O O O B I I O O O O B I I I O O O O O B O O O O O,32
9726,8981,"Thus , the patient appeared to be doubly heterozygous for interacting genetic abnormalities affecting vWF expression .",O O O O O O O O O O O B I O O O O,13
2400,4378,"An unexpectedly low proportion of the breast - ovarian cancer families were estimated to be linked to BRCA1 , which could be due to a founder effect in the Dutch population .",O O O O O O B I I I O O O O O O O O O O O O O O O O O O O O O O,32
5036,4159,Molecular basis of subtotal complement C6 deficiency .,O O O B I I I O,32
4989,3835,Recurrent meningococcal meningitis with absence of the sixth component of complement : an evaluation of underlying immunologic mechanisms .,O B I O B I I I I I I O O O O O O O O,32
9961,4746,Further analysis of cognitive function in DM is required to clarify specific deficits characteristic of this patient group,O O O O O O B O O O O O O O O O O O,32
6082,3223,Molecular and phenotypic analysis of patients with deletions within the deletion - rich region of the Duchenne muscular dystrophy ( DMD ) gene .,O O O O O O O O O O O O O O O O B I I O B O O O,32
9494,10078,"However , the sera of the patients changed to be "" atherogenic "" ; total cholesterol , triglyceride and low - density lipoprotein ( LDL ) - cholesterol were increased , while high - density lipoprotein ( HDL ) - cholesterol was decreased .",O O O O O O O O O O O O O O O O O O O O O O O O O O O O O O O O O O O O O O O O O O O O,13
953,9752,"Fourteen patients had subcortical white matter lesions on MRI , 14 had cerebral atrophy .",O O O O B I I O O O O O B I O,13
3328,2785,"Three candidate genes located within the deleted region were ascertained and a previous candidate gene , MCC , was shown to be located outside the deleted region .",O O O O O O O O O O O O O O O O O O O O O O O O O O O O,32
6470,12097,All tested Ashkenazi mutation carriers share the same allelic pattern at the BRCA1 locus .,O O O O O O O O O O O O O O O,39
3918,10146,"The correlation of IQ difference and CTG expansion difference in both the DM parent - child pairs and normal sib - affected sib pairs was poor , indicating that CTG expansion is not a reliable predictor of IQ either in individual persons or families .",O O O O O O O O O O O O B O O O O O O O O O O O O O O O O O O O O O O O O O O O O O O O O,13
612,5327,"BRCA1 mutations cosegregating with breast and ovarian cancer susceptibility were identified in 16 families , including 1 family with a case of male breast cancer .",O O O O B I I I O O O O O O O O O O O O O O B I I O,32
1566,2604,"Proteolipid protein ( PLP ; M ( r ) 30 , 000 ) is a highly conserved major polytopic membrane protein in myelin but its cellular function remains obscure .",O O O O O O O O O O O O O O O O O O O O O O O O O O O O O O,32
9680,3947,These patients show a wide phenotypic variation .,O O O O O O O O,32
6679,6686,"To investigate this mechanism , we analyzed sperm samples from six individuals from five unrelated families affected with hereditary retinoblastoma .",O O O O O O O O O O O O O O O O O O B I O,13
4551,367,"In comparison with the usual EDMD phenotype , patients with P183 missense mutations have a later age at onset of first symptoms , elbow contractures , ankle contractures , upper limb weakness and lower limb weakness , but there is no difference for the age at onset of cardiac involvement .",O O O O O B O O O O O O O O O O O O O O O O O B I O B I O B I I O B I I O O O O O O O O O O O O B I O,32
1983,11316,"METHODS Mutation analyses of the DPC4 gene were performed on complementary DNA samples from 31 primary colorectal cancer specimens using a combination of polymerase chain reaction , single - strand conformation polymorphism , and DNA sequencing .",O O O O O O O O O O O O O O O O B I O O O O O O O O O O O O O O O O O O O,13
5185,5497,"We recently reported that HFE , the protein defective in HH , was physically associated with the transferrin receptor ( TfR ) in duodenal crypt cells and proposed that mutations in HFE attenuate the uptake of transferrin - bound iron from plasma by duodenal crypt cells , leading to up - regulation of transporters for dietary iron .",O O O O O O O O O O B O O O O O O O O O O O O O O O O O O O O O O O O O O O O O O O O O O O O O O O O O O O O O O O,13
1512,9422,Glucose - 6 - phosphate dehydrogenase deficiency in Papua New Guinea .,B I I I I I I O O O O O,13
2078,5508,"METHODS Eight patients with adult - onset ALD underwent clinical examination , brain and spine MRI , and SEP and MEP studies before and after 3 years of Lorenzos oil dietary therapy .",O O O O O O O B O O O O O O O O O O O O O O O O O O O O O O O O O,13
1852,11007,Buttressing these in vivo observations is the fact that mutant blastocyst growth is grossly impaired in vitro .,O O O O O O O O O O O O O O O O O O,13
7839,4335,"Combined with PTT , we detected aberrantly spliced products affecting exons 5 and 6 in one of two BRCA1 - linked families examined .",O O O O O O O O O O O O O O O O O O O O O O O O,32
3093,857,The clinical use of molecular analyses in recessive disorders relies on the exact characterization of both mutant alleles in the affected patient .,O O O O O O O B I O O O O O O O O O O O O O O,32
7604,3225,"This region includes the last five exons detected by cDNA5b - 7 , all exons detected by cDNA8 , and the first two exons detected by cDNA9 .",O O O O O O O O O O O O O O O O O O O O O O O O O O O O,32
10054,695,"We have investigated 5 novel vWS families through probands attended for cleft lip and / or palate repair at the Department of Maxillofacial Surgery of Hopital Trousseau , Paris , in order to tentatively refine the genetic map of the vWS region in 1q32 - q41 and possibly identify unlinked pedigrees .",O O O O O B O O O O O B I I I I I O O O O O O O O O O O O O O O O O O O O O O O B O O O O O O O O O O O,32
4556,12610,"These results would not be expected if immunostaining at intercalated discs were due to a product of the emerin gene and , therefore , cast some doubt upon the hypothesis that cardiac defects in EDMD are caused by absence of emerin from intercalated discs .",O O O O O O O O O O O O O O O O O O O O O O O O O O O O O O O B I O B O O O O O O O O O O,39
581,3868,One boy with G6PD Ube was Korean,O O O O O O O,32
93,8013,A pseudodeficiency allele common in non - Jewish Tay - Sachs carriers : implications for carrier screening .,O O O O O O O O B I I O O O O O O O,13
7226,7564,AluR . centromere .,O O O O,13
4980,8815,The disease mainly occurs in three large kindreds in remote Northern Finland .,O O O O O O O O O O O O O,13
538,3424,Crossovers with the VHL locus suggest that the defect responsible for the VHL phenotype is not a mutation in the RAF1 gene itself .,O O O B O O O O O O O O B O O O O O O O O O O O,32
3689,10777,"For the BRCA1 mutations studied here , the individual mutations are estimated to have arisen 9 - 170 generations ago .",O O O O O O O O O O O O O O O O O O O O O,13
8913,3544,"Deletions have been characterised which encompass either the pERT87 ( DXS164 ) locus only , the XJ1 .",O O O O O O O O O O O O O O O O O O,32
3409,5290,Two novel nonsense mutations led to the loss of mutant BRCA1 transcript in families with 10 and 6 cases of early - onset breast cancer and ovarian cancer .,O O O O O O O O O O O O O O O O O O O O O O O B I O B I O,32
4536,1969,Patients with FAP typically develop hundreds to thousands of benign colorectal tumors and early - onset colorectal cancer .,O O B O O O O O O B I I O O O O B I O,32
9274,973,"These patients were mostly men , of non - North African origin , P < 0 .",O O O O O O O O O O O O O O O O O,32
8437,5205,Structure and genomic sequence of the myotonic dystrophy ( DM kinase ) gene .,O O O O O O B I O B O O O O,32
3629,10025,These results suggest that mutation of BRCA1 may not be critical in the development of the majority of breast and ovarian cancers that arise in the absence of a mutant germline allele . .,O O O O O O O O O O O O O O O O O O B I I I O O O O O O O O O O O O,13
856,6219,The type of somatic mutation at APC in familial adenomatous polyposis is determined by the site of the germline mutation : a new facet to Knudson ' s ' two - hit ' hypothesis .,O O O O O O O O B I I O O O O O O O O O O O O O O O O O O O O O O O O,13
561,4927,We used SSCP analysis on four overlapping cDNA fragments covering the entire coding region of the PEPD gene and detected abnormal SSCP bands for the fragment spanning all or part of exons 13 - 15 in three of the probands .,O O O O O O O O O O O O O O O O O O O O O O O O O O O O O O O O O O O O O O O O O,32
9453,9094,"The assessment , repeated every 2 months , included weight and height measurements , functional and motor ability tests , ergometry and determinations of serum enzymes and GH levels .",O O O O O O O O O O O O O O O O O O O O O O O O O O O O O O,13
4642,8742,Together these data indicate that nonrandom inactivation of the cytogenetically normal paternal X chromosome and a microdeletion of the HPRT gene on an active maternal X chromosome were responsible for the absence of HPRT in this patient . .,O O O O O O O O O O O O O O O O O O O O O O O O O O O O O O O O O O O O O O O,13
7920,5797,Mutation analysis of ACTC revealed an Ala295Ser mutation in exon 5 close to 2 missense mutations recently described to cause the inherited form of idiopathic dilated cardiomyopathy ( IDC ) .,O O O O O O O O O O O O O O O O O O O O O O O O B I I O B O O,13
5684,8140,"Linkage relationship of C2 deficiency , HLA and glyoxalase I loci .",O O O B I O O O O O O O,13
7584,2352,1 + / - 2 .,O O O O O O,32
5628,9849,"Antibodies to the human PTS1R recognize this protein in human , monkey , rat , and hamster cells .",O O O O O O O O O O O O O O O O O O O,13
3734,5852,95 at D1S422 ( P = . 03 ) .,O O O O O O O O O O,13
4983,8022,"A family with an apparent history of X - linked Pelizaeus - Merzbacher disease presented for genetic counseling , requesting carrier detection and prenatal diagnosis .",O O O O O O O O O O B I I I O O O O O O O O O O O O,13
4200,9729,The same mutation was found in one additional melanoma among 28 melanomas analyzed .,O O O O O O O O B O O B O O,13
2922,2050,Detection of a novel missense mutation and second recurrent mutation in the CACNA1A gene in individuals with EA - 2 and FHM .,O O O O O O O O O O O O O O O O O B I I O B O,32
9129,5269,Inherited mutations in the BRCA1 gene are associated with a high risk of breast and ovarian cancer in some families .,O O O O O O O O O O O O O B I I I O O O O,32
4290,8503,The overall rate of G6PD deficiency was 2 .,O O O O B I O O O,13
1994,3594,These results suggest that the primary defect in SLS is deficiency of fatty alcohol NAD + oxidoreductase .,O O O O O O O O B O B I I I I I I O,32
4572,8399,Interstitial cytogenetic deletions involving the paternally derived chromosome 15q11 - 13 have been described in patients with the Prader - Willi syndrome ( PWS ) .,O O O O O O O O O O O O O O O O O O B I I I O B O O,13
9013,12372,Exon - specific primers developed in this study will facilitate mutation screening studies of patients with the disease .,O O O O O O O O O O O O O O O O O O O,39
7675,3361,The patients serum lacked the 85 kDa C7 chain .,O O O O O O O O O O,32
8225,7808,"3 % ( 20 of 94 ) were G to A mutation at nt 1388 , 7 .",O O O O O O O O O O O O O O O O O O,13
5877,1861,This fact encourages the hypothesis that the described kindred segregates for a variant of Cohen syndrome and suggests a redefinition of its phenotype,O O O O O O O O O O O O O O B I O O O O O O O,32
4709,10594,The underlying DNA changes associated with glucose - 6 - phosphate dehydrogenase ( G6PD ) - deficient Asians have not been extensively investigated .,O O O O O O B I I I I I I I I I I O O O O O O O,13
3154,3746,"We isolated several mutant PAH cDNA clones from a PKU carrier individual and showed that they contained an internal 116 base pair deletion , corresponding precisely to exon 12 of the human chromosomal PAH gene .",O O O O O O O O O B O O O O O O O O O O O O O O O O O O O O O O O O O O,32
715,1610,"Using large human flanking sequences and a large amplification , we demonstrate that the intergenerational CTG repeat instability is reproduced in mice , with a strong bias towards expansions and with the same sex - and size - dependent characteristics as in humans .",O O O O O O O O O O O O O O O O O O O O O O O O O O O O O O O O O O O O O O O O O O O O,32
1268,3589,Hexadecanol accumulation was not due to increased fatty alcohol synthesis nor its deficient utilization for glycerol ether synthesis .,O O O O O O O O O O O O O O O O O O O,32
3728,5384,A DNA sequence variant in the Brca1 locus was identified and used to map this gene on a ( Mus m . musculus Czech II x C57BL / KsJ ) F1 x C57BL / KsJ intersubspecific backcross to distal mouse chromosome 11 .,O O O O O O O O O O O O O O O O O O O O O O O O O O O O O O O O O O O O O O O O O O O,32
1951,1502,"Indeed , a six - marker haplotype extending over a region of 5 .",O O O O O O O O O O O O O O,32
7379,5138,Genetic mapping of the breast - ovarian cancer syndrome to a small interval on chromosome 17q12 - 21 : exclusion of candidate genes EDH17B2 and RARA .,O O O O B I I I I O O O O O O O O O O O O O O O O O O,32
5258,9756,Quantification of CTG repeat size may allow an early estimate on the probability of brain involvement in DM ; cognitive dysfunction is associated with white matter lesions and cerebral atrophy later on in the course . .,O O O O O O O O O O O O O O O O O B O B I O O O B I I O B I O O O O O O O,13
