Unnamed: 0.1,Unnamed: 0,text,labels,txt_len
7473,4926,"Four PEPD mutations from five severely affected individuals were characterized by analysis of reverse - transcribed , PCR - amplified ( RT - PCR ) cDNA .",O O O O O O O O O O O O O O O O O O O O O O O O O O O,32
9262,43,Increased incidence of cancer in patients with cartilage - hair hypoplasia .,O O O B O O O B I I I O,32
5014,5632,"Enlarged vestibular aqueduct ( EVA ) , known as the most common form of inner ear abnormality , has recently been of particular genetic interest because this anomaly is inherited in a recessive manner .",B I I O B O O O O O O O O O B I I O O O O O O O O O O O O O O O O O O,13
3978,3007,"Ten of the twelve markers have been shown to be proximal to the DM gene and two , PRKCG and D19S22 , distal but at distances of approximately 25 cM and 15 cM , respectively .",O O O O O O O O O O O O O B O O O O O O O O O O O O O O O O O O O O O O,32
4430,5975,Individuals homoallelic for Q188R tend to have a severe phenotype and this is in keeping with the virtually complete loss of enzyme activity observed in in vitro expression systems .,O O O O O O O O O O O O O O O O O O O O O O O O O O O O O O,13
8477,3197,The plasma of the probands was totally deficient in CETP activity and mass .,O O O O O O O O O O O O O O,32
9564,10165,"To better understand the function of the EWS protein , we cloned the EWS cDNA .",O O O O O O O O O O O O O O O O,13
2473,9417,"0 with otherwise normal properties ( heat stability at 46 degrees C , apparent affinity for substrates , optimum pH , and utilization of substrate analogues ) .",O O O O O O O O O O O O O O O O O O O O O O O O O O O O,13
6141,2806,Fragments of the arylsulfatase A ( ARSA ) gene from a patient with juvenile - onset metachromatic leukodystrophy ( MLD ) were amplified by PCR and ligated into MP13 cloning vectors .,O O O O O O O O O O O O O O O O B I O B O O O O O O O O O O O O,32
7458,3350,"The other variants ( types III - VI ) , which have sometimes been categorized as Pelizaeus - Merzbacher disease , may represent mutations in genes encoding other structural myelin proteins or proteins critical to myelination . .",O O O O O O O O O O O O O O O O B I I I O O O O O O O O O O O O O O O O O O,32
9278,422,MEFV - Gene analysis in armenian patients with Familial Mediterranean fever : diagnostic value and unfavorable renal prognosis of the M694V homozygous genotype - genetic and therapeutic implications .,O O O O O O O O B I I O O O O O O O O O O O O O O O O O O,32
4962,3994,No TSD carriers were observed among the 166 Jews of Near Eastern origins .,O B O O O O O O O O O O O O,32
5787,452,"Estimates from heterogeneity tests suggest that , within Sweden , as many as 50 % of early - onset families had evidence of linkage to the HPC1 region .",O O O O O O O O O O O O O O O O O O O O O O O O O O O O O,32
4179,2292,"This could be because the 68 Val - - > Met mutation happened to arise in an A gene in the first instance , or because the 68 Val - - > Met mutation alone is not sufficient to cause G6PD deficiency .",O O O O O O O O O O O O O O O O O O O O O O O O O O O O O O O O O O O O O O O O B I O,32
7431,9289,Molecular evidence for new mutation at the hprt locus in Lesch - Nyhan patients .,O O O O O O O O O O B I I O O,13
873,3675,"Thus , recombinant viruses containing human PAH cDNA provide a means for introducing functional PAH into mammalian cells of hepatic origin and can potentially be introduced into whole animals as a model for somatic gene therapy for PKU . .",O O O O O O O O O O O O O O O O O O O O O O O O O O O O O O O O O O O O O B O O,32
8913,3544,"Deletions have been characterised which encompass either the pERT87 ( DXS164 ) locus only , the XJ1 .",O O O O O O O O O O O O O O O O O O,32
6975,2902,"Thus , this is a rare example of homozygous hypobetalipoproteinemia .",O O O O O O O O B I O,32
7480,11135,"Thus , we screened 16 endometrial carcinomas with microsatellite instability for alterations in FEN1 ( the human homolog of RTH ) and in MSH3 ( refs 12 - 14 ) .",O O O O O B I O O O O O O O O O O O O O O O O O O O O O O O O,13
6494,9627,"ADCA type I patients from families segregating SCA3 share clinical features in common with those with Machado - Joseph disease ( MJD ) , the gene of which maps to the same region .",B I I O O O O B O O O O O O O O B I I I O B O O O O O O O O O O O O,13
5630,417,"A missense mutation , R483G , was located in the highly conserved PtdIns ( 4 , 5 ) P2 5 - phosphatase domain .",O O O O O O O O O O O O O O O O O O O O O O O O,32
9469,4725,Sixty - four probands were analyzed for mutations in the ASPA gene .,O O O O O O O O O O O O O,32
708,2608,Here we show that a new mouse mutant rumpshaker is defined by the amino - acid substitution Ile - to - Thr at residue 186 in a membrane - embedded domain of PLP .,O O O O O O O O O O O O O O O O O O O O O O O O O O O O O O O O O O,32
5638,730,"Thus , exon 5a appears to function as a molecular switch that specifies target genes .",O O O O O O O O O O O O O O O O,32
1667,10792,"Using both antisera , we found positive nuclear membrane staining in skeletal , cardiac and smooth muscles in the normal controls and in patients with neuromuscular diseases other than EDMD .",O O O O O O O O O O O O O O O O O O O O O O O O O B I O O B O,13
4491,5611,These results suggest that the HFE gene has been the subject of selection pressure .,O O O O O O O O O O O O O O O,13
8760,12508,"We have also observed the 879delG defect in two Dutch C6 - deficient kindreds , but the 879delG defect in the Cape probably did not come from The Netherlands . .",O O O O O O O O O O B I I O O O O O O O O O O O O O O O O O O,39
9449,10288,"Second , affected members of a family with dominantly inherited anterior segment malformations , including Peters anomaly are heterozygous for an R26G mutation in the PAX6 paired box .",O O O O O O O O O O B I I O O B I O O O O O O O O O O O O,13
8730,11300,"The mutation of case 1 was a homozygous T to A transversion at nucleotide 2250 , the third nucleotide of the codon TGT for Cys728 , leading to a stop codon TGA ( C728X ) .",O O O O O O O O O O O O O O O O O O O O O O O O O O O O O O O O O O O O,13
2699,1863,Ankylosing spondylitis ( AS ) is a common and highly familial rheumatic disorder .,B I O B O O O O O O O B I O,32
2677,2556,"Chorionic villus sampling performed for advanced maternal age revealed trisomy 15 in all direct and cultured cells , though the fetus appeared normal .",O O O O O O O O O B I O O O O O O O O O O O O O,32
8181,10142,Scaled scores from the assessment were converted into an intelligence quotient ( IQ ) estimation on each person .,O O O O O O O O O O O O O O O O O O O,13
4855,9985,"These data demonstrate that point mutations which result in single amino acid substitutions can produce Kniest dysplasia and further support the hypothesis that alteration of a domain , which includes the region encoded by exon 12 , in the type II collagen protein leads to this disorder . .",O O O O O O O O O O O O O O O B I O O O O O O O O O O O O O O O O O O O O O O O O O O O O O O O O,13
2372,7429,"We have also found that DCC is a substrate for metalloprotease - dependent ectodomain shedding , and that the inhibitors block proteolytic processing of DCC and cause an increase in DCC protein levels on axons within spinal cord explants .",O O O O O O O O O O O O O O O O O O O O O O O O O O O O O O O O O O O O O O O O,13
1716,3226,"These 80 individuals account for approximately 75 % of 109 deletions of the gene , detected among 181 patients analyzed with the entire dystrophin cDNA .",O O O O O O O O O O O O O O O O O O O O O O O O O O,32
5026,11132,"Although this microsatellite instability has been attributed to mutations in four DNA mismatch repair genes in hereditary nonpolyposis colorectal cancer ( HNPCC ) kindreds , many sporadic tumours exhibit instability but no detectable mutations in these genes .",O O B I O O O O O O O O O O O O B I I I O B O O O O B I O O O O O O O O O O,13
2046,9429,Glucose - 6 - phosphate dehydrogenase ( G6PD ) ; EC 1 .,O O O O O O O O O O O O O,13
3659,6913,Gene loci in the X - linked recessive forms have been assigned to Xq13 .,O O O O O O O O O O O O O O O,13
1272,10034,We have constructed a physical map of a 4 cM region on chromosome 17q12 - 21 that contains the hereditary breast and ovarian cancer gene BRCA1 .,O O O O O O O O O O O O O O O O O O O B I I I I O O O,13
1851,6543,Splice - site mutation in the PDS gene may result in intrafamilial variability for deafness in Pendred syndrome .,O O O O O O B O O O O O O O B O B I O,13
43,4397,We engineered a construct of the OCRL cDNA that encodes amino acids homologous to the platelet 5 - phosphatase for expression in baculovirus - infected Sf9 insect cells .,O O O O O O O O O O O O O O O O O O O O O O O O O O O O O,32
5367,2093,Prenatal diagnosis of Wolman disease .,O O O B I O,32
1072,2593,The mother had seropositive rheumatoid arthritis .,O O O B I I O,32
3330,4246,"Of 4 unrelated patients with the XLT phenotype , 3 had missense mutations affecting exon 2 and 1 had a splice - site mutation affecting exon 9 .",O O O O O O B O O O O O O O O O O O O O O O O O O O O O,32
4572,8399,Interstitial cytogenetic deletions involving the paternally derived chromosome 15q11 - 13 have been described in patients with the Prader - Willi syndrome ( PWS ) .,O O O O O O O O O O O O O O O O O O B I I I O B O O,13
8686,2251,The mutation underlying myotonic dystrophy ( DM ) has been identified as an expansion of a polymorphic CTG - repeat in a gene encoding protein kinase activity .,O O O B I O B O O O O O O O O O O O O O O O O O O O O O,32
8287,7025,Type 1 disease is panethnic but is more prevalent in individuals of Ashkenazi Jewish ( AJ ) descent .,O O O O O O O O O O O O O O O O O O O,13
1744,7881,Three were at nucleotide position 1180 resulting in an arg > trp amino acid change .,O O O O O O O O O O O O O O O O,13
9381,3154,Both the Ham test and the sugar water test using normal human serum or plasma yielded marked haemolysis of the patients erythrocytes .,O O O O O O O O O O O O O O O O O O O O O O O,32
2264,11780,Additive genetic effects were estimated to contribute 97 % of the population variance .,O O O O O O O O O O O O O O,39
10108,5289,"In one family , penetrance was complete , with females developing early - onset breast cancer or ovarian cancer and the male carrier developing prostatic cancer , whereas , in the other family , penetrance was incomplete and only breast cancer occurred , diagnosed at ages 38 - 81 years .",O O O O O O O O O O O O O O B I O B I O O O O O B I O O O O O O O O O O O O O B I O O O O O O O O O O,32
6751,4431,The first known human kindred with hereditary deficiency of the fifth component of complement ( C5 ) was documented in the accompanying report .,O O O O O O B I I I I I I I O O O O O O O O O O,32
5266,5966,"A previously described 28 - bp deletion at the COL2A1 exon 12 - intron 12 junction , deleting the splice donor site , was identified in the fifth case .",O O O O O O O O O O O O O O O O O O O O O O O O O O O O O O,13
1428,1485,We now provide strong evidence of a second FRDA locus .,O O O O O O O O B O O,32
4075,4572,This mutation has been reported in patients with the late infantile MLD from different ethnic groups .,O O O O O O O O O O O B O O O O O,32
7652,478,"Mutations in the human EGR2 gene have recently been associated with the inherited peripheral neuropathies Charcot - Marie - Tooth type 1 , Dejerine - Sottas syndrome and congenital hypomyelinating neuropathy .",O O O O O O O O O O O O B I I B I I I I I I O B I I I O B I I O,32
8098,6833,"Wilson disease ( WD ) is an autosomal recessive disorder characterized by copper accumulation in the liver , brain , kidneys , and corneas , and culminating in copper toxication in these organs .",B I O B O O O B I I O O O O O O O O O O O O O O O O O O O O O O O O,13
3691,4876,We have used single strand conformational polymorphism ( SSCP ) and heteroduplex analysis to screen for variants in this region of the gene in a total of 45 affected but unrelated individuals .,O O O O O O O O O O O O O O O O O O O O O O O O O O O O O O O O O,32
6997,6616,A more complete understanding of the functional physiology of cathepsin C carries significant implications for understanding normal and abnormal skin development and periodontal disease susceptibility,O O O O O O O O O O O O O O O O O O O O O O B I O,13
3364,1085,"In this family of disorders , a normally polymorphic CAG repeat becomes expanded , resulting in expression of an expanded polyglutamine domain in the disease gene product .",O O O O O O O O O O O O O O O O O O O O O O O O O O O O,32
1440,4351,"Fourteen patients had subcortical white matter lesions on MRI , 14 had cerebral atrophy .",O O O O B I I O O O O O B I O,32
5438,3846,"No C5 protein was detectable , but low levels of functional C5 activity could be found using a sensitive bactericidal assay .",O O O O O O O O O O O O O O O O O O O O O O,32
2080,2935,"These two markers also show close linkage to each other ( theta max = 0 . 05 , Zmax = 9 . 09 ) .",O O O O O O O O O O O O O O O O O O O O O O O O O,32
4751,5672,The rates of transport for iodide and chloride were significantly increased following the expression of pendrin in both cell systems .,O O O O O O O O O O O O O O O O O O O O O,13
869,11206,These findings suggest that the pathogenesis of HD is not mediated through DNA - protein interaction and that presence of the RNA transcript with an expanded CAG repeat is insufficient to cause the disease .,O O O O O O O B O O O O O O O O O O O O O O O O O O O O O O O O O O O,13
7966,411,"Characterization of a germline mosaicism in families with Lowe syndrome , and identification of seven novel mutations in the OCRL1 gene .",O O O O O O O O B I O O O O O O O O O O O O,32
4053,1364,"In contrast , the excision of exons 13 / 14 that causes a frameshift and creates a C - terminally truncated protein is clearly cell type dependent and occurs predominantly in smooth muscle .",O O O O O O O O O O O O O O O O O O O O O O O O O O O O O O O O O O,32
9892,2404,This method involves the selective amplification of a DNA fragment from human G6PD gene with specific oligonucleotide primers followed by digestion with restriction enzymes that recognize artificially created or naturally occurring restriction sites .,O O O O O O O O O O O O O O O O O O O O O O O O O O O O O O O O O O,32
10088,2960,Serum amyloid A and P protein genes in familial Mediterranean fever .,O O O O O O O O B I I O,32
5486,4791,"Moreover , the exclusive maternal inheritance of the congenital form remains unexplained .",O O O O O O O O O O O O O,32
8134,3503,"HindIII total - digest libraries were prepared in lambda phage Charon 21A from flow - sorted inverted duplicated no . 15 human chromosomes and propagated on recombination - proficient ( LE392 ) and recBC - , sbcB - ( DB1257 ) bacteria .",O O O O O O O O O O O O O O O O O O O O O O O O O O O O O O O O O O O O O O O O O O O,32
5124,11921,The inactivation of the von Hippel - Lindau ( VHL ) tumor suppressor gene predisposes affected individuals to the human VHL cancer syndrome and is associated with sporadic renal cell carcinomas ( RCC ) and brain hemangioblastomas .,O O O O B I I I I I I I O O O O O O O O B I I O O O O B I I I O B O O B I O,39
6934,8999,We have examined the meiotic segregation products of the common female ancestor using marker restriction fragment length polymorphisms ( RFLPs ) detected by probes that lie within this deletion .,O O O O O O O O O O O O O O O O O O O O O O O O O O O O O O,13
4960,284,The objective of this study was to provide more accurate frequency estimates of breast cancer susceptibility gene 1 ( BRCA1 ) germline alterations in the ovarian cancer population .,O O O O O O O O O O O O O B I O O O O O O O O O O B I O O,32
720,5773,"We reported previously a family whose underlying mutation is a 500 - 800 kb deletion localized to chromosome bands 1q32 - q41 [ Sander et al . , 1994 Hum Mol Genet 3 576 - 578 ] .",O O O O O O O O O O O O O O O O O O O O O O O O O O O O O O O O O O O O O O,13
6240,6380,"The response to treatment was good despite using low colchicine dose , P < 0 .",O O O O O O O O O O O O O O O O,13
2648,4559,"A previous conceptus in this family was stillborn at 36 weeks , with features of severe type II GD .",O O O O O O O B O O O O O O O O B I I O,32
9950,3018,"The localization of histidase to mouse chromosome 10 suggests that the histidase regulatory locus ( Hsd ) and the histidinemia mutation ( his ) , which are both known to be on chromosome 10 , may be alleles of the histidase structural gene locus .",O O O O O O O O O O O O O O O O O O O O O O O O O O O O O O O O O O O O O O O O O O O O O,32
9994,7167,"In vitro stimulation of monocytes with the proinflammatory agents interferon ( IFN ) gamma , tumor necrosis factor , and lipopolysaccharide induced MEFV expression , whereas the antiinflammatory cytokines interleukin ( IL ) 4 , IL - 10 , and transforming growth factor beta inhibited such expression .",O O O O O O O O O O O O O O O B O O O O O O O O O O O O O O O O O O O O O O O O O O O O O O O O,13
5313,9890,"Five of nine siblings of the patient , comprising two cerebral ALD , one adrenomyeloneuropathy , one Addison only as well as the symptomatic mother ( all accumulating very long chain fatty acids ) carried this mutation , which was not found in the unaffected persons , in five unrelated ALD patients , and in twenty controls .",O O O O O O O O O O B I O O B O O B I O O O O O O O O O O O O O O O O O O O O O O O O O O O O O O O B O O O O O O O,13
4190,5784,Fewer than half of the splicing mutations involved the canonical AG splice - acceptor site or GT splice - donor site .,O O O O O O O O O O O O O O O O O O O O O O,13
5312,8706,This is confirmed by other recombinants where DM segregates with distal probes .,O O O O O O O B O O O O O,13
8899,3640,Glucose - 6 - phosphate dehydrogenase ( G6PD ; EC 1 . 1 . 1 . 49 ) deficiency is a common genetic abnormality affecting an estimated 400 million people worldwide .,B I I I I I I I I I I I I I I I I I I O O O B I O O O O O O O O,32
3980,6892,Glycerol as a correlate of impaired glucose tolerance : dissection of a complex system by use of a simple genetic trait .,O O O O O B I I O O O O O O O O O O O O O O,13
3770,7735,The amount of p19 / nm23 increased in normal lymphocytes in response to mitotic stimulation and paralleled the increase in DNA synthesis .,O O O O O O O O O O O O O O O O O O O O O O O,13
9358,12488,"Two of the children exhibited a homozygous deficiency characterized by the absence of the 150 - kD form of Factor H and the presence , upon immunoblotting , of the 42 - kD Factor H - like protein 1 ( FHL - 1 ) and other FH - related protein ( FHR ) bands .",O O O O O O O O O O O O O O O O O O O O O O O O O O O O O O O O O O O O O O O O O O O O O O O O O O O O O O O,39
10019,814,Atypical or variant forms of well - known chondrodysplasias may pose diagnostic problems .,O O O O O O O O B O O O O O,32
5247,3421,"Von Hippel - Lindau disease ( VHL ) is an autosomal dominant disorder with inherited susceptibility to various forms of cancer , including hemangioblastomas of the central nervous system , phaeochromocytomas , pancreatic malignancies , and renal cell carcinomas .",B I I I I O B O O O B I I O O O O O O O B O O B O O O O O O B O B I O O B I I O,32
7231,593,The study of mutational events revealed a significant difference between somatic and germline mutations with mutations leading to truncated proteins observed in 78 % of somatic mutations vs only 37 % in germline mutations ( P < 0 . 001 ) .,O O O O O O O O O O O O O O O O O O O O O O O O O O O O O O O O O O O O O O O O O O,32
4083,5232,"As the VHL gene is believed to function as a tumor suppressor gene , VHL gene mutations may play a role in the initiation of tumorigenesis in sporadic cystadenomas of the epididymis .",O O B O O O O O O O B O O O B O O O O O O O O O O O O O B I I I O,32
9628,7039,One further B27 negative patients had a sister with ankylosing spondylitis and ulcerative colitis and a mother with ulcerative colitis .,O O O O O O O O O B I O B I O O O O B I O,13
9025,7865,Somatic mutations of the APC gene in colorectal tumors : mutation cluster region in the APC gene .,O O O O B O O B I O O O O O O B O O,13
3927,8027,"As this change results in a Thr - to - Pro change at amino acid 181 in a region of the gene predicted to be part of a transmembrane segment , it was concluded that this was the mutation causing the disease in this family .",O O O O O O O O O O O O O O O O O O O O O O O O O O O O O O O O O O O O O O O O O O O O O O,13
7645,10981,"However , there appeared to be a considerable variation in colchicine milk concentration among the different patients , which might be related to individual breast milk composition and , possibly , to other nutritional or metabolic factors .",O O O O O O O O O O O O O O O O O O O O O O O O O O O O O O O O O O O O O O,13
3783,6683,One possible explanation for our finding is an altered alpha - / beta ( 1 ) - subunit association in the mutant . .,O O O O O O O O O O O O O O O O O O O O O O O O,13
4842,1592,"Foxc1 ( + / - ) and Foxc2 ( + / - ) mice are useful models for studying anterior segment development and its anomalies , and may allow identification of genes that interact with Foxc1 and Foxc2 ( or FKHL7 and FKHL14 ) to produce a phenotype with elevated IOP and glaucoma . .",O O O O O O O O O O O O O O O O O O O O O O O O O O O O O O O O O O O O O O O O O O O O O O O O O O O O B O O,32
9780,10134,"Of the 128 unrelated Canavan chromosomes analyzed , 88 were from probands of Ashkenazi Jewish descent .",O O O O B O O O O O O O O O O O O,13
1205,9603,One PAX6 mutation found in the PST region was associated with cataracts in an aniridia family .,O O O O O O O O O O O B O O B O O,13
295,11405,"The disease in these two kindreds was linked to five markers in the 1q21 - q32 region ( logarithm - of - odds scores 3 . 2 - 4 2 - 4 . 2 ) , whereas linkage to the MEN1 and MEN2 regions was excluded .",O O O O O O O O O O O O O O O O O O O O O O O O O O O O O O O O O O O O O O O O B O B O O O O,13
7663,9032,X - linked glucose - 6 - phosphate dehydrogenase deficiency in Mus musculus .,B I I I I I I I I I O O O O,13
8745,5444,Increased incidence of cancer in patients with cartilage - hair hypoplasia .,O O O B O O O B I I I O,13
1987,11005,"In vivo , mutant embryos do not exhibit increased apoptosis but show reduced cell proliferation accompanied by decreased expression of cyclin E and mdm - 2 , a regulator of p53 activity .",O O O O O O O O O O O O O O O O O O O O O O O O O O O O O O O O O,13
9427,1888,S .,O O,32
3847,2764,Two distinct mutations at a single BamHI site in phenylketonuria .,O O O O O O O O O B O,32
5780,7731,We have previously identified the protein product of the nm23 - H1 gene in two - dimensional electrophoretic gels and have designated it p19 / nm23 .,O O O O O O O O O O O O O O O O O O O O O O O O O O O,13
651,1721,"To test the role of Six5 loss in DM , we have analysed a strain of mice in which Six5 was deleted .",O O O O O O O O B O O O O O O O O O O O O O O,32
6763,9400,"The patient , a 31 year old white male , was seen on the occasion of an isolated episode of meningococcal meningitis .",O O O O O O O O O O O O O O O O O O O O B I O,13
5507,11187,"LPP , the preferred fusion partner gene of HMGIC in lipomas , is a novel member of the LIM protein gene family .",O O O O O O O O O O B O O O O O O O O O O O O,13
204,3719,"Criteria for hypopigmentation included the presence of type I or II skin , the lightest skin type in the family by history , and iris translucency on globe transillumination .",O O B O O O O O O O O O O O O O O O O O O O O O O O O O O O,32
9080,7979,"83 at theta = 0 , with a peak lod score in multipoint linkage analysis of 2 .",O O O O O O O O O O O O O O O O O O,13
7381,3166,RFLP and quantitative Southern blot analyses revealed a grandpaternal origin of duplication in four families and grandmaternal origin in one family .,O O O O O O O O O O O O O O O O O O O O O O,32
6331,9561,A carboxy - terminally truncated but functionally active C6 .,O O O O O O O O O O,13
8711,2506,We report the isolation of an expressed sequence from this region which detects a DNA fragment that is larger in affected individuals than in normal siblings or unaffected controls .,O O O O O O O O O O O O O O O O O O O O O O O O O O O O O O,32
7643,1479,"These results suggest that emerin anchors at the inner nuclear membrane through the hydrophobic stretch , and protrudes from the hydrophilic region to the nucleoplasm where it interacts with the nuclear lamina .",O O O O O O O O O O O O O O O O O O O O O O O O O O O O O O O O O,32
211,11524,"We determined 48 amino acid residues from five peptides from the homogeneous monomer of homogentisate 1 , 2 - dioxygenase ( HGO ; E . C . 1 . 13 . 11 . 15 ) of mouse liver .",O O O O O O O O O O O O O O O O O O O O O O O O O O O O O O O O O O O O O O O,13
4568,3033,This made a prenatal or presymptomatic diagnosis and heterozygote detection by DNA analysis with this marker reliable .,O O O O O O O O O O O O O O O O O O,32
4896,7570,One splicing mutation results in a 3 amino acid in - frame insertion .,O O O O O O O O O O O O O O,13
4724,3791,"For 17 patients ( 13 kindreds ) diagnosed with these criteria , we have studied the platelet contents of vWF Ag and RiCof and the changes of these in plasma after DDAVP infusion .",O O O O O O O O O O O O O O O O O O O O O O O O O O O O O O O O O O,32
6336,8916,Both of these cloned segments were described as tightly linked to the locus and were capable of detecting deletions in the DNA of boys affected with DMD .,O O O O O O O O O O O O O O O O O O O O O O O O O O B O,13
7505,7106,Mice deficient in Six5 develop cataracts : implications for myotonic dystrophy .,O B I I O B O O O B I O,13
