Unnamed: 0.1,Unnamed: 0,text,labels,txt_len
7428,7892,"Using these methods , we report striking linkage disequilibrium for diastrophic dysplasia ( DTD ) in Finland indicating that the DTD gene should lie within 0 .",O O O O O O O O O O B I O B O O O O O O B O O O O O O,13
7889,10472,The results suggest a strong peak of existing linkage disequilibrium focused within the i82 - to - 6 .,O O O O O O O O O O O O O O O O O O O,13
8587,5235,"To elucidate the range of WASP mutations responsible for WAS , we used PCR - SSCP analysis to screen for WASP gene mutation in 19 unrelated boys with the diagnosis of classical or attenuated WAS or isolated thrombocytopenia .",O O O O O O O O O B O O O O O O O O O O O O O O O O O O O O O O O O B O B I O,32
2047,5594,"In cotransfection experiments , Fas constructs with either intra - or extracellular mutations caused dominant inhibition of apoptosis mediated by wild - type Fas .",O O O O O O O O O O O O O O O O O O O O O O O O O,13
3424,12121,Myotonic dystrophy ( DM ) is caused by a CTG expansion in the 3 untranslated region of the DM gene .,B I O B O O O O O O O O O O O O O O B O O,39
8686,2251,The mutation underlying myotonic dystrophy ( DM ) has been identified as an expansion of a polymorphic CTG - repeat in a gene encoding protein kinase activity .,O O O B I O B O O O O O O O O O O O O O O O O O O O O O,32
5278,1088,"The monoclonal antibody 1C2 is known preferentially to bind expanded polyglutamine , but we find that it also binds a fragment of ataxin - 3 containing a normal glutamine repeat .",O O O O O O O O O O O O O O O O O O O O O O O O O O O O O O O,32
6988,9368,"The linkage analysis required is described , and the need to check DMD families for informative RFLPs is stressed .",O O O O O O O O O O O O B O O O O O O O,13
8284,5618,"9 % in Iceland , 5 .",O O O O O O O,13
6372,12496,"To investigate whether a founder chromosome for the DM mutation exists in the Japanese population , we genotyped families using polymorphic markers near the ( CTG ) n repeat region and constructed haplotypes .",O O O O O O O O B O O O O O O O O O O O O O O O O O O O O O O O O O,39
2803,6550,"Since the newly created donor splice site is likely to compete with the normal one , variations of the levels of normal and aberrant transcripts of the PDS gene in the cochlea may explain the variability in the deafness presentation . .",O O O O O O O O O O O O O O O O O O O O O O O O O O O B O O O O O O O O O O B O O O,13
484,6068,"Then , 189 MPKUCS subjects were grouped according to the various combinations of mutation classifications .",O O O O O O O O O O O O O O O O,13
873,3675,"Thus , recombinant viruses containing human PAH cDNA provide a means for introducing functional PAH into mammalian cells of hepatic origin and can potentially be introduced into whole animals as a model for somatic gene therapy for PKU . .",O O O O O O O O O O O O O O O O O O O O O O O O O O O O O O O O O O O O O B O O,32
8231,4738,Predominant occurrence of certain mutations among Ashkenazi Jewish and non - Jewish patients with Canavan disease would suggest a founding - father effect in propagation of these mutant chromosomes,O O O O O O O O O O O O O O B I O O O O O O O O O O O O O,32
9098,647,This is the most comprehensive compilation of ATM polymorphisms assembled to date .,O O O O O O O O O O O O O,32
3548,10618,The phenotypic expression of the mutation was determined to be recessive because heterozygous family members were clinically unaffected .,O O O O O O O O O O O O O O O O O O O,13
6689,3083,"Location scores indicate that three contiguous subsegments within the [ S144 - THY1 ] segment , as well as three contiguous segments telomeric to THY1 , are each unlikely to contain the AT locus , while the more centromeric [ STMY - S144 ] segment is most likely to contain the AT locus .",O O O O O O O O O O O O O O O O O O O O O O O O O O O O O O O O B O O O O O O O O O O O O O O O O O O B O O,32
1584,2180,"In order to test the effect of this substitution , an in vitro mutagenized cDNA construct was introduced into a mammalian expression vector and transfected into monkey Cos - 1 cells separately or along with a beta - cDNA expression vector .",O O O O O O O O O O O O O O O O O O O O O O O O O O O O O O O O O O O O O O O O O O,32
3897,4939,"This approach allowed us to identify one phase - known recombination and one probable historic recombination on haplotypes from Reunion Island patients , both of which place three of the five markers proximal to FRDA .",O O O O O O O O O O O O O O O O O O O O O O O O O O O O O O O O O O B O,32
6048,7383,Increased iron deposition and evidence of oxidative damage have also been observed in cardiac tissue and cultured fibroblasts from patients with FRDA .,O O O O O O O O O O O O O O O O O O O O O B O,13
8909,11309,"To test this proposition , we bred HPRT - APRT - deficient mice .",O O O O O O O B I I I I O O,13
6035,24,For females there was a high risk of endometrial cancer ( 0 . 5 at age 60 years ) and premenopausal ovarian cancer ( 0 . 2 at 50 years ) .,O O O O O O O O B I O O O O O O O O O O B I I O O O O O O O O O,32
9623,2803,"Thus , PRAD1 is an excellent candidate "" BCL1 oncogene .",O O O O O O O O O O O,32
4023,9998,Confirmation of BRCA1 by analysis of germline mutations linked to breast and ovarian cancer in ten families .,O O O O O O O O O O B I I I O O O O,13
3285,11563,"Autosomal dominant myotonia congenita is an inherited disorder of skeletal muscle caused by mutations in a voltage - gated Cl - channel gene ( CLCN1 , 7q35 ) .",B I I I O O B I I I I O O O O O O O O O O O O O O O O O O,13
1126,5264,A deletion of 8q24 .,O O O O O,32
8899,3640,Glucose - 6 - phosphate dehydrogenase ( G6PD ; EC 1 . 1 . 1 . 49 ) deficiency is a common genetic abnormality affecting an estimated 400 million people worldwide .,B I I I I I I I I I I I I I I I I I I O O O B I O O O O O O O O,32
2309,5331,"Sequencing of genomic DNA led to the identification of a mutation in the coding region of BRCA1 in 12 families , and cDNA analysis revealed an abnormal or missing BRCA1 transcript in 4 of the 8 remaining families .",O O O O O O O O O O O O O O O O O O O O O O O O O O O O O O O O O O O O O O O,32
5910,404,"Skin was seborrhoeic in adolescent and adult patients , with erythema of the facial skin already common in childhood .",O O O O O O O O O O B I I I I O O O O O,32
8720,7277,Functional differences of the PDS gene product are associated with phenotypic variation in patients with Pendred syndrome and non - syndromic hearing loss ( DFNB4 ) .,O O O O B O O O O O O O O O O B I O B I I I I O B O O,13
8850,302,Centrosome amplification and a defective G2 - M cell cycle checkpoint induce genetic instability in BRCA1 exon 11 isoform - deficient cells .,O O O O O O O O O O O O O O O O O O O O O O O,32
179,2176,The mutation causing juvenile Tay - Sachs disease ( TSD ) in two sibs of Lebanese - Maronite origin is described .,O O O O B I I I O B O O O O O O O O O O O O,32
3040,1619,"We show that homozygous deletions cause embryonic lethality a few days after implantation , demonstrating an important role for frataxin during early development .",O O O O O O B I O O O O O O O O O O O O O O O O,32
9429,5404,"In colon carcinoma cells , loss of APC leads to the accumulation of betacatenin in the nucleus , where it binds to and activates the Tcf - 4 transcription factor ( reviewed in [ 1 ] [ 2 ] ) .",O B I O O O O O O O O O O O O O O O O O O O O O O O O O O O O O O O O O O O O O O,13
1519,10619,Recombinant vWF containing the observed amino acid substitution was expressed in COS - 1 cells .,O O O O O O O O O O O O O O O O,13
3194,3040,"Additional evidence of a large gene deletion was given by novel SfiI junction fragments detected by probes p20 , J - Bir , and J - 66 on pulsed - field gel electrophoresis ( PFGE ) .",O O O O O O O O O O O O O O O O O O O O O O O O O O O O O O O O O O O O O,32
5583,794,Loss of the ataxia - telangiectasia gene product causes oxidative damage in target organs .,O O O B I I O O O O O O O O O,32
6819,7203,"2 domain , in which most FMF - associated mutations have been found in human MEFV .",O O O O O O B O O O O O O O O O O,13
5229,12046,The largest proportion ( 67 % ) of families due to other genes was found in families with four or five cases of female breast cancer only .,O O O O O O O O O O O O O O O O O O O O O O O O B I O O,39
662,11070,"Germline VHL gene mutations predispose to the development of retinal , cerebellar and spinal haemangioblastomas , renal cell carcinoma and phaeochromocytoma .",O B O O O O O O O B I I I I I O B I I O B O,13
9464,12311,Another nephew ( patient 4 ) of patient 1 was classified as having an adolescent form .,O O O O O O O O O O O O O O O O O,39
5060,9493,Nephropathy was detected in five of 32 patients with the Wiskott - Aldrich syndrome who were participating in a study of transfer factor ( TF ) therapy .,B O O O O O O O O O B I I I O O O O O O O O O O O O O O,13
813,1770,These results refine understanding of MEFV by placing the gene in the myelomonocytic - specific proinflammatory pathway and identifying it as an IFN - gamma immediate early gene . .,O O O O O O O O O O O O O O O O O O O O O O O O O O O O O O,32
9212,604,"The murine equivalent of CHS , beige mice , present similar characteristics but do not develop the lymphoproliferative syndrome .",O O O O B O O O O O O O O O O O O B I O,32
8966,883,"Our data show that a mutant DMPK 3 - UTR , with as few as 57 CTGs , had a negative cis effect on protein expression and resulted in the aggregation of reporter transcripts into discrete nuclear foci .",O O O O O O O O O O O O O O O O O O O O O O O O O O O O O O O O O O O O O O O,32
6949,5294,"Three other families have positive lod scores for linkage to BRCA2 , but 13 families without detected BRCA1 mutations have negative lod scores for both BRCA1 and BRCA2 .",O O O O O O O O O O O O O O O O O O O O O O O O O O O O O,32
2450,6483,"These results suggest that rhabdoid tumors , choroid plexus carcinomas and a subset of medulloblastomas and cPNETs share common pathways of oncogenesis related to hSNF5 / INI1 alteration and that hSNF5 / INI1 mutations define a genetically homogeneous family of highly aggressive cancers mainly occurring in young children and frequently , but not always , exhibiting a rhabdoid phenotype",O O O O B I O B I I O O O O B O O O O O O O O O O O O O O O O O O O O O O O O O O O B O O O O O O O O O O O O O O B O,13
5182,10817,The magnitude of the relative risk associated with a rare HRAS1 allele was not altered by adjusting for the other known risk factors for hereditary ovarian cancer ( 5 ) .,O O O O O O O O O O O O O O O O O O O O O O O O B I I O O O O,13
9124,112,CONCLUSIONS Lorenzos oil therapy had no effect on patients with evidence of inflammatory brain lesions .,O O O O O O O O O O O O B I I O,32
1251,6313,"Since the original report , we have diagnosed congenital hypothyroidism by newborn TSH screening in 9 additional children from the family .",O O O O O O O O B I O O O O O O O O O O O O,13
1706,8123,This is the first example of dystrophin deficiency caused by a splice - site mutation . .,O O O O O O B I O O O O O O O O O,13
8146,7755,We have determined that the human gene ( PDEB ) maps to 4p16 .,O O O O O O O O O O O O O O,13
7044,4666,"However , the D442G and Int14 A mutations were highly prevalent in subjects with HDL - C > or = 60 mg / dl , with combined allele frequencies of 9 % , 12 % , 21 % and 43 % for HDL - C 60 - 79 , 80 - 99 , 100 - 119 , and > or = 120 mg / dl , respectively .",O O O O O O O O O O O O O O O O O O O O O O O O O O O O O O O O O O O O O O O O O O O O O O O O O O O O O O O O O O O O O O O O O O O O,32
1905,5724,The enzymatic defect leads to the systemic accumulation of neutral glycosphingolipids with terminal alpha - galactosyl moieties .,O O O O O O O O O O O O O O O O O O,13
8679,522,These findings have diagnostic implications as well as pointing to functionally important regions of the emerin protein . .,O O O O O O O O O O O O O O O O O O O,32
5164,2974,A 29 - year - old woman with discoid lupus erythematosus had undetectable classic pathway complement activity .,O O O O O O O O B I I O O O O O O O,32
8785,10044,"This model will be important for studying liver pathophysiology , for developing therapy for Wilson disease and for studying the pathway of copper transport and its possible interaction with other heavy metals . .",O O O O O O O O O O O O O O B I O O O O O O O O O O O O O O O O O O,13
1392,8533,The red - green visual pigment gene region in adrenoleukodystrophy .,O O O O O O O O O B O,13
5675,2848,"The proband and her affected brother showed completely different apoB gene alleles , suggesting that the apoB gene itself is not related to this disorder in this family .",O O O O O O O O O O O O O O O O O O O O O O O O O O O O O,32
5342,7831,"Starting from the MCC gene , a strategy was undertaken to identify constitutional submicroscopic deletions in familial adenomatous polyposis patients that might considerably narrow down the position of the APC gene .",O O O O O O O O O O O O O O O O B I I O O O O O O O O O O B O O,13
2021,12235,Patient 2 was homozygous for a mutation in exon 2 ( C3804A ) which abolishes POMC translation .,O O O O O O O O O O O O O O O O O O,39
1572,11037,"To investigate the role of gene dosage in more detail , we have generated yeast artificial chromosome transgenic mice carrying the human PAX6 locus .",O O O O O O O O O O O O O O O O O O O O O O O O O,13
9202,1231,The gene for Alstrom syndrome ( ALMS1 ) has been previously localized to human chromosome 2p13 by homozygosity mapping in two distinct isolated populations - French Acadian and North African .,O O O B I O O O O O O O O O O O O O O O O O O O O O O O O O O,32
5590,1155,"Nineteen of the missense mutations resulted in a severe reduction of FALDH enzyme catalytic activity when expressed in mammalian cells , but one mutation ( 798G - - > C [ K266N ] ) seemed to have a greater effect on mRNA stability .",O O O O O O O O O O O O O O O O O O O O O O O O O O O O O O O O O O O O O O O O O O O O,32
10119,6092,"This heritable - deletion mouse model will be particularly useful for the identification of the etiological genes and mechanisms , phenotypic basis , and investigation of therapeutic approaches for PWS . .",O O O O O O O O O O O O O O O O O O O O O O O O O O O O O B O O,13
3045,4928,"Direct sequencing of the mutant cDNAs showed a G - - > A , 1342 substitution ( G448R ) in two patients and a 3 - bp deletion ( delta E452 or delta E453 ) in another .",O O O O O O O O O O O O O O O O O O O O O O O O O O O O O O O O O O O O O O,32
2561,2053,Several different missense mutations have been identified in patients with FHM .,O O O O O O O O O O B O,32
10099,10896,Founding BRCA1 mutations in hereditary breast and ovarian cancer in southern Sweden .,O O O O B I I I I O O O O,13
8421,7115,"Myotonic dystrophy ( DM ) is an autosomal dominant disorder characterized by skeletal muscle wasting , myotonia , cardiac arrhythmia , hyperinsulinaemia , mental retardation and ocular cataracts .",B I O B O O O B I I O O O B I O B O B I O B O B I O O B O,13
1378,6759,"In view of the current explosive increase in full genome sequencing projects , this tool will become rapidly available for numerous other genes . .",O O O O O O O O O O O O O O O O O O O O O O O O O,13
8112,2585,Each of these five mutations was strongly associated with only one of the more than 70 chromosomal haplotypes defined by eight RFLPs in or near the PAH gene .,O O O O O O O O O O O O O O O O O O O O O O O O O O O O O,32
4360,6621,The three novel AKU mutations are most likely specific for the Finnish population and have originated recently . .,O O O B O O O O O O O O O O O O O O O,13
3086,3565,"C3 levels in family members ( seven of 24 half - normal ) , lack of anti - C3 activity , normal C3b - INA levels and a normal rate of catabolism of transfused C3 indicated that the deficiency was inherited with autosomal codominance and involved decreased synthesis of C3 .",O O O O O O O O O O O O O O O O O O O O O O O O O O O O O O O O O O O O O O O O O O O O O O B I I I O,32
711,12222,"Insertional mutation by transposable element , L1 , in the DMD gene results in X - linked dilated cardiomyopathy .",O O O O O O O O O O B O O O B I I I I O,39
2709,2047,These rearrangements were initially revealed by analyzing cDNAs and could not have been identified by using mutation detection methods that screened each exon individually .,O O O O O O O O O O O O O O O O O O O O O O O O O,32
3298,1871,Homozygosity for poor metabolizer alleles was found to be associated with AS .,O O O O O O O O O O O B O,32
9314,11016,"55 ( P = . 02 ) ; after additional adjustment for HDL levels , the RR was 1 .",O O O O O O O O O O O O O O O O O O O O,13
6891,2125,The pedigree and clinical findings were compatible with autosomal recessive transmission of analbuminemia .,O O O O O O O O O O O O B O,32
3756,10933,Abnormal CAG expansions in the IT - 15 gene are associated with Huntington disease ( HD ) .,O O O O O O O O O O O O B I O B O O,13
6954,7,Human APC2 maps to chromosome 19p13 .,O O O O O O O,32
723,9088,These tumors provide additional evidence that the cloned sequences are representative of a gene that is a frequent target of inactivation during tumorigenesis .,O B O O O O O O O O O O O O O O O O O O O O O O,13
2117,12601,A lod score of 16 between HLA - B and Factor B allotypes was calculated at a maximum likelihood value of the recombinant fraction of 0 .,O O O O O O O O O O O O O O O O O O O O O O O O O O O,39
8543,2144,"However , a comparison of the data suggested that both missense and synonymous mutations can occur at any coding sequence of the human germ line HPRT gene , but that a limited percentage of all the missense mutations cause disease .",O O O O O O O O O O O O O O O O O O O O O O O O O O O O O O O O O O O O O O O O O,32
2413,9695,"Detection of eight BRCA1 mutations in 10 breast / ovarian cancer families , including 1 family with male breast cancer .",O O O O O O O B I I I O O O O O O B I I O,13
5826,5067,"For these practical considerations , traditional linkage analysis could prove of limited value in further refining the extrapolated physical position of HFE .",O O O O O O O O O O O O O O O O O O O O O O O,32
1219,3474,"The 5 end of the gene also appeared to be associated with a clustering of sites for several infrequently cleaving restriction enzymes , indicating the presence of an HpaII tiny fragment island .",O O O O O O O O O O O O O O O O O O O O O O O O O O O O O O O O O,32
49,12351,"Based on its chromosomal position , this gene is a candidate for conferring susceptibility to diabetes .",O O O O O O O O O O O O O O O B O,39
5543,8927,Male mice carrying the mutant alleles are viable and analysis of their cells shows a total lack of HPRT activity . .,O O O O O O O O O O O O O O O O O O O O O O,13
2556,6551,The molecular basis of Sjogren - Larsson syndrome : mutation analysis of the fatty aldehyde dehydrogenase gene .,O O O O B I I I O O O O O O O O O O,13
4224,1,"The adenomatous polyposis coli ( APC ) tumour - suppressor protein controls the Wnt signalling pathway by forming a complex with glycogen synthase kinase 3beta ( GSK - 3beta ) , axin / conductin and betacatenin .",O B I I I I I I O O O O O O O O O O O O O O O O O O O O O O O O O O O O O,32
4194,5231,"Direct sequencing revealed a cytosine to thymine transition at nucleotide 694 , resulting in the replacement of an arginine with a stop codon after the sixth amino acid of exon 3 .",O O O O O O O O O O O O O O O O O O O O O O O O O O O O O O O O,32
1662,1355,"From the alignment of the amino acid ( aa ) sequence of 52 glucose 6 - phosphate dehydrogenase ( G6PD ) species from 42 different organisms , we found a striking correlation between the aa replacements that cause G6PD deficiency in humans and the sequence conservation of G6PD two - thirds of such replacements are in highly and moderately conserved ( 50 - 99 % ) aa ; relatively few are in fully conserved aa ( where they might be lethal ) or in poorly conserved aa , where presumably they simply would not cause G6PD deficiency .",O O O O O O O O O O O O O O O O O O O O O O O O O O O O O O O O O O O O O O B I O O O O O O O O O O O O O O O O O O O O O O O O O O O O O O O O O O O O O O O O O O O O O O O O O O O O O O O B I O,32
5692,11155,"In order to elucidate the cellular and molecular processes which are involved in Norrie disease ( ND ) , we have used gene targeting technology to generate ND mutant mice .",O O O O O O O O O O O O O B I O B O O O O O O O O O O B O O O,13
7395,5639,"The classic form of ALD usually has onset in childhood ( childhood cerebral ALD ) , with rapid neurologic deterioration leading to a vegetative state .",O O O O B O O O O O O B I I O O O O B I O O O O O O,13
5035,9155,"The amino acid sequence that is predicted from this portion of the DMD gene indicates that the protein product might serve a structural role in muscle , but the abundance and tissue distribution of the messenger RNA suggests that the DMD protein is not nebulin . .",O O O O O O O O O O O O B O O O O O O O O O O O O O O O O O O O O O O O O O O O B O O O O O O,13
1468,4480,These studies suggest that BRCA1 may normally serve as a negative regulator of mammary epithelial cell growth whose function is compromised in breast cancer either by direct mutation or alterations in gene expression . .,O O O O O O O O O O O O O O O O O O O O O O B I O O O O O O O O O O O,32
7228,2440,"Consequently , familial studies in patients affected by this syndrome are recommended . .",O O O O O O O O O O O O O O,32
8593,11172,"In most people with red - blood - cell glucose - 6 - phosphate dehydrogenase ( G6PD ) deficiency , the enzyme - deficient phenotype is only moderately expressed in nucleated cells .",O O O O O O O O O B I I I I I I I I I O O O O O O O O O O O O O O,13
9096,6774,"In this group of relatives , a low free protein S level was the most reliable predictor of a PROS1 gene defect ( sensitivity 97 . 7 % , specificity 100 % ) .",O O O O O O O O O O O O O O O O O O O B I I O O O O O O O O O O O O,13
5874,8633,"This is in agreement with recent findings by Baumbach et al . and Koenig et al . but is in contrast to findings , by Malhotra et al . at the 5 ' end of the gene .",O O O O O O O O O O O O O O O O O O O O O O O O O O O O O O O O O O O O O O,13
9775,4981,PURPOSE .,O O,32
5942,4585,CAG expansions in a novel gene for Machado - Joseph disease at chromosome 14q32 . 1 .,O O O O O O O B I I I O O O O O O,32
8301,339,The severity of the disease correlates with the position of the inherited APC mutation ( genotype - phenotype correlation ) .,O O O O O O O O O O O O B O O O O O O O O,32
7271,2268,"We assembled the YAC clones into overlapping sets by hybridizing them to a large number of DNA probes from the HD region , including the STSs .",O O O O O O O O O O O O O O O O O O O O B O O O O O O,32
4184,9631,Evidence was found for somatic and gonadal mosaicism for alleles carrying expanded trinucleotide repeats .,O O O O O O O O O O O O O O O,13
9814,9084,The mutant allele can be carried in the germ line .,O O O O O O O O O O O,13
8096,4664,Two other mutations were identified by DNA sequencing or primer - mediated restriction map modification of PCR products a novel intron 14 splice donor site mutation caused by a T insertion at position + 3 from the exon14 / intron14 boundary ( Int14 T ) and a missense mutation ( Asp442 to Gly ) within exon 15 ( D442G ) .,O O O O O O O O O O O O O O O O O O O O O O O O O O O O O O O O O O O O O O O O O O O O O O O O O O O O O O O O O O O O O,32
1980,9927,The breast - ovary cancer - family syndrome is a dominant predisposition to cancer of the breast and ovaries which has been mapped to chromosome region 17q12 - q21 .,O B I I I I I I O O O O O B I I I I I O O O O O O O O O O O,13
5166,5808,"Of 16 oral mucosal lesions studied histologically , 15 represented fibroepithelial or epithelial hyperplasias and were reactive in nature .",O O B I I O O O O O B I I I O O O O O O,13
3442,8891,Segregation analysis of a marker localised Xp21 . 2 - Xp21 . 3 in Duchenne and Becker muscular dystrophy families .,O O O O O O O O O O O O O O B I I I I O O,13
7480,11135,"Thus , we screened 16 endometrial carcinomas with microsatellite instability for alterations in FEN1 ( the human homolog of RTH ) and in MSH3 ( refs 12 - 14 ) .",O O O O O B I O O O O O O O O O O O O O O O O O O O O O O O O,13
3831,8803,An amino - acid substitution involved in phenylketonuria is in linkage disequilibrium with DNA haplotype 2 .,O O O O O O O B O O O O O O O O O,13
1666,12198,The 4612del165 mutations in three different families were all ascribed to the same T - - > A substitution at the splice donor site in intron 33 .,O O O O O O O O O O O O O O O O O O O O O O O O O O O O,39
3917,58,"A large phenotypic variability has been observed , with convulsive disorders , motor retardation and mental retardation being the most abundant manifestations .",O O O O O O O O O B I O B I O B I O O O O O O,32
3608,10085,"The combination of CDCA and pravastatin was a good treatment for CTX , based on the improvement of serum lipoprotein metabolism , the suppression of cholesterol synthesis , and reductions of cholestanol and plant sterol levels .",O O O O O O O O O O O B O O O O O O O O O O O O O O O O O O O O O O O O O,13
384,3302,We previously reported a recombination in an individual with myotonic dystrophy ( DM ) which placed the markers D19S19 and APOC2 on the same side of the DM locus .,O O O O O O O O O B I O B O O O O O O O O O O O O O O B O O,32
8520,3725,Phenotype heterogeneity among hemizygotes in a family biochemically screened for adrenoleukodystrophy .,O O O O O O O O O O B O,32
3212,12162,Genotype - phenotype correlations in attenuated adenomatous polyposis coli .,O O O O O B I I I O,39
