Unnamed: 0.1,Unnamed: 0,text,labels,txt_len
3035,10975,"Using a specific radioimmunoassay , we determined colchicine concentrations in the serum and breast milk of 4 patients at various time points , following oral administration of the drug .",O O O O O O O O O O O O O O O O O O O O O O O O O O O O O O,13
630,1603,FMR1 YAC transgenic mice overexpressing the human protein did produce opposing behavioral responses and additional abnormal behaviors were also observed .,O O O O O O O O O O O O O O O O O O O O O,32
9245,8729,Tight linkage was also demonstrated for CKMM and the gene for apolipoprotein C2 ( ApoC2 ) .,O O O O O O O O O O O O O O O O O,13
8729,6841,"Therefore , the accumulation of the types of mutations in Japanese patients with WD will facilitate the fast and effective genetic diagnosis of WD in Japanese patients . .",O O O O O O O O O O O O O B O O O O O O O O O B O O O O O,13
2614,12562,These mutations resulted in the absence or a dramatic decrease of CPO activity .,O O O O O O O O O O O O O O,39
916,7820,Previous authors have used the RNase protection assay and the single - strand conformation polymorphisms procedure to screen for mutations .,O O O O O O O O O O O O O O O O O O O O O,13
1053,3653,In 16 families with myotonic dystrophy ( DM ) a novel approach based on use of allele - specific oligonucleotides has been employed to study the linkage relationship between the apolipoprotein E ( APOE ) gene and DM .,O O O O B I O B O O O O O O O O O O O O O O O O O O O O O O O O O O O O O B O,32
2670,10480,"Overall , the establishment of a likely "" hemochromatosis critical region "" centromeric boundary and the identification of a linkage - disequilibrium zone both significantly contribute to a reduction in the amount of DNA required to be searched for novel coding sequences constituting the HFE defect",O O O O O O O O B O O O O O O O O O O O O O O O O O O O O O O O O O O O O O O O O O O O B I,13
2635,9132,The recent discovery of sequences at the site of the Duchenne muscular dystrophy ( DMD ) gene in humans has opened up the possibility of a detailed molecular analysis of the genes in humans and in related mammalian species .,O O O O O O O O O O B I I O B O O O O O O O O O O O O O O O O O O O O O O O O O,13
7437,7670,"In addition , we isolated the ends of the human DNA inserts of most of the YAC clones to assist in the construction of the contig .",O O O O O O O O O O O O O O O O O O O O O O O O O O O,13
7635,5992,"VHL mutations were found only in the nonpapillary renal cell carcinoma ( RCC ) subtype , as previously reported .",B O O O O O O B I I I O B O O O O O O O,13
7450,5981,N314D is in linkage disequilibrium with other base changes that differ on the D1 and D2 alleles .,O O O O O O O O O O O O O O O O O O,13
3652,1233,84 and 2 .,O O O O,32
4374,874,Individuals with normal ERGs have mutations predominantly located 5 of the transcript initiation site of Dp260 .,O O O O O O O O O O O O O O O O O,32
4192,7482,"In one case , previously described , the enzyme was of the A - type .",O O O O O O O O O O O O O O O O,13
598,5364,Atelosteogenesis type II is caused by mutations in the diastrophic dysplasia sulfate - transporter gene ( DTDST ) : evidence for a phenotypic series involving three chondrodysplasias .,B I I O O O O O O B I O O O O O O O O O O O O O O O B O,32
2683,9653,"In contrast , dominant myotonias sensitive to potassium are caused by point mutations in SCN4A on chromosome 17q , the gene for the alpha subunit of the adult skeletal muscle sodium channel .",O O O B I O O O O O O O O O O O O O O O O O O O O O O O O O O O O,13
5132,1922,"A common recurrent mutation , at the donor splice site of FGA intron 4 ( IVS4 + 1 G > T ) , accounted for 14 of the 26 ( 54 % ) alleles .",O O O O O O O O O O O O O O O O O O O O O O O O O O O O O O O O O O O,32
6720,1560,"Chromosomal translocations in human lipomas frequently create fusion transcripts encoding high mobility group ( HMG ) I - C DNA - binding domains and C - terminal sequences from different presumed transcription factors , suggesting a potential role for HMG I - C in the development of lipomas .",O O O O B O O O O O O O O O O O O O O O O O O O O O O O O O O O O O O O O O O O O O O O O O O B O,32
7118,11108,"We show that the less severe phenotype in these patients is caused by some degree of normal splicing , which occurs as an alternative product from the insertion - containing allele .",O O O O O O O O O O O O O O O O O O O O O O O O O O O O O O O O,13
5744,11265,Initial evaluation of the ATM knockout animals indicates that inactivation of the mouse ATM gene recreates much of the phenotype of ataxia - telangiectasia .,O O O O O O O O O O O O O O O O O O O O O B I I O,13
514,2131,Deletion of the KIT and PDGFRA genes in a patient with piebaldism .,O O O O O O O O O O O B O,32
306,5561,"R . , and Wolff , R .",O O O O O O O O,13
1117,9166,"Heterozygous C2 deficiency associated with angioedema , myasthenia gravis , and systemic lupus erythematosus .",B I I O O B O B I O O B I I O,13
3711,9141,"The mouse mdx mutation affects muscle and confers a mild dystrophic syndrome , but it is not clear whether this mutation is equivalent to Duchenne / Becker muscular dystrophy in man .",O O O O O O O O O O B I O O O O O O O O O O O O B I I I I O O O,13
9879,8043,"Gd - frequency , calculated from the data obtained ( 7 . 7 % ) , may be compared to neighbouring regions frequencies ( 6 - 30 % ) .",O O O O O O O O O O O O O O O O O O O O O O O O O O O O O O,13
1544,7491,Skin fibroblasts of affected individuals showed several orders of magnitude more chromosome breakage than lymphocytes .,O O O O O O O O O O O O O O O O,13
7938,4451,Antibodies to PTS1R inhibit peroxisomal protein - import of PTS1 - containing proteins in a permeabilized CHO cell system .,O O O O O O O O O O O O O O O O O O O O,32
803,10341,This represents the first identification of close FRDA flanking markers on the centromeric side .,O O O O O O O B O O O O O O O,13
1854,2077,Glucose - 6 - phosphate dehydrogenase variants from Italian subjects associated with severe neonatal jaundice .,O O O O O O O O O O O O B I I O,32
3719,10726,A high incidence of BRCA1 mutations in 20 breast - ovarian cancer families .,O O O O O O O O B I I I O O,13
4029,7413,BRCA1 is associated with a human SWI / SNF - related complex : linking chromatin remodeling to breast cancer .,O O O O O O O O O O O O O O O O O B I O,13
2571,3121,"D2 / oSnJ , and four C5 - sufficient strains , Balb / CJ , C57Bl / 6J , DBA / 1J , and B10 .",O O O O O O O O O O O O O O O O O O O O O O O O O O,32
5259,3185,We compared the enzyme - based test widely used in screening for Tay - Sachs disease with a test based on analysis of DNA .,O O O O O O O O O O O O B I I I O O O O O O O O O,32
4344,8275,We have sequenced the portions of the introns flanking each of the 14 HEXA exons in order to specify oligonucleotide primers for the PCR - dependent amplification of each exon and splice - junction sequence .,O O O O O O O O O O O O O O O O O O O O O O O O O O O O O O O O O O O O,13
1514,11186,This suggests that any greater amount of segregation distortion at the myotonic dystrophy locus must result from events following sperm ejaculation .,O O O O O O O O O O O B I O O O O O O O O O,13
1803,12613,"In contrast , lamin B1 was absent from cardiomyocyte nuclei , showing that lamin B1 is not essential for localization of emerin to the nuclear lamina .",O O O O O O O O O O O O O O O O O O O O O O O O O O O,39
2835,1202,Papillon - Lefevre syndrome ( PLS ) is an autosomal recessive disorder characterised by palmoplantar hyperkeratosis and severe early onset periodontitis that results in the premature loss of the primary and secondary dentitions .,B I I I O B O O O B I I O O B I O O O O B O O O O O O O O O O O O O,32
6871,11875,"Mutations in the SMAD4 / DPC4 tumor suppressor gene , a key signal transducer in most TGFbeta - related pathways , are involved in 50 % of pancreatic cancers .",O O O O O O B O O O O O O O O O O O O O O O O O O O O B I O,39
8817,7635,"Together with a recently identified allele responsible for Hex A pseudodeficiency ( Triggs - Raine et al . Am J Hum Genet , 1992 ) , these two alleles accounted for almost 50 % ( 29 / 64 ) of TSD or carrier alleles ascertained by enzyme screening tests in non - Jewish Caucasians . .",O O O O O O O O O O O O O O O O O O O O O O O O O O O O O O O O O O O O O O O O B O O O O O O O O O O O O O O O,13
1098,7316,These studies demonstrate for the first time that a complex ultrastructural cell defect can be corrected both morphologically and functionally by in vivo gene transfer . .,O O O O O O O O O O O O O O O O O O O O O O O O O O O,13
5624,10477,"7 locus , both of which are comprised by the major ancestral or founder HFE haplotype in Brittany , supports the possibility that the disease gene may reside immediately telomeric to the 6 .",O O O O O O O O O O O O O O O O O O O O O O O O O O O O O O O O O O,13
2780,4038,( 3 ) Favism has been observed associated with all kinds of variants described here .,O O O B O O O O O O O O O O O O,32
6889,365,These alterations predict the replacement of a proline residue at position 183 with either a histidine or a threonine .,O O O O O O O O O O O O O O O O O O O O,32
2388,6109,Progeny of the homozygous mutant females demonstrated neurological abnormalities and growth retardation characteristic of copper deficiency .,O O O O O O O B I O B I O O B I O,13
2344,2919,Aspartylglucosaminuria ( AGU ) is caused by deficient activity of the enzyme aspartylglucosaminidase ( AGA ) .,B O B O O O O O O O O O O O O O O,32
1634,8508,"In addition , we have found several examples of two other known polymorphic variants ( G6PD Cagliari and G6PD A - ) ; three new polymorphic variants , G6PD Metaponto ( class III ) , G6PD Montalbano ( class III ) , and G6PD Pisticci ( class IV ) ; and two sporadic variants , G6PD Tursi ( class III ) and G6PD Ferrandina ( class II ) .",O O O O O O O O O O O O O O O O O O O O O O O O O O O O O O O O O O O O O O O O O O O O O O O O O O O O O O O O O O O O O O O O O O O O O,13
1385,5622,7 % in Denmark .,O O O O O,13
7187,3132,The red - green visual pigment gene region in adrenoleukodystrophy .,O O O O O O O O O B O,32
9294,6426,"We screened 31 new unrelated patients and families for XLRS1 mutations in addition to previously reported mutations for 60 of our families ( Retinoschisis Consortium , Hum Mol Genet 1998 ; 7 1185 - 1192 ) .",O O O O O O O O O O O O O O O O O O O O O O O B O O O O O O O O O O O O O,13
6611,12156,"The present study used PCR and restriction - enzyme digestion to analyze the frequency of the 845 G - - > A and 187 C - - > G mutations in HLA - typed samples from non - Caucasian populations , comprising Australian Aboriginal , Chinese , and Pacific Islanders .",O O O O O O O O O O O O O O O O O O O O O O O O O O O O O O O O O O O O O O O O O O O O O O O O O O O,39
5788,2628,This results in a Leu - to - Pro change in a carrier mother and in her two affected sons .,O O O O O O O O O O O O O O O O O O O O O,32
3830,3987,The Tay - Sachs disease gene in North American Jewish populations : geographic variations and origin .,O B I I I O O O O O O O O O O O O,32
2730,2979,"A missense mutation has been identified in the human phenylalanine hydroxylase [ PAH ; phenylalanine 4 - monooxygenase ; L - phenylalanine , tetrahydrobiopterin oxygen oxidoreductase ( 4 - hydroxylating ) , EC 1 . 14 . 16 . 1 ] gene in a Chinese patient with classic phenylketonuria ( PKU ) .",O O O O O O O O O O O O O O O O O O O O O O O O O O O O O O O O O O O O O O O O O O O O O O O O B O B O O,32
7494,9515,Four new G6PD variants have been characterized in individuals from Papua New Guinea .,O O O O O O O O O O O O O O,13
798,4045,5 % of normal .,O O O O O,32
6714,5441,Complete absence of C7 was also found in one sibling who had the clinical syndrome of meningococcal meningitis and arthritis as a child and in this siblings clinically well eight - year - old son .,B I I I O O O O O O O O O O O O B I O B O O O O O O O O O O O O O O O O,13
9107,781,Reduced levels of a normal - size WASP with a missense mutation were seen in two individuals with XLT .,O O O O O O O O O O O O O O O O O O B O,32
459,6714,Atm and Bax cooperate in ionizing radiation - induced apoptosis in the central nervous system .,O O O O O O O O O O O O O O O O,13
9578,2709,The third mutation ( 1376 G - - - - T ) was found in four affected Chinese .,O O O O O O O O O O O O O O O O O O O,32
3322,1686,The transcription initiation site has been assigned to a residue 163 bp upstream from the translation initiation triplet by primer extension analysis .,O O O O O O O O O O O O O O O O O O O O O O O,32
6511,5973,Q188R is the most common mutation in European populations or in those predominantly of European descent .,O O O O O O O O O O O O O O O O O,13
3805,5709,These data uncover an essential role of BRCA1 in maintaining genetic stability through the regulation of centrosome duplication and the G2 - M checkpoint and provide a molecular basis for the role of BRCA1 in tumorigenesis . .,O O O O O O O O O O O O O O O O O O O O O O O O O O O O O O O O O O O O O O,13
3823,10913,A previously undescribed mutation within the tetramerisation domain of TP53 in a family with Li - Fraumeni syndrome .,O O O O O O O O O O O O O O B I I I O,13
7122,11472,The molecular mechanisms of triplet instability remain elusive .,O O O O O O O O O,13
7068,3864,These three variants had a mild to moderate G6PD deficiency and were not associated with any clinical signs .,O O O O O O O O B I O O O O O O O O O,32
6148,2513,"Restriction mapping and sequencing of clones that span both translocation breakpoints as well as the corresponding normal regions indicate the loss of approximately 5 kb in the formation of the derivative X chromosome , with 4 - 6 bp deleted from chromosome 4 .",O O O O O O O O O O O O O O O O O O O O O O O O O O O O O O O O O O O O O O O O O O O O,32
7275,1549,Molecular analysis of the genotype - phenotype relationship in factor X deficiency .,O O O O O O O O O B I I O,32
6975,2902,"Thus , this is a rare example of homozygous hypobetalipoproteinemia .",O O O O O O O O B I O,32
2469,9903,The transition from the mild to the adult type was associated with transmission through a male parent .,O O O O O O O O O O O O O O O O O O,13
8139,9908,This is the only subject who may transmit the gene to the sixth generation .,O O O O O O O O O O O O O O O,13
70,307,"Mutant fibroblasts contain multiple , functional centrosomes , which lead to unequal chromosome segregation , abnormal nuclear division , and aneuploidy .",O O O O O O O O O O O O O O O O O O O O B O,32
5068,8389,Glucose / galactose malabsorption caused by a defect in the Na + / glucose cotransporter .,B I I I O O O O O O O O O O O O,13
8974,3913,2 % of the male population living in the urban area of Algiers .,O O O O O O O O O O O O O O,32
3883,6121,Likelihood - based analysis of segregation distortion in the single sperm data using the SPERMSEG program also showed no support for segregation distortion at the gamete level in this patient population .,O O O O O O O O O O O O O O O O O O O O O O O O O O O O O O O O,13
4316,11788,""" BRCA1 associates in vivo with a structurally related protein termed BARD1 .",O O O O O O O O O O O O O,39
5198,1267,3 in a large Northern Irish family .,O O O O O O O O,32
9893,996,We report on a boy with a maternal uniparental disomy for chromosome 14 ( UPD ( 14 ) ) .,O O O O O O O B I I I I I O B O O O O O,32
6703,2753,Wilms tumors from three individuals and one juvenile granulosa cell tumor demonstrate reduction to homozygosity for the mutated WT1 allele .,B I O O O O O O O O B O O O O O O O O O O,32
1217,2383,It lacks the entire large domain of spectrin - like repeats and the actin - binding N - terminal domain of dystrophin .,O O O O O O O O O O O O O O O O O O O O O O O,32
8987,1303,OBJECTIVE To analyze Japanese patients clinically diagnosed as having XLRS formutational changes in the XLRS1 gene .,O O O O O O O O O B O O O O O O O,32
5505,6871,Transcription of rsca3 was detected in most rat tissues including brain .,O O O O O O O O O O O O,13
5023,11145,"1 of rat chromosome 8 , and qa4 - qa5 of Syrian hamster chromosome 12 .",O O O O O O O O O O O O O O O O,13
314,6537,"Exon 9 mutations in the WT1 gene , without influencing KTS splice isoforms , are also responsible for Frasier syndrome .",O O O O O O O O O O O O O O O O O O B I O,13
3844,8021,"Pelizaeus - Merzbacher disease : detection of mutations Thr181 - - - - Pro and Leu223 - - - - Pro in the proteolipid protein gene , and prenatal diagnosis .",B I I I O O O O O O O O O O O O O O O O O O O O O O O O O O O,13
4971,1449,Mutations in the BRCA1 ( ref . 1 ) tumour suppressor gene are found in almost all of the families with inherited breast and ovarian cancers and about half of the families with only breast cancer .,O O O O O O O O O B O O O O O O O O O O O B I I I I O O O O O O O O B I O,32
1273,12157,"Results showed that the 845 G - - > A mutation was present in these populations ( allele frequency 0 . 32 % ) , and , furthermore , it was always seen in conjunction with HLA haplotypes common in Caucasians , suggesting that 845 G - - > A may have been introduced into these populations by Caucasian admixture .",O O O O O O O O O O O O O O O O O O O O O O O O O O O O O O O O O O O O O O O O O O O O O O O O O O O O O O O O O O O O O,39
3477,11917,"These rapid assays detected mutations in 76 % of Costa Rican patients ( 3 ) , 50 % of Norwegian patients ( 1 ) , 25 % of Polish patients ( 4 ) , and 14 % of Italian patients ( 1 ) , as well as in patients of Amish / Mennonite and Irish English backgrounds .",O O O O O O O O O O O O O O O O O O O O O O O O O O O O O O O O O O O O O O O O O O O O O O O O O O O O O O O O O O,39
5120,3169,Glucose 6 - phosphate dehydrogenase variants : Gd ( + ) Alexandra associated with neonatal jaundice and Gd ( - ) Camperdown in a young man with lamellar cataracts .,O O O O O O O O O O O O O O B I O O O O O O O O O O O B I O,32
6982,5500,"By using Northern blot analyses , we quantitated duodenal expression of both classes of DMT1 transcripts one containing an iron responsive element ( IRE ) , called DMT1 ( IRE ) , and one containing no IRE , called DMT1 ( non - IRE ) .",O O O O O O O O O O O O O O O O O O O O O O O O O O O O O O O O O O O O O O O O O O O O O O,13
1521,8830,"The Lowe oculocerebrorenal syndrome ( OCRL ) is characterized by congenital cataract , mental retardation , and defective renal tubular function .",O B I I O B O O O O O B O B I O O B I I I O,13
5527,2542,We have used single - strand conformation polymorphism analysis and PCR sequencing to study two such families .,O O O O O O O O O O O O O O O O O O,32
1576,7618,"A high frequency of individuals who appeared to be TSD heterozygotes was detected ( Kelly et al . , 1975 ) .",O O O O O O O O O B O O O O O O O O O O O O,13
8476,9072,"Recombinant virus was detected in the culture medium of the transfected psi 2 cells , which is capable of transmitting the human PAH gene into mouse NIH 3T3 cells by infection leading to stable incorporation of the recombinant provirus .",O O O O O O O O O O O O O O O O O O O O O O O O O O O O O O O O O O O O O O O O,13
9655,9190,Heterogeneity of type I von Willebrand disease : evidence for a subgroup with an abnormal von Willebrand factor .,O O B I I I I O O O O O O O O B I O O,13
1139,8430,"It showed , furthermore , that phenotypic differences between ALD and AMN are not necessarily the consequence of allelic heterogeneity due to different mutations within the same gene .",O O O O O O O O O B O B O O O O O O O O O O O O O O O O O,13
7115,1574,"Fragile X syndrome , a common form of inherited mental retardation , is mainly caused by massive expansion of CGG triplet repeats located in the 5 - untranslated region of the fragile X mental retardation - 1 ( FMR1 ) gene .",B I I O O O O O B I I O O O O O O O O O O O O O O O O O O O O B I I I O O O O O O O,32
2113,7382,Genetic inactivation of the yeast frataxin homologue ( Yfh1p ) results in mitochondrial iron accumulation and hypersensitivity to oxidative stress .,O O O O O O O O O O O O B I I O B I I I O,13
6280,587,"To investigate the nature of somatic von Hippel - Lindau ( VHL ) mutations , we analyzed 173 primary sporadic human renal cell carcinomas for mutations of the VHL tumor suppressor gene , using polymerase chain reaction ( PCR ) and single - strand conformational polymorphism analysis ( SSCP ) of DNA .",O O O O O O B I I I O B O O O O O O O O O B I I O O O O B I O O O O O O O O O O O O O O O O O O O O O O O,32
10029,4654,The murine homologues of the Huntington disease gene ( Hdh ) and the alpha - adducin gene ( Add1 ) map to mouse chromosome 5 within a region of conserved synteny with human chromosome 4p16 . 3 .,O O O O O B I O O O O O O O O O O O O O O O O O O O O O O O O O O O O O O O,32
3397,172,"Therefore , HFE appears to reduce cellular acquisition of iron from Tf within endocytic compartments .",O O O O O O O O O O O O O O O O,32
5781,12181,We propose that WT1 and Dax - 1 functionally oppose each other in testis development by modulating SF - 1 - mediated transactivation . .,O O O O O O O O O O O O O O O O O O O O O O O O O,39
5515,3582,Alloantibodies developed only in the kindred with homozygous deletions .,O O O O O O O O O O,32
8478,2923,The heterozygous family members were identified by reduced activity of AGA in lymphocytes .,O O O O O O O O O O O O O O,32
1540,3573,Homozygous and heterozygous deletions of the von Willebrand factor gene in patients and carriers of severe von Willebrand disease .,O O O O O O B I O O O O O O O B I I I O,32
4178,6114,"On the basis of a sperm typing study performed in patients of Japanese descent with Machado - Joseph disease ( MJD ) , it was reported that disease alleles are preferentially transmitted during meiosis .",O O O O O O O O O O O O O O O B I I I O B O O O O O O O O O O O O O O,13
9139,495,No inherited form of GPI - anchor deficiency has been described .,O O O O B I I I O O O O,32
9877,7816,"We compared G6PD activity among different mutations , without discovering significant differences between them .",O O O O O O O O O O O O O O O,13
8875,4721,"We have found that a point mutation ( His139Tyr ) in exon 3B of an affected male produces a mutant PLP but a normal DM20 , and segregates with the disease ( Zmax = 6 . 63 , theta = 0 . 00 ) .",O O O O O O O O O O O O O O O O O O O O O O O O O O O O O O O O O O O O O O O O O O O O O,32
4144,3650,"The mutations observed show a striking predominance of C - - - - T transitions , with CG doublets involved in four of seven cases .",O O O O O O O O O O O O O O O O O O O O O O O O O O,32
2960,6696,About 98 % of mutant alleles have an expansion of a GAA trinucleotide repeat in intron 1 of the gene .,O O O O O O O O O O O O O O O O O O O O O,13
5616,10977,Colchicine was found to be excreted in breast milk .,O O O O O O O O O O,13
3034,11770,Other observations indicate that the C5D state is compatible with normal coagulation function and the capacity to mount a neutrophilic leukocytosis during pyogenic infection . .,O O O O O B O O O O O O O O O O O O O O O O B I O O,39
4617,10016,"We have identified the source of the genetic instability in one ovarian tumor as a point mutation ( R524P ) in the human mismatch - repair gene MSH2 ( Salmonella MutS homologue ) , which has recently been shown to be involved in hereditary nonpolyposis colorectal cancer .",O O O O O O O O O O O B I O O O O O O O O O O O O O O O O O O O O O O O O O O O O O O B I I I O,13
3448,12275,"Furthermore , our findings are best interpreted as true gamete complementation resulting in maternal UPD 15 and PWS",O O O O O O O O O O O O O B I I O B,39
347,8414,The gene was sublocalized to region 12q22 - - - - q24 .,O O O O O O O O O O O O O,13
1002,11432,"However , a single mutation was observed in 32 / 33 defective ATM alleles in Jewish A - T families of North African origin , coming from various regions of Morocco and Tunisia .",O O O O O O O O O O O O O O O O B I I O O O O O O O O O O O O O O O,13
9615,3607,"Dmd mRNA is also present , but at much lower than normal levels , in both the muscle and brain of three different strains of dystrophic mdx mice .",O O O O O O O O O O O O O O O O O O O O O O O O O B O O O,32
8353,390,We identified the alpha - cardiac actin gene ( ACTC ) as a novel disease gene in a pedigree suffering from familial hypertrophic cardiomyopathy ( FHC ) .,O O O O O O O O O O O O O O O O O O O O O B I I O B O O,32
296,2174,"Since continuing advances in molecular methodologies have dramatically accelerated the rate in which new mutations are being identified and characterized , this register of mutations will be updated periodically . .",O O O O O O O O O O O O O O O O O O O O O O O O O O O O O O O,32
6958,4098,The results suggest that renal failure occurs in the Wiskott - Aldrich syndrome more frequently than generally recognized and that administration of TF may precipitate or accelerate the renal disease in patients with this syndrome . .,O O O O B I O O O B I I I O O O O O O O O O O O O O O O B I O O O O O O O,32
7840,8676,The combined maximum lod score was 87 .,O O O O O O O O,13
3919,563,We used heteroduplex analysis to identify sequence anomalies in five individuals with Kniest dysplasia .,O O O O O O O O O O O O B I O,32
6709,2356,Analysis of the comparative map for mice and humans shows that the mouse homologue of the HD gene will reside on chromosome 5 .,O O O O O O O O O O O O O O O O B O O O O O O O,32
6865,7065,"Patient 1 was homozygous for a complex mutant allele containing two alterations , including a 194C > T transition ( P65L ) and 739A > C transversion ( K247Q ) ; in the case of P65L , the amino acid change does not reduce enzyme activity .",O O O O O O O O O O O O O O O O O O O O O O O O O O O O O O O O O O O O O O O O O O O O O O O,13
