Unnamed: 0.1,Unnamed: 0,text,labels,txt_len
7679,2234,"Together with a recently identified allele responsible for Hex A pseudodeficiency ( Triggs - Raine et al . Am J Hum Genet , 1992 ) , these two alleles accounted for almost 50 % ( 29 / 64 ) of TSD or carrier alleles ascertained by enzyme screening tests in non - Jewish Caucasians . .",O O O O O O O O O O O O O O O O O O O O O O O O O O O O O O O O O O O O O O O O B O O O O O O O O O O O O O O O,32
2925,5395,Growth retardation and tumour inhibition by BRCA1 .,B I O B O O O O,32
3,7552,"The distinction between the two fragile sites is important clinically since cytogenetic detection of FRAXE , without molecular analysis , could result in misdiagnosis of fragile X syndrome . .",O O O O O O O O O O O O O O O O O O O O O O O O O B I I O O,13
4276,12042,Families were included without regard to the occurrence of ovarian or other cancers .,O O O O O O O O O B I I I O,39
4923,4156,"C7 M / N protein polymorphism allotyping , used to investigate the segregation of the C7 deficiency genes , showed that the apparently complement sufficient brother was heterozygous C7 deficient and a carrier of one of the deficiency genes .",O O O O O O O O O O O O O O O B I O O O O O O O O O O O B I O O O O O O O O O O,32
5585,2002,"Interestingly , Arg - 610 is located within one of the two pleckstrin homology ( PH ) domains of the FGD1 gene and it corresponds to a highly conserved residue which has been involved in InsP binding in PH domains of other proteins .",O O O O O O O O O O O O O O O O O O O O O O O O O O O O O O O O O O O O O O O O O O O O,32
5107,9777,We used an intake cut - off of at least three first - degree relatives with breast and / or ovarian cancer at any age .,O O O O O O O O O O O O O O O O B I I I I I O O O O,13
2414,6789,Identification of novel imprinted transcripts in the Prader - Willi syndrome and Angelman syndrome deletion region : further evidence for regional imprinting control .,O O O O O O O B I I I O B I O O O O O O O O O O,13
9210,6402,"After birth he showed hypotonia with poor sucking , for which gavage feeding was needed .",O O O O B O O O O O O O O O O O,13
8697,7083,"Mutations in the glycine decarboxylase gene ( GLDC ) cause nonketotic hyperglycinemia ( NKH ) , an in - born error of metabolism characterized by severe neurological disturbance .",O O O O O O O O O O B I O B O O O B I I I I I O O O B I O,13
100,7105,"Our studies demonstrate that the PWS IC element is not only required for the establishment of the paternal imprint , but also for its postzygotic maintenance . .",O O O O O B O O O O O O O O O O O O O O O O O O O O O O,13
8524,4619,BRCA1 mutations in primary breast and ovarian carcinomas .,O O O O B I I I O,32
7411,11895,"In order to further characterize the dynamics of DM CTG repeat somatic instability , we have studied repeat length changes over time in 111 myotonic dystrophy patients with varying clinical severity and CTG repeat size over time intervals of 1 - 7 years .",O O O O O O O O B O O O O O O O O O O O O O O O B I O O O O O O O O O O O O O O O O O O,39
9163,1389,"Deletions and other abnormalities of human chromosome 15q11 - q13 are associated with two developmental disorders , Prader - Willi syndrome ( PWS ) and Angelman syndrome ( AS ) .",O O O O O O O O O O O O O O O O O B I I I O B O O B I O B O O,32
5244,1838,Age of the intronic GAA triplet repeat expansion mutation in Friedreich ataxia .,O O O O O O O O O O B I O,32
5953,4540,"In this report , the isolation and sequencing of full - length cDNA clones encoding human ketohexokinase are described .",O O O O O O O O O O O O O O O O O O O O,32
3878,10631,A somatic VHL gene mutation was detected in one of the two tumors by polymerase chain reaction followed by single - strand conformation polymorphism analysis .,O O B O O O O O O O O O B O O O O O O O O O O O O O,13
6786,7765,An initial inguinal lymph node biopsy surprisingly revealed Kaposi sarcoma .,O O O O O O O O B I O,13
2729,2689,57 at theta = 0 .,O O O O O O,32
8474,2797,"Rearrangement is thought to deregulate a nearby protooncogene , but transcribed sequences in the immediate vicinity of BCL1 breakpoints had not been identified .",O O O O O O O O O O O O O O O O O O O O O O O O,32
2733,4650,"To facilitate the detection of mutations in ALD patients , we have determined the intronic sequences flanking the exons as well as the sequence of the 3 untranslated region and of the immediate 5 promoter region .",O O O O O O O B O O O O O O O O O O O O O O O O O O O O O O O O O O O O O,32
6773,7746,"As expected , the molecular analyses indicate loss of one allele at the MCC and APC loci .",O O O O O O O O O O O O O O O B O O,13
6754,2274,2 Mb .,O O O,32
7445,11996,The UBE3A gene encodes the E6 - AP ubiquitin - protein ligase and has recently been shown to be mutated in Angelman syndrome patients who lack 15q11 - q13 deletions or chromosome 15 paternal uniparental disomy .,O O O O O O O O O O O O O O O O O O O O O B I O O O O O O O O O O O B I O,39
4248,11003,"Mutant embryos are poorly developed , with no evidence of mesoderm formation .",O O O O O O O O O O O O O,13
5086,1035,"During GH treatment , resting ventilation increased by 26 % , P ( 0 . 1 ) by 72 % and the response to CO ( 2 ) by 65 % ( P < 0 . 002 , < 0 . 04 and < 0 . 02 , respectively ) .",O O O O O O O O O O O O O O O O O O O O O O O O O O O O O O O O O O O O O O O O O O O O O O O O O O O,32
3093,857,The clinical use of molecular analyses in recessive disorders relies on the exact characterization of both mutant alleles in the affected patient .,O O O O O O O B I O O O O O O O O O O O O O O,32
2399,9006,5 kilobases of the murine Duchenne muscular dystrophy ( Dmd ) messenger RNA ( mRNA ) .,O O O O O B I I O O O O O O O O O,13
4373,401,We were able to examine 66 Finnish AGU patients for changes in the oral mucosa and 44 of these for changes in facial skin .,O O O O O O O B O O O O O O O O O O O O O O O O O,32
9294,6426,"We screened 31 new unrelated patients and families for XLRS1 mutations in addition to previously reported mutations for 60 of our families ( Retinoschisis Consortium , Hum Mol Genet 1998 ; 7 1185 - 1192 ) .",O O O O O O O O O O O O O O O O O O O O O O O B O O O O O O O O O O O O O,13
9867,1633,"Coalescence analyses for the N370S and 84GG mutations estimated similar coalescence times , of 48 and 55 . 5 generations ago , respectively .",O O O O O O O O O O O O O O O O O O O O O O O O,32
726,6086,A transgene insertion creating a heritable chromosome deletion mouse model of Prader - Willi and angelman syndromes .,O O O O O O O O O O O B I I I I I O,13
5491,9379,"The phenotypic expressions of the different genetic predispositions involved , include sacro - iliitis , psoriasis , acute anterior uveitis , peripheral arthropathy and inflammatory bowel disease .",O O O O O O O O O O O B I I O B O B I I O O B O B I I O,13
1509,10796,Growth retardation and tumour inhibition by BRCA1 .,B I O B O O O O,13
6489,1223,"Mutations located at the extreme 5 end of the APC gene , however , are associated with a less severe disease known as attenuated adenomatous polyposis coli ( AAPC ) .",O O O O O O O O O B O O O O O O O O O O O O O B I I I O B O O,32
2406,9360,28 that bridge the DMD gene .,O O O O B O O,13
8729,6841,"Therefore , the accumulation of the types of mutations in Japanese patients with WD will facilitate the fast and effective genetic diagnosis of WD in Japanese patients . .",O O O O O O O O O O O O O B O O O O O O O O O B O O O O O,13
10012,9643,"Besides the classic WAS phenotype , there is a group of patients with congenital X - linked thrombocytopenia ( XLT ) who have small platelets but only transient eczema , if any , and minimal immune deficiency .",O O O B O O O O O O O O O B I I I I O B O O O O O O O O B O O O O O O B I O,13
3761,245,RESULTS Three patients with adult - onset cerebral ALD were identified as having large genomic rearrangements .,O O O O O O O B I O O O O O O O O,32
5730,1807,Additional copies of the proteolipid protein gene causing Pelizaeus - Merzbacher disease arise by separate integration into the X chromosome .,O O O O O O O O B I I I O O O O O O O O O,32
3315,12133,"This missense mutation , which replaces Ala with Thr , is frequent among FNDI patients and is thought to reduce the efficiency of cleavage by signal peptidases . .",O O O O O O O O O O O O O B O O O O O O O O O O O O O O O,39
1325,7821,In this study we used denaturing gradient gel electrophoresis ( DGGE ) .,O O O O O O O O O O O O O,13
2489,9118,Hypopigmentation in the Prader - Willi syndrome .,B O O B I I I O,13
4950,3785,3 - - - - qter 3 - - - - qter .,O O O O O O O O O O O O O,32
6106,5425,For females there was a high risk of endometrial cancer ( 0 . 5 at age 60 years ) and premenopausal ovarian cancer ( 0 . 2 at 50 years ) .,O O O O O O O O B I O O O O O O O O O O B I I O O O O O O O O O,13
860,8161,8 without recombination .,O O O O,13
5920,1211,An exon 1 nonsense mutation ( 856C - - > T ) introduces a premature stop codon at amino acid 286 .,O O O O O O O O O O O O O O O O O O O O O O,32
8358,11775,"HLA typing for HLA - B27 , HLA - B60 , and HLA - DR1 was performed by polymerase chain reaction with sequence - specific primers , and zygosity was assessed using microsatellite markers .",O O O O O O O O O O O O O O O O O O O O O O O O O O O O O O O O O O O,39
1868,1333,This finding supports simple autosomal recessive inheritance for HMS in these families .,O O O O O O O O B O O O O,32
7673,983,"01 , compared to our regular FMF population .",O O O O O O B O O,32
1970,4053,"With a new method we measured the saturated very long chain fatty acids in the plasma of adrenoleukodystrophy ( ALD ) hemizygotes , ALD heterozygotes , and controls .",O O O O O O O O O O O O O O O O O B O B O O O B O O O O O,32
1040,7369,Germline mutations of the adenomatous polyposis coli ( APC ) tumor - suppressor gene result in familial adenomatous polyposis ( FAP ) .,O O O O B I I I I I I O O O O O B I I O B O O,13
9439,5283,"Novel inherited mutations and variable expressivity of BRCA1 alleles , including the founder mutation 185delAG in Ashkenazi Jewish families .",O O O O O O O O O O O O O O O O O O O O,32
7849,3526,Male mice carrying the mutant alleles are viable and analysis of their cells shows a total lack of HPRT activity . .,O O O O O O O O O O O O O O O O O O O O O O,32
2415,6993,"Foxc1 ( + / - ) and Foxc2 ( + / - ) mice are useful models for studying anterior segment development and its anomalies , and may allow identification of genes that interact with Foxc1 and Foxc2 ( or FKHL7 and FKHL14 ) to produce a phenotype with elevated IOP and glaucoma . .",O O O O O O O O O O O O O O O O O O O O O O O O O O O O O O O O O O O O O O O O O O O O O O O O O O O O B O O,13
9463,11809,The mutation was confirmed by restriction endonuclease analysis .,O O O O O O O O O,39
2601,7221,The exon 13 duplication in the BRCA1 gene is a founder mutation present in geographically diverse populations .,O O O O O O O O O O O O O O O O O O,13
2275,10379,"CHRPE lesions are almost always absent if the mutation occurs before exon 9 , but are systematically present if it occurs after this exon .",B O O O O O O O O O O O O O O O O O O O O O O O O,13
2871,5909,Mice carrying each of the two mutations were bred and analyzed .,O O O O O O O O O O O O,13
7492,3090,"Complement assays showed a complete deficiency of the C9 component , while the other individual component levels were normal and the hemolytic activity ( measured using the CH50 assay ) was only slightly reduced .",O O O O B I I I I I O O O O O O O O O O O O O O O O O O O O O O O O O,32
2100,6620,"We describe three novel mutations ( R58fs , R330S , and H371R ) and one common AKU mutation ( M368V ) , detected by mutational and polymorphism analysis of the HGO gene in five Finnish AKU pedigrees .",O O O O O O O O O O O O O O O O B O O O O O O O O O O O O O O O O O O B O O,13
3848,430,The demonstration of both the diagnostic and prognostic value of MEFV analysis and particular modes of inheritance should lead to new ways for management of FMF - including genetic counseling and therapeutic decisions in affected families .,O O O O O O O O O O O O O O O O O O O O O O O O O O O O O O O O O O O O O,32
6093,5113,"In the remaining two - thirds of the tumors only one mutation was found , consistent with the loss - of - heterozygosity theory of tumorigenesis .",O O O O O O O O B O O O O O O O O O O O O O O O O O O,32
5406,9629,Analysis of the mutation in these families shows a strong negative correlation between size of the expanded CAG repeat and age at onset of clinical disease .,O O O O O O O O O O O O O O O O O O O O O O O O O O O,13
2507,6798,A domain of exclusive paternal expression surrounding the imprinting center suggests strong regional control of the imprinting process .,O O O O O O O O O O O O O O O O O O O,13
8479,3211,"The latter subjects had an additional mutation , at nucleotide 1311 , that did not produce a coding change .",O O O O O O O O O O O O O O O O O O O O,32
3592,253,A common human skin tumour is caused by activating mutations in beta - catenin .,O O O B I O O O O O O O O O O,32
2939,10145,The correlation appeared to be more linear with age of onset .,O O O O O O O O O O O O,13
5425,10927,"No mutation was observed in exons 25 - 27 , although this region contains two CGA codons .",O O O O O O O O O O O O O O O O O O,13
6051,5822,This observation has direct implications for genetic counseling of Lowe syndrome families . .,O O O O O O O O O B I O O O,13
3243,4587,"1 , the genetic locus for Machado - Joseph disease ( MJD ) .",O O O O O O B I I I O B O O,32
1727,722,All of the French patients were heterozygous for this polymorphism .,O O O O O O O O O O O,32
1772,6136,"For genetic counseling and predictive testing in families with inherited breast - ovarian cancer , penetrances and expressions of the underlying mutations should be known .",O O O O O O O O O B I I I I O O O O O O O O O O O O,13
2540,9465,Abnormal high density lipoproteins in cerebrotendinous xanthomatosis .,O O O O O B I O,13
8126,2140,"This gene , designated HPRT Tokyo , had a single nucleotide change from G to A , as identified by sequencing cDNA amplified by the polymerase chain reaction .",O O O O O O O O O O O O O O O O O O O O O O O O O O O O O,32
1410,1015,Friedreich ataxia is an autosomal recessive disorder caused by mutations in the FRDA gene that encodes a 210 - amino acid protein called frataxin .,B I O O B I I O O O O O B O O O O O O O O O O O O,32
6134,3465,"Although molecular characteristics of this variant closely resemble those of G6PD Bangkok and G6PD Duarte , it can be distinguished from these and all other previously reported variants by virtue of its unusual pH curve .",O O O O O O O O O O O O O O O O O O O O O O O O O O O O O O O O O O O O,32
9298,1451,BRCA1 exists in nuclear foci but is hyperphosphorylated and disperses after DNA damage .,O O O O O O O O O O O O O O,32
4354,11889,"In summary , our results show frequent involvement of the p16 gene in familial melanoma and confirm the role of the CDK4 gene as a melanoma - predisposing gene . .",O O O O O O O O O O O O O B I O O O O O O O O O O B O O O O O,39
6327,4689,"Causative mutations in the CHM gene were detected in at least 12 families , indicating that a substantial part of the mutations can be identified by this approach .",O O O O B O O O O O O O O O O O O O O O O O O O O O O O O,32
6350,1395,"5 - Mb domain surrounding the SNRPN - associated imprinting center , which already includes four imprinted , paternally expressed genes .",O O O O O O O O O O O O O O O O O O O O O O,32
232,1775,"Fifteen missense mutations and two newly engineered active site mutations ( C79S , C79T ) were characterized by transient expression analysis .",O O O O O O O O O O O O O O O O O O O O O O,32
3776,7351,These results suggest that retinoschisin is released by photo - receptors and has functions within the inner retinal layers .,O O O O O O O O O O O O O O O O O O O O,13
5169,10649,"A T - cell line from a WAS patient contained two independent DNA alterations , a constitutional frameshift mutation , also present in peripheral blood leukocytes from the patient , and compensatory splice site mutation unique to the cell line .",O O O O O O O B O O O O O O O O O O O O O O O O O O O O O O O O O O O O O O O O O,13
952,4387,We have previously cloned and characterized the murine homologue of the Huntington disease ( HD ) gene and shown that it maps to mouse chromosome 5 within a region of conserved synteny with human chromosome 4p16 .,O O O O O O O O O O O B I O B O O O O O O O O O O O O O O O O O O O O O O,32
6223,7112,"Homozygous mutant mice had no apparent abnormalities of skeletal muscle function , but developed lenticular opacities at a higher rate than controls .",O O O O O O B I I I I O O O B I O O O O O O O,13
6902,10668,BRCA1 mutations in a population - based sample of young women with breast cancer .,O O O O O O O O O O O O B I O,13
6731,12274,"Uniparental disomy associated with unbalanced segregation of non - Robertsonian translocations has been reported previously but has not , to our knowledge , been observed in a case of PWS .",B I O O O O O O O O O O O O O O O O O O O O O O O O O O O B O,39
7840,8676,The combined maximum lod score was 87 .,O O O O O O O O,13
3255,8246,Normotriglyceridemic abetalipoproteinemia is a rare familial disorder characterized by an isolated deficiency of apoB - 100 .,B I O O O B I O O O O B I I I I O,13
3905,9735,"Furthermore , we were able to amplify the remaining coding region by RT - PCR using lymphocyte RNA .",O O O O O O O O O O O O O O O O O O O,13
1062,6479,"Mutations were retrieved in most rhabdoid tumors , whatever their sites of occurrence , indicating the common pathogenetic origin of these tumors .",O O O O O B I O O O O O O O O O O O O O O B O,13
4489,984,"We conclude that the onset of FMF in a late age defines a milder form of disease with typical clinical , demographic , and molecular genetic characteristics",O O O O O O B O O O O O O O O O O O O O O O O O O O O,32
8153,12057,"In SCA1 , saccade amplitude was significantly increased , resulting in hypermetria .",O B O O O O O O O O O B O,39
7380,1169,"Using homozygosity mapping in eight small consanguineous families , we have narrowed the candidate region to a 1 .",O O O O O O O O O O O O O O O O O O O,32
2680,5761,Changes at P183 of emerin weaken its protein - protein interactions resulting in X - linked Emery - Dreifuss muscular dystrophy .,O O O O O O O O O O O O O B I I I I I I I O,13
599,5047,Similar findings in two other brothers suggested strongly that they were all suffering from an X linked recessive thrombocytopenic disorder .,O O O O O O O O O O O O O O O B I I I I O,32
2514,2028,"We have also found that DCC is a substrate for metalloprotease - dependent ectodomain shedding , and that the inhibitors block proteolytic processing of DCC and cause an increase in DCC protein levels on axons within spinal cord explants .",O O O O O O O O O O O O O O O O O O O O O O O O O O O O O O O O O O O O O O O O,32
3679,6617,Mutational analysis of the HGO gene in Finnish alkaptonuria patients .,O O O O O O O O B O O,13
7297,8095,"Although pyoderma gangrenosum ( PG ) is often associated with systemic diseases , it has not been reported in association with congenital complement deficiencies .",O B I O B O O O O O B I O O O O O O O O O B I I O,13
5105,9154,The nucleic acid and predicted amino acid sequences from the two species are nearly 90 percent homologous .,O O O O O O O O O O O O O O O O O O,13
891,7880,"Four of the mutations were in exon 9 , all resulting in missense mutations .",O O O O O O O O O O O O O O O,13
7773,11141,"Together the data suggest that the MSH3 gene encodes a product that functions in repair of some but not all pre - mutational intermediates , its mutation in tumours can result in genomic instability and , as in yeast , MSH3 and MSH6 are partially redundant for mismatch repair . .",O O O O O O O O O O O O O O O O O O O O O O O O O O O O B O O O O O O O O O O O O O O O O O O O O O O,13
2757,6002,Its membrane expression is highly regulated by endocytosis and trafficking through the secretory lysosome pathway .,O O O O O O O O O O O O O O O O,13
4624,3266,We have estimated the haplotype distribution of mutant and normal phenylalanine hydroxylase ( PAH ) alleles for 17 Turkish phenylketonuria ( PKU ) families 20 normal and 27 mutated PAH alleles could be identified .,O O O O O O O O O O O O O O O O O O O B O B O O O O O O O O O O O O O,32
3531,3475,The detection and mapping of the translocation breakpoints of all three retinoblastoma patients to within the putative RB1 gene substantiated the authenticity of this candidate sequence and demonstrated the utility of FIGE in detecting chromosomal rearrangements affecting this locus .,O O O O O O O O O O O B O O O O O O O O O O O O O O O O O O O O O O O O O O O O,32
8813,4167,5 % smaller than normal C6 .,O O O O O O O,32
3285,11563,"Autosomal dominant myotonia congenita is an inherited disorder of skeletal muscle caused by mutations in a voltage - gated Cl - channel gene ( CLCN1 , 7q35 ) .",B I I I O O B I I I I O O O O O O O O O O O O O O O O O O,13
1444,4909,Alkaptonuria ( AKU ; McKusick no . 203500 ) is a rare autosomal recessive disorder caused by the lack of homogentisic acid oxidase activity .,B O B O O O O O O O O O B I I O O O O O O O O O O,32
9203,2229,"Most of those carrying the allele trace their origins to the United Kingdom , Ireland , or Western Europe .",O O O O O O O O O O O O O O O O O O O O,32
9883,4225,"The spinocerebellar ataxia 3 locus ( SCA3 ) for type I autosomal dominant cerebellar ataxia ( ADCA type I ) , a clinically and genetically heterogeneous group of neurodegenerative disorders , has been mapped to chromosome 14q32 .",O B I I O O B O O B I I I I I O B I I O O O O O O O O O B I O O O O O O O O,32
3619,1263,"Familial expansile osteolysis ( FEO , MIM 174810 ) is a rare , autosomal dominant bone disorder characterized by focal areas of increased bone remodelling .",B I I O B O O O O O O O O B I I I O O O O O B I I O,32
8255,2507,"The size of this fragment varies between affected siblings , and increases in size through generations in parallel with increasing severity of the disease .",O O O O O O O O O O O O O O O O O O O O O O O O O,32
182,7147,"From the 189 patients who identified themselves as Jewish , 88 hereditary cases were identified with the presence of a germline founder mutation in BRCA1 or BRCA2 .",O O O O O O O O O O O O O O O O O O O O O O O O O O O O,13
7781,1707,"Targeted deletion of Dm15 , the mouse orthologue of human DMPK , produced mice with a mild myopathy and cardiac conduction abnormalities , but without other features of myotonic dystrophy , such as myotonia and cataracts .",O O O O O O O O O O O O O O O O O B O B I I O O O O O O B I O O O B O B O,32
4978,8766,"A father and daughter with isolated aniridia were observed to have an apparently balanced , reciprocal translocation involving chromosomes 5 and 11 [ t ( 5 ; 11 ) ( q13 . 1 ; p13 ) ] .",O O O O O B I O O O O O O O O O O O O O O O O O O O O O O O O O O O O O O O,13
688,1544,In addition Hmgic - / - mice have a deficiency in fat tissue .,O O O O O O O O O O O O O O,32
199,8405,"The order of fourteen polymorphic markers localised to the long arm of human chromosome 19 has been established by multipoint mapping in a set of 40 CEPH ( Centre dEtude de Polymorphisme Humain , Paris ) reference families .",O O O O O O O O O O O O O O O O O O O O O O O O O O O O O O O O O O O O O O O,13
6441,6574,In two of these families we used a functional assay to demonstrate an almost total loss of cathepsin C activity in PLS patients and reduced activity in obligate carriers .,O O O O O O O O O O O O O O O O O O O O O B O O O O O O O O,13
6207,10198,"5 kb , the intergenerational variation was more important through female meioses , whereas a tendency to compression was observed almost exclusively in male meioses , for > or = 1 .",O O O O O O O O O O O O O O O O O O O O O O O O O O O O O O O O,13
2064,8309,Autologous reinfusion of labeled d less than 1 .,O O O O O O O O O,13
4230,9953,"It may occur alone as a single base - pair mutation but often is found as part of a complex allele containing additional GBA nucleotide substitutions , G6468C ( A456P ) and G6482C ( V460V ) , without ( recNciI ) or with ( recTL ) G5957C ( D409H ) .",O O O O O O O O O O O O O O O O O O O O O O O O O O O O O O O O O O O O O O O O O O O O O O O O O O O,13
9376,3981,Prader - Willi syndrome and chromosome 15 .,B I I I O O O O,32
7613,2081,"In one case , previously described , the enzyme was of the A - type .",O O O O O O O O O O O O O O O O,32
7129,8834,63 ; and for DXS10 theta = 0 .,O O O O O O O O O,13
228,336,Dominant negative effect of the APC1309 mutation : a possible explanation for genotype - phenotype correlations in familial adenomatous polyposis .,O O O O O O O O O O O O O O O O O B I I O,32
7584,2352,1 + / - 2 .,O O O O O O,32
3163,255,"In response to this stimulus , cytoplasmic beta - catenin ( encoded by CTNNB1 ) is stabilized , enabling downstream transcriptional activation by members of the LEF / TCF family .",O O O O O O O O O O O O O O O O O O O O O O O O O O O O O O O,32
6214,803,"The c862t ( R279W ) transition is the most common mutation in non - Finnish patients , but in these disorders it is usually combined with other DTDST mutations .",O O O O O O O O O O O O O O O O O O O O O O O O O O O O O O,32
8667,141,"N . , Gnirke , A . , Thomas , W . , Tsuchihashi , Z . , Ruddy , D .",O O O O O O O O O O O O O O O O O O O O O O,32
9853,3945,"Biochemical assays permit prenatal diagnosis , as well as identification of most heterozygotes .",O O O O O O O O O O O O O O,32
