Unnamed: 0.1,Unnamed: 0,text,labels,txt_len
4016,7368,Inactivation of germline mutant APC alleles by attenuated somatic mutations : a molecular genetic mechanism for attenuated familial adenomatous polyposis .,O O O O B O O O O O O O O O O O B I I I O,13
7422,9866,Aniridia - associated cytogenetic rearrangements suggest that a position effect may cause the mutant phenotype .,B O O O O O O O O O O O O O O O,13
5073,11183,The upper limit of the two - sided 95 % confidence interval for the estimate of the common segregation probability for the three donors is at or below .,O O O O O O O O O O O O O O O O O O O O O O O O O O O O O,13
3243,4587,"1 , the genetic locus for Machado - Joseph disease ( MJD ) .",O O O O O O B I I I O B O O,32
8416,8746,"We describe here a Pelizaeus - Merzbacher pedigree of the classical type , with X - linked inheritance , a typical clinical progression , and a pathologic loss of myelinating cells and myelin in the central nervous system .",O O O O B I I O O O O O O O O O O O O O O O O O O O O O O O O O O O O O O O O,13
2833,4006,Chronic neisserial infection can be associated with C7 deficiency and must be distinguished from other causes of cutaneous vasculitis . .,B I I O O O O B I O O O O O O O O B I O O,32
7012,6355,Clinical and molecular genetic analysis of 19 Wolfram syndrome kindreds demonstrating a wide spectrum of mutations in WFS1 .,O O O O O O O B I O O O O O O O O O O,13
7202,5889,"We studied an unusual Palestinian family consisting of asymptomatic first cousin parents and three children affected with neurohypophyseal diabetes insipidus , suggesting autosomal recessive inheritance .",O O O O O O O O O O O O O O O O O B I I O O O O O O,13
9707,8860,A new glucose - 6 - phosphate dehydrogenase ( G6PD ) variant with severe erythrocytic G6PD deficiency and a unique pH optimum is described in a young patient with chronic nonspherocytic hemolytic anemia ( CNSHA ) and familial amyloidotic polyneuropathy ( FAP ) .,O O O O O O O O O O O O O O B I I O O O O O O O O O O O O B I I I O B O O B I I O B O O,13
9818,1917,"Congenital afibrinogenemia is a rare , autosomal , recessive disorder characterized by the complete absence of detectable fibrinogen .",B I O O O O B I I I O O O O O O O O O,32
9317,11158,Hemizygous mice carrying a replacement mutation in exon 2 of the ND gene developed retrolental structures in the vitreous body and showed an overall disorganization of the retinal ganglion cell layer .,O O O O O O O O O O O B O O O O O O O O O O O O O O O O O O O O,13
3515,9370,Genetics .,O O,13
3748,9825,These results suggested the heterogenous nature of the mutations causing the deficiency in the seven patients .,O O O O O O O O O O O O O O O O O,13
7613,2081,"In one case , previously described , the enzyme was of the A - type .",O O O O O O O O O O O O O O O O,32
523,6475,2 and recently shown to be mutated in malignant rhabdoid tumors .,O O O O O O O O B I I O,13
4497,4353,"MRI lesions were associated with impaired psychometric performance , but MRI and molecular findings were only weakly related .",O O O O O O O O O O O O O O O O O O O,32
9783,9375,"Such known factors are HLA B27 associated disease susceptibility , susceptibility to psoriatic arthropathy and susceptibility to entero - arthropathy .",O O O O O O O O O O O O B I O O O B I I O,13
1198,456,beta - Glucuronidase activity was undetectable in affected cat fibroblasts and restored by retroviral gene transfer of rat beta - glucuronidase cDNA .,O O O O O O O O O O O O O O O O O O O O O O O,32
1845,2741,HLA - D typing showed that 5 members typed with homozygous Dw2 typing cells from an individual with C2 deficiency but not with Dw2 typing cells from 2 individuals with normal C2 .,O O O O O O O O O O O O O O O O O O B I O O O O O O O O O O O O O,32
1405,3491,"A DNA marker C7 , localised Xp21 .",O O O O O O O O,32
7225,6796,"5 - Mb domain surrounding the SNRPN - associated imprinting center , which already includes four imprinted , paternally expressed genes .",O O O O O O O O O O O O O O O O O O O O O O,13
6753,3989,0324 ( 1 in 31 individuals ) .,O O O O O O O O,32
6516,12239,Previous studies have suggested that the highly variable metabolic phenotypes of PAH deficiency correlate with PAH genotypes .,O O O O O O O O O O O B I O O O O O,39
7497,10810,"Women who carry a mutation in the BRCA1 gene ( on chromosome 17q21 ) , have an 80 % risk of breast cancer and a 40 % risk of ovarian cancer by the age of 70 ( ref . 1 ) .",O O O O O O O O O O O O O O O O O O O O O B I O O O O O O B I O O O O O O O O O O O,13
7128,7264,Ankylosing spondylitis ( AS ) is a common and highly familial rheumatic disorder .,B I O B O O O O O O O B I O,13
436,1563,"These findings demonstrate that the DNA - binding domains of HMG I - C , in the absence of a C - terminal fusion partner , are sufficient to perturb adipogenesis and predispose to lipomas .",O O O O O O O O O O O O O O O O O O O O O O O O O O O O O O O O O O B O,32
6527,5720,"These analyses also demonstrated that the nucleotide substitutions in HGO do not involve CpG dinucleotides , which illustrates important differences between HGO and other genes for the occurrence of mutation at specific short - sequence motifs .",O O O O O O O O O O O O O O O O O O O O O O O O O O O O O O O O O O O O O,13
9591,4971,Restriction of ocular fundus lesions to a specific subgroup of APC mutations in adenomatous polyposis coli patients .,O O O O O O O O O O B O O B I I O O,32
3399,5243,23 and shown to be mutated in three patients with the Wiskott - Aldrich syndrome ( WAS ) .,O O O O O O O O O O O B I I I O B O O,32
7263,3642,"However , until now , their precise molecular basis has remained unknown .",O O O O O O O O O O O O O,32
5419,9568,5 % smaller than normal C6 .,O O O O O O O,13
407,2904,"006 g / ml lipoprotein fraction , in both the postprandial and postabsorptive state , are bimodally distributed .",O O O O O O O O O O O O O O O O O O O,32
9314,11016,"55 ( P = . 02 ) ; after additional adjustment for HDL levels , the RR was 1 .",O O O O O O O O O O O O O O O O O O O O,13
938,8230,"The mutation , which causes loss of an HphI site and changes amino acid 155 from threonine to isoleucine , was absent from 108 normal chromosomes .",O O O O O O O O O O O O O O O O O O O O O O O O O O O,13
4037,10376,The exact APC mutation was identified in 42 unrelated patients .,O O B O O O O O O O O,13
2234,1862,Polymorphisms of the CYP2D6 gene increase susceptibility to ankylosing spondylitis .,O O O O O O O O B I O,32
1763,1464,"However , the C - terminal end of the putative protein differs strongly from the published human sequence .",O O O O O O O O O O O O O O O O O O O,32
6378,9398,Human deficiency of the sixth component of complement in a patient with meningococcal meningitis and no haemostasis abnormality .,O B I I I I I I O O O O B I O O B I O,13
7233,5584,"Among approximately 200 anonymous Ashkenazi Jewish DNA samples , the MEFV carrier frequency was 21 % , with E148Q the most common mutation .",O O O O O O O O O O O O O O O O O O O O O O O O,13
8261,4109,A new CT pattern was observed in 2 patients with adrenoleukodystrophy ( ALD ) .,O O O O O O O O O O B O B O O,32
5109,3006,The resulting genetic map is supported by the localisation of the DNA markers in a panel of somatic cell hybrids .,O O O O O O O O O O O O O O O O O O O O O,32
3975,1539,"Consequently , both molecules are affected by the mutations , and they may contribute differently to the occurrence of specific clinical manifestations . .",O O O O O O O O O O O O O O O O O O O O O O O O,32
10090,627,We postulate that the END repeats flanking 15q11 - q13 mediate homologous recombination resulting in deletion .,O O O O O O O O O O O O O O O O O,32
2062,734,Penetrances of BRCA1 1675delA and 1135insA with respect to breast cancer and ovarian cancer .,O O O O O O O O O B I O B I O,32
6951,6610,7 kb CTSC gene consists of two exons .,O O O O O O O O O,13
5831,7047,"We have undertaken a hospital - based study , to identify possible BRCA1 and BRCA2 founder mutations in the Polish population .",O O O O O O O O O O O O O O O O O O O O O O,13
4214,10481,"Genomic structure of the EWS gene and its relationship to EWSR1 , a site of tumor - associated chromosome translocation .",O O O O O O O O O O O O O O O B O O O O O,13
2319,5344,"Adrenoleukodystrophy ( ALD ) , an X - linked inherited metabolic disorder , is the most frequent inborn peroxisomal disease .",B O B O O O B I I I I I O O O O O B I I O,32
4989,3835,Recurrent meningococcal meningitis with absence of the sixth component of complement : an evaluation of underlying immunologic mechanisms .,O B I O B I I I I I I O O O O O O O O,32
1298,10872,"By electrophysiological tests and magnetic resonance imaging it was determined that two patients had cerebral ALD , one had adrenomyeloneuropathy with cerebral involvement , and two had preclinical AMN .",O O O O O O O O O O O O O O B I O O O B O O O O O O O O B O,13
4852,7898,"The results indicate close linkage between the WAS and OATL1 loci ( Z = 6 . 08 at theta = 0 . 00 ) and localize the TIMP , OATL1 , DXS255 , and WAS loci distal to DXS146 and the OATL1 and WAS loci proximal to TIMP .",O O O O O O O B O O O O O O O O O O O O O O O O O O O O O O O O O O B O O O O O O O O B O O O O O,13
3092,2445,This is therefore a rare case of an inherited WAGR deletion .,O O O O O O O O O B O O,32
128,8773,"ApoB protein was detected within HBL hepatocytes utilizing immunohistochemical techniques ; however , it was markedly reduced in quantity when compared with control samples .",O O O O O B O O O O O O O O O O O O O O O O O O O,13
4958,3418,The above haplotype is a very useful diagnostic tool in these TCD families .,O O O O O O O O O O O B O O,32
10039,651,"A 50 - year - old man showed progressive muscular atrophy , choreic movement , elevated level of serum creatinine kinase , and acanthocytosis .",O O O O O O O O O B I O B I O O O O O O O O O B O,32
2914,9327,"The data support the hypothesis that G6PD deficiency may confer a selective advantage in a malarious area ; the female heterozygote may be at a particular advantage because resistance to malaria equals that of male hemizygotes , but the risk of fatal hemolysis may be less .",O O O O O O B I O O O O O O O B O O O O O O O O O O O O O O B O O O O O O O O O O B I O O O O,13
8190,11907,"We performed a blind chromosomal analysis on G2 - phase lymphocytes from 7 unrelated A - T patients , 13 obligate A - T heterozygotes ( parents of the patients ) , and 14 normal controls following X - irradiation with 1 Gy in order to evaluate this cytogenetic method as a tool for detection of ATM carriers .",O O O O O O O O O O O O O O B I I O O O O B I I O O O O O O O O O O O O O O O O O O O O O O O O O O O O O O O O O O O,39
2712,5979,"In vitro expression results are discrepant , but some individuals carrying S135L appear to exhibit GALT activity in some tissues .",O O O O O O O O O O O O O O O O O O O O O,13
4566,11710,"We examined galactosylceramidase ( GALC ) cDNA in four Japanese patients with adult onset globoid cell leukodystrophy ( Krabbe disease ; AO - GLD ) by polymerase chain reaction / single - strand conformation polymorphism ( PCR - SSCP ) analysis , subsequent sequence determination , and restriction enzyme digestion of PCR products , initial symptoms were the onset of slowly progressive spastic paraplegia from the middle of the second decade , and all patients had diminished GALC activity in their leukocytes .",O O O O O O O O O O O O B I I I I O B I O B I I O O O O O O O O O O O O O O O O O O O O O O O O O O O O O O O O O O O O O O B I O O O O O O O O O O O O B I I O O O O,13
4363,298,The pathognomonic accumulation of very long chain fatty acids could also be prevented by overexpression of ALDRP in immortalized X - ALD cells .,O O O O O O O O O O O O O O O O O O O O O O O O,32
5446,9993,"We analysed 50 probands with a family history of breast and / or ovarian cancer for germline mutations in the coding region of the BRCA1 candidate gene , using single - strand conformation polymorphism ( SSCP ) analysis on PCR - amplified genomic DNA .",O O O O O O O O O B I I I I I O O O O O O O O O O O O O O O O O O O O O O O O O O O O O O,13
3048,5399,"Development of MCF - 7 tumours in nude mice is inhibited when MCF - 7 cells are transfected with wild - type , but not mutant , BRCA1 .",O O B I I I O O O O O O O O O O O O O O O O O O O O O O O,32
956,7409,"Here we report that , in mutant mice expressing HD repeats , the production and aggregation of N - terminal huntingtin fragments preferentially occur in HD - affected neurons and their processes and axonal terminals .",O O O O O O O O O B O O O O O O O O O O O O O O O B O O O O O O O O O O,13
8129,9989,"In normal individuals the gene contains between 13 and 36 CAG repeats , whereas most of the clinically diagnosed patients and all of the affected members of a family with the clinical and pathological diagnosis of MJD show expansion of the repeat - number ( from 68 - 79 ) .",O O O O O O O O O O O O O O O O O O O O O O O O O O O O O O O O O O O O B O O O O O O O O O O O O O O,13
6473,1769,"In granulocytes , MEFV was up - regulated by IFN - gamma and the combination of IFN - alpha and colchicine .",O O O O O O O O O O O O O O O O O O O O O O,32
2875,7797,We have now identified two additional mutations within exon 5 of the HEXA gene that account for the remaining TSD alleles in the patient and carriers .,O O O O O O O O O O O O O O O O O O O B O O O O O O O,13
615,1030,"667T - - > C ( C223R ) , respectively , present the first genetic evidence for the functional significance of the putative leader peptide sequence and for the functional significance at the carboxyl terminal of the XLRS1 protein beyond the discoidin domain .",O O O O O O O O O O O O O O O O O O O O O O O O O O O O O O O O O O O O O O O O O O O O,32
3695,155,"M . , Schatzman , R .",O O O O O O O,32
1861,5204,All the mutations will interfere with the correct translation of the mRNA predicting a truncated protein or no gene product at all . .,O O O O O O O O O O O O O O O O O O O O O O O O,32
8120,6194,This treatment could prove effective in up to 15 % of patients with DMD . .,O O O O O O O O O O O O O B O O,13
9689,9463,0063 % of total fatty acids .,O O O O O O O,13
3384,6176,"Most of the nonsense , frameshift and splice site mutations were found in exons 6 - 11 .",O O O O O O O O O O O O O O O O O O,13
6979,10062,Genetic determinants of HDL cholesterol ( HDL - C ) levels in the general population are poorly understood .,O O O O O O O O O O O O O O O O O O O,13
8018,5353,The mutations were not detected in the ALD gene of 30 healthy persons . .,O O O O O O O B O O O O O O O,32
2144,7555,This disease gene was previously linked to the DXS7 ( L1 . 28 ) locus and the MAO genes in band Xp11 .,O O O O O O O O O O O O O O O O O O O O O O O,13
1939,1809,Mutations and duplications of this gene are associated with Pelizaeus - Merzbacher disease ( PMD ) .,O O O O O O O O O B I I I O B O O,32
718,12203,"Less severe , subacute ( juvenile - onset ) and chronic ( adult - onset ) variants are characterized by a broad spectrum of clinical manifestations and are associated with residual levels of Hex A enzyme activity .",O O O O O O O O O O O O O O O O O O O O O O O O O O O O O O O O O O O O O O,39
4778,9160,Results of chromosome studies on the parents and surviving sibs were normal .,O O O O O O O O O O O O O,13
1329,11243,"A specific BRCA1 mutation , 185delAG , has a reported increased carrier frequency of approximately 0 .",O O O O O O O O O O O O O O O O O,13
8557,8541,"The red / green color pigment ( R / GCP ) region was studied by pulsed - field gel electrophoresis in 14 of these patients , and we did not find any fragment size difference between the patients and normal individuals who have the same number of pigment genes .",O O O O O O O O O O O O O O O O O O O O O O O O O O O O O O O O O O O O O O O O O O O O O O O O O O,13
9560,8202,Three of the seven centrocytic lymphomas had detectable BCL1 DNA rearrangement .,O O O O B I O O O O O O,13
2093,6131,"Thus , exon 5a appears to function as a molecular switch that specifies target genes .",O O O O O O O O O O O O O O O O,13
5442,8661,Six tumours retained the paternal allele and three retained the maternal allele .,O B O O O O O O O O O O O,13
3542,1493,Impaired glucose tolerance ( IGT ) and hypertriglyceridemia are associated with an increased risk of diabetes mellitus and cardiovascular disease .,B I I O B O O B O O O O O O O B I O B I O,32
3023,10646,"These missense , nonsense and frameshift mutations involve eight of the 12 exons of the gene .",O O O O O O O O O O O O O O O O O,13
7647,2085,"The abnormal enzymes are respectively designated as GdDcbrousse - like , GdGallura and GdAgrigento . .",O O O O O O O O O O O O O O O O,32
6130,6093,Linkage analysis of 5 novel van der Woude syndrome kindreds to 1q32 - q41 markers further supports locus homogeneity of the disease trait .,O O O O O B I I I O O O O O O O O O O O O O O O,13
1860,9222,"The seven other siblings were heterozygous for C7 deficiency , while the paternal aunt had a normal C7 level .",O O O O O O O B I O O O O O O O O O O O,13
1165,4950,We report herein the occurrence of three separate phenotypes within a single family with a novel 3 - base pair deletion of codon 153 or 154 of the peripherin / RDS gene .,O O O O O O O O O O O O O O O O O O O O O O O O O O O O O O O O O,32
4198,6231,Mxi1 is thought to negatively regulate Myc function and may therefore be a potential tumor suppressor gene .,O O O O O O O O O O O O O O B O O O,13
1137,11179,"Meiotic drive at the myotonic dystrophy ( DM ) locus has recently been suggested as being responsible for maintaining the frequency , in the human population , of DM chromosomes capable of expansion to the disease state .",O O O O B I O B O O O O O O O O O O O O O O O O O O O O B O O O O O O O O O,13
4223,2413,These results show that the former five mutations account for more than 90 % of G6PD deficiency cases in Taiwan .,O O O O O O O O O O O O O O O B I O O O O,32
1260,2253,"The unstable [ CTG ] 5 - 30 motif is found uniquely in humans , although the flanking nucleotides are also present in mouse .",O O O O O O O O O O O O O O O O O O O O O O O O O,32
2422,11872,Heterozygotes for the rare mutant may be indistinguishable from heterozygotes for the common TSD mutant .,O O O O O O O O O O O O O B O O,39
1360,1292,Friedreich ataxia : an overview .,B I O O O O,32
7137,7066,"However , the nucleotide change resulted in exon 3 skipping , whereas the latter K247Q mutation had a drastic effect on enzyme activity .",O O O O O O O O O O O O O O O O O O O O O O O O,13
10013,4865,"Sperm alleles with > 1 , 000 CTGs were not seen .",O O O O O O O O O O O O,32
3465,9356,Two new variants were identified - G6PD Rudosem and G6PD Nedelino .,O O O O O O O O O O O O,13
2754,2175,A glycine250 - - > aspartate substitution in the alpha - subunit of hexosaminidase A causes juvenile - onset Tay - Sachs disease in a Lebanese - Canadian family .,O O O O O O O O O O O O O O O O O O O B I I I O O O O O O O,32
1734,589,"After sequencing , we identified microdeletions in 58 % of cases , microinsertions in 17 % , nonsense mutations in 8 % , and missense mutations in 17 % .",O O O O O O O O O O O O O O O O O O O O O O O O O O O O O O,32
8830,8369,"We have now examined the DNA of three previously reported electrophoretically fast Mexican G6PD variants , - G6PD Distrito Federal , G6PD Tepic , and G6PD Castilla .",O O O O O O O O O O O O O O O O O O O O O O O O O O O O,13
7999,10696,"A new glucose - 6 - phosphate dehydrogenase variant , G6PD Orissa ( 44 Ala - - > Gly ) , is the major polymorphic variant in tribal populations in India .",O O O O O O O O O O O O O O O O O O O O O O O O O O O O O O O O,13
4950,3785,3 - - - - qter 3 - - - - qter .,O O O O O O O O O O O O O,32
7001,1634,"The results of these studies are consistent with a significant bottleneck occurring in the AJ population during the first millennium , when the population became established in Europe .",O O O O O O O O O O O O O O O O O O O O O O O O O O O O O,32
9109,6408,DNA analysis for Prader - Willi syndrome showed no abnormalities .,O O O B I I I O O O O,13
3115,597,We observed RCC in at least one member of the VHL families in 77 % of cases with mutations leading to truncated proteins versus 55 % in cases with missense mutations ( P < 0 . 05 ) .,O O B O O O O O O O B O O O O O O O O O O O O O O O O O O O O O O O O O O O O,32
2048,8386,The data demonstrate unambiguously that the mutation occurred after racial divergence of Orientals and Caucasians and suggest that the allele has spread throughout the Orient by a founder effect .,O O O O O O O O O O O O O O O O O O O O O O O O O O O O O O,13
1189,5392,"In contrast , a deficiency in immunofluorescent staining of skeletal and cardiac muscle from EDMD patients was observed .",O O O O O O O O O O O O O O B O O O O,32
5758,4576,"Kniest dysplasia is a moderately severe chondrodysplasia phenotype that results from mutations in the gene for type II collagen , COL2A1 .",B I O O O O B O O O O O O O O O O O O O O O,32
4892,1869,"For case - control studies , 617 unrelated individuals with AS ( 361 probands from sibling - pair and parent - case trio families and 256 unrelated non - familial sporadic cases ) and 402 healthy ethnically matched controls were employed .",O O O O O O O O O O B O O O O O O O O O O O O O O O O O O O O O O O O O O O O O O O,32
8820,8877,Inherited C3 deficiency with recurrent infections and glomerulonephritis .,O B I O O O O B O,13
2827,7782,8 - kDa protein that is a major product of the DMD gene .,O O O O O O O O O O O B O O,13
9089,8865,Heat stability was found to be markedly decreased ( 8 % of residual activity after 20 min of incubation at 46 degrees C ) and a particular characteristic of this enzyme was a biphasic pH curve with a greatly increased activity at low pH .,O O O O O O O O O O O O O O O O O O O O O O O O O O O O O O O O O O O O O O O O O O O O O,13
4824,3471,DNA probes from either the 5 or 3 end of the gene were used to detect a 250 - kb EagI restriction fragment in DNA from unaffected individuals .,O O O O O O O O O O O O O O O O O O O O O O O O O O O O O,32
2382,10741,"Analysis of mice homozygous for the mutant allele indicate that Brca1 is critical for normal development , as these mice died in utero between 10 and 13 days of gestation ( E10 - E13 ) .",O O O O O O O O O O O O O O O O O O O O O O O O O O O O O O O O O O O O,13
4981,7524,Immunologic methods revealed trace amounts ( 17 mg / 100 ml ) of apparently normal serum albumin .,O O O O O O O O O O O O O O O O O O,13
8815,445,"In the present report we analyze 40 ( 12 original and 28 newly identified ) Swedish families with hereditary prostate cancer ( HPC ) that , on the basis of 40 markers spanning a 25 - cM interval within 1q24 - 25 , have evidence of linkage .",O O O O O O O O O O O O O O O O O O B I I O B O O O O O O O O O O O O O O O O O O O O O O O O O,32
579,8748,"The PLP gene in one of two affected males and the carrier mother of this family exhibited a single base difference in the more than 2 kb of the PLP gene sequenced , a C - - - - T transition that would create a serine substitution for proline at the carboxy end of the protein .",O O O O O O O O O O O O O O O O O O O O O O O O O O O O O O O O O O O O O O O O O O O O O O O O O O O O O O O O O,13
3382,3703,Two new variants of glucose - 6 - phosphate dehydrogenase associated with hereditary non - spherocytic hemolytic anemia : G6PD Wayne and G6PD Huron .,O O O O O O O O O O O O B I I I I I O O O O O O O,32
5362,3946,We have identified 303 patients with ALD in 217 kindreds .,O O O O O O B O O O O,32
9541,8658,"The first allele suffers a mutational event - - deletion , duplication or point mutation ( manuscript in preparation ) - - either in the germ line ( all bilateral patients ) or in a somatic retinal cell ( most unilateral patients ) .",O O O O O O O O O O O O O O O O O O O O O O O O O O O O O O O O O O O O O O O O O O O O,13
1709,4546,Neither mutation was seen in a sample of 52 unrelated control individuals .,O O O O O O O O O O O O O,32
1829,7278,"The PDS gene encodes a transmembrane protein , known as pendrin , which functions as a transporter of iodide and chloride .",O B O O O O O O O O O O O O O O O O O O O O,13
1856,8936,"Rather , they suggest that ESD is missing from the deleted chromosome 13 and duplicated on the normal homolog .",O O O O O O O O O O O O O O O O O O O O,13
4423,1385,"The patient was homozygous for this mutation , whereas the consanguineous parents and the siblings were heterozygous .",O O O O O O O O O O O O O O O O O O,32
645,10813,"Individuals who have rare alleles of the VNTR have an increased risk of certain types of cancers , including breast cancer ( 2 - 4 ) .",O O O O O O O O O O O O O O O O B O O B I O O O O O O,13
6628,8475,"CETP deficiency appears to be a frequent cause of increased HDL levels in the population of Japan , possibly because of a founder effect .",B I O O O O O O O O O O O O O O O O O O O O O O O,13
1805,8288,"The area surrounding this missense mutation is the most highly conserved domain in the homologous enzymes from E . coli , yeast , and humans , and this mutation results in undetectable enzymatic activity , suggesting that this is a severe mutation .",O O O O O O O O O O O O O O O O O O O O O O O O O O O O O O O O O O O O O O O O O O O,13
1530,11251,52 % for the 6174delT mutation .,O O O O O O O,13
7271,2268,"We assembled the YAC clones into overlapping sets by hybridizing them to a large number of DNA probes from the HD region , including the STSs .",O O O O O O O O O O O O O O O O O O O O B O O O O O O,32
